Cites,Authors,Title,Year,Source,Publisher,ArticleURL,CitesURL,GSRank,QueryDate,Type,DOI,ISSN,CitationURL,Volume,Issue,StartPage,EndPage,ECC,CitesPerYear,CitesPerAuthor,AuthorCount,Age,Abstract,FullTextURL,RelatedURL
4,"F Ayala-Niño, Y Maya-Delgado…","Biocrust contribution to soil CO2 flux in desert shrubland ecosystem of northwest Mexico",2022,"Arid Land Research …","Taylor &Francis","https://www.tandfonline.com/doi/abs/10.1080/15324982.2021.2007428","https://scholar.google.com/scholar?cites=6840937183184214302&as_sdt=2005&sciodt=2007&hl=en",60,"2024-07-18 10:17:19","","10.1080/15324982.2021.2007428","","",,,,,4,2.00,1,3,2,"… diversity provides different responses to environmental conditions such as precipitation, which could help to explain variable photosynthetic capacities for the individual biocrust …","","https://scholar.google.com/scholar?q=related:Htl0jh_k714J:scholar.google.com/&scioq=biocrust*%7C%22biological+soil+crust%22+photosynthesis&hl=en&as_sdt=2007"
6,"C Lopez-Canfin, R Lázaro, EP Sánchez-Cañete","Disparate responses of soil-atmosphere CO2 exchange to biophysical and geochemical factors over a biocrust ecological succession in the Tabernas Desert",2022,"Geoderma","Elsevier","https://www.sciencedirect.com/science/article/pii/S0016706122003743","https://scholar.google.com/scholar?cites=2673385031038027266&as_sdt=2005&sciodt=2007&hl=en",61,"2024-07-18 10:17:19","HTML","","","",,,,,6,3.00,2,3,2,"… of the biotic contribution of photosynthetizing biocrusts to the net carbon uptake remain … fluxes evolve during the ecological succession of biocrusts and which factors control them. …","https://www.sciencedirect.com/science/article/pii/S0016706122003743","https://scholar.google.com/scholar?q=related:AkbegoXFGSUJ:scholar.google.com/&scioq=biocrust*%7C%22biological+soil+crust%22+photosynthesis&hl=en&as_sdt=2007"
86,"A Antoninka, A Faist…","Biological soil crusts in ecological restoration: emerging research and perspectives",2020,"Restoration …","Wiley Online Library","https://onlinelibrary.wiley.com/doi/abs/10.1111/rec.13201","https://scholar.google.com/scholar?cites=4483933946740031951&as_sdt=2005&sciodt=2007&hl=en",62,"2024-07-18 10:17:19","","10.1111/rec.13201","","",,,,,86,21.50,29,3,4,"… photosynthesis, fixing nitrogen, and mediating the hydrological cycle in drylands. Biocrusts have … The articles in this special issue improve the state of our current knowledge in biocrust …","https://onlinelibrary.wiley.com/doi/pdf/10.1111/rec.13201","https://scholar.google.com/scholar?q=related:z0HB6yoiOj4J:scholar.google.com/&scioq=biocrust*%7C%22biological+soil+crust%22+photosynthesis&hl=en&as_sdt=2007"
9,"A Karimi, A Tahmourespour, M Hoodaji","The formation of biocrust and improvement of soil properties by the exopolysaccharide-producing cyanobacterium: a biogeotechnological study",2023,"Biomass Conversion and …","Springer","https://link.springer.com/article/10.1007/s13399-022-02336-0","https://scholar.google.com/scholar?cites=1379719557974413796&as_sdt=2005&sciodt=2007&hl=en",63,"2024-07-18 10:17:19","HTML","10.1007/s13399-022-02336-0","","",,,,,9,9.00,3,3,1,"… photosynthesis, the microbial communities in the biocrusts including algae became the sources of CO 2 . The microbial algae in biocrusts … of photosynthesis process in biocrusts driving …","https://link.springer.com/article/10.1007/s13399-022-02336-0","https://scholar.google.com/scholar?q=related:5FG5vqC_JRMJ:scholar.google.com/&scioq=biocrust*%7C%22biological+soil+crust%22+photosynthesis&hl=en&as_sdt=2007"
62,"B Steven, LV Gallegos‐Graves…","Dryland biological soil crust cyanobacteria show unexpected decreases in abundance under long‐term elevated CO2",2012,"Environmental …","Wiley Online Library","https://ami-journals.onlinelibrary.wiley.com/doi/abs/10.1111/1462-2920.12011","https://scholar.google.com/scholar?cites=15701658266412193521&as_sdt=2005&sciodt=2007&hl=en",64,"2024-07-18 10:17:19","","10.1111/1462-2920.12011","","",,,,,62,5.17,21,3,12,"… We hypothesized that, since they are photosynthetic autotrophs, the biocrust cyanobacteria that colonize the interspaces would respond positively to elevated atmospheric CO 2 …","https://www.researchgate.net/profile/Blaire-Steven/publication/232764130_Dryland_biological_soil_crust_Cyanobacteria_show_unexpected_decreases_in_abundance_under_long-term_elevated_CO2/links/5b00ad11aca2720ba0970568/Dryland-biological-soil-crust-Cyanobacteria-show-unexpected-decreases-in-abundance-under-long-term-elevated-CO2.pdf","https://scholar.google.com/scholar?q=related:8RYTmgB_59kJ:scholar.google.com/&scioq=biocrust*%7C%22biological+soil+crust%22+photosynthesis&hl=en&as_sdt=2007"
125,"Y Zhang, AL Aradottir, M Serpe, B Boeken","Interactions of biological soil crusts with vascular plants",2016,"Biological soil crusts: an …","Springer","https://link.springer.com/chapter/10.1007/978-3-319-30214-0_19","https://scholar.google.com/scholar?cites=2601769870199028431&as_sdt=2005&sciodt=2007&hl=en",65,"2024-07-18 10:17:19","","10.1007/978-3-319-30214-0_19","","",,,,,125,15.63,31,4,8,"… and usually enhances biocrust formation; however, a dense canopy can deprive crusts of adequate light for photosynthesis. Likewise, light litterfall may protect or favor biocrusts by …","https://www.researchgate.net/profile/Bertrand-Boeken/publication/303466503_Interactions_of_Biological_Soil_Crusts_with_Vascular_Plants/links/5c4eda46299bf12be3e90cf9/Interactions-of-Biological-Soil-Crusts-with-Vascular-Plants.pdf","https://scholar.google.com/scholar?q=related:z_qGhOlXGyQJ:scholar.google.com/&scioq=biocrust*%7C%22biological+soil+crust%22+photosynthesis&hl=en&as_sdt=2007"
0,"S Gypser, M Veste","Hotspot biocrusts: Combining chlorophyll fluorescence and NDVI to analyze spatial and temporal variations of photosynthesis",2019,"","opus4.kobv.de","https://opus4.kobv.de/opus4-UBICO/frontdoor/index/index/docId/24439","",66,"2024-07-18 10:17:19","","","","",,,,,0,0.00,0,2,5,"… Therefore, the evaluation of photosynthesis in relation to the spatial … the photosynthetic dynamics in relation to biocrust species composition and wetness. Desiccation of the biocrusts …","","https://scholar.google.com/scholar?q=related:Yep4MM8NvMkJ:scholar.google.com/&scioq=biocrust*%7C%22biological+soil+crust%22+photosynthesis&hl=en&as_sdt=2007"
11,"YA Chung, B Thornton, E Dettweiler-Robinson…","Soil surface disturbance alters cyanobacterial biocrusts and soil properties in dry grassland and shrubland ecosystems",2019,"Plant and Soil","Springer","https://link.springer.com/article/10.1007/s11104-019-04102-0","https://scholar.google.com/scholar?cites=6982484180675373762&as_sdt=2005&sciodt=2007&hl=en",67,"2024-07-18 10:17:19","HTML","10.1007/s11104-019-04102-0","","",,,,,11,2.20,3,4,5,"… Disturbance effects on other hydrologic and physical properties were indirectly mediated by the photosynthetic capacity of biocrusts. Disturbance indirectly increased infiltration depth …","https://link.springer.com/article/10.1007/s11104-019-04102-0","https://scholar.google.com/scholar?q=related:wqrwFl7E5mAJ:scholar.google.com/&scioq=biocrust*%7C%22biological+soil+crust%22+photosynthesis&hl=en&as_sdt=2007"
4,"Y Han, Q Wang, Q Li, C Hu","Active metabolism and biomass dynamics of biocrusts are shaped by variation in their successional state and seasonal energy sources",2022,"Science of The Total Environment","Elsevier","https://www.sciencedirect.com/science/article/pii/S0048969722018496","https://scholar.google.com/scholar?cites=1870766042336531996&as_sdt=2005&sciodt=2007&hl=en",68,"2024-07-18 10:17:19","","","","",,,,,4,2.00,1,4,2,"… , G/M dominated by eukaryotic photosynthetic organisms) had more commonality in terms of … core characteristics of the metabolism involved in photosynthesis, respiration, and polymer …","","https://scholar.google.com/scholar?q=related:HBZVw81L9hkJ:scholar.google.com/&scioq=biocrust*%7C%22biological+soil+crust%22+photosynthesis&hl=en&as_sdt=2007"
37,"GJ Kidron, XR Li, RL Jia, YH Gao, P Zhang","Assessment of carbon gains from biocrusts inhabiting a dunefield in the Negev Desert",2015,"Geoderma","Elsevier","https://www.sciencedirect.com/science/article/pii/S0016706115001299","https://scholar.google.com/scholar?cites=13760809413735005364&as_sdt=2005&sciodt=2007&hl=en",69,"2024-07-18 10:17:19","","","","",,,,,37,4.11,7,5,9,"… The aim of the study is thus to monitor the photosynthesis and respiration of the different crust types in the site aiming to assess their annual C gain into the ecosystem. …","https://www.academia.edu/download/45992679/Assessment_of_carbon_gains_from_biocrust20160527-13196-vi7e7t.pdf","https://scholar.google.com/scholar?q=related:tLyG_0A3-L4J:scholar.google.com/&scioq=biocrust*%7C%22biological+soil+crust%22+photosynthesis&hl=en&as_sdt=2007"
11,"I Miralles, R Ortega, MC Montero-Calasanz","Studying the microbiome of cyanobacterial biocrusts from drylands and its functional influence on biogeochemical cycles",2021,"","researchsquare.com","https://www.researchsquare.com/article/rs-252045/latest","https://scholar.google.com/scholar?cites=3567009089932310891&as_sdt=2005&sciodt=2007&hl=en",70,"2024-07-18 10:17:19","","","","",,,,,11,3.67,4,3,3,"… Respiration overshadowed photosynthesis in cyanobacteria-dominated biocrusts especially following rainfalls after the long dry summer period. The authors attributed these ndings to …","https://www.researchsquare.com/article/rs-252045/latest.pdf","https://scholar.google.com/scholar?q=related:azkBVN6PgDEJ:scholar.google.com/&scioq=biocrust*%7C%22biological+soil+crust%22+photosynthesis&hl=en&as_sdt=2007"
75,"I Miralles, R Lázaro, M Sánchez-Marañón…","Biocrust cover and successional stages influence soil bacterial composition and diversity in semiarid ecosystems",2020,"Science of the Total …","Elsevier","https://www.sciencedirect.com/science/article/pii/S0048969719346455","https://scholar.google.com/scholar?cites=16626047793667811595&as_sdt=2005&sciodt=2007&hl=en",71,"2024-07-18 10:17:19","","","","",,,,,75,18.75,19,4,4,"… biocrust <mature cyanobacterial biocrusts <biocrust … <Biocrust characterized by the Lepraria isidiata lichen. Moreover, in each biocrust type, four different percentages of biocrust cover …","https://digibug.ugr.es/bitstream/handle/10481/87386/Biocrust%20cover_pre-print.pdf?sequence=1&isAllowed=y","https://scholar.google.com/scholar?q=related:C6k8OGGWu-YJ:scholar.google.com/&scioq=biocrust*%7C%22biological+soil+crust%22+photosynthesis&hl=en&as_sdt=2007"
34,"L Morillas, V Bellucco, ML Cascio, S Marras, D Spano…","Contribution of biological crust to soil CO2 efflux in a Mediterranean shrubland ecosystem",2017,"Geoderma","Elsevier","https://www.sciencedirect.com/science/article/pii/S0016706116307674","https://scholar.google.com/scholar?cites=6692273136243205606&as_sdt=2005&sciodt=2007&hl=en",72,"2024-07-18 10:17:19","","","","",,,,,34,4.86,6,6,7,"… the biocrust … biocrust biomass, soil microflora and biocrust type are all shaped by the soil superficial moisture (Kidron et al., 2010). As biocrust respiration is highly dependent on biocrust …","https://iris.uniss.it/retrieve/e1dc1a2d-ba68-1507-e053-3a05fe0ac7a3/Morillas%20et%20al_Postprint.pdf","https://scholar.google.com/scholar?q=related:5mWq0fW631wJ:scholar.google.com/&scioq=biocrust*%7C%22biological+soil+crust%22+photosynthesis&hl=en&as_sdt=2007"
14,"XC Zhang, JY Li, JL Liu, CX Yuan, YN Li, BR Liu…","Temporal shifts in cyanobacterial diversity and their relationships to different types of biological soil crust in the southeastern Tengger Desert",2021,"Rhizosphere","Elsevier","https://www.sciencedirect.com/science/article/pii/S2452219821000185","https://scholar.google.com/scholar?cites=14175879174031149900&as_sdt=2005&sciodt=2007&hl=en",73,"2024-07-18 10:17:19","","","","",,,,,14,4.67,2,7,3,"… photosynthesis, carbon fixation, and nitrogen-sulfur cycle participation in the biocrusts and in the cyanobacterial biocrust … moss biocrust plots, including five cyanobacterial biocrusts and …","","https://scholar.google.com/scholar?q=related:TAv8cgDXusQJ:scholar.google.com/&scioq=biocrust*%7C%22biological+soil+crust%22+photosynthesis&hl=en&as_sdt=2007"
177,"CR Kuske, CM Yeager, S Johnson, LO Ticknor…","Response and resilience of soil biocrust bacterial communities to chronic physical disturbance in arid shrublands",2012,"The ISME …","academic.oup.com","https://academic.oup.com/ismej/article-abstract/6/4/886/7590007","https://scholar.google.com/scholar?cites=17227711008221287672&as_sdt=2005&sciodt=2007&hl=en",74,"2024-07-18 10:17:19","","","","",,,,,177,14.75,35,5,12,"… Sub-biocrust soils were collected by removing the biocrust and scooping 5 g of sample at 5 cm depth. After preliminary analysis by T-RFLP and 16S rRNA gene sequencing showed …","https://www.nature.com/articles/ismej2011153.pdf","https://scholar.google.com/scholar?q=related:-NQduuIfFe8J:scholar.google.com/&scioq=biocrust*%7C%22biological+soil+crust%22+photosynthesis&hl=en&as_sdt=2007"
17,"C Tian, J Xi, M Ju, Y Li, Q Guo, L Yao, C Wang, Y Lin…","Biocrust microbiomes influence ecosystem structure and function in the Mu Us Sandland, northwest China",2021,"Ecological …","Elsevier","https://www.sciencedirect.com/science/article/pii/S1574954121002326","https://scholar.google.com/scholar?cites=97500958652438947&as_sdt=2005&sciodt=2007&hl=en",75,"2024-07-18 10:17:19","","","","",,,,,17,5.67,2,9,3,"… of biocrusts, and the mechanisms of biogeochemical cycles in the bacterial and fungal community in typical desert biocrusts… the ecological services provided by biocrusts. Therefore, the …","","https://scholar.google.com/scholar?q=related:oxm99ZpkWgEJ:scholar.google.com/&scioq=biocrust*%7C%22biological+soil+crust%22+photosynthesis&hl=en&as_sdt=2007"
2,"E Stricker, G Crain, J Rudgers, R Sinsabaugh…","What Could Explain δ13C Signatures in Biocrust Cyanobacteria of Drylands?",2021,"Microbial ecology","Springer","https://link.springer.com/article/10.1007/s00248-020-01536-3","https://scholar.google.com/scholar?cites=8760274108417081608&as_sdt=2005&sciodt=2007&hl=en",76,"2024-07-18 10:17:19","","10.1007/s00248-020-01536-3","","",,,,,2,0.67,0,5,3,"… photosynthetic capacity among biocrusts, we … of photosynthetic machinery in the soil may drive less intense fractionation, as seen with leaves [39]. To compare potential photosynthetic …","https://par.nsf.gov/servlets/purl/10298469","https://scholar.google.com/scholar?q=related:CIFAP-O-knkJ:scholar.google.com/&scioq=biocrust*%7C%22biological+soil+crust%22+photosynthesis&hl=en&as_sdt=2007"
73,"KD Doherty, AJ Antoninka, MA Bowker, SV Ayuso…","A novel approach to cultivate biocrusts for restoration and experimentation",2015,"Ecological …","JSTOR","https://www.jstor.org/stable/43441702","https://scholar.google.com/scholar?cites=17989350826562409148&as_sdt=2005&sciodt=2007&hl=en",77,"2024-07-18 10:17:19","","","","",,,,,73,8.11,15,5,9,"… all key functional groups of a biocrust community on a soil substrate, and outline its use for development of restoration materials or experimentation. Biocrust physiology is unlike that of …","https://www.jstor.org/stable/pdf/43441702.pdf","https://scholar.google.com/scholar?q=related:vNIh3UMDp_kJ:scholar.google.com/&scioq=biocrust*%7C%22biological+soil+crust%22+photosynthesis&hl=en&as_sdt=2007"
28,"B Weber, J Belnap, B Büdel","Synthesis on biological soil crust research",2016,"Biological soil crusts: an organizing principle …","Springer","https://link.springer.com/chapter/10.1007/978-3-319-30214-0_25","https://scholar.google.com/scholar?cites=12143905688939277438&as_sdt=2005&sciodt=2007&hl=en",78,"2024-07-18 10:17:19","","10.1007/978-3-319-30214-0_25","","",,,,,28,3.50,9,3,8,"… It is not known what specific soil factors are offsetting the photosynthetic gains from biocrusts, or the role of abiotic versus biotic losses. In addition, as an ecosystem cannot maintain a …","","https://scholar.google.com/scholar?q=related:fiwSB-LRh6gJ:scholar.google.com/&scioq=biocrust*%7C%22biological+soil+crust%22+photosynthesis&hl=en&as_sdt=2007"
4,"C Baubin, N Ran, H Siebner, O Gillor","The response of desert biocrust bacterial communities to hydration-desiccation cycles",2021,"SOIL Discussions","soil.copernicus.org","https://soil.copernicus.org/preprints/soil-2021-88/","https://scholar.google.com/scholar?cites=349821750293901791&as_sdt=2005&sciodt=2007&hl=en",79,"2024-07-18 10:17:19","","","","",,,,,4,1.33,1,4,3,"… predicted that increased biocrust moisture would resuscitate the phototrophs, while … Once the biocrust is hydrated, the 50 phototrophs respond quickly by inducing their photosynthetic …","https://soil.copernicus.org/preprints/soil-2021-88/soil-2021-88.pdf","https://scholar.google.com/scholar?q=related:3zH5SAfR2gQJ:scholar.google.com/&scioq=biocrust*%7C%22biological+soil+crust%22+photosynthesis&hl=en&as_sdt=2007"
0,"AD Richardson, GV Kong, KM Taylor…","Soil-atmosphere fluxes of CO2, CH4, and N2O across an experimentally-grown, successional gradient of biocrust community types",2022,"Frontiers in …","frontiersin.org","https://www.frontiersin.org/articles/10.3389/fmicb.2022.979825/full","",80,"2024-07-18 10:17:19","HTML","10.3389/fmicb.2022.979825","","",,,,,0,0.00,0,4,2,"… papers on biocrust photosynthesis, compared to the thousands of publications on photosynthesis by vascular plants. More generally, understanding of the potential for biocrusts to serve …","https://www.frontiersin.org/articles/10.3389/fmicb.2022.979825/full","https://scholar.google.com/scholar?q=related:kN7zoDWUtrQJ:scholar.google.com/&scioq=biocrust*%7C%22biological+soil+crust%22+photosynthesis&hl=en&as_sdt=2007"
1,"M Dietz, M Küppers, M Wachendorf, T Stefan, M Veste…","Modelling photosynthesis and carbon fluxes of moss-and lichen-dominated biological soil crusts in temperate dry acid grasslands in Brandenburg",2019,"","opus4.kobv.de","https://opus4.kobv.de/opus4-UBICO/frontdoor/index/index/docId/24436","https://scholar.google.com/scholar?cites=6072701556232592640&as_sdt=2005&sciodt=2007&hl=en",81,"2024-07-18 10:17:19","","","","",,,,,1,0.20,0,6,5,"… We analysed the response of photosynthesis … biocrust drying and rewetting cycles under field conditions. These experiments facilitated the development of an empirical photosynthesis …","","https://scholar.google.com/scholar?q=related:AJ00DuSRRlQJ:scholar.google.com/&scioq=biocrust*%7C%22biological+soil+crust%22+photosynthesis&hl=en&as_sdt=2007"
1,"Y Ma, B Weber, A Kratz, J Raggio, C Colesie…","Exploring environmental and physiological drivers of the annual carbon budget of biocrusts from various climatic zones with a mechanistic data-driven model",2023,"…","bg.copernicus.org","https://bg.copernicus.org/articles/20/2553/2023/bg-20-2553-2023.html","https://scholar.google.com/scholar?cites=16317417642536595009&as_sdt=2005&sciodt=2007&hl=en",82,"2024-07-18 10:17:19","HTML","","","",,,,,1,1.00,0,6,1,"… on biocrusts. This is necessary since, in our model, calculations of photosynthesis and … temperature but also depend on water saturation of biocrusts (affecting activity). However, …","https://bg.copernicus.org/articles/20/2553/2023/bg-20-2553-2023.html","https://scholar.google.com/scholar?q=related:Qe4Ve-Qcc-IJ:scholar.google.com/&scioq=biocrust*%7C%22biological+soil+crust%22+photosynthesis&hl=en&as_sdt=2007"
12,"KE Young, SC Reed","Spectrally monitoring the response of the biocrust moss Syntrichia caninervis to altered precipitation regimes",2017,"Scientific Reports","nature.com","https://www.nature.com/articles/srep41793","https://scholar.google.com/scholar?cites=6018657506728130655&as_sdt=2005&sciodt=2007&hl=en",83,"2024-07-18 10:17:19","HTML","","","",,,,,12,1.71,6,2,7,"… physiology of biocrusts with … biocrusts, which leaves them frequently photosynthetically inactive and difficult to assess. To address this critical limitation, we subjected a dominant biocrust …","https://www.nature.com/articles/srep41793","https://scholar.google.com/scholar?q=related:X7hEOR2RhlMJ:scholar.google.com/&scioq=biocrust*%7C%22biological+soil+crust%22+photosynthesis&hl=en&as_sdt=2007"
1,"S Gypser, M Veste","Application of chlorophyll fluorescence, CO2 gas exchange, and NDVI for the detection of spatial variances of photosynthesis of biological soil crusts on …",2016,"3rd International Workshop on Biological Soil …","opus4.kobv.de","https://opus4.kobv.de/opus4-UBICO/frontdoor/index/index/docId/18335","https://scholar.google.com/scholar?cites=5682752452810048067&as_sdt=2005&sciodt=2007&hl=en",84,"2024-07-18 10:17:19","","","","",,,,,1,0.13,1,2,8,"… influence of biocrusts on carbon … photosynthetic capacity and active phase regarding biocrust formation and developmental stage, which vary from initial green algae-crusts to biocrusts …","","https://scholar.google.com/scholar?q=related:QwI5UD8x3U4J:scholar.google.com/&scioq=biocrust*%7C%22biological+soil+crust%22+photosynthesis&hl=en&as_sdt=2007"
11,"S Lan, AD Thomas, S Tooth, L Wu, C Hu","Small-scale spatial heterogeneity of photosynthetic fluorescence associated with biological soil crust succession in the Tengger Desert, China",2019,"Microbial ecology","Springer","https://link.springer.com/article/10.1007/s00248-019-01356-0","https://scholar.google.com/scholar?cites=10778701712247791616&as_sdt=2005&sciodt=2007&hl=en",85,"2024-07-18 10:17:19","HTML","10.1007/s00248-019-01356-0","","",,,,,11,2.20,2,5,5,"… the photosynthetic heterogeneity in BSCs and to investigate variations in photosynthetic … distribution pattern of photosynthetic organisms in BSCs provides greater insight into crust …","https://link.springer.com/article/10.1007/s00248-019-01356-0","https://scholar.google.com/scholar?q=related:AKBsahmklZUJ:scholar.google.com/&scioq=biocrust*%7C%22biological+soil+crust%22+photosynthesis&hl=en&as_sdt=2007"
11,"W Dou, B Xiao, Y Wang, GJ Kidron","Contributions of three types of biocrusts to soil carbon stock and annual efflux in a small watershed of Northern Chinese Loess Plateau",2022,"Applied Soil Ecology","Elsevier","https://www.sciencedirect.com/science/article/pii/S0929139322002128","https://scholar.google.com/scholar?cites=9764847879041592379&as_sdt=2005&sciodt=2007&hl=en",86,"2024-07-18 10:17:19","","","","",,,,,11,5.50,3,4,2,"… In conclusion, different types of biocrusts are the dominant contributors of soil C fixation … biocrusts is highly overwhelmed by their elevated photosynthetic capacity, which make biocrusts …","","https://scholar.google.com/scholar?q=related:OywA3Gi1g4cJ:scholar.google.com/&scioq=biocrust*%7C%22biological+soil+crust%22+photosynthesis&hl=en&as_sdt=2007"
40,"ML Phillips, BE McNellis, A Howell, CM Lauria…","Biocrusts mediate a new mechanism for land degradation under a changing climate",2022,"Nature Climate …","nature.com","https://www.nature.com/articles/s41558-021-01249-6","https://scholar.google.com/scholar?cites=1043989174554921848&as_sdt=2005&sciodt=2007&hl=en",87,"2024-07-18 10:17:19","HTML","","","",,,,,40,20.00,8,5,2,"… Biological soil crusts (biocrusts) are photosynthetic soil communities found in drylands worldwide, which are central to the stability and resilience of dryland ecosystems, but vulnerable …","https://www.nature.com/articles/s41558-021-01249-6","https://scholar.google.com/scholar?q=related:eAuzep_-fA4J:scholar.google.com/&scioq=biocrust*%7C%22biological+soil+crust%22+photosynthesis&hl=en&as_sdt=2007"
17,"J Zhang, Y Zhang","Ecophysiological responses of the biocrust moss Syntrichia caninervis to experimental snow cover manipulations in a temperate desert of central Asia",2020,"Ecological Research","Wiley Online Library","https://esj-journals.onlinelibrary.wiley.com/doi/abs/10.1111/1440-1703.12072","https://scholar.google.com/scholar?cites=14967256308459072117&as_sdt=2005&sciodt=2007&hl=en",88,"2024-07-18 10:17:19","","10.1111/1440-1703.12072","","",,,,,17,4.25,9,2,4,"… These were used to collect samples of the biocrust moss, S. caninervis, together with the … The photosynthetically active leaves and young stems of the sampled moss were quickly …","https://www.researchgate.net/profile/Jing-Zhang-271/publication/337488596_Ecophysiological_responses_of_the_biocrust_moss_Syntrichia_caninervis_to_experimental_snow_cover_manipulations_in_a_temperate_desert_of_central_Asia/links/643e1e582eca706c8b683dd4/Ecophysiological-responses-of-the-biocrust-moss-Syntrichia-caninervis-to-experimental-snow-cover-manipulations-in-a-temperate-desert-of-central-Asia.pdf","https://scholar.google.com/scholar?q=related:dWrtB1Bgts8J:scholar.google.com/&scioq=biocrust*%7C%22biological+soil+crust%22+photosynthesis&hl=en&as_sdt=2007"
117,"S Ferrenberg, CL Tucker…","Biological soil crusts: diminutive communities of potential global importance",2017,"Frontiers in Ecology and …","Wiley Online Library","https://esajournals.onlinelibrary.wiley.com/doi/abs/10.1002/fee.1469","https://scholar.google.com/scholar?cites=16907052448902347219&as_sdt=2005&sciodt=2007&hl=en",89,"2024-07-18 10:17:19","","10.1002/fee.1469","","",,,,,117,16.71,39,3,7,"… Shown are uptake of CO 2 into biocrust biomass C (CBC) via photosynthesis (gross primary productivity [GPP]; green arrow) and its subsequent transfer to soil organic C (SOC) via crust …","https://esajournals.onlinelibrary.wiley.com/doi/am-pdf/10.1002/fee.1469","https://scholar.google.com/scholar?q=related:0_m495_qoeoJ:scholar.google.com/&scioq=biocrust*%7C%22biological+soil+crust%22+photosynthesis&hl=en&as_sdt=2007"
