Cites,Authors,Title,Year,Source,Publisher,ArticleURL,CitesURL,GSRank,QueryDate,Type,DOI,ISSN,CitationURL,Volume,Issue,StartPage,EndPage,ECC,CitesPerYear,CitesPerAuthor,AuthorCount,Age,Abstract,FullTextURL,RelatedURL
29,"A Tamm, J Caesar, N Kunz, C Colesie…","Ecophysiological properties of three biological soil crust types and their photoautotrophs from the Succulent Karoo, South Africa",2018,"Plant and Soil","Springer","https://link.springer.com/article/10.1007/s11104-018-3635-4","https://scholar.google.com/scholar?cites=1448191192956242541&as_sdt=2005&sciodt=2007&hl=en",1,"2024-07-18 10:17:19","HTML","10.1007/s11104-018-3635-4","","",,,,,29,4.83,6,5,6,"… Net photosynthesis of all three biocrust types (complete biocrusts) and their respective photoautotrophic components responded with optimum curves that decreased at the lower and …","https://link.springer.com/article/10.1007/s11104-018-3635-4","https://scholar.google.com/scholar?q=related:bYoBlzcCGRQJ:scholar.google.com/&scioq=biocrust*%7C%22biological+soil+crust%22+photosynthesis&hl=en&as_sdt=2007"
20,"L Xu, B Zhu, C Li, Z Zhou, M Yao, X Zhou, J Wang…","Increasing relative abundance of non-cyanobacterial photosynthetic organisms drives ecosystem multifunctionality during the succession of biological soil crusts",2021,"Geoderma","Elsevier","https://www.sciencedirect.com/science/article/pii/S0016706121001269","https://scholar.google.com/scholar?cites=9090758204607574229&as_sdt=2005&sciodt=2007&hl=en",2,"2024-07-18 10:17:19","","","","",,,,,20,6.67,3,8,3,"… To calculate an EMFI of the biocrust system, we considered (1) ecosystem C storage and … by chlorophyll-a contents (green/photosynthetic biomass) and net photosynthetic CO 2 and (2) …","https://drive.google.com/file/d/1OXNnCSiR86nCCuNANaly7oyrwSYw2OAh/view","https://scholar.google.com/scholar?q=related:1TCaFGzcKH4J:scholar.google.com/&scioq=biocrust*%7C%22biological+soil+crust%22+photosynthesis&hl=en&as_sdt=2007"
40,"S Gypser, WB Herppich, T Fischer, P Lange…","Photosynthetic characteristics and their spatial variance on biological soil crusts covering initial soils of post-mining sites in Lower Lusatia, NE Germany",2016,"… , Functional Ecology of …","Elsevier","https://www.sciencedirect.com/science/article/pii/S0367253016300226","https://scholar.google.com/scholar?cites=732536019616664391&as_sdt=2005&sciodt=2007&hl=en",3,"2024-07-18 10:17:19","","","","",,,,,40,5.00,8,5,8,"… biocrusts had higher photosynthetic capacity compared to green algae-dominated biocrusts or soil lichens, so the photosynthetic … The ratio of gross photosynthesis to respiration …","https://scholar.google.com/scholar?output=instlink&q=info:Rwtu8qB9KgoJ:scholar.google.com/&hl=en&as_sdt=2007&scillfp=6428356255979949810&oi=lle","https://scholar.google.com/scholar?q=related:Rwtu8qB9KgoJ:scholar.google.com/&scioq=biocrust*%7C%22biological+soil+crust%22+photosynthesis&hl=en&as_sdt=2007"
38,"MD Serpe, E Roberts, DJ Eldridge…","Bromus tectorum litter alters photosynthetic characteristics of biological soil crusts from a semiarid shrubland",2013,"Soil Biology and …","Elsevier","https://www.sciencedirect.com/science/article/pii/S0038071713000497","https://scholar.google.com/scholar?cites=13304095981707916337&as_sdt=2005&sciodt=2007&hl=en",4,"2024-07-18 10:17:19","","","","",,,,,38,3.45,10,4,11,"… the litter and compared photosynthetic characteristics of the biocrusts. Through this experiment, we … Does exposure to litter reduce the photosynthetic capacity of the biocrusts? Do B. …","https://scholarworks.boisestate.edu/cgi/viewcontent.cgi?article=1296&context=bio_facpubs","https://scholar.google.com/scholar?q=related:MfRmp86kobgJ:scholar.google.com/&scioq=biocrust*%7C%22biological+soil+crust%22+photosynthesis&hl=en&as_sdt=2007"
215,"S Maier, A Tamm, D Wu, J Caesar, M Grube…","Photoautotrophic organisms control microbial abundance, diversity, and physiology in different types of biological soil crusts",2018,"The ISME …","academic.oup.com","https://academic.oup.com/ismej/article-abstract/12/4/1032/7475477","https://scholar.google.com/scholar?cites=11750483226426003732&as_sdt=2005&sciodt=2007&hl=en",5,"2024-07-18 10:17:19","","","","",,,,,215,35.83,36,6,6,"… each biocrust type were performed with a portable photosynthesis system (… photosynthesis (NP) rates of each replicate. Samples of chlorolichen- and cyanobacteria-dominated biocrusts …","https://academic.oup.com/ismej/article-pdf/12/4/1032/55851610/41396_2018_article_62.pdf","https://scholar.google.com/scholar?q=related:FNFO2jwaEqMJ:scholar.google.com/&scioq=biocrust*%7C%22biological+soil+crust%22+photosynthesis&hl=en&as_sdt=2007"
52,"TGA Green, MCF Proctor","Physiology of photosynthetic organisms within biological soil crusts: their adaptation, flexibility, and plasticity",2016,"Biological soil crusts: an organizing principle in …","Springer","https://link.springer.com/chapter/10.1007/978-3-319-30214-0_18","https://scholar.google.com/scholar?cites=17674769689599642345&as_sdt=2005&sciodt=2007&hl=en",6,"2024-07-18 10:17:19","","10.1007/978-3-319-30214-0_18","","",,,,,52,6.50,26,2,8,"… In this chapter we look at the response of biocrust photosynthetic organisms to the main … special features of the poikilohydric lifestyle and the biocrust environment; that means that these …","","https://scholar.google.com/scholar?q=related:6YptQ2NlSfUJ:scholar.google.com/&scioq=biocrust*%7C%22biological+soil+crust%22+photosynthesis&hl=en&as_sdt=2007"
29,"M Muñoz-Rojas, NMM de Lima, S Chamizo…","Restoring post-fire ecosystems with biocrusts: living, photosynthetic soil surfaces",2021,"Current Opinion in …","Elsevier","https://www.sciencedirect.com/science/article/pii/S2468584421000453","https://scholar.google.com/scholar?cites=3549073138133690709&as_sdt=2005&sciodt=2007&hl=en",7,"2024-07-18 10:17:19","","","","",,,,,29,9.67,7,4,3,"… or biocrusts are communities of photosynthetic organisms (… Recent research has demonstrated that biocrust cyanobacteria … In this review, we highlight the important roles of biocrusts …","https://www.researchgate.net/profile/Miriam-Munoz-Rojas/publication/351397084_Restoring_post-fire_ecosystems_with_biocrusts_Living_photosynthetic_soil_surfaces/links/6134887138818c2eaf8222e2/Restoring-post-fire-ecosystems-with-biocrusts-Living-photosynthetic-soil-surfaces.pdf","https://scholar.google.com/scholar?q=related:VelWIDfXQDEJ:scholar.google.com/&scioq=biocrust*%7C%22biological+soil+crust%22+photosynthesis&hl=en&as_sdt=2007"
19,"KK Coe, J Belnap, EE Grote…","Physiological ecology of desert biocrust moss following 10 years exposure to elevated CO2: evidence for enhanced photosynthetic thermotolerance",2012,"Physiologia Plantarum","Wiley Online Library","https://onlinelibrary.wiley.com/doi/abs/10.1111/j.1399-3054.2012.01566.x","https://scholar.google.com/scholar?cites=13693198155242934900&as_sdt=2005&sciodt=2007&hl=en",8,"2024-07-18 10:17:19","","10.1111/j.1399-3054.2012.01566.x","","",,,,,19,1.58,5,4,12,"… of photosynthesis, with clear consequences for biocrust functioning in … photosynthetic responses to long-term CO 2 enrichment as well as the temperature tolerance of photosynthesis for …","https://www.academia.edu/download/43409585/Physiological_ecology_of_desert_biocrust20160305-9576-1lomccx.pdf","https://scholar.google.com/scholar?q=related:dBJKKiwDCL4J:scholar.google.com/&scioq=biocrust*%7C%22biological+soil+crust%22+photosynthesis&hl=en&as_sdt=2007"
12,"AD Thomas, DR Elliott, D Hardcastle, CL Strong…","Soil biocrusts affect metabolic response to hydration on dunes in west Queensland, Australia",2022,"Geoderma","Elsevier","https://www.sciencedirect.com/science/article/pii/S0016706121005449","https://scholar.google.com/scholar?cites=17300133983430312972&as_sdt=2005&sciodt=2007&hl=en",9,"2024-07-18 10:17:19","HTML","","","",,,,,12,6.00,2,5,2,"… controls on both biocrust photosynthesis and respiration. We … biocrust hydration and illumination affect soil CO 2 flux and … When dry, biocrust photosynthetic activity was not detected …","https://www.sciencedirect.com/science/article/pii/S0016706121005449","https://scholar.google.com/scholar?q=related:DAQHqTJsFvAJ:scholar.google.com/&scioq=biocrust*%7C%22biological+soil+crust%22+photosynthesis&hl=en&as_sdt=2007"
2,"Y Su, G Huang, J Liu","Biocrusts alleviate the aggravating C limitation in microbial respiration with increasing aridity",2023,"Geoderma","Elsevier","https://www.sciencedirect.com/science/article/pii/S0016706122005171","https://scholar.google.com/scholar?cites=9625145114345690732&as_sdt=2005&sciodt=2007&hl=en",10,"2024-07-18 10:17:19","HTML","","","",,,,,2,2.00,1,3,1,"… This implies that the net effect of biocrusts on soil organic C stock should be evaluated comprehensively considering both C input via photosynthesis and stimulated microbial …","https://www.sciencedirect.com/science/article/pii/S0016706122005171","https://scholar.google.com/scholar?q=related:bFYpPHxik4UJ:scholar.google.com/&scioq=biocrust*%7C%22biological+soil+crust%22+photosynthesis&hl=en&as_sdt=2007"
51,"I Miralles, ML de Guevara, S Chamizo…","Soil CO2 exchange controlled by the interaction of biocrust successional stage and environmental variables in two semiarid ecosystems",2018,"Soil Biology and …","Elsevier","https://www.sciencedirect.com/science/article/pii/S0038071718301767","https://scholar.google.com/scholar?cites=17449362080086743665&as_sdt=2005&sciodt=2007&hl=en",11,"2024-07-18 10:17:19","","","","",,,,,51,8.50,13,4,6,"… soil exceeded the biocrust gross photosynthesis, and consequently soils colonized by biocrusts behaved as … Our results show that photosynthesis of biocrusts overshadowed C lost by …","https://repositorio.ual.es/bitstream/handle/10835/15358/1-s2.0-S0038071718301767-main.pdf?sequence=1","https://scholar.google.com/scholar?q=related:cdq9dFyWKPIJ:scholar.google.com/&scioq=biocrust*%7C%22biological+soil+crust%22+photosynthesis&hl=en&as_sdt=2007"
15,"A Kleefeld, S Gypser, WB Herppich, G Bader, M Veste","Identification of spatial pattern of photosynthesis hotspots in moss-and lichen-dominated biological soil crusts by combining chlorophyll fluorescence imaging and …",2018,"Pedobiologia","Elsevier","https://www.sciencedirect.com/science/article/pii/S003140561730269X","https://scholar.google.com/scholar?cites=13173565059626129637&as_sdt=2005&sciodt=2007&hl=en",12,"2024-07-18 10:17:19","","","","",,,,,15,2.50,3,5,6,"… spatial pattern with high or low photosynthesis in biocrusts. … , the photosynthetic activity of biocrusts strongly depends on … and water holding capacity of biocrusts, and, at least partly, in …","","https://scholar.google.com/scholar?q=related:5ViDDKDn0bYJ:scholar.google.com/&scioq=biocrust*%7C%22biological+soil+crust%22+photosynthesis&hl=en&as_sdt=2007"
27,"S Chamizo, E Rodríguez-Caballero, MJ Moro…","Non-rainfall water inputs: A key water source for biocrust carbon fixation",2021,"Science of the total …","Elsevier","https://www.sciencedirect.com/science/article/pii/S0048969721033702","https://scholar.google.com/scholar?cites=7651250808294911774&as_sdt=2005&sciodt=2007&hl=en",13,"2024-07-18 10:17:19","","","","",,,,,27,9.00,7,4,3,"… Our results suggest that NRWI whose main water source is dew could mainly stimulate biocrust photosynthetic activity, leading to a net CO 2 uptake. In contrast, NRWI whose main …","https://rua.ua.es/dspace/bitstream/10045/115706/1/Chamizo_etal_2021_SciTotEnv_accepted.pdf","https://scholar.google.com/scholar?q=related:Hq_WcxK0LmoJ:scholar.google.com/&scioq=biocrust*%7C%22biological+soil+crust%22+photosynthesis&hl=en&as_sdt=2007"
30,"WW Zhuang, M Serpe, YM Zhang","The effect of lichen‐dominated biological soil crusts on growth and physiological characteristics of three plant species in a temperate desert of northwest China",2015,"Plant Biology","Wiley Online Library","https://onlinelibrary.wiley.com/doi/abs/10.1111/plb.12359","https://scholar.google.com/scholar?cites=17098966601390185238&as_sdt=2005&sciodt=2007&hl=en",14,"2024-07-18 10:17:19","","10.1111/plb.12359","","",,,,,30,3.33,10,3,9,"… which biocrusts were removed (biocrust-removed). The remaining plots served as control plots in which the biocrusts remained intact (biocrust-… effects of biocrusts on photosynthesis and …","https://citeseerx.ist.psu.edu/document?repid=rep1&type=pdf&doi=449dd170f9e2123b080299f045e89c71fd564984","https://scholar.google.com/scholar?q=related:Flshnoe7S-0J:scholar.google.com/&scioq=biocrust*%7C%22biological+soil+crust%22+photosynthesis&hl=en&as_sdt=2007"
29,"SC Reed, M Delgado-Baquerizo, S Ferrenberg","Biocrust science and global change",2019,"The New Phytologist","JSTOR","https://www.jstor.org/stable/26759454","https://scholar.google.com/scholar?cites=2487781026911136733&as_sdt=2005&sciodt=2007&hl=en",15,"2024-07-18 10:17:19","","","","",,,,,29,5.80,10,3,5,"… that biocrusts cover c. 12% of the Earth’s terrestrial surface (Rodriguez-Caballero et al., 2018), and these photosynthetic soil … For example, biocrusts fix significant amounts of carbon and …","https://www.jstor.org/stable/pdf/26759454","https://scholar.google.com/scholar?q=related:3av-w6lfhiIJ:scholar.google.com/&scioq=biocrust*%7C%22biological+soil+crust%22+photosynthesis&hl=en&as_sdt=2007"
108,"LG Sancho, J Belnap, C Colesie, J Raggio…","Carbon budgets of biological soil crusts at micro-, meso-, and global scales",2016,"Biological soil crusts: an …","Springer","https://link.springer.com/chapter/10.1007/978-3-319-30214-0_15","https://scholar.google.com/scholar?cites=16380922660141754413&as_sdt=2005&sciodt=2007&hl=en",16,"2024-07-18 10:17:19","","10.1007/978-3-319-30214-0_15","","",,,,,108,13.50,22,5,8,"… Across all scales, we need to better understand observed NPP/NSE rates: that is, what portion of the measured NSE is due to biocrust photosynthesis and respiration, and what portion …","","https://scholar.google.com/scholar?q=related:LWjlml66VOMJ:scholar.google.com/&scioq=biocrust*%7C%22biological+soil+crust%22+photosynthesis&hl=en&as_sdt=2007"
18,"E Dettweiler‐Robinson, M Nuanez, ME Litvak","Biocrust contribution to ecosystem carbon fluxes varies along an elevational gradient",2018,"Ecosphere","Wiley Online Library","https://esajournals.onlinelibrary.wiley.com/doi/abs/10.1002/ecs2.2315","https://scholar.google.com/scholar?cites=9247852064939081277&as_sdt=2005&sciodt=2007&hl=en",17,"2024-07-18 10:17:19","","10.1002/ecs2.2315","","",,,,,18,3.00,6,3,6,"… The positive net fluxes we measured from biocrusts across all of the sites suggest biocrust respiration is higher than photosynthesis under most summertime temperature conditions and …","https://esajournals.onlinelibrary.wiley.com/doi/pdfdirect/10.1002/ecs2.2315","https://scholar.google.com/scholar?q=related:PX4OsnT4VoAJ:scholar.google.com/&scioq=biocrust*%7C%22biological+soil+crust%22+photosynthesis&hl=en&as_sdt=2007"
12,"F Garcia-Pichel","The microbiology of biological soil crusts",2023,"Annual review of microbiology","annualreviews.org","https://www.annualreviews.org/content/journals/10.1146/annurev-micro-032521-015202","https://scholar.google.com/scholar?cites=8984761693247640444&as_sdt=2005&sciodt=2007&hl=en",18,"2024-07-18 10:17:19","HTML","10.1146/annurev-micro-032521-015202","","",,,,,12,12.00,12,1,1,"… biocrust) encompasses a variety of communities that develop on soil surfaces and are powered by photosynthetic … Because many of the advances in knowledge of biocrust microbiology …","https://www.annualreviews.org/content/journals/10.1146/annurev-micro-032521-015202","https://scholar.google.com/scholar?q=related:fBOQHShJsHwJ:scholar.google.com/&scioq=biocrust*%7C%22biological+soil+crust%22+photosynthesis&hl=en&as_sdt=2007"
215,"EE Grote, J Belnap, DC Housman…","Carbon exchange in biological soil crust communities under differential temperatures and soil water contents: implications for global change",2010,"Global Change …","Wiley Online Library","https://onlinelibrary.wiley.com/doi/abs/10.1111/j.1365-2486.2010.02201.x","https://scholar.google.com/scholar?cites=16480561350230185246&as_sdt=2005&sciodt=2007&hl=en",19,"2024-07-18 10:17:19","","10.1111/j.1365-2486.2010.02201.x","","",,,,,215,15.36,54,4,14,"… (consisting of 63% cyanobacteria, 18% moss, 19%Collema) during the spring and the net photosynthetic rates measured in this study for dark Colorado Plateau biocrusts under spring-…","https://onlinelibrary.wiley.com/doi/pdf/10.1111/j.1365-2486.2010.02201.x","https://scholar.google.com/scholar?q=related:HpWA8zq3tuQJ:scholar.google.com/&scioq=biocrust*%7C%22biological+soil+crust%22+photosynthesis&hl=en&as_sdt=2007"
95,"A Darrouzet-Nardi, SC Reed, EE Grote, J Belnap","Observations of net soil exchange of CO2 in a dryland show experimental warming increases carbon losses in biocrust soils",2015,"Biogeochemistry","Springer","https://link.springer.com/article/10.1007/s10533-015-0163-7","https://scholar.google.com/scholar?cites=15322871756527148274&as_sdt=2005&sciodt=2007&hl=en",20,"2024-07-18 10:17:19","HTML","10.1007/s10533-015-0163-7","","",,,,,95,10.56,24,4,9,"… the biocrusts and the soil beneath them. We observed measurable photosynthesis in biocrust … of substantial photosynthesis underneath snow by biocrust organisms in drylands. Overall, …","https://link.springer.com/article/10.1007/s10533-015-0163-7","https://scholar.google.com/scholar?q=related:8pyqsq3GpdQJ:scholar.google.com/&scioq=biocrust*%7C%22biological+soil+crust%22+photosynthesis&hl=en&as_sdt=2007"
42,"C Zhang, D Niu, M Song, JJ Elser, JG Okie…","Effects of rainfall manipulations on carbon exchange of cyanobacteria and moss-dominated biological soil crusts",2018,"Soil Biology and …","Elsevier","https://www.sciencedirect.com/science/article/pii/S0038071718301779","https://scholar.google.com/scholar?cites=3416532225759291095&as_sdt=2005&sciodt=2007&hl=en",21,"2024-07-18 10:17:19","","","","",,,,,42,7.00,7,6,6,"… biocrusts. Under higher water additions, both cyanobacteria and moss-dominated biocrusts … of both cyanobacteria and moss-dominated biocrusts, below which carbon loss occurs. This …","https://drive.google.com/file/d/1spMCa7kl8p8LrE-JnoxXQFn3Zsi1B55t/view","https://scholar.google.com/scholar?q=related:16YOMPX1aS8J:scholar.google.com/&scioq=biocrust*%7C%22biological+soil+crust%22+photosynthesis&hl=en&as_sdt=2007"
43,"KK Coe, JP Sparks, J Belnap","Physiological ecology of dryland biocrust mosses",2013,"Photosynthesis in bryophytes and early …","Springer","https://link.springer.com/chapter/10.1007/978-94-007-6988-5_16","https://scholar.google.com/scholar?cites=482322560319715201&as_sdt=2005&sciodt=2007&hl=en",22,"2024-07-18 10:17:19","","10.1007/978-94-007-6988-5_16","","",,,,,43,3.91,14,3,11,"… Biocrust mosses possess a suite of adaptations to cope with … This chapter will review the current knowledge of biocrust … CO 2 with respect to photosynthetic performance, reproduction, …","https://www.researchgate.net/profile/Kirsten-Deane-Coe/publication/264788490_Physiological_Ecology_of_Dryland_Biocrust_Mosses/links/53f0cc2f0cf2711e0c431225/Physiological-Ecology-of-Dryland-Biocrust-Mosses.pdf","https://scholar.google.com/scholar?q=related:gXcDK9CNsQYJ:scholar.google.com/&scioq=biocrust*%7C%22biological+soil+crust%22+photosynthesis&hl=en&as_sdt=2007"
76,"SC Reed, FT Maestre, R Ochoa-Hueso…","Biocrusts in the context of global change",2016,"Biological soil crusts: An …","Springer","https://link.springer.com/chapter/10.1007/978-3-319-30214-0_22","https://scholar.google.com/scholar?cites=7332505023214154659&as_sdt=2005&sciodt=2007&hl=en",23,"2024-07-18 10:17:19","","10.1007/978-3-319-30214-0_22","","",,,,,76,9.50,19,4,8,"… There are several mechanisms by which elevated CO 2 could affect biocrusts, including direct effects on photosynthesis and indirect effects via changes to vascular plant and/or …","https://drive.google.com/file/d/11UfeZgA6-uExAT1BlR2tw7y81bs6wJYT/view","https://scholar.google.com/scholar?q=related:o3NyJnhKwmUJ:scholar.google.com/&scioq=biocrust*%7C%22biological+soil+crust%22+photosynthesis&hl=en&as_sdt=2007"
142,"B Weber, J Belnap, B Büdel, AJ Antoninka…","What is a biocrust? A refined, contemporary definition for a broadening research community",2022,"Biological …","Wiley Online Library","https://onlinelibrary.wiley.com/doi/abs/10.1111/brv.12862","https://scholar.google.com/scholar?cites=4296002332732371180&as_sdt=2005&sciodt=2007&hl=en",24,"2024-07-18 10:17:19","","10.1111/brv.12862","","",,,,,142,71.00,28,5,2,"… within biocrusts, fungal mycelial mats are excluded from biocrusts for two reasons: there are no photosynthetic organisms present and they are not purely a soil surface phenomenon. …","https://onlinelibrary.wiley.com/doi/pdf/10.1111/brv.12862","https://scholar.google.com/scholar?q=related:7DDDRFx3njsJ:scholar.google.com/&scioq=biocrust*%7C%22biological+soil+crust%22+photosynthesis&hl=en&as_sdt=2007"
0,"D Qiu, AJ Antoninka, B Xiao","Greenness of moss biocrusts derived from RGB image is a reliable indicator to estimate biocrust carbon-fixation rates in drylands",2024,"Ecological Indicators","Elsevier","https://www.sciencedirect.com/science/article/pii/S1470160X24005867","",25,"2024-07-18 10:17:19","HTML","","","",,,,,0,0.00,0,3,1,"… Our study highlights the significance of moss biocrust greenness and their potential as indicators for moss biocrust photosynthetic carbon fixation rates and possibly other ecological …","https://www.sciencedirect.com/science/article/pii/S1470160X24005867","https://scholar.google.com/scholar?q=related:8Ye0bq58GuMJ:scholar.google.com/&scioq=biocrust*%7C%22biological+soil+crust%22+photosynthesis&hl=en&as_sdt=2007"
5,"MR Hoellrich, DK James, D Bustos…","Biocrust carbon exchange varies with crust type and time on Chihuahuan Desert gypsum soils",2023,"Frontiers in …","frontiersin.org","https://www.frontiersin.org/articles/10.3389/fmicb.2023.1128631/full","https://scholar.google.com/scholar?cites=15205406711039119540&as_sdt=2005&sciodt=2007&hl=en",26,"2024-07-18 10:17:19","HTML","10.3389/fmicb.2023.1128631","","",,,,,5,5.00,1,4,1,"… photosynthesis system to determine carbon exchange. Results: Biocrust carbon exchange values differed by biocrust … suggests rapid recovery of biocrust photosynthesis across types. …","https://www.frontiersin.org/articles/10.3389/fmicb.2023.1128631/full","https://scholar.google.com/scholar?q=related:tNDTjNd0BNMJ:scholar.google.com/&scioq=biocrust*%7C%22biological+soil+crust%22+photosynthesis&hl=en&as_sdt=2007"
18,"J Raggio, A Green, A Pintado, LG Sancho…","Functional performance of biocrusts across Europe and its implications for drylands",2021,"Journal of Arid …","Elsevier","https://www.sciencedirect.com/science/article/pii/S0140196320303013","https://scholar.google.com/scholar?cites=9781683300150882589&as_sdt=2005&sciodt=2007&hl=en",27,"2024-07-18 10:17:19","","","","",,,,,18,6.00,4,5,3,"… The information given in this mini-review suggests, for all photosynthetic organisms that compose biological soil crusts, that poikilohydry is the underlying functional type and that this …","","https://scholar.google.com/scholar?q=related:HTHdyiKFv4cJ:scholar.google.com/&scioq=biocrust*%7C%22biological+soil+crust%22+photosynthesis&hl=en&as_sdt=2007"
47,"B Büdel, WJ Williams, H Reichenberger","Annual net primary productivity of a cyanobacteria-dominated biological soil crust in the Gulf Savannah, Queensland, Australia",2018,"Biogeosciences","bg.copernicus.org","https://bg.copernicus.org/articles/15/491/2018/","https://scholar.google.com/scholar?cites=3985631616176479487&as_sdt=2005&sciodt=2007&hl=en",28,"2024-07-18 10:17:19","","","","",,,,,47,7.83,16,3,6,"… , two biocrust groups can be distinguished: one where biocrusts experienced net C uptake and the other where biocrusts … Contour plot of net photosynthesis of the Boodjamulla biocrust …","https://bg.copernicus.org/articles/15/491/2018/bg-15-491-2018.pdf","https://scholar.google.com/scholar?q=related:_9zDj9bOTzcJ:scholar.google.com/&scioq=biocrust*%7C%22biological+soil+crust%22+photosynthesis&hl=en&as_sdt=2007"
8,"AM Heredia-Velásquez, A Giraldo-Silva, C Nelson…","Dual use of solar power plants as biocrust nurseries for large-scale arid soil restoration",2023,"Nature …","nature.com","https://www.nature.com/articles/s41893-023-01106-8","https://scholar.google.com/scholar?cites=15233417573877612188&as_sdt=2005&sciodt=2007&hl=en",29,"2024-07-18 10:17:19","","","","",,,,,8,8.00,2,4,1,"… The interventional regeneration of the natural cover of these soils—photosynthetic communities known as biocrusts that armour them against erosion and fertilize them—is currently …","https://www.researchgate.net/profile/Ana-Giraldo-Silva/publication/370153569_Dual_use_of_solar_power_plants_as_biocrust_nurseries_for_large-scale_arid_soil_restoration/links/6480e91e2cad460a1bfc45c1/Dual-use-of-solar-power-plants-as-biocrust-nurseries-for-large-scale-arid-soil-restoration.pdf?_sg%5B0%5D=started_experiment_milestone&_sg%5B1%5D=started_experiment_milestone&origin=journalDetail&_rtd=e30%3D","https://scholar.google.com/scholar?q=related:nP4qxpL4Z9MJ:scholar.google.com/&scioq=biocrust*%7C%22biological+soil+crust%22+photosynthesis&hl=en&as_sdt=2007"
