Cites,Authors,Title,Year,Source,Publisher,ArticleURL,CitesURL,GSRank,QueryDate,Type,DOI,ISSN,CitationURL,Volume,Issue,StartPage,EndPage,ECC,CitesPerYear,CitesPerAuthor,AuthorCount,Age,Abstract,FullTextURL,RelatedURL
1,"B Steven","Phototrophic Mats of the Desert: The Bacteria of the Biological Soil Crust Community",2022,"Microbiology of Hot Deserts","Springer","https://link.springer.com/chapter/10.1007/978-3-030-98415-1_3","https://scholar.google.com/scholar?cites=13229959161526326031&as_sdt=2005&sciodt=2007&hl=en",120,"2024-07-18 10:17:19","","10.1007/978-3-030-98415-1_3","","",,,,,1,0.50,1,1,2,"… and nourish biocrusts. This chapter is not meant to be a comprehensive review of biocrusts, … Phototrophs perform photosynthesis and fix carbon into the biocrusts and heterotrophs that …","https://www.researchgate.net/profile/Blaire-Steven/publication/362333817_Phototrophic_Mats_of_the_Desert_The_Bacteria_of_the_Biological_Soil_Crust_Community/links/62e92cee3c0ea8788776689f/Phototrophic-Mats-of-the-Desert-The-Bacteria-of-the-Biological-Soil-Crust-Community.pdf","https://scholar.google.com/scholar?q=related:D5OzF8NBmrcJ:scholar.google.com/&scioq=biocrust*%7C%22biological+soil+crust%22+photosynthesis&hl=en&as_sdt=2007"
59,"T Chock, AJ Antoninka, AM Faist, MA Bowker…","Responses of biological soil crusts to rehabilitation strategies",2019,"Journal of arid …","Elsevier","https://www.sciencedirect.com/science/article/pii/S0140196318301848","https://scholar.google.com/scholar?cites=15773320018941569828&as_sdt=2005&sciodt=2007&hl=en",121,"2024-07-18 10:17:19","HTML","","","",,,,,59,11.80,12,5,5,"… biocrust community, we scraped the top 1 cm of biocrust from the soil surface. The … Chl a, an index of photosynthetic biomass, increased two-to three-fold over the three year period …","https://www.sciencedirect.com/science/article/pii/S0140196318301848","https://scholar.google.com/scholar?q=related:JOuRkfwW5toJ:scholar.google.com/&scioq=biocrust*%7C%22biological+soil+crust%22+photosynthesis&hl=en&as_sdt=2007"
38,"J Bethany, A Giraldo-Silva, C Nelson…","Optimizing the production of nursery-based biological soil crusts for restoration of arid land soils",2019,"Applied and …","Am Soc Microbiol","https://journals.asm.org/doi/abs/10.1128/aem.00735-19","https://scholar.google.com/scholar?cites=14949483137127124693&as_sdt=2005&sciodt=2007&hl=en",122,"2024-07-18 10:17:19","","10.1128/aem.00735-19","","",,,,,38,7.60,10,4,5,"… from cold deserts took 3 to 7 weeks to reach maximum levels whereas biocrusts from hot … cold biocrusts will likely develop photosynthetic biomass at a higher rate than warm biocrusts, …","https://journals.asm.org/doi/pdf/10.1128/aem.00735-19","https://scholar.google.com/scholar?q=related:1Y4nHLU7d88J:scholar.google.com/&scioq=biocrust*%7C%22biological+soil+crust%22+photosynthesis&hl=en&as_sdt=2007"
25,"KE Young, S Ferrenberg, R Reibold, SC Reed…","Vertical movement of soluble carbon and nutrients from biocrusts to subsurface mineral soils",2022,"Geoderma","Elsevier","https://www.sciencedirect.com/science/article/pii/S0016706121005759","https://scholar.google.com/scholar?cites=1570241866710546386&as_sdt=2005&sciodt=2007&hl=en",123,"2024-07-18 10:17:19","","","","",,,,,25,12.50,5,5,2,"… through which biocrust fertility is … biocrust leachate in contributing to subsurface nutrient and soluble C pools and subsurface microbial cycling. We collected biocrusts from three biocrust …","https://www.sciencedirect.com/science/article/am/pii/S0016706121005759","https://scholar.google.com/scholar?q=related:0ne6hKieyhUJ:scholar.google.com/&scioq=biocrust*%7C%22biological+soil+crust%22+photosynthesis&hl=en&as_sdt=2007"
14,"LG Sancho, FT Maestre, B Büdel","Biological soil crusts in a changing world: introduction to the special issue",2014,"Biodiversity and Conservation","Springer","https://link.springer.com/article/10.1007/s10531-014-0727-1","https://scholar.google.com/scholar?cites=16911646522275467085&as_sdt=2005&sciodt=2007&hl=en",124,"2024-07-18 10:17:19","HTML","10.1007/s10531-014-0727-1","","",,,,,14,1.40,5,3,10,"… , net photosynthesis was significantly greater in high biocrust cover … of biocrusts than changes in rainfall amounts. They also indicate that climate change may reduce the photosynthetic …","https://link.springer.com/article/10.1007/s10531-014-0727-1","https://scholar.google.com/scholar?q=related:TQ8zB-k8suoJ:scholar.google.com/&scioq=biocrust*%7C%22biological+soil+crust%22+photosynthesis&hl=en&as_sdt=2007"
2,"J Sun, K Yu, N Chen, SM Munson, X Li, R Jia","Biocrusts modulate carbon losses under warming across global drylands: A bayesian meta-analysis",2024,"Soil Biology and …","Elsevier","https://www.sciencedirect.com/science/article/pii/S0038071723002766","https://scholar.google.com/scholar?cites=5399857225009924846&as_sdt=2005&sciodt=2007&hl=en",125,"2024-07-18 10:17:19","","","","",,,,,2,2.00,0,6,1,"… Biocrust respiration can be responsible for a large proportion of total ecosystem C emissions, while biocrusts also fix atmospheric C by photosynthesis (… gross photosynthesis of biocrust …","https://www.jjh.cz/upload/36502.pdf","https://scholar.google.com/scholar?q=related:7gqLVokl8EoJ:scholar.google.com/&scioq=biocrust*%7C%22biological+soil+crust%22+photosynthesis&hl=en&as_sdt=2007"
6,"GJ Kidron, R Kronenfeld","One‐year‐long evaluation of non‐rainfall water available to soil biocrusts in the Negev Highlands",2023,"Ecohydrology","Wiley Online Library","https://onlinelibrary.wiley.com/doi/abs/10.1002/eco.2529","https://scholar.google.com/scholar?cites=6619446588673636557&as_sdt=2005&sciodt=2007&hl=en",126,"2024-07-18 10:17:19","","10.1002/eco.2529","","",,,,,6,6.00,3,2,1,"… as an important water source for soil biocrusts. In fact, our data imply that as far as the average amounts are concerned, both thresholds for net photosynthesis, that of the cyanobacteria (…","https://scholar.google.com/scholar?output=instlink&q=info:zTiQ35n_3FsJ:scholar.google.com/&hl=en&as_sdt=2007&scillfp=10082523719546560883&oi=lle","https://scholar.google.com/scholar?q=related:zTiQ35n_3FsJ:scholar.google.com/&scioq=biocrust*%7C%22biological+soil+crust%22+photosynthesis&hl=en&as_sdt=2007"
0,"X Li, J Sun, H Zhang, H Tan, R Hui, J Qi…","Warming decreases desert ecosystem functioning by altering biocrusts in drylands",2023,"Journal of Applied …","Wiley Online Library","https://besjournals.onlinelibrary.wiley.com/doi/abs/10.1111/1365-2664.14528","",127,"2024-07-18 10:17:19","","10.1111/1365-2664.14528","","",,,,,0,0.00,0,7,1,"… Specifically, we will focus on the following questions: First, the main types of biocrusts … was estimated by measuring biocrust photosynthesis in the field. Net photosynthesis (P n ) …","","https://scholar.google.com/scholar?q=related:YGxr8y7XtHgJ:scholar.google.com/&scioq=biocrust*%7C%22biological+soil+crust%22+photosynthesis&hl=en&as_sdt=2007"
65,"AM Chilton, BA Neilan, DJ Eldridge","Biocrust morphology is linked to marked differences in microbial community composition",2018,"Plant and soil","Springer","https://link.springer.com/article/10.1007/s11104-017-3442-3","https://scholar.google.com/scholar?cites=16346929254900809471&as_sdt=2005&sciodt=2007&hl=en",128,"2024-07-18 10:17:19","HTML","10.1007/s11104-017-3442-3","","",,,,,65,10.83,22,3,6,"… In the deserts of the western United States, studies of biocrusts along a developmental gradient from thin cryptic species to dark mature biocrusts showed that changes in biocrust …","https://link.springer.com/article/10.1007/s11104-017-3442-3","https://scholar.google.com/scholar?q=related:_77NLoz12-IJ:scholar.google.com/&scioq=biocrust*%7C%22biological+soil+crust%22+photosynthesis&hl=en&as_sdt=2007"
80,"B Steven, CR Kuske, LV Gallegos-Graves…","Climate change and physical disturbance manipulations result in distinct biological soil crust communities",2015,"Applied and …","Am Soc Microbiol","https://journals.asm.org/doi/abs/10.1128/aem.01443-15","https://scholar.google.com/scholar?cites=16264250336154056731&as_sdt=2005&sciodt=2007&hl=en",129,"2024-07-18 10:17:19","","10.1128/aem.01443-15","","",,,,,80,8.89,20,4,9,"… This study illustrates that different types of biocrust disturbance damage biocrusts in … Biological soil crusts (biocrusts) are surface soil microbial mats that are dominated by photosynthetic …","https://journals.asm.org/doi/pdf/10.1128/aem.01443-15","https://scholar.google.com/scholar?q=related:G3h9UII5tuEJ:scholar.google.com/&scioq=biocrust*%7C%22biological+soil+crust%22+photosynthesis&hl=en&as_sdt=2007"
0,"L Xu, Y Kou, W Xiong, C Li, P Zou, B Jiao, Z Xu, B Tan…","Soil depths and developmental stages of biological soil crusts are more important than shrub cover in structuring prokaryotic communities",2023,"Catena","Elsevier","https://www.sciencedirect.com/science/article/pii/S0341816223005271","",130,"2024-07-18 10:17:19","","","","",,,,,0,0.00,0,9,1,"… Binding together the top millimetres of surface soil and with photosynthetic communities living in, biocrusts consist of microscopic eukaryotic algae, fungi, cyanobacteria, heterotrophic …","","https://scholar.google.com/scholar?q=related:3fzeuzY2QKgJ:scholar.google.com/&scioq=biocrust*%7C%22biological+soil+crust%22+photosynthesis&hl=en&as_sdt=2007"
27,"SE Fick, N Day, MC Duniway, S Hoy‐Skubik…","Microsite enhancements for soil stabilization and rapid biocrust colonization in degraded drylands",2020,"Restoration …","Wiley Online Library","https://onlinelibrary.wiley.com/doi/abs/10.1111/rec.13071","https://scholar.google.com/scholar?cites=7356834812187076673&as_sdt=2005&sciodt=2007&hl=en",131,"2024-07-18 10:17:19","","10.1111/rec.13071","","",,,,,27,6.75,5,5,4,"… We applied soil stabilizer to prevent burial of photosynthetic organisms and displacement of inoculum through ambient erosion by wind and water. In both the stabilizer trial and full …","https://fickse.github.io/files/Fick_Restoration_Ecology_2019.pdf","https://scholar.google.com/scholar?q=related:QWijk0i6GGYJ:scholar.google.com/&scioq=biocrust*%7C%22biological+soil+crust%22+photosynthesis&hl=en&as_sdt=2007"
37,"S Baldauf, P Porada, J Raggio, FT Maestre…","Relative humidity predominantly determines long‐term biocrust‐forming lichen cover in drylands under climate change",2021,"Journal of …","Wiley Online Library","https://besjournals.onlinelibrary.wiley.com/doi/abs/10.1111/1365-2745.13563","https://scholar.google.com/scholar?cites=7502801023218890511&as_sdt=2005&sciodt=2007&hl=en",132,"2024-07-18 10:17:19","","10.1111/1365-2745.13563","","",,,,,37,12.33,7,5,3,"… Similarly, in that study, the maximum net photosynthesis of lichen-dominated biocrusts from the Alps was independent of rainfall duration and showed similar photosynthesis rates …","https://besjournals.onlinelibrary.wiley.com/doi/pdf/10.1111/1365-2745.13563","https://scholar.google.com/scholar?q=related:DzdmccdNH2gJ:scholar.google.com/&scioq=biocrust*%7C%22biological+soil+crust%22+photosynthesis&hl=en&as_sdt=2007"
1,"GJ Kidron","Is nonrainfall water a likely water source for arid and semiarid biocrusts? A critical perspective",2024,"Ecohydrology","Wiley Online Library","https://onlinelibrary.wiley.com/doi/abs/10.1002/eco.2647","https://scholar.google.com/scholar?cites=8273785118581347940&as_sdt=2005&sciodt=2007&hl=en",133,"2024-07-18 10:17:19","","10.1002/eco.2647","","",,,,,1,1.00,1,1,1,"… to evaluate net photosynthesis by biocrusts. … photosynthesis by biocrusts comes from nondewy as well from dewy deserts. In the Tabernas (SE Spain), for instance, no photosynthesis …","https://scholar.google.com/scholar?output=instlink&q=info:ZFb0nLpj0nIJ:scholar.google.com/&hl=en&as_sdt=2007&scillfp=12902691958719116052&oi=lle","https://scholar.google.com/scholar?q=related:ZFb0nLpj0nIJ:scholar.google.com/&scioq=biocrust*%7C%22biological+soil+crust%22+photosynthesis&hl=en&as_sdt=2007"
6,"W Ai-guo, Z Yun-ge, XU Ming-xiang…","Effects of biological soil crust at different succession stages in hilly region of Loess Plateau on soil CO2 flux.",2013,"Yingyong Shengtai …","search.ebscohost.com","https://search.ebscohost.com/login.aspx?direct=true&profile=ehost&scope=site&authtype=crawler&jrnl=10019332&AN=88994899&h=Awsvf3s41rOsrYMeI0okbnRhhRLqsBjTKo7gXnbi2ZBDA3sYocZjslcCQzDqSJAKDaNESUKjF%2BtLbsFkRhTDwQ%3D%3D&crl=c","https://scholar.google.com/scholar?cites=3353252114643583235&as_sdt=2005&sciodt=2007&hl=en",134,"2024-07-18 10:17:19","","","","",,,,,6,0.55,2,4,11,"… Response of biocrusts photosynthesis to environmental factors: A possible explanation of the spatial distribution of biocrusts in the hilly Loess Plateau region of China. Acta Ecologica …","","https://scholar.google.com/scholar?q=related:A4GoLwgliS4J:scholar.google.com/&scioq=biocrust*%7C%22biological+soil+crust%22+photosynthesis&hl=en&as_sdt=2007"
1,"WM Ridenour, CJ Lortie, RM Callaway","A realized facilitation cascade mediated by biological soil crusts in a sagebrush steppe community",2023,"Scientific Reports","nature.com","https://www.nature.com/articles/s41598-023-31967-0","https://scholar.google.com/scholar?cites=12859666709154500909&as_sdt=2005&sciodt=2007&hl=en",135,"2024-07-18 10:17:19","HTML","","","",,,,,1,1.00,0,3,1,"… Aboveground biomass of Artemisia tridentata juveniles grown for two years in locations with biocrusts intact and biocrusts removed, and photosynthetic rates of one-year-old and two-…","https://www.nature.com/articles/s41598-023-31967-0","https://scholar.google.com/scholar?q=related:LRESEb22drIJ:scholar.google.com/&scioq=biocrust*%7C%22biological+soil+crust%22+photosynthesis&hl=en&as_sdt=2007"
0,"M Hoellrich, N Pietrasiak","Carbon exchange responses of rehydrated and incubated biological soil crust samples from White Sands National Park in 2020-2022",2023,"","par.nsf.gov","https://par.nsf.gov/biblio/10476953","",136,"2024-07-18 10:17:19","","","","",,,,,0,0.00,0,2,1,"… capacity of biocrust types; 2) assess biocrust carbon fixation … Biocrust carbon exchange values differed by biocrust type, … suggests rapid recovery of biocrust photosynthesis across types. …","","https://scholar.google.com/scholar?q=related:vIZyZCXf1TUJ:scholar.google.com/&scioq=biocrust*%7C%22biological+soil+crust%22+photosynthesis&hl=en&as_sdt=2007"
18,"K Zhao, B Zhang, J Li, B Li, Z Wu","The autotrophic community across developmental stages of biocrusts in the Gurbantunggut Desert",2021,"Geoderma","Elsevier","https://www.sciencedirect.com/science/article/pii/S001670612100001X","https://scholar.google.com/scholar?cites=7579828617052616797&as_sdt=2005&sciodt=2007&hl=en",137,"2024-07-18 10:17:19","","","","",,,,,18,6.00,4,5,3,"… fundamental roles in biocrust development by … biocrust succession have not been revealed. In this study, we investigated the autotrophic communities in bare sand and three biocrust …","","https://scholar.google.com/scholar?q=related:XfjCsff1MGkJ:scholar.google.com/&scioq=biocrust*%7C%22biological+soil+crust%22+photosynthesis&hl=en&as_sdt=2007"
36,"B Steven, J Belnap, CR Kuske","Chronic physical disturbance substantially alters the response of biological soil crusts to a wetting pulse, as characterized by metatranscriptomic sequencing",2018,"Frontiers in Microbiology","frontiersin.org","https://www.frontiersin.org/articles/10.3389/fmicb.2018.02382/full","https://scholar.google.com/scholar?cites=16916605482212319800&as_sdt=2005&sciodt=2007&hl=en",138,"2024-07-18 10:17:19","HTML","10.3389/fmicb.2018.02382","","",,,,,36,6.00,12,3,6,"… Soil depth (biocrust and below crust) was a relatively small factor in differentiating the … , particularly for the biocrusts. Biocrusts increased transcripts for photosynthesis and carbon fixation…","https://www.frontiersin.org/articles/10.3389/fmicb.2018.02382/full","https://scholar.google.com/scholar?q=related:OOKw3A7bw-oJ:scholar.google.com/&scioq=biocrust*%7C%22biological+soil+crust%22+photosynthesis&hl=en&as_sdt=2007"
5,"L Wu, ME Farías, RM Torres, L Xia, S Song…","Salinity affects microbial composition and function in artificially induced biocrusts: implications for cyanobacterial inoculation in saline soils",2022,"Soil Biology and …","Elsevier","https://www.sciencedirect.com/science/article/pii/S0038071722001481","https://scholar.google.com/scholar?cites=10102876052563145105&as_sdt=2005&sciodt=2007&hl=en",139,"2024-07-18 10:17:19","","","","",,,,,5,2.50,1,6,2,"… The Salt+Water treatment not only affected biocrust photosynthetic biomass, but also reduced the relative abundance of photosynthetic microorganisms in the community (P <0.05; Fig. 1…","","https://scholar.google.com/scholar?q=related:kbHTEj6gNIwJ:scholar.google.com/&scioq=biocrust*%7C%22biological+soil+crust%22+photosynthesis&hl=en&as_sdt=2007"
18,"T Fischer, M Veste","Carbon cycling of biological soil crusts mirrors ecological maturity along a Central European inland dune catena",2018,"Catena","Elsevier","https://www.sciencedirect.com/science/article/pii/S0341816217302928","https://scholar.google.com/scholar?cites=16832399383238739857&as_sdt=2005&sciodt=2007&hl=en",140,"2024-07-18 10:17:19","HTML","","","",,,,,18,3.00,9,2,6,"… In this study, we used these unique model features of biocrusts to address the question of … and influence the photosynthetic activity of the biocrusts. Hence, photosynthesis models are …","https://www.sciencedirect.com/science/article/pii/S0341816217302928","https://scholar.google.com/scholar?q=related:kQdzow6ymOkJ:scholar.google.com/&scioq=biocrust*%7C%22biological+soil+crust%22+photosynthesis&hl=en&as_sdt=2007"
29,"X Yao, MA Bowker, B Xiao","Estimation of annual CO2 efflux of moss biocrust through measuring and simulating its respiration rate in a semiarid climate",2020,"Geoderma","Elsevier","https://www.sciencedirect.com/science/article/pii/S0016706120300446","https://scholar.google.com/scholar?cites=4258715339940763412&as_sdt=2005&sciodt=2007&hl=en",141,"2024-07-18 10:17:19","","","","",,,,,29,7.25,10,3,4,"… −1 in total through photosynthesis and finally gained a net 1.70 g CO 2 -C m −2 yr −1 in the north Queensland Gulf Savannah. The net photosynthetic rate of biocrust reaches as high as …","https://par.nsf.gov/servlets/purl/10209486","https://scholar.google.com/scholar?q=related:FBetvAn_GTsJ:scholar.google.com/&scioq=biocrust*%7C%22biological+soil+crust%22+photosynthesis&hl=en&as_sdt=2007"
36,"JR Román, E Rodríguez-Caballero…","Spectral response analysis: An indirect and non-destructive methodology for the chlorophyll quantification of biocrusts",2019,"Remote Sensing","mdpi.com","https://www.mdpi.com/2072-4292/11/11/1350","https://scholar.google.com/scholar?cites=17167350481936149136&as_sdt=2005&sciodt=2007&hl=en",142,"2024-07-18 10:17:19","HTML","","","",,,,,36,7.20,12,3,5,"… photosynthetically active organisms within the biocrust community [14] that have been demonstrated to be one of the best indexes of biocrust … used to assess biocrust states in response …","https://www.mdpi.com/2072-4292/11/11/1350","https://scholar.google.com/scholar?q=related:kGpvik6uPu4J:scholar.google.com/&scioq=biocrust*%7C%22biological+soil+crust%22+photosynthesis&hl=en&as_sdt=2007"
27,"X Li, R Hui, P Zhang, N Song","Divergent responses of moss-and lichen-dominated biocrusts to warming and increased drought in arid desert regions",2021,"Agricultural and Forest Meteorology","Elsevier","https://www.sciencedirect.com/science/article/pii/S0168192321000708","https://scholar.google.com/scholar?cites=8161295977548123473&as_sdt=2005&sciodt=2007&hl=en",143,"2024-07-18 10:17:19","","","","",,,,,27,9.00,7,4,3,"… of available carbon via photosynthesis (Fig. 4), and biocrust photosynthesis is determined by the water content rather than either photosynthetically active radiation or temperature (Li et …","http://www.lzb.cas.cn/kyjz/202103/P020210312601672047996.pdf","https://scholar.google.com/scholar?q=related:UY2UgHO_QnEJ:scholar.google.com/&scioq=biocrust*%7C%22biological+soil+crust%22+photosynthesis&hl=en&as_sdt=2007"
16,"X Li, R Hui, H Tan, Y Zhao, R Liu, N Song","Biocrust research in China: recent progress and application in land degradation control",2021,"Frontiers in Plant Science","frontiersin.org","https://www.frontiersin.org/articles/10.3389/fpls.2021.751521/full","https://scholar.google.com/scholar?cites=16506133747788782264&as_sdt=2005&sciodt=2007&hl=en",144,"2024-07-18 10:17:19","HTML","10.3389/fpls.2021.751521","","",,,,,16,5.33,3,6,3,"… biocrusts conducted in China since 2000, which firstly focused on the eco-physiological responses of biocrusts to … Specifically, UV-B radiation inhibits the net photosynthetic rate of algae …","https://www.frontiersin.org/articles/10.3389/fpls.2021.751521/full","https://scholar.google.com/scholar?q=related:uJoJvDCREeUJ:scholar.google.com/&scioq=biocrust*%7C%22biological+soil+crust%22+photosynthesis&hl=en&as_sdt=2007"
41,"A Antoninka, MA Bowker, NN Barger…","Addressing barriers to improve biocrust colonization and establishment in dryland restoration",2020,"Restoration …","Wiley Online Library","https://onlinelibrary.wiley.com/doi/abs/10.1111/rec.13052","https://scholar.google.com/scholar?cites=1343612610685202817&as_sdt=2005&sciodt=2007&hl=en",145,"2024-07-18 10:17:19","","10.1111/rec.13052","","",,,,,41,10.25,10,4,4,"… the success of biocrust inoculation by: (1) reducing physiological stress on biocrusts and … Lake City, we applied field-harvested biocrust material to experimental plots on coarse- and …","https://onlinelibrary.wiley.com/doi/am-pdf/10.1111/rec.13052","https://scholar.google.com/scholar?q=related:gXGg94x4pRIJ:scholar.google.com/&scioq=biocrust*%7C%22biological+soil+crust%22+photosynthesis&hl=en&as_sdt=2007"
12,"AC Letendre, DS Coxson, KJ Stewart","Restoration of ecosystem function by soil surface inoculation with biocrust in mesic and xeric alpine ecosystems",2019,"Ecological Restoration","er.uwpress.org","https://er.uwpress.org/content/37/2/101.short","https://scholar.google.com/scholar?cites=1799093959625878484&as_sdt=2005&sciodt=2007&hl=en",146,"2024-07-18 10:17:19","","","","",,,,,12,2.40,4,3,5,"… of mature biocrusts. We also examined the influence of inoculation with mature biocrusts and fertilization on the recovery of biocrusts in disturbed alpine soils. Biocrust cover and soil …","https://muse.jhu.edu/article/725210/pdf","https://scholar.google.com/scholar?q=related:1CsNnWyq9xgJ:scholar.google.com/&scioq=biocrust*%7C%22biological+soil+crust%22+photosynthesis&hl=en&as_sdt=2007"
15,"JN Aranibar, MJ Repetur, VR García, RE Dazat…","Functional responses of biological soil crusts to simulated small precipitation pulses in the Monte desert, Argentina",2022,"Geoderma","Elsevier","https://www.sciencedirect.com/science/article/pii/S0016706121007400","https://scholar.google.com/scholar?cites=450410411265016544&as_sdt=2005&sciodt=2007&hl=en",147,"2024-07-18 10:17:19","","","","",,,,,15,7.50,3,5,2,"… that biocrusts respond to low simulated precipitation pulses, lower than 10 mm, increasing nutrient availability. We expected biocrust … Biocrust organisms can perform photosynthesis, …","","https://scholar.google.com/scholar?q=related:4MKW9uEtQAYJ:scholar.google.com/&scioq=biocrust*%7C%22biological+soil+crust%22+photosynthesis&hl=en&as_sdt=2007"
38,"L Wu, Y Zhang, J Zhang, A Downing","Precipitation intensity is the primary driver of moss crust-derived CO2 exchange: Implications for soil C balance in a temperate desert of northwestern China",2015,"European Journal of Soil Biology","Elsevier","https://www.sciencedirect.com/science/article/pii/S1164556315000047","https://scholar.google.com/scholar?cites=15244140591259564704&as_sdt=2005&sciodt=2007&hl=en",148,"2024-07-18 10:17:19","","","","",,,,,38,4.22,10,4,9,"… that comprise biocrusts have the potential to fix atmospheric C during photosynthesis, at … Photosynthetic and respiratory activity in biocrusts can be triggered by very small amounts of …","","https://scholar.google.com/scholar?q=related:oLoj0BkRjtMJ:scholar.google.com/&scioq=biocrust*%7C%22biological+soil+crust%22+photosynthesis&hl=en&as_sdt=2007"
61,"NN Barger, SC Castle, GN Dean","Denitrification from nitrogen-fixing biologically crusted soils in a cool desert environment, southeast Utah, USA",2013,"Ecological Processes","Springer","https://link.springer.com/article/10.1186/2192-1709-2-16","https://scholar.google.com/scholar?cites=16625856737242589350&as_sdt=2005&sciodt=2007&hl=en",149,"2024-07-18 10:17:19","HTML","10.1186/2192-1709-2-16","","",,,,,61,5.55,20,3,11,"… AR rates only in dark biocrusts but had no effect on light biocrusts (Figure 1A, … biocrusts fix N, biocrusts may also exhibit high uptake rates of NH 4 + when active. Biocrust photosynthetic …","https://link.springer.com/article/10.1186/2192-1709-2-16","https://scholar.google.com/scholar?q=related:pijhbZ3ouuYJ:scholar.google.com/&scioq=biocrust*%7C%22biological+soil+crust%22+photosynthesis&hl=en&as_sdt=2007"
137,"SL Johnson, CR Kuske, TD Carney…","Increased temperature and altered summer precipitation have differential effects on biological soil crusts in a dryland ecosystem",2012,"Global Change …","Wiley Online Library","https://onlinelibrary.wiley.com/doi/abs/10.1111/j.1365-2486.2012.02709.x","https://scholar.google.com/scholar?cites=701467720488806371&as_sdt=2005&sciodt=2007&hl=en",150,"2024-07-18 10:17:19","","10.1111/j.1365-2486.2012.02709.x","","",,,,,137,11.42,34,4,12,"… The soil surfaces are colonized by biological soil crusts (hereafter termed biocrusts) that are a photosynthetic and diazotrophic community comprised cyanobacteria, other bacteria, fungi…","","https://scholar.google.com/scholar?q=related:42cj3SwdvAkJ:scholar.google.com/&scioq=biocrust*%7C%22biological+soil+crust%22+photosynthesis&hl=en&as_sdt=2007"
