Cites,Authors,Title,Year,Source,Publisher,ArticleURL,CitesURL,GSRank,QueryDate,Type,DOI,ISSN,CitationURL,Volume,Issue,StartPage,EndPage,ECC,CitesPerYear,CitesPerAuthor,AuthorCount,Age,Abstract,FullTextURL,RelatedURL
34,"M Mallen‐Cooper, MA Bowker…","A practical guide to measuring functional indicators and traits in biocrusts",2020,"Restoration …","Wiley Online Library","https://onlinelibrary.wiley.com/doi/abs/10.1111/rec.12974","https://scholar.google.com/scholar?cites=6557611580597816287&as_sdt=2005&sciodt=2007&hl=en",90,"2024-07-18 10:17:19","","10.1111/rec.12974","","",,,,,34,8.50,11,3,4,"… The photosynthetic capacity of a biocrust can be approximated by the fluorescence of chloro… reemitted light that was not used to drive photosynthesis. Using a combination of light- and …","https://www.researchgate.net/profile/David-Eldridge-2/publication/333054699_A_practical_guide_to_measuring_functional_indicators_and_traits_in_biocrusts/links/644cb64097449a0e1a65f13f/A-practical-guide-to-measuring-functional-indicators-and-traits-in-biocrusts.pdf","https://scholar.google.com/scholar?q=related:30uFJP1QAVsJ:scholar.google.com/&scioq=biocrust*%7C%22biological+soil+crust%22+photosynthesis&hl=en&as_sdt=2007"
19,"S Li, MA Bowker, B Xiao","Biocrust impacts on dryland soil water balance: A path toward the whole picture",2022,"Global Change Biology","Wiley Online Library","https://onlinelibrary.wiley.com/doi/abs/10.1111/gcb.16416","https://scholar.google.com/scholar?cites=14100488829011268431&as_sdt=2005&sciodt=2007&hl=en",91,"2024-07-18 10:17:19","","10.1111/gcb.16416","","",,,,,19,9.50,6,3,2,"… , our findings indicate that biocrusts may have an overall … storage and availability of the deeper soil underlying biocrusts. … , biocrusts fix atmospheric carbon through photosynthesis …","","https://scholar.google.com/scholar?q=related:T5OU5OH_rsMJ:scholar.google.com/&scioq=biocrust*%7C%22biological+soil+crust%22+photosynthesis&hl=en&as_sdt=2007"
32,"Y Zhang, P Duan, P Zhang, M Li","Variations in cyanobacterial and algal communities and soil characteristics under biocrust development under similar environmental conditions",2018,"Plant and soil","Springer","https://link.springer.com/article/10.1007/s11104-017-3443-2","https://scholar.google.com/scholar?cites=2839075444984739602&as_sdt=2005&sciodt=2007&hl=en",92,"2024-07-18 10:17:19","HTML","10.1007/s11104-017-3443-2","","",,,,,32,5.33,8,4,6,"… increased in the biocrusts as the biocrust age increased. The … biocrust and increased to more than 30% in other biocrusts. … formed biocrust and declined with increasing biocrust age. …","https://link.springer.com/article/10.1007/s11104-017-3443-2","https://scholar.google.com/scholar?q=related:EnfZPBNsZicJ:scholar.google.com/&scioq=biocrust*%7C%22biological+soil+crust%22+photosynthesis&hl=en&as_sdt=2007"
1,"B Atashpaz, F Khormali, E Malekzadeh…","Evaluating the Effect of Different Sequences of Biological Crusts on Loess Derived Soil Biophysiological Properties in the Semi-arid Regions of Northern Iran",2023,"Journal of Soil Science …","Springer","https://link.springer.com/article/10.1007/s42729-023-01535-6","https://scholar.google.com/scholar?cites=1052516583863382706&as_sdt=2005&sciodt=2007&hl=en",93,"2024-07-18 10:17:19","HTML","10.1007/s42729-023-01535-6","","",,,,,1,1.00,0,4,1,"… The objective of this study was to investigate the role of biocrust sequences on the soil … , biocrusts and soil under their surface were sampled after identifying the sequences of biocrusts (…","https://link.springer.com/article/10.1007/s42729-023-01535-6","https://scholar.google.com/scholar?q=related:snJirUFKmw4J:scholar.google.com/&scioq=biocrust*%7C%22biological+soil+crust%22+photosynthesis&hl=en&as_sdt=2007"
20,"KE Young, HS Grover, MA Bowker","Altering biocrusts for an altered climate",2016,"New Phytologist","JSTOR","https://www.jstor.org/stable/newphytologist.210.1.18","https://scholar.google.com/scholar?cites=2901354767978757455&as_sdt=2005&sciodt=2007&hl=en",94,"2024-07-18 10:17:19","PDF","","","",,,,,20,2.50,7,3,8,"… for much of the photosynthetic ground cover. (a) Biocrusts are comprised of cyanobacteria and in … , such as this dominant biocrust moss (photograph: Kristina Young). (b) In some cases, …","https://www.jstor.org/stable/newphytologist.210.1.18","https://scholar.google.com/scholar?q=related:T33CGMquQygJ:scholar.google.com/&scioq=biocrust*%7C%22biological+soil+crust%22+photosynthesis&hl=en&as_sdt=2007"
20,"LW Lehnert, P Jung, WA Obermeier, B Büdel, J Bendix","Estimating net photosynthesis of biological soil crusts in the Atacama using hyperspectral remote sensing",2018,"Remote Sensing","mdpi.com","https://www.mdpi.com/2072-4292/10/6/891","https://scholar.google.com/scholar?cites=13953568469055462486&as_sdt=2005&sciodt=2007&hl=en",95,"2024-07-18 10:17:19","HTML","","","",,,,,20,3.33,4,5,6,"… that allow us to estimate net photosynthesis rates for the most … is a more robust indicator for photosynthetic activity than the … to analyze the photosynthesis of BSC with multispectral data. …","https://www.mdpi.com/2072-4292/10/6/891","https://scholar.google.com/scholar?q=related:Vlwk65cIpcEJ:scholar.google.com/&scioq=biocrust*%7C%22biological+soil+crust%22+photosynthesis&hl=en&as_sdt=2007"
38,"E Rodríguez‐Caballero, S Chamizo…","Runoff from biocrust: A vital resource for vegetation performance on Mediterranean steppes",2018,"…","Wiley Online Library","https://onlinelibrary.wiley.com/doi/abs/10.1002/eco.1977","https://scholar.google.com/scholar?cites=3183060333058587856&as_sdt=2005&sciodt=2007&hl=en",96,"2024-07-18 10:17:19","","10.1002/eco.1977","","",,,,,38,6.33,13,3,6,"… Both treatments showed significant differences in photosynthetically active biomass, which increased with time since exclusion from runoff supply from biocrusts. However, although the …","https://scholar.google.com/scholar?output=instlink&q=info:0PyXIoKALCwJ:scholar.google.com/&hl=en&as_sdt=2007&scillfp=216241663062799356&oi=lle","https://scholar.google.com/scholar?q=related:0PyXIoKALCwJ:scholar.google.com/&scioq=biocrust*%7C%22biological+soil+crust%22+photosynthesis&hl=en&as_sdt=2007"
127,"KK Coe, J Belnap, JP Sparks","Precipitation‐driven carbon balance controls survivorship of desert biocrust mosses",2012,"Ecology","Wiley Online Library","https://esajournals.onlinelibrary.wiley.com/doi/abs/10.1890/11-2247.1","https://scholar.google.com/scholar?cites=1714165081516968680&as_sdt=2005&sciodt=2007&hl=en",97,"2024-07-18 10:17:19","","10.1890/11-2247.1","","",,,,,127,10.58,42,3,12,"… To measure the per hydration event C balance of moss, we used photosynthetic gas exchange analysis to measure net C fixation to and from moss shoots over the course of an entire …","https://esajournals.onlinelibrary.wiley.com/doi/pdf/10.1890/11-2247.1","https://scholar.google.com/scholar?q=related:6IoyQg_wyRcJ:scholar.google.com/&scioq=biocrust*%7C%22biological+soil+crust%22+photosynthesis&hl=en&as_sdt=2007"
15,"B Roncero-Ramos, JR Román, G Acién…","Towards large scale biocrust restoration: Producing an efficient and low-cost inoculum of N-fixing cyanobacteria",2022,"Science of the Total …","Elsevier","https://www.sciencedirect.com/science/article/pii/S0048969722048033","https://scholar.google.com/scholar?cites=15744159753534845217&as_sdt=2005&sciodt=2007&hl=en",98,"2024-07-18 10:17:19","","","","",,,,,15,7.50,4,4,2,"… and photosynthetic stress. Afterwards, we analyzed their capacity to induce biocrusts and … them and induced the formation of biocrusts improving the organic carbon substrate content…","","https://scholar.google.com/scholar?q=related:ITFyNOF9ftoJ:scholar.google.com/&scioq=biocrust*%7C%22biological+soil+crust%22+photosynthesis&hl=en&as_sdt=2007"
14,"J Sosa-Quintero, H Godínez-Alvarez…","Biocrusts in Mexican deserts and semideserts: A review of their species composition, ecology, and ecosystem function",2022,"Journal of Arid …","Elsevier","https://www.sciencedirect.com/science/article/pii/S0140196322000076","https://scholar.google.com/scholar?cites=13163047787100378482&as_sdt=2005&sciodt=2007&hl=en",99,"2024-07-18 10:17:19","","","","",,,,,14,7.00,5,3,2,"… effects on biocrust structure and function. We synthesize studies on biocrusts performed in … incanum limit photosynthesis and the establishment of lichens and cyanobacteria. Mosses, …","","https://scholar.google.com/scholar?q=related:chWctziKrLYJ:scholar.google.com/&scioq=biocrust*%7C%22biological+soil+crust%22+photosynthesis&hl=en&as_sdt=2007"
109,"B Steven, C Yeager, J Belnap, CR Kuske","Common and distinguishing features of the bacterial and fungal communities in biological soil crusts and shrub root zone soils",2014,"Soil Biology and Biochemistry","Elsevier","https://www.sciencedirect.com/science/article/pii/S003807171300415X","https://scholar.google.com/scholar?cites=16952306199476181726&as_sdt=2005&sciodt=2007&hl=en",100,"2024-07-18 10:17:19","","","","",,,,,109,10.90,27,4,10,"… to photosynthesis, circadian clock proteins, and heterocyst-associated genes were enriched in the biocrusts… abundant in the biocrusts, suggesting differences in nutrient cycling between …","https://www.academia.edu/download/44301518/Common_and_distinguishing_features_of_th20160401-27639-1dwvxgt.pdf","https://scholar.google.com/scholar?q=related:3hpu16uwQusJ:scholar.google.com/&scioq=biocrust*%7C%22biological+soil+crust%22+photosynthesis&hl=en&as_sdt=2007"
0,"G Mugnai, S Chamizo, G Certini, H Li, F Rossi…","The contribution of the phototrophic fraction in the fertility of different successional stages of induced biological soil crusts",2024,"Biology and Fertility of …","Springer","https://link.springer.com/article/10.1007/s00374-024-01840-x","",101,"2024-07-18 10:17:19","HTML","10.1007/s00374-024-01840-x","","",,,,,0,0.00,0,6,1,"… Photosynthetic pigment content, total carbohydrates, exopolysaccharides, organic C, and … is the “patchy” biocrust spatial arrangement of the biocrust mat at the topsoil, where …","https://link.springer.com/article/10.1007/s00374-024-01840-x","https://scholar.google.com/scholar?q=related:sEIZevbQaVYJ:scholar.google.com/&scioq=biocrust*%7C%22biological+soil+crust%22+photosynthesis&hl=en&as_sdt=2007"
13,"S Lan, AD Thomas, JB Rakes…","Cyanobacterial community composition and their functional shifts associated with biocrust succession in the Gurbantunggut Desert",2021,"Environmental …","Wiley Online Library","https://ami-journals.onlinelibrary.wiley.com/doi/abs/10.1111/1758-2229.13011","https://scholar.google.com/scholar?cites=16482625599390008884&as_sdt=2005&sciodt=2007&hl=en",102,"2024-07-18 10:17:19","","10.1111/1758-2229.13011","","",,,,,13,4.33,3,4,3,"… In this study, to identify whether a cyanobacterial community shift is involved in biocrust … of biocrusts in the Gurbantunggut Desert. Our findings showed that the biocrust cyanobacteria in …","https://par.nsf.gov/servlets/purl/10381570","https://scholar.google.com/scholar?q=related:NMZmaacMvuQJ:scholar.google.com/&scioq=biocrust*%7C%22biological+soil+crust%22+photosynthesis&hl=en&as_sdt=2007"
5,"YS Wu, XR Li, RL Jia, RP Yin, TJ Liu","Livestock trampling regulates the soil carbon exchange by mediating surface roughness and biocrust cover",2023,"Geoderma","Elsevier","https://www.sciencedirect.com/science/article/pii/S0016706122005821","https://scholar.google.com/scholar?cites=13271362182401422626&as_sdt=2005&sciodt=2007&hl=en",103,"2024-07-18 10:17:19","HTML","","","",,,,,5,5.00,1,5,1,"… potential importance of biocrusts in global carbon cycling, their photosynthetic and respiratory … the carbon balance of biocrust-covered sandy soil, the net photosynthetic rate (NP), gross …","https://www.sciencedirect.com/science/article/pii/S0016706122005821","https://scholar.google.com/scholar?q=related:IvWWF5dZLbgJ:scholar.google.com/&scioq=biocrust*%7C%22biological+soil+crust%22+photosynthesis&hl=en&as_sdt=2007"
120,"AM Faist, JE Herrick, J Belnap, JW Van Zee…","Biological soil crust and disturbance controls on surface hydrology in a semi‐arid ecosystem",2017,"…","Wiley Online Library","https://esajournals.onlinelibrary.wiley.com/doi/abs/10.1002/ecs2.1691","https://scholar.google.com/scholar?cites=12432919054983183852&as_sdt=2005&sciodt=2007&hl=en",104,"2024-07-18 10:17:19","","10.1002/ecs2.1691","","",,,,,120,17.14,24,5,7,"… Chlorophyll a (a proxy for biomass of photosynthetic organisms) reflected differences in biocrust types and treatments. As expected, chlorophyll a was higher in intact dark soil …","https://esajournals.onlinelibrary.wiley.com/doi/pdf/10.1002/ecs2.1691","https://scholar.google.com/scholar?q=related:7D11EQKaiqwJ:scholar.google.com/&scioq=biocrust*%7C%22biological+soil+crust%22+photosynthesis&hl=en&as_sdt=2007"
0,"W Yong Sheng, L Xin Rong, Y Rui Ping…","The Carbon Exchange Response of Biocrust-Covered Sandy Soil to Grazing/Trampling Disturbance is Regulated by Surface Roughness and Biocrust Cover",,"… Response of Biocrust …","papers.ssrn.com","https://papers.ssrn.com/sol3/papers.cfm?abstract_id=4059934","",105,"2024-07-18 10:17:19","","","","",,,,,0,0.00,0,4,,"… photosynthetic carbon assimilation rates of biocrusts in different regions differ by 108 … biocrusts is still an important carbon source for dryland ecosystems with sparse 110 …","","https://scholar.google.com/scholar?q=related:4Z8O0Yz8oNMJ:scholar.google.com/&scioq=biocrust*%7C%22biological+soil+crust%22+photosynthesis&hl=en&as_sdt=2007"
0,"K Coe","Physiological Ecology Of Biocrust Mosses Under Global Change: Implications For Dryland Biogeochemistry",2012,"","ecommons.cornell.edu","https://ecommons.cornell.edu/bitstream/1813/31079/1/kkc32.pdf","",106,"2024-07-18 10:17:19","PDF","","","",,,,,0,0.00,0,1,12,"… First, I provide an overview of the physiological ecology of biocrust mosses. These … on biocrust mosses. I show that, unlike vascular plants, mosses do not acclimate photosynthetically to …","https://ecommons.cornell.edu/bitstream/1813/31079/1/kkc32.pdf","https://scholar.google.com/scholar?q=related:T95jGS50f5gJ:scholar.google.com/&scioq=biocrust*%7C%22biological+soil+crust%22+photosynthesis&hl=en&as_sdt=2007"
199,"NN Barger, B Weber, F Garcia-Pichel, E Zaady…","Patterns and controls on nitrogen cycling of biological soil crusts",2016,"Biological soil crusts: an …","Springer","https://link.springer.com/chapter/10.1007/978-3-319-30214-0_14","https://scholar.google.com/scholar?cites=6442892447687657049&as_sdt=2005&sciodt=2007&hl=en",107,"2024-07-18 10:17:19","","10.1007/978-3-319-30214-0_14","","",,,,,199,24.88,40,5,8,"… the presence of biocrusts but biocrust community composition … -lichen biocrusts >dark cyanobacterial biocrust (eg, Nostoc … this peak occurred in the zone of high photosynthetic activity. …","https://www.colorado.edu/lab/barger/sites/default/files/attached-files/barger_biocrust_2015_chp_14.pdf","https://scholar.google.com/scholar?q=related:WUZ4lovAaVkJ:scholar.google.com/&scioq=biocrust*%7C%22biological+soil+crust%22+photosynthesis&hl=en&as_sdt=2007"
3,"Y Ma, B Weber, A Kratz, J Raggio…","Key drivers of the annual carbon budget of biocrusts from various climatic zones determined with a mechanistic data-driven model",2022,"Biogeosciences …","bg.copernicus.org","https://bg.copernicus.org/articles/20/2553/2023/","https://scholar.google.com/scholar?cites=1194295717145227949&as_sdt=2005&sciodt=2007&hl=en",108,"2024-07-18 10:17:19","HTML","","","",,,,,3,1.50,1,5,2,"… on biocrusts. This is necessary since, in our model, calculations of photosynthesis and … temperature but also depend on water saturation of biocrusts (affecting activity). However, …","https://bg.copernicus.org/articles/20/2553/2023/","https://scholar.google.com/scholar?q=related:rTI2iaD9khAJ:scholar.google.com/&scioq=biocrust*%7C%22biological+soil+crust%22+photosynthesis&hl=en&as_sdt=2007"
116,"DR Bowling, EE Grote, J Belnap","Rain pulse response of soil CO2 exchange by biological soil crusts and grasslands of the semiarid Colorado Plateau, United States",2011,"Journal of Geophysical …","Wiley Online Library","https://agupubs.onlinelibrary.wiley.com/doi/abs/10.1029/2011JG001643","https://scholar.google.com/scholar?cites=1248020194480892280&as_sdt=2005&sciodt=2007&hl=en",109,"2024-07-18 10:17:19","","10.1029/2011JG001643","","",,,,,116,8.92,39,3,13,"… biocrusts are difficult to study in their natural environment; the present study is among very few conducted of biocrust … biocrusts, have shown rates of net photosynthesis and respiration in …","https://agupubs.onlinelibrary.wiley.com/doi/pdf/10.1029/2011JG001643","https://scholar.google.com/scholar?q=related:eCmMLMHbUREJ:scholar.google.com/&scioq=biocrust*%7C%22biological+soil+crust%22+photosynthesis&hl=en&as_sdt=2007"
10,"AM Faist, AJ Antoninka, NN Barger…","Broader impacts for ecologists: biological soil crust as a model system for education",2021,"Frontiers in …","frontiersin.org","https://www.frontiersin.org/articles/10.3389/fmicb.2020.577922/full","https://scholar.google.com/scholar?cites=5272633953053642273&as_sdt=2005&sciodt=2007&hl=en",110,"2024-07-18 10:17:19","HTML","10.3389/fmicb.2020.577922","","",,,,,10,3.33,3,4,3,"… The green color in the cells of biocrusts is due to photosynthetic pigments, performing the process of photosynthesis that is the foundation of most ecosystem functions and of the larger …","https://www.frontiersin.org/articles/10.3389/fmicb.2020.577922/full","https://scholar.google.com/scholar?q=related:IQ5tCqUoLEkJ:scholar.google.com/&scioq=biocrust*%7C%22biological+soil+crust%22+photosynthesis&hl=en&as_sdt=2007"
133,"LP Chiquoine, SR Abella, MA Bowker","Rapidly restoring biological soil crusts and ecosystem functions in a severely disturbed desert ecosystem",2016,"Ecological Applications","Wiley Online Library","https://esajournals.onlinelibrary.wiley.com/doi/abs/10.1002/15-0973","https://scholar.google.com/scholar?cites=5015184057301484599&as_sdt=2005&sciodt=2007&hl=en",111,"2024-07-18 10:17:19","","10.1002/15-0973","","",,,,,133,16.63,44,3,8,"… 3), indicating low photosynthetic biomass present in the soil. Topsoil addition moderately … whether salvaged biocrust can be used as an inoculant to enhance biocrust reestablishment …","https://esajournals.onlinelibrary.wiley.com/doi/pdf/10.1002/15-0973","https://scholar.google.com/scholar?q=related:N0SoGlSDmUUJ:scholar.google.com/&scioq=biocrust*%7C%22biological+soil+crust%22+photosynthesis&hl=en&as_sdt=2007"
4,"R Adelizzi, EA O'Brien, M Hoellrich, JA Rudgers…","Disturbance to biocrusts decreased cyanobacteria, N‐fixer abundance, and grass leaf N but increased fungal abundance",2022,"Ecology","Wiley Online Library","https://esajournals.onlinelibrary.wiley.com/doi/abs/10.1002/ecy.3656","https://scholar.google.com/scholar?cites=17978341051448204818&as_sdt=2005&sciodt=2007&hl=en",112,"2024-07-18 10:17:19","","10.1002/ecy.3656","","",,,,,4,2.00,1,5,2,"… , and biocrusts, we disturbed all unvegetated surfaces with human foot trampling twice yearly from 2013–2019 in dry conditions in cyanobacteria-dominated biocrusts … the photosynthetic …","https://esajournals.onlinelibrary.wiley.com/doi/pdfdirect/10.1002/ecy.3656","https://scholar.google.com/scholar?q=related:Ep5k1u7lf_kJ:scholar.google.com/&scioq=biocrust*%7C%22biological+soil+crust%22+photosynthesis&hl=en&as_sdt=2007"
2,"RB Smáradóttir","Bacterial community structure and function of Anthelia biological soil crust",2020,"","skemman.is","https://skemman.is/bitstream/1946/34970/1/RunaBjork_MS.pdf","https://scholar.google.com/scholar?cites=1697881825085556570&as_sdt=2005&sciodt=2007&hl=en",113,"2024-07-18 10:17:19","PDF","","","",,,,,2,0.50,2,1,4,"… structure and function of the biocrust in various habitats within four … A clear difference was found between the biocrust and … photosynthetic organisms are in abundance in the biocrust, …","https://skemman.is/bitstream/1946/34970/1/RunaBjork_MS.pdf","https://scholar.google.com/scholar?q=related:WgfRLoYWkBcJ:scholar.google.com/&scioq=biocrust*%7C%22biological+soil+crust%22+photosynthesis&hl=en&as_sdt=2007"
0,"W Dou, M Delgado-Baquerizo, B Xiao","Biocrusts drive soil respiration across seasons and depths in a cold-winter desert",2024,"Soil Biology and Biochemistry","Elsevier","https://www.sciencedirect.com/science/article/pii/S0038071724000440","",114,"2024-07-18 10:17:19","","","","",,,,,0,0.00,0,3,1,"… biocrust-covered and bare soils during two continuous years and multiple seasons. Our high-time-resolution approach indicated that biocrusts … C by photosynthetic C sequestration and …","https://www.researchgate.net/profile/Weiqiang-Dou-3/publication/378067605_Biocrusts_drive_soil_respiration_across_seasons_and_depths_in_a_cold-winter_desert/links/65ce1f01e51f606f9973107c/Biocrusts-drive-soil-respiration-across-seasons-and-depths-in-a-cold-winter-desert.pdf","https://scholar.google.com/scholar?q=related:dQXr-UrlzLkJ:scholar.google.com/&scioq=biocrust*%7C%22biological+soil+crust%22+photosynthesis&hl=en&as_sdt=2007"
13,"F Sun, B Xiao, GJ Kidron, JL Heitman","Insights about biocrust effects on soil gas transport and aeration in drylands: Permeability, diffusivity, and their connection to hydraulic conductivity",2022,"Geoderma","Elsevier","https://www.sciencedirect.com/science/article/pii/S001670612200444X","https://scholar.google.com/scholar?cites=16871002179629175652&as_sdt=2005&sciodt=2007&hl=en",115,"2024-07-18 10:17:19","HTML","","","",,,,,13,6.50,3,4,2,"… As ecosystem engineers in drylands, biocrusts may greatly … soil and three types of biocrusts (cyanobacterial, cyanobacterial-… Our results showed that biocrusts were associated with a …","https://www.sciencedirect.com/science/article/pii/S001670612200444X","https://scholar.google.com/scholar?q=related:ZFOjkRjXIeoJ:scholar.google.com/&scioq=biocrust*%7C%22biological+soil+crust%22+photosynthesis&hl=en&as_sdt=2007"
36,"B Weber, J Hill","Remote sensing of biological soil crusts at different scales",2016,"Biological soil crusts: an organizing principle in …","Springer","https://link.springer.com/chapter/10.1007/978-3-319-30214-0_12","https://scholar.google.com/scholar?cites=14254350388379325155&as_sdt=2005&sciodt=2007&hl=en",116,"2024-07-18 10:17:19","","10.1007/978-3-319-30214-0_12","","",,,,,36,4.50,18,2,8,"… biocrusts’ seasonal photosynthetic activity. Thus, in a later step, remote sensing methods might be applicable to estimate biocrust … of photosynthetic light use efficiency. It is calculated as …","","https://scholar.google.com/scholar?q=related:4xJNyyeg0cUJ:scholar.google.com/&scioq=biocrust*%7C%22biological+soil+crust%22+photosynthesis&hl=en&as_sdt=2007"
7,"S Kammann, U Schiefelbein, C Dolnik, T Mikhailyuk…","Successional development of the phototrophic community in biological soil crusts on coastal and inland dunes",2022,"Biology","mdpi.com","https://www.mdpi.com/2079-7737/12/1/58","https://scholar.google.com/scholar?cites=2221508315927264517&as_sdt=2005&sciodt=2007&hl=en",117,"2024-07-18 10:17:19","HTML","","","",,,,,7,3.50,1,5,2,"… Phototrophic biocrust organisms are important contributors to the global photosynthetic carbon … was used as a proxy for the photosynthetic biomass (chlorophyll a mg m −2 ) in biocrust (…","https://www.mdpi.com/2079-7737/12/1/58","https://scholar.google.com/scholar?q=related:Bb1rFAti1B4J:scholar.google.com/&scioq=biocrust*%7C%22biological+soil+crust%22+photosynthesis&hl=en&as_sdt=2007"
21,"X Yang, M Xu, Y Zhao, L Gao…","Moss-dominated biological soil crusts improve stability of soil organic carbon on the Loess Plateau, China",2019,"Plant, Soil and …","agriculturejournals.cz","http://www.agriculturejournals.cz/pdfs/pse/2019/02/08.pdf","https://scholar.google.com/scholar?cites=15078760570918927560&as_sdt=2005&sciodt=2007&hl=en",118,"2024-07-18 10:17:19","PDF","","","",,,,,21,4.20,4,5,5,"… other biocrusts. The ratio of SMC to SOC was the highest in light cyanobacteria biocrust and … and SWSC to SOC in biocrust layers among four studied biocrusts. The results show that the …","http://www.agriculturejournals.cz/pdfs/pse/2019/02/08.pdf","https://scholar.google.com/scholar?q=related:yPzJOtmEQtEJ:scholar.google.com/&scioq=biocrust*%7C%22biological+soil+crust%22+photosynthesis&hl=en&as_sdt=2007"
29,"OL Lange, J Belnap","How biological soil crusts became recognized as a functional unit: a selective history",2016,"Biological soil crusts: an organizing principle in …","Springer","https://link.springer.com/chapter/10.1007/978-3-319-30214-0_2","https://scholar.google.com/scholar?cites=8320622202742871414&as_sdt=2005&sciodt=2007&hl=en",119,"2024-07-18 10:17:19","","10.1007/978-3-319-30214-0_2","","",,,,,29,3.63,15,2,8,"… of biocrusts as a community with important ecosystem functions. The idea of biocrusts as a … Here, we trace the history of these studies from the distant past until 1990, when biocrusts …","","https://scholar.google.com/scholar?q=related:dpW3EM_JeHMJ:scholar.google.com/&scioq=biocrust*%7C%22biological+soil+crust%22+photosynthesis&hl=en&as_sdt=2007"
