Cites,Authors,Title,Year,Source,Publisher,ArticleURL,CitesURL,GSRank,QueryDate,Type,DOI,ISSN,CitationURL,Volume,Issue,StartPage,EndPage,ECC,CitesPerYear,CitesPerAuthor,AuthorCount,Age,Abstract,FullTextURL,RelatedURL
26,"R. Finger-Higgens","Decline in biological soil crust N-fixing lichens linked to increasing summertime temperatures",2022,"Proceedings of the National Academy of Sciences of the United States of America","","","https://www.scopus.com/inward/citedby.uri?partnerID=HzOxMe3b&scp=85128130112&origin=inward",170,"2024-07-03 09:27:42","Article","10.1073/pnas.2120975119","0027-8424","https://api.elsevier.com/content/abstract/scopus_id/85128130112",119,16,,,26,13.00,26,1,2,"","",""
26,"M.A. Bowker","Rapid ex situ culture of N-fixing soil lichens and biocrusts is enhanced by complementarity",2016,"Plant and Soil","","","https://www.scopus.com/inward/citedby.uri?partnerID=HzOxMe3b&scp=84992129556&origin=inward",171,"2024-07-03 09:27:42","Article","10.1007/s11104-016-2929-7","0032-079X","https://api.elsevier.com/content/abstract/scopus_id/84992129556",408,1,415,428,26,3.25,26,1,8,"","",""
26,"B. Stuiver","Nitrogen fixation rates associated with the feather mosses Pleurozium schreberi and Hylocomium splendens during forest stand development following clear-cutting",2015,"Forest Ecology and Management","","https://api.elsevier.com/content/article/eid/1-s2.0-S0378112715001371","https://www.scopus.com/inward/citedby.uri?partnerID=HzOxMe3b&scp=84925821763&origin=inward",172,"2024-07-03 09:27:42","Article","10.1016/j.foreco.2015.03.017","0378-1127","https://api.elsevier.com/content/abstract/scopus_id/84925821763",347,,130,139,26,2.89,26,1,9,"","",""
26,"D.C. Jordan","Biological nitrogen fixation in the terrestrial environment of a high Arctic ecosystem (Truelove Lowland, Devon Island, N.W.T.).",1978,"Canadian journal of microbiology","","","https://www.scopus.com/inward/citedby.uri?partnerID=HzOxMe3b&scp=0017979759&origin=inward",173,"2024-07-03 09:27:42","Article","10.1139/m78-108","0008-4166","https://api.elsevier.com/content/abstract/scopus_id/0017979759",24,6,643,649,26,0.57,26,1,46,"","",""
25,"M. Kolton","Defining the Sphagnum Core Microbiome across the North American Continent Reveals a Central Role for Diazotrophic Methanotrophs in the Nitrogen and Carbon Cycles of Boreal Peatland Ecosystems",2022,"mBio","","","https://www.scopus.com/inward/citedby.uri?partnerID=HzOxMe3b&scp=85125865783&origin=inward",174,"2024-07-03 09:27:42","Article","10.1128/MBIO.03714-21","2161-2129","https://api.elsevier.com/content/abstract/scopus_id/85125865783",13,1,,,25,12.50,25,1,2,"","",""
25,"M. Salemaa","N <inf>2</inf> fixation associated with the bryophyte layer is suppressed by low levels of nitrogen deposition in boreal forests",2019,"Science of the Total Environment","","https://api.elsevier.com/content/article/eid/1-s2.0-S0048969718342645","https://www.scopus.com/inward/citedby.uri?partnerID=HzOxMe3b&scp=85056208566&origin=inward",175,"2024-07-03 09:27:42","Article","10.1016/j.scitotenv.2018.10.364","0048-9697","https://api.elsevier.com/content/abstract/scopus_id/85056208566",653,,995,1004,25,5.00,25,1,5,"","",""
25,"R.S. Winder","The effects of high-tannin leaf litter from transgenic poplars on microbial communities in microcosm soils",2013,"Frontiers in Microbiology","","","https://www.scopus.com/inward/citedby.uri?partnerID=HzOxMe3b&scp=84885410843&origin=inward",176,"2024-07-03 09:27:42","Article","10.3389/fmicb.2013.00290","1664-302X","https://api.elsevier.com/content/abstract/scopus_id/84885410843",4,,,,25,2.27,25,1,11,"","",""
24,"H. Talbot","Origin and preservation of bacteriohopanepolyol signatures in Sphagnum peat from Bissendorfer Moor (Germany)",2016,"Organic Geochemistry","","https://api.elsevier.com/content/article/eid/1-s2.0-S0146638016300365","https://www.scopus.com/inward/citedby.uri?partnerID=HzOxMe3b&scp=84967215093&origin=inward",177,"2024-07-03 09:27:42","Article","10.1016/j.orggeochem.2016.04.011","0146-6380","https://api.elsevier.com/content/abstract/scopus_id/84967215093",97,,95,110,24,3.00,24,1,8,"","",""
24,"F. Hyodo","Changes in stable nitrogen and carbon isotope ratios of plants and soil across a boreal forest fire chronosequence",2013,"Plant and Soil","","","https://www.scopus.com/inward/citedby.uri?partnerID=HzOxMe3b&scp=84878550945&origin=inward",178,"2024-07-03 09:27:42","Article","10.1007/s11104-013-1667-3","0032-079X","https://api.elsevier.com/content/abstract/scopus_id/84878550945",367,1,111,119,24,2.18,24,1,11,"","",""
24,"M.E. Jean","Short-term N<inf>2</inf> fixation kinetics in a moss-associated cyanobacteria",2012,"Environmental Science and Technology","","","https://www.scopus.com/inward/citedby.uri?partnerID=HzOxMe3b&scp=84865465583&origin=inward",179,"2024-07-03 09:27:42","Article","10.1021/es3018539","0013-936X","https://api.elsevier.com/content/abstract/scopus_id/84865465583",46,16,8667,8671,24,2.00,24,1,12,"","",""
24,"X. Ding","Synergistic interactions between Glomus mosseae and Bradyrhizobium japonicum in enhancing proton release from nodules and hyphae",2012,"Mycorrhiza","","","https://www.scopus.com/inward/citedby.uri?partnerID=HzOxMe3b&scp=84855273690&origin=inward",180,"2024-07-03 09:27:42","Article","10.1007/s00572-011-0381-3","0940-6360","https://api.elsevier.com/content/abstract/scopus_id/84855273690",22,1,51,58,24,2.00,24,1,12,"","",""
24,"T.H. DeLuca","Enhanced soil fertility under Juniperus communis in arctic ecosystems",2007,"Plant and Soil","","","https://www.scopus.com/inward/citedby.uri?partnerID=HzOxMe3b&scp=34249031586&origin=inward",181,"2024-07-03 09:27:42","Article","10.1007/s11104-007-9242-4","0032-079X","https://api.elsevier.com/content/abstract/scopus_id/34249031586",294,1,147,155,24,1.41,24,1,17,"","",""
24,"K.D. Pandey","Nitrogen fixation by cyanobacteria associated with moss communities in schirmacher oasis, antarctica",1992,"Israel Journal of Botany","","","https://www.scopus.com/inward/citedby.uri?partnerID=HzOxMe3b&scp=0000074706&origin=inward",182,"2024-07-03 09:27:42","Article","10.1080/0021213X.1992.10677226","0021-213X","https://api.elsevier.com/content/abstract/scopus_id/0000074706",41,4,187,198,24,0.75,24,1,32,"","",""
23,"I.J. Klarenberg","Long-term warming effects on the microbiome and nifH gene abundance of a common moss species in sub-Arctic tundra",2022,"New Phytologist","","","https://www.scopus.com/inward/citedby.uri?partnerID=HzOxMe3b&scp=85119174193&origin=inward",183,"2024-07-03 09:27:42","Article","10.1111/nph.17837","0028-646X","https://api.elsevier.com/content/abstract/scopus_id/85119174193",234,6,2044,2056,23,11.50,23,1,2,"","",""
23,"J.E.M. Stuart","Host Identity as a Driver of Moss-Associated N<inf>2</inf> Fixation Rates in Alaska",2021,"Ecosystems","","","https://www.scopus.com/inward/citedby.uri?partnerID=HzOxMe3b&scp=85089065518&origin=inward",184,"2024-07-03 09:27:42","Article","10.1007/s10021-020-00534-3","1432-9840","https://api.elsevier.com/content/abstract/scopus_id/85089065518",24,3,530,547,23,7.67,23,1,3,"","",""
23,"D.A. Nikitin","Microbial biomass and biological activity of soils and soil-like bodies in coastal oases of Antarctica",2017,"Eurasian Soil Science","","","https://www.scopus.com/inward/citedby.uri?partnerID=HzOxMe3b&scp=85029751339&origin=inward",185,"2024-07-03 09:27:42","Article","10.1134/S1064229317070079","1064-2293","https://api.elsevier.com/content/abstract/scopus_id/85029751339",50,9,1086,1097,23,3.29,23,1,7,"","",""
23,"R. Franson","The Glycine‐Glomus‐Bradyrhizobiun symbiosis. XI. Nodule gas exchange and efficiency as a function of soil and root water status in mycorrhizal soybean",1991,"Physiologia Plantarum","","","https://www.scopus.com/inward/citedby.uri?partnerID=HzOxMe3b&scp=84989674559&origin=inward",186,"2024-07-03 09:27:42","Article","10.1111/j.1399-3054.1991.tb00123.x","0031-9317","https://api.elsevier.com/content/abstract/scopus_id/84989674559",83,3,476,482,23,0.70,23,1,33,"","",""
23,"M. Athar","Nodulation, biomass production, and nitrogen fixation in alfalfa under drought",1996,"Journal of Plant Nutrition","","","https://www.scopus.com/inward/citedby.uri?partnerID=HzOxMe3b&scp=0030039881&origin=inward",187,"2024-07-03 09:27:42","Article","10.1080/01904169609365116","0190-4167","https://api.elsevier.com/content/abstract/scopus_id/0030039881",19,1,185,199,23,0.82,23,1,28,"","",""
22,"L.Q. Gao","The effects of biological soil crust succession on soil ecological stoichiometry characteristics",2018,"Shengtai Xuebao","","","https://www.scopus.com/inward/citedby.uri?partnerID=HzOxMe3b&scp=85041070520&origin=inward",188,"2024-07-03 09:27:42","Article","10.5846/stxb201612132559","1000-0933","https://api.elsevier.com/content/abstract/scopus_id/85041070520",38,2,678,688,22,3.67,22,1,6,"","",""
22,"M. Chiwa","Sphagnum can 'filter' N deposition, but effects on the plant and pore water depend on the N form",2016,"Science of the Total Environment","","https://api.elsevier.com/content/article/eid/1-s2.0-S0048969716305563","https://www.scopus.com/inward/citedby.uri?partnerID=HzOxMe3b&scp=84962170619&origin=inward",189,"2024-07-03 09:27:42","Article","10.1016/j.scitotenv.2016.03.130","0048-9697","https://api.elsevier.com/content/abstract/scopus_id/84962170619",559,,113,120,22,2.75,22,1,8,"","",""
22,"K. Rousk","The sensitivity of moss-Associated nitrogen fixation towards repeated nitrogen input",2016,"PLoS ONE","","","https://www.scopus.com/inward/citedby.uri?partnerID=HzOxMe3b&scp=84953807551&origin=inward",190,"2024-07-03 09:27:42","Article","10.1371/journal.pone.0146655","1932-6203","https://api.elsevier.com/content/abstract/scopus_id/84953807551",11,1,,,22,2.75,22,1,8,"","",""
22,"J.C. Meeks","Molecular mechanisms in the nitrogen-fixing Nostoc-bryophyte symbiosis.",2006,"Progress in molecular and subcellular biology","","","https://www.scopus.com/inward/citedby.uri?partnerID=HzOxMe3b&scp=33744786004&origin=inward",191,"2024-07-03 09:27:42","Review","10.1007/3-540-28221-1_9","0079-6484","https://api.elsevier.com/content/abstract/scopus_id/33744786004",41,,165,196,22,1.22,22,1,18,"","",""
22,"J.D. Karagatzides","Nitrogen fixation in the high arctic tundra at Sarcpa Lake, Northwest Territories.",1985,"Canadian Journal of Botany","","","https://www.scopus.com/inward/citedby.uri?partnerID=HzOxMe3b&scp=0022245183&origin=inward",192,"2024-07-03 09:27:42","Article","10.1139/b85-131","0008-4026","https://api.elsevier.com/content/abstract/scopus_id/0022245183",63,5,974,979,22,0.56,22,1,39,"","",""
21,"R.K. Stuart","Bidirectional C and N transfer and a potential role for sulfur in an epiphytic diazotrophic mutualism",2020,"ISME Journal","","","https://www.scopus.com/inward/citedby.uri?partnerID=HzOxMe3b&scp=85089601181&origin=inward",193,"2024-07-03 09:27:42","Article","10.1038/s41396-020-00738-4","1751-7362","https://api.elsevier.com/content/abstract/scopus_id/85089601181",14,12,3068,3078,21,5.25,21,1,4,"","",""
21,"Z.T. Aanderud","The Burning of Biocrusts Facilitates the Emergence of a Bare Soil Community of Poorly-Connected Chemoheterotrophic Bacteria With Depressed Ecosystem Services",2019,"Frontiers in Ecology and Evolution","","","https://www.scopus.com/inward/citedby.uri?partnerID=HzOxMe3b&scp=85077304489&origin=inward",194,"2024-07-03 09:27:42","Article","10.3389/fevo.2019.00467","2296-701X","https://api.elsevier.com/content/abstract/scopus_id/85077304489",7,,,,21,4.20,21,1,5,"","",""
21,"G.V. Ingimundardóttir","Bryophyte colonization history of the virgin volcanic Island Surtsey, Iceland",2014,"Biogeosciences","","","https://www.scopus.com/inward/citedby.uri?partnerID=HzOxMe3b&scp=84906707008&origin=inward",195,"2024-07-03 09:27:42","Article","10.5194/bg-11-4415-2014","1726-4170","https://api.elsevier.com/content/abstract/scopus_id/84906707008",11,16,4415,4427,21,2.10,21,1,10,"","",""
21,"N. Garg","Influence of zinc on cadmium-induced toxicity in nodules of pigeonpea (Cajanus cajan L. Millsp.) inoculated with arbuscular mycorrhizal (AM) fungi",2012,"Acta Physiologiae Plantarum","","","https://www.scopus.com/inward/citedby.uri?partnerID=HzOxMe3b&scp=84856440804&origin=inward",196,"2024-07-03 09:27:42","Article","10.1007/s11738-012-0933-y","0137-5881","https://api.elsevier.com/content/abstract/scopus_id/84856440804",34,4,1363,1380,21,1.75,21,1,12,"","",""
21,"J. Marsh","Composition and function of biological soil crust communities along topographic gradients in grasslands of central interior British Columbia (Chilcotin) and southwestern Yukon (Kluane)",2006,"Canadian Journal of Botany","","","https://www.scopus.com/inward/citedby.uri?partnerID=HzOxMe3b&scp=33749317202&origin=inward",197,"2024-07-03 09:27:42","Article","10.1139/B06-026","0008-4026","https://api.elsevier.com/content/abstract/scopus_id/33749317202",84,5,717,736,21,1.17,21,1,18,"","",""
21,"W.G. Gold","Functional influences of cryptobiotic surface crusts in an Alpine tundra basin of the Olympic Mountains, Washington, U.S.A.",2001,"Northwest Science","","","https://www.scopus.com/inward/citedby.uri?partnerID=HzOxMe3b&scp=0034863369&origin=inward",198,"2024-07-03 09:27:42","Article","","0029-344X","https://api.elsevier.com/content/abstract/scopus_id/0034863369",75,3,315,326,21,0.91,21,1,23,"","",""
20,"V.P. Shabayev","Nitrogen fixation and CO<inf>2</inf> exchange in soybeans (Glycine max L.) inoculated with mixed cultures of different microorganisms",1996,"Biology and Fertility of Soils","","","https://www.scopus.com/inward/citedby.uri?partnerID=HzOxMe3b&scp=85047678418&origin=inward",199,"2024-07-03 09:27:42","Article","10.1007/BF00335917","0178-2762","https://api.elsevier.com/content/abstract/scopus_id/85047678418",23,4,425,430,20,0.71,20,1,28,"","",""
20,"S.G. Schwabedissen","Nitrogenase activity by biological soil crusts in cold sagebrush steppe ecosystems",2017,"Biogeochemistry","","","https://www.scopus.com/inward/citedby.uri?partnerID=HzOxMe3b&scp=85019550047&origin=inward",200,"2024-07-03 09:27:42","Article","10.1007/s10533-017-0342-9","0168-2563","https://api.elsevier.com/content/abstract/scopus_id/85019550047",134,1,57,76,20,2.86,20,1,7,"","",""
