Cites,Authors,Title,Year,Source,Publisher,ArticleURL,CitesURL,GSRank,QueryDate,Type,DOI,ISSN,CitationURL,Volume,Issue,StartPage,EndPage,ECC,CitesPerYear,CitesPerAuthor,AuthorCount,Age,Abstract,FullTextURL,RelatedURL
4,"A Kirkwood, P Roy-Léveillée, M Packalen…","Evolution of palsas and peat plateaus in the Hudson Bay Lowlands: Permafrost degradation and the production of greenhouse gases",2019,"… Conference on Cold …","ascelibrary.org","https://ascelibrary.org/doi/abs/10.1061/9780784482599.069","https://scholar.google.com/scholar?cites=13487914837274338497&as_sdt=2005&sciodt=2007&hl=en",100,"2024-07-10 14:02:17","","10.1061/9780784482599.069","","",,,,,4,0.80,1,4,5,"… is likely to occur, mainly due to lateral heat conduction causing thaw and subsidence at the palsa … A bright green sphagnum moss was present e palsa, between the southern edge of the …","https://www.researchgate.net/profile/Adam-Kirkwood/publication/335056757_Evolution_of_Palsas_and_Peat_Plateaus_in_the_Hudson_Bay_Lowlands_Permafrost_Degradation_and_the_Production_of_Greenhouse_Gases/links/5d516b9c92851cd046b554ce/Evolution-of-Palsas-and-Peat-Plateaus-in-the-Hudson-Bay-Lowlands-Permafrost-Degradation-and-the-Production-of-Greenhouse-Gases","https://scholar.google.com/scholar?q=related:wSR1HBWzLrsJ:scholar.google.com/&scioq=sphagnum+%22heat+conduction%22&hl=en&as_sdt=2007"
479,"VE Romanovsky, TE Osterkamp","Effects of unfrozen water on heat and mass transport processes in the active layer and permafrost",2000,"Permafrost and Periglacial …","Wiley Online Library","https://onlinelibrary.wiley.com/doi/abs/10.1002/1099-1530(200007/09)11:3%3C219::AID-PPP352%3E3.0.CO;2-7","https://scholar.google.com/scholar?cites=16260197864153209575&as_sdt=2005&sciodt=2007&hl=en",101,"2024-07-10 14:02:17","","10.1002/1099-1530(200007/09)11:3%3C219::AID-PPP352%3E3.0.CO;2-7","","",,,,,479,19.96,240,2,24,"… ""LTER# site on the Tanana River ~oodplain\ 15 km south!west from Fairbanks[ Vegetation includes sparse black spruce stands with shrubs and a thick moss cover ""mostly sphagnum# …","https://www.researchgate.net/profile/Tom-Osterkamp/publication/248684144_Effects_of_unfrozen_water_on_heat_and_mass_transport_in_the_active_layer_and_permafrost/links/5a295879aca2727dd8888443/Effects-of-unfrozen-water-on-heat-and-mass-transport-in-the-active-layer-and-permafrost.pdf","https://scholar.google.com/scholar?q=related:59pqps7Tp-EJ:scholar.google.com/&scioq=sphagnum+%22heat+conduction%22&hl=en&as_sdt=2007"
5,"B Christensen","Permafrost development and active-layer hydrology of peat plateaus in wetland-dominated discontinuous permafrost",2014,"… Masters Thesis. University of Calgary, Calgary …","prism.ucalgary.ca","https://prism.ucalgary.ca/server/api/core/bitstreams/b16ed989-d1cf-4218-92da-83bd96c248cc/content","https://scholar.google.com/scholar?cites=8157883430416486299&as_sdt=2005&sciodt=2007&hl=en",102,"2024-07-10 14:02:17","PDF","","","",,,,,5,0.50,5,1,10,"… energy balance and soil heat conduction equation. As runoff … with a surface organic layer of sphagnum mosses and lichen. … of a peat layer overlain with sphagnum mosses and sedges, …","https://prism.ucalgary.ca/server/api/core/bitstreams/b16ed989-d1cf-4218-92da-83bd96c248cc/content","https://scholar.google.com/scholar?q=related:mw8F9cGfNnEJ:scholar.google.com/&scioq=sphagnum+%22heat+conduction%22&hl=en&as_sdt=2007"
7,"SF Sun, JF Yan, N Xia, Q Li","The model study of water mass and energy exchange between the inland water body and atmosphere",2008,"Science in China Series G: Physics …","Springer","https://link.springer.com/article/10.1007/s11433-008-0121-7","https://scholar.google.com/scholar?cites=6081084359875257859&as_sdt=2005&sciodt=2007&hl=en",103,"2024-07-10 14:02:17","","10.1007/s11433-008-0121-7","","",,,,,7,0.44,2,4,16,"… between the water body and the atmosphere, heat conduction, the energy exchange due to the … Surface energy fluxes and control of evapotranspiration from a Swedish Sphagnum mire. …","https://www.researchgate.net/profile/Qian-Li-159/publication/257687224_The_model_study_of_water_mass_and_energy_exchange_between_the_inland_water_body_and_atmosphere/links/5fd6b2e792851c13fe84cc03/The-model-study-of-water-mass-and-energy-exchange-between-the-inland-water-body-and-atmosphere.pdf","https://scholar.google.com/scholar?q=related:A2aMnwFaZFQJ:scholar.google.com/&scioq=sphagnum+%22heat+conduction%22&hl=en&as_sdt=2007"
0,"JB Murton","Global Warming and Thermokarst Julian B. Murton",2008,"Permafrost Soils","books.google.com","https://books.google.com/books?hl=en&lr=&id=20jZ1MKtC9YC&oi=fnd&pg=PA183&dq=sphagnum+%22heat+conduction%22&ots=yQkSkD8ynE&sig=RdSqitoCGlRyTx9zI7Cr0dsE7mQ","",104,"2024-07-10 14:02:17","","","","",,,,,0,0.00,0,1,16,"… Ablation typically occurs by melting caused by heat conduction as the active layer deepens … by plants such as sedges and Sphagnum, peat accumulation and eventually growth of ice …","","https://scholar.google.com/scholar?q=related:bk5JrppuemwJ:scholar.google.com/&scioq=sphagnum+%22heat+conduction%22&hl=en&as_sdt=2007"
8,"CI Seyrek Şık, A Woźniczka, B Widera","A conceptual framework for the design of energy-efficient vertical green façades",2022,"Energies","mdpi.com","https://www.mdpi.com/1996-1073/15/21/8069","https://scholar.google.com/scholar?cites=16443777233172091169&as_sdt=2005&sciodt=2007&hl=en",105,"2024-07-10 14:02:17","HTML","","","",,,,,8,4.00,3,3,2,"… vertical green systems reduced heat conduction by 18.7–39.8… compost, clay balls and sphagnum moss and a CVF substrate … The authors found that green walls containing sphagnum …","https://www.mdpi.com/1996-1073/15/21/8069","https://scholar.google.com/scholar?q=related:IdHgTEUINOQJ:scholar.google.com/&scioq=sphagnum+%22heat+conduction%22&hl=en&as_sdt=2007"
57,"SD Mamet, KP Chun, GGL Kershaw…","Recent increases in permafrost thaw rates and areal loss of palsas in the Western Northwest Territories, Canada",2017,"Permafrost and …","Wiley Online Library","https://onlinelibrary.wiley.com/doi/abs/10.1002/ppp.1951","https://scholar.google.com/scholar?cites=9960882345331233082&as_sdt=2005&sciodt=2007&hl=en",106,"2024-07-10 14:02:17","","10.1002/ppp.1951","","",,,,,57,8.14,14,4,7,"… at BP, sphagnum tussocks were characterised by Sphagnum sp., B. … heat conduction and areal loss during degradation (Kershaw and Gill, 1979; Seppälä, 2011). This heat conduction, …","https://www.researchgate.net/profile/Steven-Mamet/publication/316748466_Recent_Increases_in_Permafrost_Thaw_Rates_and_Areal_Loss_of_Palsas_in_the_Western_Northwest_Territories_Canada/links/59dd1c930f7e9b53c196e34c/Recent-Increases-in-Permafrost-Thaw-Rates-and-Areal-Loss-of-Palsas-in-the-Western-Northwest-Territories-Canada.pdf","https://scholar.google.com/scholar?q=related:OpHt0rcpPIoJ:scholar.google.com/&scioq=sphagnum+%22heat+conduction%22&hl=en&as_sdt=2007"
31,"TJ Williams, JW Pomeroy, JR Janowicz…","A radiative–conductive–convective approach to calculate thaw season ground surface temperatures for modelling frost table dynamics",2015,"Hydrological …","Wiley Online Library","https://onlinelibrary.wiley.com/doi/abs/10.1002/hyp.10573","https://scholar.google.com/scholar?cites=10655554726952005657&as_sdt=2005&sciodt=2007&hl=en",107,"2024-07-10 14:02:17","","10.1002/hyp.10573","","",,,,,31,3.44,8,4,9,"… Unfortunately this reference temperature for soil-heat conduction is not necessarily the surface temperature that is the common reference for radiative and turbulent transfer to the …","http://www.scottycreek.com/media/documents/publications/74_Williams%20et%20al.,%202015.pdf","https://scholar.google.com/scholar?q=related:GXC1kJEi4JMJ:scholar.google.com/&scioq=sphagnum+%22heat+conduction%22&hl=en&as_sdt=2007"
1410,"O Farouki, O Farouki","Thermal properties of soils",1981,"","apps.dtic.mil","https://apps.dtic.mil/sti/citations/ADA111734","https://scholar.google.com/scholar?cites=15149368982894678013&as_sdt=2005&sciodt=2007&hl=en",108,"2024-07-10 14:02:17","BOOK","","","",,,,,1410,32.79,705,2,43,"… Change in the amount of unfrozen water in a sphagnum peat … 2.1 HEAT CONDUCTION by a process of evaporation followed by … Heat conduction occurs in all the soil constituents, thus …","https://apps.dtic.mil/sti/tr/pdf/ADA111734.pdf","https://scholar.google.com/scholar?q=related:_Q_CPNNePdIJ:scholar.google.com/&scioq=sphagnum+%22heat+conduction%22&hl=en&as_sdt=2007"
34,"MR Turetsky, JL Baltzer, JF Johnstone, MC Mack…","Losing legacies, ecological release, and transient responses: Key challenges for the future of northern ecosystem science",2017,"Ecosystems","Springer","https://link.springer.com/article/10.1007/s10021-016-0055-2","https://scholar.google.com/scholar?cites=12799047730567063220&as_sdt=2005&sciodt=2007&hl=en",109,"2024-07-10 14:02:17","HTML","10.1007/s10021-016-0055-2","","",,,,,34,4.86,7,5,7,"… slow decomposition traits of Sphagnum hummock mosses, we … Although hummock Sphagnum mosses possess traits that … water holding capacity and heat conduction such that they act …","https://link.springer.com/article/10.1007/s10021-016-0055-2","https://scholar.google.com/scholar?q=related:tCa4Qxlan7EJ:scholar.google.com/&scioq=sphagnum+%22heat+conduction%22&hl=en&as_sdt=2007"
111,"S Yi, AD McGuire, J Harden…","Interactions between soil thermal and hydrological dynamics in the response of Alaska ecosystems to fire disturbance",2009,"Journal of …","Wiley Online Library","https://agupubs.onlinelibrary.wiley.com/doi/abs/10.1029/2008JG000841","https://scholar.google.com/scholar?cites=13041815708187546709&as_sdt=2005&sciodt=2007&hl=en",110,"2024-07-10 14:02:17","","10.1029/2008JG000841","","",,,,,111,7.40,28,4,15,"… There is about 50 cm of organic soil overlying loess, with 8 cm of feather and Sphagnum spp. mosses on top of the organic soil. … The heat conduction-driven melt is described below in E. …","https://agupubs.onlinelibrary.wiley.com/doi/pdf/10.1029/2008JG000841","https://scholar.google.com/scholar?q=related:VdSgwEnW_bQJ:scholar.google.com/&scioq=sphagnum+%22heat+conduction%22&hl=en&as_sdt=2007"
97,"C South, C Susan, B Grimmond, CP Wolfe","Evapotranspiration rates from wetlands with different disturbance histories: Indiana Dunes National Lakeshore",1998,"Wetlands","Springer","https://link.springer.com/article/10.1007/BF03161657","https://scholar.google.com/scholar?cites=6620586223824282776&as_sdt=2005&sciodt=2007&hl=en",111,"2024-07-10 14:02:17","","10.1007/BF03161657","","",,,,,97,3.73,24,4,26,"This study examines the effects of different disturbance histories, specifically patterns of ditching and drainage on wetland evapotranspiration rates for two sites within the Indiana Dunes …","https://link.springer.com/content/pdf/10.1007/BF03161657.pdf","https://scholar.google.com/scholar?q=related:mCTk2xcM4VsJ:scholar.google.com/&scioq=sphagnum+%22heat+conduction%22&hl=en&as_sdt=2007"
6,"AM Grishin, AN Golovanov, YV Sukov…","Experimental investigation of peat ignition and combustion regimes",2007,"Journal of Engineering …","Springer","https://link.springer.com/article/10.1007/s10891-007-0148-z","https://scholar.google.com/scholar?cites=18402124952719688398&as_sdt=2005&sciodt=2007&hl=en",112,"2024-07-10 14:02:17","","10.1007/s10891-007-0148-z","","",,,,,6,0.35,2,4,17,"… In the case where the moisture content of a peat reaches W = 0.15, the rate of its combustion increases by 30%, which can be explained by the increase in the effective heat conduction …","https://link.springer.com/content/pdf/10.1007/s10891-007-0148-z.pdf","https://scholar.google.com/scholar?q=related:zoI1VyV7Yf8J:scholar.google.com/&scioq=sphagnum+%22heat+conduction%22&hl=en&as_sdt=2007"
65,"RA Metcalfe, JM Buttle","A statistical model of spatially distributed snowmelt rates in a boreal forest basin",1998,"Hydrological processes","Wiley Online Library","https://onlinelibrary.wiley.com/doi/abs/10.1002/(SICI)1099-1085(199808/09)12:10/11%3C1701::AID-HYP690%3E3.0.CO;2-D","https://scholar.google.com/scholar?cites=18258739270161237291&as_sdt=2005&sciodt=2007&hl=en",113,"2024-07-10 14:02:17","","10.1002/(SICI)1099-1085(199808/09)12:10/11%3C1701::AID-HYP690%3E3.0.CO;2-D","","",,,,,65,2.50,33,2,26,"… feather moss (Pleurozium schreberi), sphagnum mosses (Sphagnum spp.) and some scrub … around the dowel at each thermocouple location to minimize the effect of heat conduction …","https://citeseerx.ist.psu.edu/document?repid=rep1&type=pdf&doi=7d1e0fba265db591cc03da61a3a8df1e1f83f1af","https://scholar.google.com/scholar?q=related:K4VvlKASZP0J:scholar.google.com/&scioq=sphagnum+%22heat+conduction%22&hl=en&as_sdt=2007"
179,"WR Rouse, CJ Oswald, J Binyamin…","The role of northern lakes in a regional energy balance",2005,"Journal of …","journals.ametsoc.org","https://journals.ametsoc.org/view/journals/hydr/6/3/jhm421_1.xml?tab_body=pdf","https://scholar.google.com/scholar?cites=9139238505702778529&as_sdt=2005&sciodt=2007&hl=en",114,"2024-07-10 14:02:17","HTML","","","",,,,,179,9.42,45,4,19,"There are many lakes of widely varying morphometry in northern latitudes. For this study region, in the central Mackenzie River valley of western Canada, lakes make up 37% of the …","https://journals.ametsoc.org/view/journals/hydr/6/3/jhm421_1.xml?tab_body=pdf","https://scholar.google.com/scholar?q=related:oWb8yf8Y1X4J:scholar.google.com/&scioq=sphagnum+%22heat+conduction%22&hl=en&as_sdt=2007"
0,"AV Sokolov, AB Kukushkin, PA Sdvizhenskii…","Application of the balanced identification method to the reconstruction of the parameters of fast nonlocal heat transfer in a plasma of magnetic thermonuclear fusion",2020,"International Journal of …","injoit.ru","http://www.injoit.ru/index.php/j1/article/view/890","",115,"2024-07-10 14:02:17","","","","",,,,,0,0.00,0,4,4,"… gap-filling in CO2 flux data in a sphagnum peat bog,” Сomputer Research and Modeling (in … scale of heat diffusion described by the heat conduction equation) response of the spatial …","http://www.injoit.ru/index.php/j1/article/viewFile/890/877","https://scholar.google.com/scholar?q=related:hrfyCYMYkwYJ:scholar.google.com/&scioq=sphagnum+%22heat+conduction%22&hl=en&as_sdt=2007"
368,"PH Stoutjesdijk, JJ Barkman","Microclimate, vegetation &fauna",2015,"","books.google.com","https://books.google.com/books?hl=en&lr=&id=O7O9CwAAQBAJ&oi=fnd&pg=PP1&dq=sphagnum+%22heat+conduction%22&ots=TRZPmA-EmY&sig=qVI4eWeB-Z8Jt6BYGCyav6qkuh4","https://scholar.google.com/scholar?cites=3341500326681538600&as_sdt=2005&sciodt=2007&hl=en",116,"2024-07-10 14:02:17","BOOK","","","",,,,,368,40.89,184,2,9,"… At some height above the surface the effectiveness of the turbulent exchange process is a hundred times greater than the processes of molecular diffusion and heat conduction, which …","","https://scholar.google.com/scholar?q=related:KHC01NdkXy4J:scholar.google.com/&scioq=sphagnum+%22heat+conduction%22&hl=en&as_sdt=2007"
16,"C Ou, B Leblon, Y Zhang, A LaRocque…","Modelling and mapping permafrost at high spatial resolution using Landsat and Radarsat images in northern Ontario, Canada: Part 1–model calibration",2016,"… Journal of Remote …","Taylor &Francis","https://www.tandfonline.com/doi/abs/10.1080/01431161.2016.1157642","https://scholar.google.com/scholar?cites=12851254532778986022&as_sdt=2005&sciodt=2007&hl=en",117,"2024-07-10 14:02:17","","10.1080/01431161.2016.1157642","","",,,,,16,2.00,3,5,8,"… They are dominated by Sphagnum, with black spruce (Picea … Fens range from open (dominated by sedges, Sphagnum, … the one-dimensional heat conduction equation. The upper …","","https://scholar.google.com/scholar?q=related:JoproOjTWLIJ:scholar.google.com/&scioq=sphagnum+%22heat+conduction%22&hl=en&as_sdt=2007"
14,"M Jean, S Payette","Dynamics of active layer in wooded palsas of northern Quebec",2014,"Geomorphology","Elsevier","https://www.sciencedirect.com/science/article/pii/S0169555X13004893","https://scholar.google.com/scholar?cites=5136030880897344450&as_sdt=2005&sciodt=2007&hl=en",118,"2024-07-10 14:02:17","HTML","","","",,,,,14,1.40,7,2,10,"… 1D, F) were dominated by a Sphagnum vegetation and by a thick organic layer above clay deposits (113 and 91 cm, respectively, Table 1). More than 1 m of snow accumulates over …","https://www.sciencedirect.com/science/article/pii/S0169555X13004893","https://scholar.google.com/scholar?q=related:wqNS09_YRkcJ:scholar.google.com/&scioq=sphagnum+%22heat+conduction%22&hl=en&as_sdt=2007"
0,"A Mikhaylov, O Evdokimov, A Guryanov, N Spesivtseva","The Influence of Composite Fuel Granules Fractional Composition on Their Characteristics as an Energy Source",,"","","","",119,"2024-07-10 14:02:17","CITATION","","","",,,,,0,0.00,0,4,,"","","https://scholar.google.com/scholar?q=related:tBShoyjw3yoJ:scholar.google.com/&scioq=sphagnum+%22heat+conduction%22&hl=en&as_sdt=2007"
387,"Y Zhang, C Li, CC Trettin, H Li…","An integrated model of soil, hydrology, and vegetation for carbon dynamics in wetland ecosystems",2002,"Global biogeochemical …","Wiley Online Library","https://agupubs.onlinelibrary.wiley.com/doi/abs/10.1029/2001GB001838","https://scholar.google.com/scholar?cites=1939476756469571775&as_sdt=2005&sciodt=2007&hl=en",120,"2024-07-10 14:02:17","","10.1029/2001GB001838","","",,,,,387,17.59,77,5,22,"… beneath the snowpack can effectively insulate heat conduction. Such insulation effects are … a poor fen with carpet-forming mosses (Sphagnum papillosum) dominating the vegetation. …","https://agupubs.onlinelibrary.wiley.com/doi/pdfdirect/10.1029/2001GB001838","https://scholar.google.com/scholar?q=related:v-B-j9Vn6hoJ:scholar.google.com/&scioq=sphagnum+%22heat+conduction%22&hl=en&as_sdt=2007"
13,"PW Gandar, CB Tanner","Comparison of methods for measuring leaf and tuber water potentials in potatoes",1975,"American Potato Journal","Springer","https://link.springer.com/article/10.1007/BF02852793","https://scholar.google.com/scholar?cites=16429067378766942558&as_sdt=2005&sciodt=2007&hl=en",121,"2024-07-10 14:02:17","","10.1007/BF02852793","","",,,,,13,0.27,7,2,49,"… To minimize errors due to heat conduction, leads were coiled against the tubers. Tubers were then buried under sphagnum moss. Tuber water potentials were measured 18 hours to 10 …","","https://scholar.google.com/scholar?q=related:XpFcbrzF_-MJ:scholar.google.com/&scioq=sphagnum+%22heat+conduction%22&hl=en&as_sdt=2007"
0,"CI Seyrek Şık, A Woźniczka, B Widera","A Conceptual Framework for the Design of Energy-Efficient Vertical Green Façades. Energies 2022, 15, 8069",2022,"","academia.edu","https://www.academia.edu/download/98482805/pdf.pdf","",122,"2024-07-10 14:02:17","PDF","","","",,,,,0,0.00,0,3,2,"… vertical green systems reduced heat conduction by 18.7–39.8… compost, clay balls and sphagnum moss and a CVF substrate … The authors found that green walls containing sphagnum …","https://www.academia.edu/download/98482805/pdf.pdf","https://scholar.google.com/scholar?q=related:DxR9r2dx5zUJ:scholar.google.com/&scioq=sphagnum+%22heat+conduction%22&hl=en&as_sdt=2007"
74,"S Liebner, CU Welte","Roles of thermokarst lakes in a warming world",2020,"Trends in Microbiology","cell.com","https://www.cell.com/trends/microbiology/fulltext/S0966-842X(20)30091-3","https://scholar.google.com/scholar?cites=8654459482146801637&as_sdt=2005&sciodt=2007&hl=en",123,"2024-07-10 14:02:17","HTML","","","",,,,,74,18.50,37,2,4,"… The expansion of thermokarst landscapes is accelerated by the physical phenomenon of rapid heat conduction through thawed water bodies leading to abrupt thaw beneath and …","https://www.cell.com/trends/microbiology/fulltext/S0966-842X(20)30091-3","https://scholar.google.com/scholar?q=related:5QdftAvRGngJ:scholar.google.com/&scioq=sphagnum+%22heat+conduction%22&hl=en&as_sdt=2007"
40,"RÍ Magnússon, A Hamm, SV Karsanaev…","Extremely wet summer events enhance permafrost thaw for multiple years in Siberian tundra",2022,"Nature …","nature.com","https://www.nature.com/articles/s41467-022-29248-x","https://scholar.google.com/scholar?cites=19103520086738630&as_sdt=2005&sciodt=2007&hl=en",124,"2024-07-10 14:02:17","HTML","","","",,,,,40,20.00,10,4,2,"… modelling suggests that increased rainfall likely warmed the soil through direct input of warmer rainwater into colder soils (advective heat transfer) and increased heat conduction in …","https://www.nature.com/articles/s41467-022-29248-x","https://scholar.google.com/scholar?q=related:xsa64IzeQwAJ:scholar.google.com/&scioq=sphagnum+%22heat+conduction%22&hl=en&as_sdt=2007"
87,"DR Nossov, MT Jorgenson, K Kielland…","Edaphic and microclimatic controls over permafrost response to fire in interior Alaska",2013,"Environmental …","iopscience.iop.org","https://iopscience.iop.org/article/10.1088/1748-9326/8/3/035013/meta","https://scholar.google.com/scholar?cites=14617093139117250996&as_sdt=2005&sciodt=2007&hl=en",125,"2024-07-10 14:02:17","","10.1088/1748-9326/8/3/035013","","",,,,,87,7.91,22,4,11,"… of moist soils reduces heat conduction into the ground in … others by the abundance of acidifying Sphagnum mosses (mainly S. … was common, whereas Sphagnum and ericaceous shrubs …","https://iopscience.iop.org/article/10.1088/1748-9326/8/3/035013/pdf","https://scholar.google.com/scholar?q=related:tBni7cNY2soJ:scholar.google.com/&scioq=sphagnum+%22heat+conduction%22&hl=en&as_sdt=2007"
4,"B Disher","Characterizing the hydrological function of treed bogs in the zone of discontinuous permafrost",2020,"","scholars.wlu.ca","https://scholars.wlu.ca/etd/2261/","https://scholar.google.com/scholar?cites=10946257106710722839&as_sdt=2005&sciodt=2007&hl=en",126,"2024-07-10 14:02:17","","","","",,,,,4,1.00,4,1,4,"… Currently, it is proposed that treed bogs form due to the upward growth of Sphagnum spp. … variations in the both the subsurface and heat conduction properties of treed bogs. For …","https://scholars.wlu.ca/cgi/viewcontent.cgi?article=3386&context=etd","https://scholar.google.com/scholar?q=related:F3mWwdfq6JcJ:scholar.google.com/&scioq=sphagnum+%22heat+conduction%22&hl=en&as_sdt=2007"
36,"RH Kadlec, FB Bevis","Wastewater treatment at the Houghton Lake wetland: vegetation response",2009,"ecological engineering","Elsevier","https://www.sciencedirect.com/science/article/pii/S0925857408002656","https://scholar.google.com/scholar?cites=2415871218394080938&as_sdt=2005&sciodt=2007&hl=en",127,"2024-07-10 14:02:17","","","","",,,,,36,2.40,18,2,15,"… bog there is 2–5 m of medium-decomposition sphagnum peat. The entire wetland rests on a clay “pan… Temperatures below the under-mat water were also cooler, due to heat conduction …","http://hillsborough.wateratlas.usf.edu/upload/documents/Houghton%20Lake%20Vegetation%20Response.pdf","https://scholar.google.com/scholar?q=related:qiZ4wxLmhiEJ:scholar.google.com/&scioq=sphagnum+%22heat+conduction%22&hl=en&as_sdt=2007"
40,"G Wang, L Liu, G Liu, H Hu, T Li","Impacts of grassland vegetation cover on the active‐layer thermal regime, northeast Qinghai‐Tibet Plateau, China",2010,"Permafrost and Periglacial …","Wiley Online Library","https://onlinelibrary.wiley.com/doi/abs/10.1002/ppp.699","https://scholar.google.com/scholar?cites=16814889024734071540&as_sdt=2005&sciodt=2007&hl=en",128,"2024-07-10 14:02:17","","10.1002/ppp.699","","",,,,,40,2.86,8,5,14,"… ) increased from 20–40 cm beneath a sphagnum-dominated vegetation layer to more than 60 … of different depths was calculated using the one-dimensional heat conduction equation: …","","https://scholar.google.com/scholar?q=related:9IrjmHp8WukJ:scholar.google.com/&scioq=sphagnum+%22heat+conduction%22&hl=en&as_sdt=2007"
2,"BZ Richardson, EE Farmer","Revegetation of phosphate mined lands in the Intermountain West",1983,"","scholar.archive.org","https://scholar.archive.org/work/2m34nb3iiffonl34hdzcmrbf5u/access/wayback/http://fipr.state.fl.us/wp-content/uploads/2014/12/03-036-010Final.pdf#page=378","https://scholar.google.com/scholar?cites=8915801184939832812&as_sdt=2005&sciodt=2007&hl=en",129,"2024-07-10 14:02:17","BOOK","","","",,,,,2,0.05,1,2,41,"… The mulch consisted of a layer of sphagnum peatmoss applied at a rate of 2.5 tons/acre and … Even with this information, a straightforward solution to problems relating to heat conduction …","https://scholar.archive.org/work/2m34nb3iiffonl34hdzcmrbf5u/access/wayback/http://fipr.state.fl.us/wp-content/uploads/2014/12/03-036-010Final.pdf#page=378","https://scholar.google.com/scholar?q=related:7HVYlPBJu3sJ:scholar.google.com/&scioq=sphagnum+%22heat+conduction%22&hl=en&as_sdt=2007"
0,"Y Zhang, J Li, X Wang, W Chen, W Sladen, L Dyke…","Using remote sensing-based spatial modelling to assess the changes of permafrost in Wapusk National Park",,"pubs.aina.ucalgary.ca","","https://pubs.aina.ucalgary.ca/cpc/CPC6-1291.pdf","",130,"2024-07-10 14:02:17","PDF","","","",,,,,0,0.00,0,7,,"… Ground thermal dynamics are simulated by solving the one-dimensional heat conduction … (eg, sedge larch fens, lichen spruce bogs, and sphagnum spruce bogs). The changes in active-…","https://pubs.aina.ucalgary.ca/cpc/CPC6-1291.pdf","https://scholar.google.com/scholar?q=related:Rx_GCKORoicJ:scholar.google.com/&scioq=sphagnum+%22heat+conduction%22&hl=en&as_sdt=2007"
