Cites,Authors,Title,Year,Source,Publisher,ArticleURL,CitesURL,GSRank,QueryDate,Type,DOI,ISSN,CitationURL,Volume,Issue,StartPage,EndPage,ECC,CitesPerYear,CitesPerAuthor,AuthorCount,Age,Abstract,FullTextURL,RelatedURL
7,"DL Elwell, MY Hamdy, WL Roller, AE Ahmed…","Soil heating using subsurface pipes: A decade of research results at OSU/OARDC",1985,"","kb.osu.edu","https://kb.osu.edu/bitstreams/1ff457f8-55be-516b-a350-2cc821804ef0/download","https://scholar.google.com/scholar?cites=1590746438892700317&as_sdt=2005&sciodt=2007&hl=en",131,"2024-07-10 14:02:17","PDF","","","",,,,,7,0.18,1,5,39,"… , under the assumptions of pure heat conduction and constant physical properties of the soil medium. A steady-state heat conduction model was developed, assuming constant thermal …","https://kb.osu.edu/bitstreams/1ff457f8-55be-516b-a350-2cc821804ef0/download","https://scholar.google.com/scholar?q=related:ncLqQXV3ExYJ:scholar.google.com/&scioq=sphagnum+%22heat+conduction%22&hl=en&as_sdt=2007"
80,"KM Hinkel, JRJ Nicholas","Active layer thaw rate at a boreal forest site in central Alaska, USA",1995,"Arctic and Alpine Research","Taylor &Francis","https://www.tandfonline.com/doi/abs/10.1080/00040851.1995.12003098","https://scholar.google.com/scholar?cites=7404606855167420323&as_sdt=2005&sciodt=2007&hl=en",132,"2024-07-10 14:02:17","","10.1080/00040851.1995.12003098","","",,,,,80,2.76,40,2,29,"… (1991) utilized a mechanistic heat conduction model which incorporated the effects of freeze… The surface is a 27-cm thick organic mat of living sphagnum moss which overlies a mixed silt…","https://www.tandfonline.com/doi/pdf/10.1080/00040851.1995.12003098","https://scholar.google.com/scholar?q=related:oyetF7RywmYJ:scholar.google.com/&scioq=sphagnum+%22heat+conduction%22&hl=en&as_sdt=2007"
14,"RH Kadlec","Wastewater treatment at the Houghton Lake wetland: Temperatures and the energy balance",2009,"Ecological Engineering","Elsevier","https://www.sciencedirect.com/science/article/pii/S0925857409000627","https://scholar.google.com/scholar?cites=10948100528362981097&as_sdt=2005&sciodt=2007&hl=en",133,"2024-07-10 14:02:17","","","","",,,,,14,0.93,14,1,15,"… in most locations, with 2–5 m of medium-decomposition sphagnum peat in other zones. … are governed by the unsteady state heat conduction equation together with the boundary …","http://tampabay.wateratlas.usf.edu/upload/documents/Houghton%20Lake%20Temperature%20and%20Energy.pdf","https://scholar.google.com/scholar?q=related:6YZXzmx375cJ:scholar.google.com/&scioq=sphagnum+%22heat+conduction%22&hl=en&as_sdt=2007"
0,"GC Rau, MO Cuthbert, MS Andersen, AA Baker…","What controls the cave drip water temperature? Analysis and implications for paleoclimate reconstruction from speleothems",2015,"","apo.ansto.gov.au","https://apo.ansto.gov.au/dspace/handle/10238/13684","",134,"2024-07-10 14:02:17","","","","",,,,,0,0.00,0,5,9,"… Cave drip water temperature is mainly controlled by the subsurface heat conduction profile as well as the cave climate. This, however, depends on the drip rate and length of flow path …","https://apo.ansto.gov.au/bitstreams/91d2e397-12b8-491f-b595-4084742e451d/download","https://scholar.google.com/scholar?q=related:ZOe8Na7vgEgJ:scholar.google.com/&scioq=sphagnum+%22heat+conduction%22&hl=en&as_sdt=2007"
130,"DJ Nicolsky, VE Romanovsky, GG Panteleev","Estimation of soil thermal properties using in-situ temperature measurements in the active layer and permafrost",2009,"Cold Regions Science and …","Elsevier","https://www.sciencedirect.com/science/article/pii/S0165232X08000451","https://scholar.google.com/scholar?cites=15702252735414673491&as_sdt=2005&sciodt=2007&hl=en",135,"2024-07-10 14:02:17","","","","",,,,,130,8.67,43,3,15,"… In many practical applications, heat conduction is the dominant mode of energy transfer in a ground material. Within certain assumptions (Andersland and Anderson, 1978, Kudryavtsev, …","https://citeseerx.ist.psu.edu/document?repid=rep1&type=pdf&doi=13138ac4ca2184c11d9cebf5740179814669cb76","https://scholar.google.com/scholar?q=related:UyDMM6ub6dkJ:scholar.google.com/&scioq=sphagnum+%22heat+conduction%22&hl=en&as_sdt=2007"
31,"A Ulutaş, F Balo, A Topal","Identifying the most efficient natural fibre for common commercial building insulation materials with an integrated PSI, MEREC, LOPCOW and MCRAT model",2023,"Polymers","mdpi.com","https://www.mdpi.com/2073-4360/15/6/1500","https://scholar.google.com/scholar?cites=11847669587585442337&as_sdt=2005&sciodt=2007&hl=en",136,"2024-07-10 14:02:17","HTML","","","",,,,,31,31.00,10,3,1,"… It changes according to the effects of heat conduction, convection, and radiation. Building elements … were produced from straw, sphagnum moss, and reeds and bound with NaSi [38]. …","https://www.mdpi.com/2073-4360/15/6/1500","https://scholar.google.com/scholar?q=related:IaI64Ldga6QJ:scholar.google.com/&scioq=sphagnum+%22heat+conduction%22&hl=en&as_sdt=2007"
50,"WR Rouse, J Binyamin, PD Blanken…","The influence of lakes on the regional energy and water balance of the central Mackenzie River Basin",2008,"… Region Atmospheric and …","Springer","https://link.springer.com/chapter/10.1007/978-3-540-73936-4_18","https://scholar.google.com/scholar?cites=9999205468421952406&as_sdt=2005&sciodt=2007&hl=en",137,"2024-07-10 14:02:17","","10.1007/978-3-540-73936-4_18","","",,,,,50,3.13,13,4,16,"… They include sphagnum moss mats overlying organic soils. They are not sufficiently large to … determined from thermistor strings and the heat conduction based on measurements of the …","https://www.researchgate.net/profile/Claude-Duguay-2/publication/236173331_The_Influence_of_Lakes_on_the_Regional_Energy_and_Water_Balance_of_the_Central_Mackenzie_River_Basin/links/5699171b08ae6169e5516934/The-Influence-of-Lakes-on-the-Regional-Energy-and-Water-Balance-of-the-Central-Mackenzie-River-Basin.pdf","https://scholar.google.com/scholar?q=related:lhNvPWVQxIoJ:scholar.google.com/&scioq=sphagnum+%22heat+conduction%22&hl=en&as_sdt=2007"
0,"MS Iseas, MF Rossi, MCA Acuña…","Influence of the microtopography of patagonian peatbogs on the fluxes of greenhouse gasses and dissolved carbon in porewater",2024,"Ecohydrology & …","Elsevier","https://www.sciencedirect.com/science/article/pii/S1642359324000132","",138,"2024-07-10 14:02:17","","","","",,,,,0,0.00,0,4,1,"… (2018) found a rate of 98.26 mg CO 2 m − 2 h −1 in a raised Sphagnum bog very close to our study sites in northern Ushuaia, Tierra del Fuego (Argentina). Finally, Thalasso et al. (2023…","","https://scholar.google.com/scholar?q=related:urMQqx9A6joJ:scholar.google.com/&scioq=sphagnum+%22heat+conduction%22&hl=en&as_sdt=2007"
45,"TH Jeffers, PG Bennett, RR Corwin","Biosorption of metal contaminants using immobilized biomass: field studies",1993,"","books.google.com","https://books.google.com/books?hl=en&lr=&id=QQDqEkqYOPcC&oi=fnd&pg=PA1&dq=sphagnum+%22heat+conduction%22&ots=FTmQTAm_Mm&sig=9QC06BK1qRK3xiv48yc5yfxfpZw","https://scholar.google.com/scholar?cites=8487643214383614949&as_sdt=2005&sciodt=2007&hl=en",139,"2024-07-10 14:02:17","BOOK","","","",,,,,45,1.45,15,3,31,"… The US Bureau of Mines has developed porous beads containing immobilized biological materials such as sphagnum peat moss for extracting metal contaminants from waste waters. …","https://books.google.com/books?hl=en&lr=&id=QQDqEkqYOPcC&oi=fnd&pg=PA1&dq=sphagnum+%22heat+conduction%22&ots=FTmQTAm_Mm&sig=9QC06BK1qRK3xiv48yc5yfxfpZw","https://scholar.google.com/scholar?q=related:5QuXtYgqynUJ:scholar.google.com/&scioq=sphagnum+%22heat+conduction%22&hl=en&as_sdt=2007"
16,"M Drewnik, A Rajwa-Kuligiewicz, M Stolarczyk…","Intra-annual groundwater levels and water temperature patterns in raised bogs affected by human impact in mountain areas in Poland",2018,"Science of the total …","Elsevier","https://www.sciencedirect.com/science/article/pii/S0048969717336367","https://scholar.google.com/scholar?cites=16349041582470001063&as_sdt=2005&sciodt=2007&hl=en",140,"2024-07-10 14:02:17","","","","",,,,,16,2.67,4,4,6,"… to that occupied by Sphagnum sp. In addition, the evaporation of Sphagnum sp. moss may be … , which can be explained by the complexity of heat conduction in peat soil (Histosol). …","","https://scholar.google.com/scholar?q=related:p_E2xbJ24-IJ:scholar.google.com/&scioq=sphagnum+%22heat+conduction%22&hl=en&as_sdt=2007"
45,"Y Zhang, J Li, X Wang, W Chen…","Modelling and mapping permafrost at high spatial resolution in Wapusk National Park, Hudson Bay Lowlands",2012,"Canadian Journal of …","cdnsciencepub.com","https://cdnsciencepub.com/doi/abs/10.1139/e2012-031","https://scholar.google.com/scholar?cites=9905055696699468618&as_sdt=2005&sciodt=2007&hl=en",141,"2024-07-10 14:02:17","","10.1139/e2012-031","","",,,,,45,3.75,9,5,12,"… Soil temperature dynamics are simulated by solving the one-dimensional heat conduction … At a wet sphagnum spruce bog site in the southwest corner of the park, our field probing in …","https://cdnsciencepub.com/doi/pdf/10.1139/e2012-031","https://scholar.google.com/scholar?q=related:Sis7Sq3TdYkJ:scholar.google.com/&scioq=sphagnum+%22heat+conduction%22&hl=en&as_sdt=2007"
87,"RJE Brown","Influence of climatic and terrain factors on ground temperatures at three locations in the permafrost region of Canada",1973,"Proceedings of the Second International Conference …","books.google.com","https://books.google.com/books?hl=en&lr=&id=M4SvF9Qax7EC&oi=fnd&pg=PA27&dq=sphagnum+%22heat+conduction%22&ots=guvqhMvKRU&sig=HYPpIuy2OgRX49ntpEhvDshxblA","https://scholar.google.com/scholar?cites=16488321124078286822&as_sdt=2005&sciodt=2007&hl=en",142,"2024-07-10 14:02:17","HTML","","","",,,,,87,1.71,87,1,51,"… trees growing on a 10-cm-thick layer of Sphagnum over 10 cm of peat, 23 cm of black … site B growing on an 18-cm-thick layer of hummocky Sphagnum over 18 cm of peat, 10 cm of black …","https://books.google.com/books?hl=en&lr=&id=M4SvF9Qax7EC&oi=fnd&pg=PA27&dq=sphagnum+%22heat+conduction%22&ots=guvqhMvKRU&sig=HYPpIuy2OgRX49ntpEhvDshxblA","https://scholar.google.com/scholar?q=related:5ndBF7RI0uQJ:scholar.google.com/&scioq=sphagnum+%22heat+conduction%22&hl=en&as_sdt=2007"
90,"AL Atchley, SL Painter, DR Harp…","Using field observations to inform thermal hydrology models of permafrost dynamics with ATS (v0. 83)",2015,"Geoscientific Model …","gmd.copernicus.org","https://gmd.copernicus.org/articles/8/2701/2015/","https://scholar.google.com/scholar?cites=14396701574261280295&as_sdt=2005&sciodt=2007&hl=en",143,"2024-07-10 14:02:17","","","","",,,,,90,10.00,23,4,9,"… the peat layer, and maintained or increased heat conduction for mineral soil. Peat porosity and … hydraulic conductivity in living and undecomposed Sphagnum moss, Soil Sci. Soc. Am. …","https://gmd.copernicus.org/articles/8/2701/2015/gmd-8-2701-2015.pdf","https://scholar.google.com/scholar?q=related:J44mB85by8cJ:scholar.google.com/&scioq=sphagnum+%22heat+conduction%22&hl=en&as_sdt=2007"
2,"AA Grigoryev","The Reclamation of the Forest Belt of the USSR in Europe",1953,"The Geographical Journal","JSTOR","https://www.jstor.org/stable/1791376","https://scholar.google.com/scholar?cites=575769650413108446&as_sdt=2005&sciodt=2007&hl=en",144,"2024-07-10 14:02:17","","","","",,,,,2,0.03,2,1,71,"… littledecomposed, horizons of sphagnum (upland) peat bogs as litter … sphagnum peat bogs. Such floors serve not less than two years. The great water capacity and low heat conduction …","https://www.jstor.org/stable/pdf/1791376.pdf","https://scholar.google.com/scholar?q=related:3vxSTXKL_QcJ:scholar.google.com/&scioq=sphagnum+%22heat+conduction%22&hl=en&as_sdt=2007"
132,"WL Quinton, M Hayashi, LE Chasmer","Peatland hydrology of discontinuous permafrost in the Northwest Territories: overview and synthesis",2009,"… Water Resources Journal","Taylor &Francis","https://www.tandfonline.com/doi/abs/10.4296/cwrj3404311","https://scholar.google.com/scholar?cites=14653883679231709181&as_sdt=2005&sciodt=2007&hl=en",145,"2024-07-10 14:02:17","","10.4296/cwrj3404311","","",,,,,132,8.80,44,3,15,"… Flat bog surfaces are relatively fixed, and are covered with Sphagnum sp. overlying yellowish peat with well-defined sphagnum remains (Zoltai and Vitt, 1995). Club-moss, fungi, and …","https://www.tandfonline.com/doi/pdf/10.4296/cwrj3404311","https://scholar.google.com/scholar?q=related:_Q-AEJENXcsJ:scholar.google.com/&scioq=sphagnum+%22heat+conduction%22&hl=en&as_sdt=2007"
0,"Q Che","Evaluation of the energy-based runoff concept for a subalpine tundra hillslope",2012,"","uwspace.uwaterloo.ca","https://uwspace.uwaterloo.ca/handle/10012/7135","",146,"2024-07-10 14:02:17","","","","",,,,,0,0.00,0,1,12,"… Throughout the basin, the ground surface is composed of a continuous cover of Sphagnum … By Equation 4.14, the energy equation is solved taking into account the heat conduction …","https://uwspace.uwaterloo.ca/bitstream/handle/10012/7135/Che_Qian.pdf?isAllowed=y&sequence=1","https://scholar.google.com/scholar?q=related:ul5DF0wFkXUJ:scholar.google.com/&scioq=sphagnum+%22heat+conduction%22&hl=en&as_sdt=2007"
10,"K Haahti, H Marttila, L Warsta…","Modeling sediment transport after ditch network maintenance of a forested peatland",2016,"Water Resources …","Wiley Online Library","https://agupubs.onlinelibrary.wiley.com/doi/abs/10.1002/2016WR019442","https://scholar.google.com/scholar?cites=12386273247921671123&as_sdt=2005&sciodt=2007&hl=en",147,"2024-07-10 14:02:17","","10.1002/2016WR019442","","",,,,,10,1.25,3,4,8,"… The peat was woody Sphagnum peat or woody Sphagnum-Carex peat (Figure 2a). The … The winter process schematization in FLUSH includes heat conduction through the snow into …","https://agupubs.onlinelibrary.wiley.com/doi/pdfdirect/10.1002/2016WR019442","https://scholar.google.com/scholar?q=related:04tLyeTh5KsJ:scholar.google.com/&scioq=sphagnum+%22heat+conduction%22&hl=en&as_sdt=2007"
10,"AD Matthias, ARP Hernández","Modeling temperatures in soil under an opaque cylindrical enclosure",1998,"Agricultural and forest meteorology","Elsevier","https://www.sciencedirect.com/science/article/pii/S0168192397000944","https://scholar.google.com/scholar?cites=15233550079103478817&as_sdt=2005&sciodt=2007&hl=en",148,"2024-07-10 14:02:17","","","","",,,,,10,0.38,5,2,26,"… The G o is given by Fourier's law of heat conduction(23) G o =k s ∂ T ∂ z z where k s is the soil thermal conductivity (W m −1 K −1 ), and ∂T/∂z is the vertical temperature gradient at …","","https://scholar.google.com/scholar?q=related:ISwWDRZxaNMJ:scholar.google.com/&scioq=sphagnum+%22heat+conduction%22&hl=en&as_sdt=2007"
34,"LCP Martin, J Nitzbon, KS Aas…","Stability conditions of peat plateaus and palsas in northern Norway",2019,"Journal of …","Wiley Online Library","https://agupubs.onlinelibrary.wiley.com/doi/abs/10.1029/2018JF004945","https://scholar.google.com/scholar?cites=10397501377011973491&as_sdt=2005&sciodt=2007&hl=en",149,"2024-07-10 14:02:17","","10.1029/2018JF004945","","",,,,,34,6.80,9,4,5,"… The wet fens mainly present sphagnum sedges, cotton grass (Eriophorum), mosses, and … The model features a simple snowpack module which includes heat conduction, dynamic …","https://agupubs.onlinelibrary.wiley.com/doi/pdfdirect/10.1029/2018JF004945","https://scholar.google.com/scholar?q=related:c_1uAGpYS5AJ:scholar.google.com/&scioq=sphagnum+%22heat+conduction%22&hl=en&as_sdt=2007"
71,"YA Mohamed, WGM Bastiaanssen…","Wetland versus open water evaporation: An analysis and literature review",2012,"… of the Earth, Parts A/B/C","Elsevier","https://www.sciencedirect.com/science/article/pii/S147470651100194X","https://scholar.google.com/scholar?cites=11827084156318808686&as_sdt=2005&sciodt=2007&hl=en",150,"2024-07-10 14:02:17","","","","",,,,,71,5.92,24,3,12,"… An alternative to the classical heat conduction equation is an empirical estimation of the G 0 /R n ratio. Field measurements have indicated that in hot deserts this ratio can be …","","https://scholar.google.com/scholar?q=related:bnoIqmA-IqQJ:scholar.google.com/&scioq=sphagnum+%22heat+conduction%22&hl=en&as_sdt=2007"
27,"C Ackley, SE Tank, KM Haynes, F Rezanezhad…","Coupled hydrological and geochemical impacts of wildfire in peatland-dominated regions of discontinuous permafrost",2021,"Science of the Total …","Elsevier","https://www.sciencedirect.com/science/article/pii/S0048969721019112","https://scholar.google.com/scholar?cites=3464424435632824219&as_sdt=2005&sciodt=2007&hl=en",151,"2024-07-10 14:02:17","","","","",,,,,27,9.00,5,5,3,"… The ground cover is comprised mainly of Sphagnum moss and Cladina lichen species which together produce hummock-hollow type microtopography over the plateau surface, …","http://www.scottycreek.com/media/documents/publications/114_Ackley%20et%20al.pdf","https://scholar.google.com/scholar?q=related:m98TPasbFDAJ:scholar.google.com/&scioq=sphagnum+%22heat+conduction%22&hl=en&as_sdt=2007"
64,"KO Yoro, MK Amosa, PT Sekoai, J Mulopo…","Diffusion mechanism and effect of mass transfer limitation during the adsorption of CO2 by polyaspartamide in a packed-bed unit",2020,"International Journal …","Taylor &Francis","https://www.tandfonline.com/doi/abs/10.1080/19397038.2019.1592261","https://scholar.google.com/scholar?cites=17884412965831685711&as_sdt=2005&sciodt=2007&hl=en",152,"2024-07-10 14:02:17","","10.1080/19397038.2019.1592261","","",,,,,64,16.00,13,5,4,"… More so, complicated heat transfer equations for transient heat conduction will be required to describe the time-varying and non-spatially-uniform temperature field within the material (…","https://www.tandfonline.com/doi/pdf/10.1080/19397038.2019.1592261","https://scholar.google.com/scholar?q=related:T7bJNNYyMvgJ:scholar.google.com/&scioq=sphagnum+%22heat+conduction%22&hl=en&as_sdt=2007"
0,"JW POMEROY, DM GRAY, KR SHOOK","An Evaluation of Snow Processe for Land Surface Modelling",,"Citeseer","","https://citeseerx.ist.psu.edu/document?repid=rep1&type=pdf&doi=ba0b07637ab566d6f9390c58345459089861cb2b","",153,"2024-07-10 14:02:17","PDF","","","",,,,,0,0.00,0,3,,"… Over the period of study from November 1994 to April 1995, the low-lying carpet of sphagnum moss and kinnikinnick (bearberry) was covered by snow. …","https://citeseerx.ist.psu.edu/document?repid=rep1&type=pdf&doi=ba0b07637ab566d6f9390c58345459089861cb2b","https://scholar.google.com/scholar?q=related:1uvTEkz4I2kJ:scholar.google.com/&scioq=sphagnum+%22heat+conduction%22&hl=en&as_sdt=2007"
121,"NT Roulet, M Woo","Hydrology of a wetland in the continuous permafrost region",1986,"Journal of Hydrology","Elsevier","https://www.sciencedirect.com/science/article/pii/0022169486901447","https://scholar.google.com/scholar?cites=8799071642397553781&as_sdt=2005&sciodt=2007&hl=en",154,"2024-07-10 14:02:17","","","","",,,,,121,3.18,61,2,38,"This study examines the hydrological system of a northern wetland in the continuous permafrost region. Water balance computation quantifies the relative importance of various …","","https://scholar.google.com/scholar?q=related:dbRRDgqVHHoJ:scholar.google.com/&scioq=sphagnum+%22heat+conduction%22&hl=en&as_sdt=2007"
0,"M Zhao","Assessment of Snow Effects on Heating Loads for Buildings with Green Roofs",2011,"","etda.libraries.psu.edu","https://etda.libraries.psu.edu/catalog/12295","",155,"2024-07-10 14:02:17","","","","",,,,,0,0.00,0,1,13,"… of atmospheric fluxes on surface temperature is reasonably well understood and parameterized, it could be difficult to model the snow surface temperature, because the heat conduction …","https://etda.libraries.psu.edu/files/final_submissions/4531","https://scholar.google.com/scholar?q=related:URLbGyKavcMJ:scholar.google.com/&scioq=sphagnum+%22heat+conduction%22&hl=en&as_sdt=2007"
23,"SC Iden, JR Blöcher, E Diamantopoulos, A Peters…","Numerical test of the laboratory evaporation method using coupled water, vapor and heat flow modelling",2019,"Journal of …","Elsevier","https://www.sciencedirect.com/science/article/pii/S0022169419300204","https://scholar.google.com/scholar?cites=16263717545173725537&as_sdt=2005&sciodt=2007&hl=en",156,"2024-07-10 14:02:17","","","","",,,,,23,4.60,5,5,5,"… Finally, the model for the ground heat flux G encompasses molecular heat conduction and convective heat transport by flowing liquid water and water vapor (Saito et al., 2006, Šimunek …","https://scholar.google.com/scholar?output=instlink&q=info:YTFeP_BUtOEJ:scholar.google.com/&hl=en&as_sdt=2007&scillfp=12955347620370566078&oi=lle","https://scholar.google.com/scholar?q=related:YTFeP_BUtOEJ:scholar.google.com/&scioq=sphagnum+%22heat+conduction%22&hl=en&as_sdt=2007"
385,"CR Tracy","A model of the dynamic exchanges of water and energy between a terrestrial amphibian and its environment",1976,"Ecological Monographs","Wiley Online Library","https://esajournals.onlinelibrary.wiley.com/doi/abs/10.2307/1942256","https://scholar.google.com/scholar?cites=6567826949887457727&as_sdt=2005&sciodt=2007&hl=en",157,"2024-07-10 14:02:17","","10.2307/1942256","","",,,,,385,8.02,385,1,48,"… Therefore, heat conduction through the frog does not simply pass through a single cross… experimental frogs were housed in aquaria containing sphagnum moss and fed a diet of crickets …","https://www.jstor.org/stable/pdf/1942256.pdf","https://scholar.google.com/scholar?q=related:v3lHJtCbJVsJ:scholar.google.com/&scioq=sphagnum+%22heat+conduction%22&hl=en&as_sdt=2007"
26,"A Jones, LH Louie, H Nguyen, J Roller…","Compressed absorbent tampon",2003,"US Patent App. 10 …","Google Patents","https://patents.google.com/patent/US20030233742A1/en","https://scholar.google.com/scholar?cites=7927783394857912229&as_sdt=2005&sciodt=2007&hl=en",158,"2024-07-10 14:02:17","","","","",,,,,26,1.24,5,5,21,"… Looser capillaries of the more open web allow more even heat conduction into center of the web. Further, when the unrolled web is heated there is less thermal mass between the heat …","https://patentimages.storage.googleapis.com/79/7c/94/c170f5fd848d51/US20030233742A1.pdf","https://scholar.google.com/scholar?q=related:pQe_kv4kBW4J:scholar.google.com/&scioq=sphagnum+%22heat+conduction%22&hl=en&as_sdt=2007"
1,"AJL Adikari","Devolopment of a mechanical dryer for drying coco peat to use growing media",2016,"","","","https://scholar.google.com/scholar?cites=7953980546960975557&as_sdt=2005&sciodt=2007&hl=en",159,"2024-07-10 14:02:17","CITATION","","","",,,,,1,0.13,1,1,8,"","","https://scholar.google.com/scholar?q=related:xeb5Wyo3Ym4J:scholar.google.com/&scioq=sphagnum+%22heat+conduction%22&hl=en&as_sdt=2007"
82,"F Ascione, RF De Masi, M Mastellone, S Ruggiero…","Green walls, a critical review: Knowledge gaps, design parameters, thermal performances and multi-criteria design approaches",2020,"Energies","mdpi.com","https://www.mdpi.com/1996-1073/13/9/2296","https://scholar.google.com/scholar?cites=9964399396651597591&as_sdt=2005&sciodt=2007&hl=en",160,"2024-07-10 14:02:17","HTML","","","",,,,,82,20.50,16,5,4,"… For the heat conduction and heat storage in the back wall and in the soil layer, thermal … have found conductivities of 0.062 W/m K for sphagnum moss, 0.060 W/m K for outdoor planting …","https://www.mdpi.com/1996-1073/13/9/2296","https://scholar.google.com/scholar?q=related:F_-IJXWoSIoJ:scholar.google.com/&scioq=sphagnum+%22heat+conduction%22&hl=en&as_sdt=2007"
0,"RLH ESSERY, A PIETRONIRO, N HEDSTROM","for Land Surface Modelling",,"easternsnow.org","","https://www.easternsnow.org/s/08-JW-Pomeroy-et-al.pdf","",161,"2024-07-10 14:02:17","PDF","","","",,,,,0,0.00,0,3,,"… , the low-lying carpet of sphagnum moss and kinnikinnick (bearberry) was covered by snow. … the soil temperature is largely supplied by heat conduction at the surface (high heat transfer …","https://www.easternsnow.org/s/08-JW-Pomeroy-et-al.pdf","https://scholar.google.com/scholar?q=related:pfK_f_DUnWMJ:scholar.google.com/&scioq=sphagnum+%22heat+conduction%22&hl=en&as_sdt=2007"
92,"J Cui, C Li, C Trettin","Analyzing the ecosystem carbon and hydrologic characteristics of forested wetland using a biogeochemical process model",2005,"Global Change Biology","Wiley Online Library","https://onlinelibrary.wiley.com/doi/abs/10.1111/j.1365-2486.2005.00900.x","https://scholar.google.com/scholar?cites=16878195614121907346&as_sdt=2005&sciodt=2007&hl=en",162,"2024-07-10 14:02:17","","10.1111/j.1365-2486.2005.00900.x","","",,,,,92,4.84,31,3,19,"… MEF-Bog is completely forested with black spruce (Picea mariana), and the surface is covered by mosses (Sphagnum spp.) and sedge species (Carex spp.). MEF-Bog has a perched …","https://onlinelibrary.wiley.com/doi/pdf/10.1111/j.1365-2486.2005.00900.x","https://scholar.google.com/scholar?q=related:ktRKjXxlO-oJ:scholar.google.com/&scioq=sphagnum+%22heat+conduction%22&hl=en&as_sdt=2007"
26,"D Olefeldt, L Heffernan, MC Jones, ABK Sannel…","Permafrost thaw in northern peatlands: rapid changes in ecosystem and landscape functions",2021,"Ecosystem collapse and …","Springer","https://link.springer.com/chapter/10.1007/978-3-030-71330-0_3","https://scholar.google.com/scholar?cites=7250671247269897001&as_sdt=2005&sciodt=2007&hl=en",163,"2024-07-10 14:02:17","","10.1007/978-3-030-71330-0_3","","",,,,,26,8.67,5,5,3,"… Sphagnum mosses to feather mosses, lichens, and shrubs and concurrently reduced ACAR. Thus early permafrost stages with Sphagnum … edges due to heat conduction from adjacent …","https://www.researchgate.net/profile/David-Olefeldt/publication/352547371_Permafrost_Thaw_in_Northern_Peatlands_Rapid_Changes_in_Ecosystem_and_Landscape_Functions/links/625748344173a21a0d0fa357/Permafrost-Thaw-in-Northern-Peatlands-Rapid-Changes-in-Ecosystem-and-Landscape-Functions.pdf","https://scholar.google.com/scholar?q=related:KSOpbBWPn2QJ:scholar.google.com/&scioq=sphagnum+%22heat+conduction%22&hl=en&as_sdt=2007"
