Cites,Authors,Title,Year,Source,Publisher,ArticleURL,CitesURL,GSRank,QueryDate,Type,DOI,ISSN,CitationURL,Volume,Issue,StartPage,EndPage,ECC,CitesPerYear,CitesPerAuthor,AuthorCount,Age,Abstract,FullTextURL,RelatedURL
4,"V Stepanenko, I Repina, A Artamonov","Derivation of heat conductivity from temperature and heat flux measurements in soil",2021,"Land","mdpi.com","https://www.mdpi.com/2073-445X/10/6/552","https://scholar.google.com/scholar?cites=206381742762416376&as_sdt=2005&sciodt=2007&hl=en",1,"2024-07-10 14:02:17","HTML","","","",,,,,4,1.33,1,3,3,"… The sensors were placed in the Sphagnum moss layer 5–25 cm below surface, with the … (“Fourier law”) for the heat conduction problem provides a convenient framework, because it is …","https://www.mdpi.com/2073-445X/10/6/552","https://scholar.google.com/scholar?q=related:-Nh6ARo33QIJ:scholar.google.com/&scioq=sphagnum+%22heat+conduction%22&hl=en&as_sdt=2007"
197,"JA O'Donnell, VE Romanovsky, JW Harden…","The effect of moisture content on the thermal conductivity of moss and organic soil horizons from black spruce ecosystems in interior Alaska",2009,"Soil …","journals.lww.com","https://journals.lww.com/soilsci/fulltext/2009/12000/The_Effect_of_Moisture_Content_on_the_Thermal.2.aspx","https://scholar.google.com/scholar?cites=18315986973597956049&as_sdt=2005&sciodt=2007&hl=en",2,"2024-07-10 14:02:17","","","","",,,,,197,13.13,49,4,15,"… Our findings suggest that a shift toward Sphagnum-dominated from feather moss-dominated ecosystems could enhance heat conduction through organic horizons via wetter soil …","https://citeseerx.ist.psu.edu/document?repid=rep1&type=pdf&doi=202bd6259c9ed46d987f9383a0a8b9b4c5dd82eb","https://scholar.google.com/scholar?q=related:0ff8Nxx1L_4J:scholar.google.com/&scioq=sphagnum+%22heat+conduction%22&hl=en&as_sdt=2007"
58,"JM McKenzie, DI Siegel, DO Rosenberry…","Heat transport in the Red Lake bog, glacial Lake Agassiz peatlands",2007,"Hydrological …","Wiley Online Library","https://onlinelibrary.wiley.com/doi/abs/10.1002/hyp.6239","https://scholar.google.com/scholar?cites=8961607566573764441&as_sdt=2005&sciodt=2007&hl=en",3,"2024-07-10 14:02:17","","10.1002/hyp.6239","","",,,,,58,3.41,15,4,17,"… The upper 3 m of peat consist of oligotrophic bog peat derived largely from Sphagnum moss … Using Equation (5), the total heat conduction is calculated as 1Ð8 MJ day 1, indicating it …","https://citeseerx.ist.psu.edu/document?repid=rep1&type=pdf&doi=3b1c03144a0467dafad1848fdc019b9f001c2533","https://scholar.google.com/scholar?q=related:Wf8U5pkGXnwJ:scholar.google.com/&scioq=sphagnum+%22heat+conduction%22&hl=en&as_sdt=2007"
73,"R Weiss, NJ Shurpali, T Sallantaus, R Laiho, J Laine…","Simulation of water table level and peat temperatures in boreal peatlands",2006,"Ecological …","Elsevier","https://www.sciencedirect.com/science/article/pii/S0304380005003534","https://scholar.google.com/scholar?cites=943337294936746032&as_sdt=2005&sciodt=2007&hl=en",4,"2024-07-10 14:02:17","","","","",,,,,73,4.06,12,6,18,"… Using the peat characteristics in terms of the remains of peat constituents such as Sphagnum, Carex, Eriophorum and Lignum, they have established well-defined water retention …","https://www.academia.edu/download/49963916/Simulation_of_water_table_level_and_peat20161029-6326-7rkk6k.pdf","https://scholar.google.com/scholar?q=related:MCgVkEVoFw0J:scholar.google.com/&scioq=sphagnum+%22heat+conduction%22&hl=en&as_sdt=2007"
14,"DD Dimitrov, RF Grant, PM Lafleur…","Modeling peat thermal regime of an ombrotrophic peatland with hummock–hollow microtopography",2010,"Soil Science Society …","Wiley Online Library","https://acsess.onlinelibrary.wiley.com/doi/abs/10.2136/sssaj2009.0288","https://scholar.google.com/scholar?cites=18383335438720002112&as_sdt=2005&sciodt=2007&hl=en",5,"2024-07-10 14:02:17","","10.2136/sssaj2009.0288","","",,,,,14,1.00,4,4,14,"… heat wouldn't have penetrated and heat conduction would act alone. Therefore, the effective … The groundcover is mainly Sphagnum mosses and overstory vegetation is dominated by a …","https://www.researchgate.net/profile/Dimitre-Dimitrov/publication/250129440_Modeling_Peat_Thermal_Regime_of_an_Ombrotrophic_Peatland_with_Hummock-Hollow_Microtopography/links/5c98f257a6fdccd4603ae2c3/Modeling-Peat-Thermal-Regime-of-an-Ombrotrophic-Peatland-with-Hummock-Hollow-Microtopography.pdf","https://scholar.google.com/scholar?q=related:QGjBsy66Hv8J:scholar.google.com/&scioq=sphagnum+%22heat+conduction%22&hl=en&as_sdt=2007"
26,"SH Dissanayaka, S Hamamoto…","Thermal properties of peaty soils: Effects of liquid‐phase impedance factor and shrinkage",2012,"Vadose Zone …","Wiley Online Library","https://acsess.onlinelibrary.wiley.com/doi/abs/10.2136/vzj2011.0092","https://scholar.google.com/scholar?cites=2586543023773348141&as_sdt=2005&sciodt=2007&hl=en",6,"2024-07-10 14:02:17","","10.2136/vzj2011.0092","","",,,,,26,2.17,9,3,12,"… mainly of fresh and decawying sphagnum moss inside the marsh (… profile consisted of decomposed sphagnum and decaying plant … to the overall heat capacity than to heat conduction. …","https://acsess.onlinelibrary.wiley.com/doi/pdfdirect/10.2136/vzj2011.0092","https://scholar.google.com/scholar?q=related:LXFGEC0_5SMJ:scholar.google.com/&scioq=sphagnum+%22heat+conduction%22&hl=en&as_sdt=2007"
49,"H Park, S Launiainen, PY Konstantinov…","Modeling the effect of moss cover on soil temperature and carbon fluxes at a tundra site in northeastern Siberia",2018,"Journal of …","Wiley Online Library","https://agupubs.onlinelibrary.wiley.com/doi/abs/10.1029/2018jg004491","https://scholar.google.com/scholar?cites=4958760740448732755&as_sdt=2005&sciodt=2007&hl=en",7,"2024-07-10 14:02:17","","10.1029/2018jg004491","","",,,,,49,8.17,12,4,6,"… The main objective of this study was to quantitatively assess the impact of the Sphagnum-… G s is the heat conduction from the bottom snow layer when snow covers the moss, and f s …","https://agupubs.onlinelibrary.wiley.com/doi/pdfdirect/10.1029/2018JG004491","https://scholar.google.com/scholar?q=related:U4aZ7J4O0UQJ:scholar.google.com/&scioq=sphagnum+%22heat+conduction%22&hl=en&as_sdt=2007"
0,"M Yamada, T Sato, H Takahashi","A numerical simulation of the effect of water table levels on nocturnal air temperature and frost damage in Mire, Japan",2009,"Wetlands","Springer","https://link.springer.com/article/10.1672/07-151.1","",8,"2024-07-10 14:02:17","","10.1672/07-151.1","","",,,,,0,0.00,0,3,15,"… Vegetation at the study site was dominated by Sphagnum papillosum, Sphagnum … temperature change in the peat layer is due to heat conduction as well as latent heat release. Thermal …","https://link.springer.com/content/pdf/10.1672/07-151.1.pdf","https://scholar.google.com/scholar?q=related:K14pR59TwHAJ:scholar.google.com/&scioq=sphagnum+%22heat+conduction%22&hl=en&as_sdt=2007"
0,"E Mastej, S Wright, M Braverman, É Devoie…","An evaluation of ground-cooling systems in a saturated subarctic peatland",2024,"Cold Regions Science …","Elsevier","https://www.sciencedirect.com/science/article/pii/S0165232X23003269","",9,"2024-07-10 14:02:17","","","","",,,,,0,0.00,0,5,1,"… The area was vegetated by a mixture of mosses (Sphagnum spp.), shrubs (Rhododendron groenlandicum), lichens (Cladonia spp.), and some sparse tree seedlings (Picea mariana). …","","https://scholar.google.com/scholar?q=related:Z7bFEWvqbkEJ:scholar.google.com/&scioq=sphagnum+%22heat+conduction%22&hl=en&as_sdt=2007"
27,"R Puranen, M Mäkilä, H Säävuori","Electric conductivity and temperature variations within a raised bog in Finland: implications for bog development",1999,"The Holocene","journals.sagepub.com","https://journals.sagepub.com/doi/abs/10.1191/095968399669634350","https://scholar.google.com/scholar?cites=599740835549243024&as_sdt=2005&sciodt=2007&hl=en",10,"2024-07-10 14:02:17","","10.1191/095968399669634350","","",,,,,27,1.08,9,3,25,"… to 5 m thick layer of Sphagnum peat was developed so that now … are mainly controlled by heat conduction. Noclear signs of thermal … The heat conduction model can also be used in the …","https://journals.sagepub.com/doi/pdf/10.1191/095968399669634350","https://scholar.google.com/scholar?q=related:kGY1xBy1UggJ:scholar.google.com/&scioq=sphagnum+%22heat+conduction%22&hl=en&as_sdt=2007"
66,"PM Lafleur","Connecting atmosphere and wetland: energy and water vapour exchange",2008,"Geography Compass","Wiley Online Library","https://compass.onlinelibrary.wiley.com/doi/abs/10.1111/j.1749-8198.2007.00132.x","https://scholar.google.com/scholar?cites=4515310758650894866&as_sdt=2005&sciodt=2007&hl=en",11,"2024-07-10 14:02:17","","10.1111/j.1749-8198.2007.00132.x","","",,,,,66,4.13,66,1,16,"… Sphagnum moss cover and low-nutrient status, and rich fens, that have little or no Sphagnum, a … G is heat conduction within the soil. Typical direction of fluxes for daytime and nighttime …","","https://scholar.google.com/scholar?q=related:EtriOzabqT4J:scholar.google.com/&scioq=sphagnum+%22heat+conduction%22&hl=en&as_sdt=2007"
30,"F Fedorik, J Zach, M Lehto, HR Kymäläinen…","Hygrothermal properties of advanced bio-based insulation materials",2021,"Energy and …","Elsevier","https://www.sciencedirect.com/science/article/pii/S0378778821008124","https://scholar.google.com/scholar?cites=15835792340956741462&as_sdt=2005&sciodt=2007&hl=en",12,"2024-07-10 14:02:17","HTML","","","",,,,,30,10.00,6,5,3,"… of peat and sphagnum moss, one from sphagnum moss, one … However, the effect of heat conduction and convection inside … is negligible compared with heat conduction through solid …","https://www.sciencedirect.com/science/article/pii/S0378778821008124","https://scholar.google.com/scholar?q=related:Vv-TgzsJxNsJ:scholar.google.com/&scioq=sphagnum+%22heat+conduction%22&hl=en&as_sdt=2007"
0,"TM Parratt","Wintertime Infiltration and the Thermal Dynamics of Black Spruce Peatlands within the Boreal Plains",2022,"","harvest.usask.ca","https://harvest.usask.ca/bitstream/10388/13879/1/PARRATT-DISSERTATION-2022.pdf","",13,"2024-07-10 14:02:17","PDF","","","",,,,,0,0.00,0,1,2,"… black spruce trees and sphagnum moss on winter infiltration and subsurface temperatures. … time at the site, supporting the conceptual model that the insulation provided by sphagnum …","https://harvest.usask.ca/bitstream/10388/13879/1/PARRATT-DISSERTATION-2022.pdf","https://scholar.google.com/scholar?q=related:Ho1FaRLnMZoJ:scholar.google.com/&scioq=sphagnum+%22heat+conduction%22&hl=en&as_sdt=2007"
5,"N Wright","Water and energy fluxes from a permafrost peat plateau: examining the controls on runoff generation",2009,"","summit.sfu.ca","https://summit.sfu.ca/item/9536","https://scholar.google.com/scholar?cites=4635905035169118573&as_sdt=2005&sciodt=2007&hl=en",14,"2024-07-10 14:02:17","","","","",,,,,5,0.33,5,1,15,"… The frost table on 11 July was generated using SFASH coupled with a simple heat conduction algorithm. Note that the fen-plateau boundary is point 0 on the x-axis. ......................................…","https://summit.sfu.ca/_flysystem/fedora/sfu_migrate/9536/ETD4514.pdf","https://scholar.google.com/scholar?q=related:bTmzQRELVkAJ:scholar.google.com/&scioq=sphagnum+%22heat+conduction%22&hl=en&as_sdt=2007"
22,"Z Fan, JC Neff, JW Harden, T Zhang, H Veldhuis…","Water and heat transport in boreal soils: Implications for soil response to climate change",2011,"Science of the Total …","Elsevier","https://www.sciencedirect.com/science/article/pii/S0048969711001288","https://scholar.google.com/scholar?cites=7337966933638378879&as_sdt=2005&sciodt=2007&hl=en",15,"2024-07-10 14:02:17","","","","",,,,,22,1.69,4,6,13,"… However, heat conduction is not the only mechanism for heat transport in soils and ecosystems. Cahill and Parlange (1998) indicated that liquid water and thermally-induced vapor …","https://escholarship.org/content/qt40r7c46p/qt40r7c46p.pdf","https://scholar.google.com/scholar?q=related:f_UTRQyy1WUJ:scholar.google.com/&scioq=sphagnum+%22heat+conduction%22&hl=en&as_sdt=2007"
42,"BD Smerdon, CA Mendoza","Hysteretic freezing characteristics of riparian peatlands in the Western Boreal Forest of Canada",2010,"Hydrological Processes: An …","Wiley Online Library","https://onlinelibrary.wiley.com/doi/abs/10.1002/hyp.7544","https://scholar.google.com/scholar?cites=4778573943588877713&as_sdt=2005&sciodt=2007&hl=en",16,"2024-07-10 14:02:17","","10.1002/hyp.7544","","",,,,,42,3.00,21,2,14,"… (Picea mariana) swamp with understory of Sphagnum moss hollows and Labrador tea (Ledum … with a heat transfer model that accounted for heat conduction and the water-to-ice phase …","","https://scholar.google.com/scholar?q=related:kXWNCK_nUEIJ:scholar.google.com/&scioq=sphagnum+%22heat+conduction%22&hl=en&as_sdt=2007"
51,"I Juszak, W Eugster, MMPD Heijmans…","Contrasting radiation and soil heat fluxes in Arctic shrub and wet sedge tundra",2016,"…","bg.copernicus.org","https://bg.copernicus.org/preprints/bg-2016-41/","https://scholar.google.com/scholar?cites=14784326010873977445&as_sdt=2005&sciodt=2007&hl=en",17,"2024-07-10 14:02:17","","","","",,,,,51,6.38,13,4,8,"… Towards the lower, wetter areas peat mosses (Sphagnum spp.) and sedges border the … by air and heat conduction will be dominated by the air. Thus heat conduction through the …","https://bg.copernicus.org/preprints/bg-2016-41/bg-2016-41-manuscript-version2.pdf","https://scholar.google.com/scholar?q=related:ZRq2GS16LM0J:scholar.google.com/&scioq=sphagnum+%22heat+conduction%22&hl=en&as_sdt=2007"
339,"DL Kane, KM Hinkel, DJ Goering, LD Hinzman…","Non-conductive heat transfer associated with frozen soils",2001,"Global and Planetary …","Elsevier","https://www.sciencedirect.com/science/article/pii/S0921818101000959","https://scholar.google.com/scholar?cites=4810086480934543271&as_sdt=2005&sciodt=2007&hl=en",18,"2024-07-10 14:02:17","","","","",,,,,339,14.74,68,5,23,"… Numerous applications of heat conduction theory to analyze … Using a one-dimensional heat conduction model that … ) layer of Sphagnum moss underlain by mixed Sphagnum duff and silt …","https://www.academia.edu/download/56176311/s0921-8181_2801_2900095-920180327-10448-13cvq0k.pdf","https://scholar.google.com/scholar?q=related:px8DYyvcwEIJ:scholar.google.com/&scioq=sphagnum+%22heat+conduction%22&hl=en&as_sdt=2007"
0,"CA Macheel, RP Daanen, D Misra…","Thermo-and Hydrodynamic Simulation of Variably Saturated Flow in Northern Latitude Peatlands",2010,"… , June 20-June 23 …","elibrary.asabe.org","https://elibrary.asabe.org/abstract.asp?aid=29918","",19,"2024-07-10 14:02:17","","","","",,,,,0,0.00,0,4,14,"… Heat conduction and convection in organic porous media are primarily dependent on … Profiles of water content and pore size in Sphagnum and peat, and their relation to peat bog …","","https://scholar.google.com/scholar?q=related:PR6AEsgFH5UJ:scholar.google.com/&scioq=sphagnum+%22heat+conduction%22&hl=en&as_sdt=2007"
45,"Y Wu, N Zhang, G Slater, JM Waddington…","Hydrophobicity of peat soils: Characterization of organic compound changes associated with heat-induced water repellency",2020,"Science of the Total …","Elsevier","https://www.sciencedirect.com/science/article/pii/S004896971936440X","https://scholar.google.com/scholar?cites=14446514488502984258&as_sdt=2005&sciodt=2007&hl=en",20,"2024-07-10 14:02:17","","","","",,,,,45,11.25,9,5,4,"… Ground cover moss species were typically dominated by Sphagnum and feather moss and/… , uneven heat conduction in the furnace, and the high sample composition heterogeneity. …","","https://scholar.google.com/scholar?q=related:Qh7B6WJUfMgJ:scholar.google.com/&scioq=sphagnum+%22heat+conduction%22&hl=en&as_sdt=2007"
6,"G Liu, F Yu, MS Irshad, X Xiong, Z Guo…","Biomass‐Inspired Solar Evaporator for Simultaneous Steam and Power Generation Enhanced by Thermal‐Electric Effect",2022,"Energy …","Wiley Online Library","https://onlinelibrary.wiley.com/doi/abs/10.1002/ente.202200854","https://scholar.google.com/scholar?cites=11580622143841067204&as_sdt=2005&sciodt=2007&hl=en",21,"2024-07-10 14:02:17","","10.1002/ente.202200854","","",,,,,6,3.00,1,6,2,"… Sphagnum palustre is very common in nature and is cheap to obtain. Sphagnum palustre … heat radiation, heat convection, and heat conduction (Figure 4c). Efficient evaporators must …","","https://scholar.google.com/scholar?q=related:xGCrqXuitqAJ:scholar.google.com/&scioq=sphagnum+%22heat+conduction%22&hl=en&as_sdt=2007"
68,"BRK Runkle, C Wille, M Gažovič, M Wilmking…","The surface energy balance and its drivers in a boreal peatland fen of northwestern Russia",2014,"Journal of …","Elsevier","https://www.sciencedirect.com/science/article/pii/S002216941400078X","https://scholar.google.com/scholar?cites=5181007168205492276&as_sdt=2005&sciodt=2007&hl=en",22,"2024-07-10 14:02:17","HTML","","","",,,,,68,6.80,14,5,10,"… Sphagnum angustifolium with dwarf Pinus sylvestris trees on hummocks. The minerogenous fen region in the south part contains Sphagnum … of spatial heterogeneity in heat conduction. …","https://www.sciencedirect.com/science/article/pii/S002216941400078X","https://scholar.google.com/scholar?q=related:NBCkv5Gi5kcJ:scholar.google.com/&scioq=sphagnum+%22heat+conduction%22&hl=en&as_sdt=2007"
6,"B Van Huizen, OF Sutton, JS Price, RM Petrone","Assessing the importance of bi-directional melting when modeling boreal peatland freeze/thaw dynamics",2022,"Journal of Hydrology","Elsevier","https://www.sciencedirect.com/science/article/pii/S0022169421012865","https://scholar.google.com/scholar?cites=16515326876407186998&as_sdt=2005&sciodt=2007&hl=en",23,"2024-07-10 14:02:17","","","","",,,,,6,3.00,2,4,2,"The modeling of seasonal ground ice (SGI) freeze/thaw a common feature in boreal peatlands, has often been completed using a unidirectional approach, where melting is driven by …","https://scholar.google.com/scholar?output=instlink&q=info:Nka2yUo6MuUJ:scholar.google.com/&hl=en&as_sdt=2007&scillfp=431475640586884036&oi=lle","https://scholar.google.com/scholar?q=related:Nka2yUo6MuUJ:scholar.google.com/&scioq=sphagnum+%22heat+conduction%22&hl=en&as_sdt=2007"
6,"R Eggelsmann","The thermal constant of different high-bogs and sandy soils",1973,"Proc. 4th Int. Peat Congr","","","https://scholar.google.com/scholar?cites=4934244207012978399&as_sdt=2005&sciodt=2007&hl=en",24,"2024-07-10 14:02:17","CITATION","","","",,,,,6,0.12,6,1,51,"","","https://scholar.google.com/scholar?q=related:354Jqvb0eUQJ:scholar.google.com/&scioq=sphagnum+%22heat+conduction%22&hl=en&as_sdt=2007"
0,"J van Huissteden, J van Huissteden","The Energy Balance of Permafrost Soils and Ecosystems",2020,"Thawing Permafrost: Permafrost …","Springer","https://link.springer.com/chapter/10.1007/978-3-030-31379-1_2","",25,"2024-07-10 14:02:17","","10.1007/978-3-030-31379-1_2","","",,,,,0,0.00,0,2,4,"… This heat conduction into the ground is determined by two thermal properties of the soil … bare, dark peat lumps, and the amount of Sphagnum mosses increased. At the dry peat plateau …","https://scholar.google.com/scholar?output=instlink&q=info:GmDMIT1klIgJ:scholar.google.com/&hl=en&as_sdt=2007&scillfp=12595705009192537300&oi=lle","https://scholar.google.com/scholar?q=related:GmDMIT1klIgJ:scholar.google.com/&scioq=sphagnum+%22heat+conduction%22&hl=en&as_sdt=2007"
3,"DP Kasymov","Experimental investigation of the deepening of the combustion front into peat layers different in botanical composition",2017,"Journal of Engineering Physics and Thermophysics","Springer","https://link.springer.com/article/10.1007/s10891-017-1559-0","https://scholar.google.com/scholar?cites=993047415533569161&as_sdt=2005&sciodt=2007&hl=en",26,"2024-07-10 14:02:17","","10.1007/s10891-017-1559-0","","",,,,,3,0.43,3,1,7,"… in which the thermophysical properties of peat (heat conduction, heat capacity, combustion heat)… We analyze pine-cotton grass and grass-sphagnum peats, which are the most abundant …","https://link.springer.com/content/pdf/10.1007/s10891-017-1559-0.pdf","https://scholar.google.com/scholar?q=related:iYT_71wDyA0J:scholar.google.com/&scioq=sphagnum+%22heat+conduction%22&hl=en&as_sdt=2007"
0,"X Liu","Modelling evaporation from wetland lichen and moss tundra in Churchill, Manitoba",2009,"","research.library.mun.ca","http://research.library.mun.ca/id/eprint/9262","",27,"2024-07-10 14:02:17","","","","",,,,,0,0.00,0,1,15,"Today northern subarctic terrestrial environments are receiving increased attention due to their hydrologic effects not only on subarctic terrain but on the whole global water cycle. …","https://research.library.mun.ca/9262/1/Liu_Xiang.pdf","https://scholar.google.com/scholar?q=related:5RBsfV1csSUJ:scholar.google.com/&scioq=sphagnum+%22heat+conduction%22&hl=en&as_sdt=2007"
17,"MJ Aho, JL Tummavuori, JP Hämäläinen…","Determination of heats of pyrolysis and thermal reactivity of peats",1989,"Fuel","Elsevier","https://www.sciencedirect.com/science/article/pii/0016236189901798","https://scholar.google.com/scholar?cites=9069131183427853499&as_sdt=2005&sciodt=2007&hl=en",28,"2024-07-10 14:02:17","","","","",,,,,17,0.49,4,4,35,"Heats of pyrolysis of four Finnish peats were determined by differential scanning calorimetry (dsc), and combustion enthalpies were compared by differential thermoanalysis (DTA) in an …","","https://scholar.google.com/scholar?q=related:u5yi0cIG3H0J:scholar.google.com/&scioq=sphagnum+%22heat+conduction%22&hl=en&as_sdt=2007"
0,"L Port, J Goeke","Thermal analysis of green roof with moos mats",,"researchgate.net","","https://www.researchgate.net/profile/Johannes-Goeke/publication/372769324_Thermal_analysis_of_green_roof_with_moos_mats/links/65aeb8979ce29c458b945a69/Thermal-analysis-of-green-roof-with-moos-mats.pdf","",29,"2024-07-10 14:02:17","PDF","","","",,,,,0,0.00,0,2,,"… , the heat storage capacity increased, but the heat conduction into the room did not change … To prevent this, sphagnum mosses have a water storage capacity that is 25 times their dry …","https://www.researchgate.net/profile/Johannes-Goeke/publication/372769324_Thermal_analysis_of_green_roof_with_moos_mats/links/65aeb8979ce29c458b945a69/Thermal-analysis-of-green-roof-with-moos-mats.pdf","https://scholar.google.com/scholar?q=related:nb9O0efOk_UJ:scholar.google.com/&scioq=sphagnum+%22heat+conduction%22&hl=en&as_sdt=2007"
61,"S Launiainen, GG Katul, A Lauren, P Kolari","Coupling boreal forest CO2, H2O and energy flows by a vertically structured forest canopy–Soil model with separate bryophyte layer",2015,"Ecological modelling","Elsevier","https://www.sciencedirect.com/science/article/pii/S0304380015002562","https://scholar.google.com/scholar?cites=18382751504867999675&as_sdt=2005&sciodt=2007&hl=en",30,"2024-07-10 14:02:17","","","","",,,,,61,6.78,15,4,9,"… Heat conduction between the living bryophytes and the topmost soil layer is(28) G m = λ h T m − T s , 1 Δ z m + Δ z s 1 , where Δz m is the height of the bryophyte layer, Δz s1 and T s,1 …","","https://scholar.google.com/scholar?q=related:uz_vARmnHP8J:scholar.google.com/&scioq=sphagnum+%22heat+conduction%22&hl=en&as_sdt=2007"
4,"AI Varentsov, SS Zilitinkevich, VM Stepanenko…","Thermal roughness of the fen surface",2023,"Boundary-Layer …","Springer","https://link.springer.com/article/10.1007/s10546-022-00741-6","https://scholar.google.com/scholar?cites=1322906575123496473&as_sdt=2005&sciodt=2007&hl=en",31,"2024-07-10 14:02:17","","10.1007/s10546-022-00741-6","","",,,,,4,4.00,1,4,1,"… the surface is implemented mainly by pressure difference at the opposing facets of roughness elements, while the transfer of heat is carried out by means of molecular heat conduction. …","https://search.proquest.com/openview/86bb344f1dd4f2aaa00a068405bf9074/1?pq-origsite=gscholar&cbl=105435","https://scholar.google.com/scholar?q=related:Gb5DYYXoWxIJ:scholar.google.com/&scioq=sphagnum+%22heat+conduction%22&hl=en&as_sdt=2007"
21,"L Chasmer, A Kenward, W Quinton…","CO2 Exchanges within Zones of Rapid Conversion from Permafrost Plateau to Bog and Fen Land Cover Types",2012,"Arctic, Antarctic, and …","Taylor &Francis","https://www.tandfonline.com/doi/abs/10.1657/1938-4246-44.4.399","https://scholar.google.com/scholar?cites=13873282167056045806&as_sdt=2005&sciodt=2007&hl=en",32,"2024-07-10 14:02:17","","10.1657/1938-4246-44.4.399","","",,,,,21,1.75,5,4,12,"… The bog surface is covered by Sphagnum fuscum and Pleurozium schreberi. Ericaceous … The fen surface is covered by a buoyant Sphagnum riparium—dominated peat mat, which is …","https://www.tandfonline.com/doi/pdf/10.1657/1938-4246-44.4.399","https://scholar.google.com/scholar?q=related:7hYjjKDMh8AJ:scholar.google.com/&scioq=sphagnum+%22heat+conduction%22&hl=en&as_sdt=2007"
26,"B Colbers, S Cornelis, E Geraets, N Gutiérrez-Valdés…","A feasibility study on the usage of cattail (Typha spp.) for the production of insulation materials and bio-adhesives",2017,"","edepot.wur.nl","https://edepot.wur.nl/429929","https://scholar.google.com/scholar?cites=12951132391951266807&as_sdt=2005&sciodt=2007&hl=en",33,"2024-07-10 14:02:17","BOOK","","","",,,,,26,3.71,5,5,7,"… This aerenchyma provides material with a low heat conduction and thus excellent insulation value. The high amount of aerenchyma is a primary adaptation of wetland plants to be able …","https://edepot.wur.nl/429929","https://scholar.google.com/scholar?q=related:93NP3Uqqu7MJ:scholar.google.com/&scioq=sphagnum+%22heat+conduction%22&hl=en&as_sdt=2007"
