Cites,Authors,Title,Year,Source,Publisher,ArticleURL,CitesURL,GSRank,QueryDate,Type,DOI,ISSN,CitationURL,Volume,Issue,StartPage,EndPage,ECC,CitesPerYear,CitesPerAuthor,AuthorCount,Age,Abstract,FullTextURL,RelatedURL
65,"T. Hallingback","Guidelines for application of the revised IUCN threat categories to bryophytes",1998,"Lindbergia","","","https://www.scopus.com/inward/citedby.uri?partnerID=HzOxMe3b&scp=0031902974&origin=inward",179,"2024-07-01 13:05:19","Conference Paper","","0105-0761","https://api.elsevier.com/content/abstract/scopus_id/0031902974",23,1,6,12,65,2.50,65,1,26,"","",""
65,"M.A.S. Burton","Metal accumulation by aquatic bryophytes from polluted mine streams",1979,"Environmental Pollution (1970)","","https://api.elsevier.com/content/article/eid/1-s2.0-0013932779901113","https://www.scopus.com/inward/citedby.uri?partnerID=HzOxMe3b&scp=0018472857&origin=inward",180,"2024-07-01 13:05:19","Article","10.1016/0013-9327(79)90111-3","0013-9327","https://api.elsevier.com/content/abstract/scopus_id/0018472857",19,1,39,46,65,1.44,65,1,45,"","",""
64,"N.C. Johnson","Mycorrhizas: Symbiotic Mediators of Rhizosphere and Ecosystem Processes",2007,"The Rhizosphere","","https://api.elsevier.com/content/article/eid/3-s2.0-B9780120887750500069","https://www.scopus.com/inward/citedby.uri?partnerID=HzOxMe3b&scp=84882325433&origin=inward",181,"2024-07-01 13:05:19","Book Chapter","10.1016/B978-012088775-0/50006-9","","https://api.elsevier.com/content/abstract/scopus_id/84882325433",,,73,100,64,3.76,64,1,17,"","",""
64,"S. Pérez-Ortega","Lichen myco- and photobiont diversity and their relationships at the edge of life (McMurdo Dry Valleys, Antarctica)",2012,"FEMS Microbiology Ecology","","","https://www.scopus.com/inward/citedby.uri?partnerID=HzOxMe3b&scp=84867717167&origin=inward",182,"2024-07-01 13:05:19","Article","10.1111/j.1574-6941.2012.01422.x","0168-6496","https://api.elsevier.com/content/abstract/scopus_id/84867717167",82,2,429,448,64,5.33,64,1,12,"","",""
64,"M. Pärtel","Conservation of Northern European plant diversity: The correspondence with soil pH",2004,"Biological Conservation","","https://api.elsevier.com/content/article/eid/1-s2.0-S0006320704001508","https://www.scopus.com/inward/citedby.uri?partnerID=HzOxMe3b&scp=7944225871&origin=inward",183,"2024-07-01 13:05:19","Article","10.1016/j.biocon.2004.03.025","0006-3207","https://api.elsevier.com/content/abstract/scopus_id/7944225871",120,4,525,531,64,3.20,64,1,20,"","",""
64,"S. Sundberg","Colonization of Sphagnum on land uplift islands in the Baltic Sea: Time, area, distance and life history",2006,"Journal of Biogeography","","","https://www.scopus.com/inward/citedby.uri?partnerID=HzOxMe3b&scp=33745926203&origin=inward",184,"2024-07-01 13:05:19","Article","10.1111/j.1365-2699.2006.01520.x","0305-0270","https://api.elsevier.com/content/abstract/scopus_id/33745926203",33,8,1479,1491,64,3.56,64,1,18,"","",""
64,"A. Poulíčková","Distribution of diatoms and bryophytes on linear transects through spring fens",2004,"Nova Hedwigia","","","https://www.scopus.com/inward/citedby.uri?partnerID=HzOxMe3b&scp=24944530930&origin=inward",185,"2024-07-01 13:05:19","Article","10.1127/0029-5035/2004/0078-0411","0029-5035","https://api.elsevier.com/content/abstract/scopus_id/24944530930",78,3,411,424,64,3.20,64,1,20,"","",""
64,"B. Lyons","Spatial distribution and succession of epiphytes on Tsuga heterophylla (western hemlock) in an old-growth Douglas-fir forest",2000,"Canadian Journal of Botany","","","https://www.scopus.com/inward/citedby.uri?partnerID=HzOxMe3b&scp=0033823779&origin=inward",186,"2024-07-01 13:05:19","Article","10.1139/cjb-78-7-957","0008-4026","https://api.elsevier.com/content/abstract/scopus_id/0033823779",78,7,957,968,64,2.67,64,1,24,"","",""
64,"R. Økland","Patterns of bryophyte associations at different scales in a Norwegian boreal spruce forest",1994,"Journal of Vegetation Science","","","https://www.scopus.com/inward/citedby.uri?partnerID=HzOxMe3b&scp=0028176019&origin=inward",187,"2024-07-01 13:05:19","Article","10.2307/3235646","1100-9233","https://api.elsevier.com/content/abstract/scopus_id/0028176019",5,1,127,138,64,2.13,64,1,30,"","",""
63,"R.A. Chimner","Mountain fen distribution, types and restoration priorities, San Juan Mountains, Colorado, USA",2010,"Wetlands","","","https://www.scopus.com/inward/citedby.uri?partnerID=HzOxMe3b&scp=84899473646&origin=inward",188,"2024-07-01 13:05:19","Article","10.1007/s13157-010-0039-5","0277-5212","https://api.elsevier.com/content/abstract/scopus_id/84899473646",30,4,763,771,63,4.50,63,1,14,"","",""
63,"M. Vázquez-Urbez","A sedimentary facies model for stepped, fluvial tufa systems in the Iberian Range (Spain): The Quaternary Piedra and Mesa valleys",2012,"Sedimentology","","","https://www.scopus.com/inward/citedby.uri?partnerID=HzOxMe3b&scp=84855917147&origin=inward",189,"2024-07-01 13:05:19","Article","10.1111/j.1365-3091.2011.01262.x","0037-0746","https://api.elsevier.com/content/abstract/scopus_id/84855917147",59,2,502,526,63,5.25,63,1,12,"","",""
63,"J. Aldasoro","Diversity and distribution of ferns in sub-Saharan Africa, Madagascar and some islands of the South Atlantic",2004,"Journal of Biogeography","","","https://www.scopus.com/inward/citedby.uri?partnerID=HzOxMe3b&scp=4644352057&origin=inward",190,"2024-07-01 13:05:19","Article","10.1111/j.1365-2699.2004.01106.x","0305-0270","https://api.elsevier.com/content/abstract/scopus_id/4644352057",31,10,1579,1604,63,3.15,63,1,20,"","",""
63,"I. Holz","Bryophyte diversity, microhabitat differentiation, and distribution of life forms in Costa Rican upper montane Quercus forest",2002,"Bryologist","","","https://www.scopus.com/inward/citedby.uri?partnerID=HzOxMe3b&scp=0036743117&origin=inward",191,"2024-07-01 13:05:19","Article","10.1639/0007-2745(2002)105[0334:BDMDAD]2.0.CO;2","0007-2745","https://api.elsevier.com/content/abstract/scopus_id/0036743117",105,3,334,348,63,2.86,63,1,22,"","",""
62,"T. Hallingbäck","New checklist of Swedish bryophytes",2006,"Svensk Botanisk Tidskrift","","","https://www.scopus.com/inward/citedby.uri?partnerID=HzOxMe3b&scp=33646442195&origin=inward",192,"2024-07-01 13:05:19","Article","","0039-646X","https://api.elsevier.com/content/abstract/scopus_id/33646442195",100,2,96,148,62,3.44,62,1,18,"","",""
62,"J.A. Couto","Active biomonitoring of element uptake with terrestrial mosses: A comparison of bulk and dry deposition",2004,"Science of the Total Environment","","https://api.elsevier.com/content/article/eid/1-s2.0-S0048969703006284","https://www.scopus.com/inward/citedby.uri?partnerID=HzOxMe3b&scp=1842635423&origin=inward",193,"2024-07-01 13:05:19","Article","10.1016/j.scitotenv.2003.10.024","0048-9697","https://api.elsevier.com/content/abstract/scopus_id/1842635423",324,1,211,222,62,3.10,62,1,20,"","",""
62,"M. Van Der Velde","The reproductive biology of Polytrichum formosum: Clonal structure and paternity revealed by microsatellites",2001,"Molecular Ecology","","","https://www.scopus.com/inward/citedby.uri?partnerID=HzOxMe3b&scp=0034764425&origin=inward",194,"2024-07-01 13:05:19","Article","10.1046/j.0962-1083.2001.01385.x","0962-1083","https://api.elsevier.com/content/abstract/scopus_id/0034764425",10,10,2423,2434,62,2.70,62,1,23,"","",""
62,"D.J. Eldridge","Assessment of erosion rates from microphyte-dominated calcareous soils under rain-impacted flow",1997,"Australian Journal of Soil Research","","","https://www.scopus.com/inward/citedby.uri?partnerID=HzOxMe3b&scp=0030619034&origin=inward",195,"2024-07-01 13:05:19","Article","10.1071/S96072","0004-9573","https://api.elsevier.com/content/abstract/scopus_id/0030619034",35,3,475,489,62,2.30,62,1,27,"","",""
61,"S. Skowronek","Mapping an invasive bryophyte species using hyperspectral remote sensing data",2017,"Biological Invasions","","","https://www.scopus.com/inward/citedby.uri?partnerID=HzOxMe3b&scp=84989184690&origin=inward",196,"2024-07-01 13:05:19","Article","10.1007/s10530-016-1276-1","1387-3547","https://api.elsevier.com/content/abstract/scopus_id/84989184690",19,1,239,254,61,8.71,61,1,7,"","",""
61,"J. Patiño","Approximate Bayesian Computation Reveals the Crucial Role of Oceanic Islands for the Assembly of Continental Biodiversity",2015,"Systematic Biology","","","https://www.scopus.com/inward/citedby.uri?partnerID=HzOxMe3b&scp=84931585458&origin=inward",197,"2024-07-01 13:05:19","Article","10.1093/sysbio/syv013","1063-5157","https://api.elsevier.com/content/abstract/scopus_id/84931585458",64,4,579,589,61,6.78,61,1,9,"","",""
61,"J. Culioli","Trophic transfer of arsenic and antimony in a freshwater ecosystem: A field study",2009,"Aquatic Toxicology","","https://api.elsevier.com/content/article/eid/1-s2.0-S0166445X09002525","https://www.scopus.com/inward/citedby.uri?partnerID=HzOxMe3b&scp=70249092478&origin=inward",198,"2024-07-01 13:05:19","Article","10.1016/j.aquatox.2009.07.016","0166-445X","https://api.elsevier.com/content/abstract/scopus_id/70249092478",94,4,286,293,61,4.07,61,1,15,"","",""
61,"K. Hylander","No increase in colonization rate of boreal bryophytes n close to propagule sources",2009,"Ecology","","","https://www.scopus.com/inward/citedby.uri?partnerID=HzOxMe3b&scp=63849114963&origin=inward",199,"2024-07-01 13:05:19","Article","10.1890/08-0042.1","0012-9658","https://api.elsevier.com/content/abstract/scopus_id/63849114963",90,1,160,169,61,4.07,61,1,15,"","",""
61,"Y. León-Vargas","Microclimate, light adaptation and desiccation tolerance of epiphytic bryophytes in two Venezuelan cloud forests",2006,"Journal of Biogeography","","","https://www.scopus.com/inward/citedby.uri?partnerID=HzOxMe3b&scp=33646015682&origin=inward",200,"2024-07-01 13:05:19","Article","10.1111/j.1365-2699.2006.01468.x","0305-0270","https://api.elsevier.com/content/abstract/scopus_id/33646015682",33,5,901,913,61,3.39,61,1,18,"","",""
