Cites,Authors,Title,Year,Source,Publisher,ArticleURL,CitesURL,GSRank,QueryDate,Type,DOI,ISSN,CitationURL,Volume,Issue,StartPage,EndPage,ECC,CitesPerYear,CitesPerAuthor,AuthorCount,Age,Abstract,FullTextURL,RelatedURL
66,"A Banner, J Pojar, GE Rouse","Postglacial paleoecology and successional relationships of a bog woodland near Prince Rupert, British Columbia",1983,"Canadian Journal of Forest …","cdnsciencepub.com","https://cdnsciencepub.com/doi/abs/10.1139/x83-125","https://scholar.google.com/scholar?cites=2052339066369445606&as_sdt=2005&sciodt=2007&hl=en",133,"2024-07-11 11:55:22","","10.1139/x83-125","","",,,,,66,1.61,22,3,41,"… Fragments of other moss species such as Pleurozium schreberi, Hylocomium splendens, … Picea sitchensis and Abies amabilis are uncommon in these communities, usually as scattered …","","https://scholar.google.com/scholar?q=related:5o6b0YFfexwJ:scholar.google.com/&scioq=pleurozium+scattering&hl=en&as_sdt=2007"
97,"KA Kershaw","The role of lichens in boreal tundra transition areas",1978,"Bryologist","JSTOR","https://www.jstor.org/stable/3242190","https://scholar.google.com/scholar?cites=901903167521677075&as_sdt=2005&sciodt=2007&hl=en",134,"2024-07-11 11:55:22","","","","",,,,,97,2.11,97,1,46,"… shrubs unless they also are slow growing, scattered or have thin canopies. Therefore, light … by Hylocomium splendens, Pleurozium shreberi, Ptilidium ciliare and Vaccinium vitis-idaea. …","https://www.jstor.org/stable/pdf/3242190.pdf","https://scholar.google.com/scholar?q=related:E9_tASc0hAwJ:scholar.google.com/&scioq=pleurozium+scattering&hl=en&as_sdt=2007"
2,"H Crum, WB Schofield","The mosses of Gillam, Manitoba",1959,"","Queen's Printer","","https://scholar.google.com/scholar?cites=8019613070328341266&as_sdt=2005&sciodt=2007&hl=en",135,"2024-07-11 11:55:22","CITATION","","","",,,,,2,0.03,1,2,65,"","","https://scholar.google.com/scholar?q=related:EiMABZljS28J:scholar.google.com/&scioq=pleurozium+scattering&hl=en&as_sdt=2007"
87,"TJ Carleton","Variation in terricolous bryophyte and macrolichen vegetation along primary gradients in Canadian boreal forests",1990,"Journal of vegetation Science","Wiley Online Library","https://onlinelibrary.wiley.com/doi/abs/10.2307/3235563","https://scholar.google.com/scholar?cites=11033638740554128099&as_sdt=2005&sciodt=2007&hl=en",136,"2024-07-11 11:55:22","","10.2307/3235563","","",,,,,87,2.56,87,1,34,"… ) yielded a similar bivariate scatter but the upland-bottomland trend was less clear. The cryptogam ordination by DCCA produced a very similar bivariate scatter to that based on DCA. In …","https://www.jstor.org/stable/pdf/3235563.pdf","https://scholar.google.com/scholar?q=related:45q3zvlbH5kJ:scholar.google.com/&scioq=pleurozium+scattering&hl=en&as_sdt=2007"
20,"S Roturier, U Bergsten","Establishment of Cladonia stellaris after artificial dispersal in an unfenced forest in northern Sweden",2009,"Rangifer","septentrio.uit.no","https://septentrio.uit.no/index.php/rangifer/article/view/208","https://scholar.google.com/scholar?cites=16707895368618169749&as_sdt=2005&sciodt=2007&hl=en",137,"2024-07-11 11:55:22","","","","",,,,,20,1.33,10,2,15,"… in the centre of the plot or as fragments scattered (scatter) across the whole plot. The lichen … and scatter plots had decreased severely. In 2008, the lichen cover in the patch and scatter …","https://septentrio.uit.no/index.php/rangifer/article/download/208/191/","https://scholar.google.com/scholar?q=related:lVXhxlBe3ucJ:scholar.google.com/&scioq=pleurozium+scattering&hl=en&as_sdt=2007"
1,"I Bisang, R Schumacker","Southwesternmost North American locality of Odontoschisma macounii (Aust.) Underw. and Scapania spitzbergensis (Lindb.) K. Müll. at Sutherland Falls (Blanket …",1987,"Bryologist","JSTOR","https://www.jstor.org/stable/3242932","https://scholar.google.com/scholar?cites=8753177425949675478&as_sdt=2005&sciodt=2007&hl=en",138,"2024-07-11 11:55:22","","","","",,,,,1,0.03,1,2,37,"… spitzbergensis occurs together with Kiaeria starkei and scattered plants of Pleurozium schreberi, Drepanocladus uncinatus, Isopterygium elegans, Pogonatum alpinum and Marsupella …","https://www.jstor.org/stable/pdf/3242932.pdf","https://scholar.google.com/scholar?q=related:1s-yGX6IeXkJ:scholar.google.com/&scioq=pleurozium+scattering&hl=en&as_sdt=2007"
301,"DA Wardle, MC Nilsson, O Zackrisson…","Determinants of litter mixing effects in a Swedish boreal forest",2003,"Soil biology and …","Elsevier","https://www.sciencedirect.com/science/article/pii/S0038071703001184","https://scholar.google.com/scholar?cites=2785685675303332714&as_sdt=2005&sciodt=2007&hl=en",139,"2024-07-11 11:55:22","","","","",,,,,301,14.33,75,4,21,"When the litter of a given species decomposes, it will often break down in the proximity of litters from other species. We investigated the effects of litters of 10 different species in a boreal …","https://www.academia.edu/download/50820733/s0038-0717_2803_2900118-420161210-31662-1o9wapt.pdf","https://scholar.google.com/scholar?q=related:amtZzFy-qCYJ:scholar.google.com/&scioq=pleurozium+scattering&hl=en&as_sdt=2007"
61,"L Sirois","Distribution and dynamics of balsam fir (Abies balsamea [L.] Mill.) at its northern limit in the James Bay area",1997,"Ecoscience","Taylor &Francis","https://www.tandfonline.com/doi/abs/10.1080/11956860.1997.11682413","https://scholar.google.com/scholar?cites=3488988703275674068&as_sdt=2005&sciodt=2007&hl=en",140,"2024-07-11 11:55:22","","10.1080/11956860.1997.11682413","","",,,,,61,2.26,61,1,27,"… fir exists as isolated populations scattered across large expanses of Québec's … and Pleurozium schreberi debris (Figure 4). Several layers composed of either wood, lichen or Pleurozium …","https://www.jstor.org/stable/pdf/42900865.pdf","https://scholar.google.com/scholar?q=related:1OkYfL1gazAJ:scholar.google.com/&scioq=pleurozium+scattering&hl=en&as_sdt=2007"
96,"DR Foster, GA King","Vegetation pattern and diversity in SE Labrador, Canada: Betula papyrifera (birch) forest development in relation to fire history and physiography",1986,"The Journal of Ecology","JSTOR","https://www.jstor.org/stable/2260268","https://scholar.google.com/scholar?cites=17125518505582472338&as_sdt=2005&sciodt=2007&hl=en",141,"2024-07-11 11:55:22","","","","",,,,,96,2.53,48,2,38,"… stunted black spruce-Pleurozium forest on the high, exposed hills. Low-lying hills, dissected by the Alexis, Paradise and Eagle river systems, support scattered Betula papyrifera stands (…","https://www.jstor.org/stable/pdf/2260268.pdf","https://scholar.google.com/scholar?q=related:kiyfj1gQqu0J:scholar.google.com/&scioq=pleurozium+scattering&hl=en&as_sdt=2007"
8,"ZV Atutova","Post-fire restoration of pine forests in the Badary area, Tunkinskiy National Park, Russia",2023,"Nature Conservation Research","ncr-journal.bear-land.org","https://ncr-journal.bear-land.org/uploads/9fc3f34b336eb8acd500492139eeb118.pdf","https://scholar.google.com/scholar?cites=8525191329234100501&as_sdt=2005&sciodt=2007&hl=en",142,"2024-07-11 11:55:22","PDF","","","",,,,,8,8.00,8,1,1,"… (plants are found in a small number, scattered), sol. (plants are found in a … Other herbaceous plants are scattered and have a low … Pleurozium schreberi was represented by a few small …","https://ncr-journal.bear-land.org/uploads/9fc3f34b336eb8acd500492139eeb118.pdf","https://scholar.google.com/scholar?q=related:FSE9dViQT3YJ:scholar.google.com/&scioq=pleurozium+scattering&hl=en&as_sdt=2007"
7,"E Stefańska-Krzaczek, TH Szymura","Species diversity of forest floor vegetation in age gradient of managed scots pine stands",2015,"Balt For","researchgate.net","https://www.researchgate.net/profile/Ewa-Stefanska-Krzaczek/publication/287800534_Species_diversity_of_forest_floor_vegetation_in_age_gradient_of_managed_scots_pine_stands/links/567956a808ae70e8e4816986/Species-diversity-of-forest-floor-vegetation-in-age-gradient-of-managed-scots-pine-stands.pdf","https://scholar.google.com/scholar?cites=11045026971020682311&as_sdt=2005&sciodt=2007&hl=en",143,"2024-07-11 11:55:22","PDF","","","",,,,,7,0.78,4,2,9,"… , and was followed by the increase in Pleurozium schreberi and Vaccinium myrtillus cover. The … The dominance of Pleurozium schreberi and Vaccinium myrtillus in the oldest stands was …","https://www.researchgate.net/profile/Ewa-Stefanska-Krzaczek/publication/287800534_Species_diversity_of_forest_floor_vegetation_in_age_gradient_of_managed_scots_pine_stands/links/567956a808ae70e8e4816986/Species-diversity-of-forest-floor-vegetation-in-age-gradient-of-managed-scots-pine-stands.pdf","https://scholar.google.com/scholar?q=related:R-RL1oLRR5kJ:scholar.google.com/&scioq=pleurozium+scattering&hl=en&as_sdt=2007"
73,"EM Birse","Ecological studies on growth-form in bryophytes: II. Experimental studies on growth-form in mosses",1957,"The Journal of Ecology","JSTOR","https://www.jstor.org/stable/2256954","https://scholar.google.com/scholar?cites=1743629015099252655&as_sdt=2005&sciodt=2007&hl=en",144,"2024-07-11 11:55:22","","","","",,,,,73,1.09,73,1,67,"… Distal port of young shoots were detached and scattered evenly so as almost to cover the 50 s … Although Hylocomium splendens and Pleurozium schreberi are found in similar habitats, …","https://www.jstor.org/stable/pdf/2256954.pdf","https://scholar.google.com/scholar?q=related:rx8O4VmdMhgJ:scholar.google.com/&scioq=pleurozium+scattering&hl=en&as_sdt=2007"
17,"ZM Migaszewski, PJ Lamothe, JG Crock…","The role of sample preparation in interpretation of trace element concentration variability in moss bioindication studies",2011,"Environmental chemistry …","Springer","https://link.springer.com/article/10.1007/s10311-010-0282-2","https://scholar.google.com/scholar?cites=3152520941846013962&as_sdt=2005&sciodt=2007&hl=en",145,"2024-07-11 11:55:22","HTML","10.1007/s10311-010-0282-2","","",,,,,17,1.31,4,4,13,"… moss species (Hylocomium splendens and Pleurozium schreberi) collected in Alaska and in … more uniform spatial distribution than elements dispersed from scattered geologic sources. …","https://link.springer.com/article/10.1007/s10311-010-0282-2","https://scholar.google.com/scholar?q=related:Cii2BRgBwCsJ:scholar.google.com/&scioq=pleurozium+scattering&hl=en&as_sdt=2007"
8,"S Kubešová","Bryoflora in block fields in south-western Moravian river valleys",2003,"Acta Musei Moraviae, Scientiae Biologicae","researchgate.net","https://www.researchgate.net/profile/Svatava-Kubesova/publication/259841005_Bryoflora_in_block_fields_in_south-western_Moravian_river_valleys/links/00b7d52f3bd1db463f000000/Bryoflora-in-block-fields-in-south-western-Moravian-river-valleys.pdf","https://scholar.google.com/scholar?cites=17126511794018012604&as_sdt=2005&sciodt=2007&hl=en",146,"2024-07-11 11:55:22","PDF","","","",,,,,8,0.38,8,1,21,"Grimmia ovalis, Hedwigia ciliata, Hypnum cupressiforme, Pleurozium schreberi, Pohlia nutans, and Polytrichum formosum. Interesting occurrences of the species Antitrichia curtipendula…","https://www.researchgate.net/profile/Svatava-Kubesova/publication/259841005_Bryoflora_in_block_fields_in_south-western_Moravian_river_valleys/links/00b7d52f3bd1db463f000000/Bryoflora-in-block-fields-in-south-western-Moravian-river-valleys.pdf","https://scholar.google.com/scholar?q=related:vE37i7yXre0J:scholar.google.com/&scioq=pleurozium+scattering&hl=en&as_sdt=2007"
101,"LT Ellis, M Aleffi, R Tacchi, A Alegro, M Alonso…","New national and regional bryophyte records, 41",2014,"Journal of …","Taylor &Francis","https://www.tandfonline.com/doi/abs/10.1179/1743282014y.0000000123","https://scholar.google.com/scholar?cites=12915332765170658152&as_sdt=2005&sciodt=2007&hl=en",147,"2024-07-11 11:55:22","","10.1179/1743282014y.0000000123","","",,,,,101,10.10,17,6,10,"… Dicranum spurium was rare, scattered among other bryophytes especially in patches of Pleurozium schreberi and Dicranum polysetum with Polytrichum species. Plants were well …","https://www.academia.edu/download/30994852/JBR-NNARBR33_1_.pdf","https://scholar.google.com/scholar?q=related:aOv1t7h6PLMJ:scholar.google.com/&scioq=pleurozium+scattering&hl=en&as_sdt=2007"
0,"KMM Dunham","Hydrology and distillation within a feather moss boreal forest floor",2001,"","library-archives.canada.ca","https://library-archives.canada.ca/eng/services/services-libraries/theses/Pages/item.aspx?idNumber=1006743199","",148,"2024-07-11 11:55:22","","","","",,,,,0,0.00,0,1,23,"… The moss carpet is dorninated by the feather moss Pleurozium schreberi. However, there are scattered patches and tues of associated moss species such as Ptifitm cristu-castrensïs, …","https://www.nlc-bnc.ca/obj/s4/f2/dsk1/tape11/PQDD_0015/MQ45847.pdf?is_thesis=1&oclc_number=1006743199","https://scholar.google.com/scholar?q=related:FJSXI8U-5fYJ:scholar.google.com/&scioq=pleurozium+scattering&hl=en&as_sdt=2007"
19,"J Mikkola, P Pellikka","Normalization of bi-directional effects in aerial CIR photographs to improve classification accuracy of boreal and subarctic vegetation for pollen-landscape calibration",2002,"International Journal of Remote Sensing","Taylor &Francis","https://www.tandfonline.com/doi/abs/10.1080/01431160110113944","https://scholar.google.com/scholar?cites=12533930310821044506&as_sdt=2005&sciodt=2007&hl=en",149,"2024-07-11 11:55:22","","10.1080/01431160110113944","","",,,,,19,0.86,10,2,22,"… scattering is described by 1+cos2c, where c is the scattering phase angle (Möller 1973). The phase function of Rayleigh scattering is … scattering has two eVects: (1) forward scattering …","","https://scholar.google.com/scholar?q=related:GmH9xzV38a0J:scholar.google.com/&scioq=pleurozium+scattering&hl=en&as_sdt=2007"
0,"TF HERING","Department of Physiology and Environmental Studies, University of Nottingham Birkrigg Oaks (NY 215205) and Keskadale Oaks (NY 207195) are two …",1975,"The Naturalist","Simpkin, Marshall","","",150,"2024-07-11 11:55:22","CITATION","","","",,,,,0,0.00,0,1,49,"","","https://scholar.google.com/scholar?q=related:gENxBIIKwiYJ:scholar.google.com/&scioq=pleurozium+scattering&hl=en&as_sdt=2007"
18,"JC Lees","A test of harvest cutting methods in Alberta's spruce-aspen forest",1964,"","digitalcommons.usu.edu","https://digitalcommons.usu.edu/cgi/viewcontent.cgi?article=6989&context=aspen_bib","https://scholar.google.com/scholar?cites=9404690403364554868&as_sdt=2005&sciodt=2007&hl=en",151,"2024-07-11 11:55:22","PDF","","","",,,,,18,0.30,18,1,60,"… Ground cover"" beneath the patches of residual spruce consists mainly of feather mosses, Hylocomium, Pleurozium, and Hypnum spp., and scattered herbs such as bunchberry, Cornus …","https://digitalcommons.usu.edu/cgi/viewcontent.cgi?article=6989&context=aspen_bib","https://scholar.google.com/scholar?q=related:dMgR-xcshIIJ:scholar.google.com/&scioq=pleurozium+scattering&hl=en&as_sdt=2007"
22,"AM Grishin, VP Zima, VT Kuznetsov…","Ignition of combustible forest materials by a radiant energy flux",2002,"Combustion, Explosion and …","Springer","https://link.springer.com/article/10.1023/A:1014097631884","https://scholar.google.com/scholar?cites=10898130178611534342&as_sdt=2005&sciodt=2007&hl=en",152,"2024-07-11 11:55:22","","10.1023/A:1014097631884","","",,,,,22,1.00,6,4,22,"… leaves, lichen (Cladonia), and moss (Pleurozium shreberi). It is established that the moss is … A specified (weighed beforehand) amount of CFM was scattered over the upper end of the …","https://link.springer.com/content/pdf/10.1023/A:1014097631884.pdf","https://scholar.google.com/scholar?q=related:BtoaHKjvPZcJ:scholar.google.com/&scioq=pleurozium+scattering&hl=en&as_sdt=2007"
180,"R Van der Wal, ISK Pearce, RW Brooker","Mosses and the struggle for light in a nitrogen-polluted world",2005,"Oecologia","Springer","https://link.springer.com/article/10.1007/s00442-004-1706-0","https://scholar.google.com/scholar?cites=15930595037229214040&as_sdt=2005&sciodt=2007&hl=en",153,"2024-07-11 11:55:22","HTML","10.1007/s00442-004-1706-0","","",,,,,180,9.47,60,3,19,"… cryptogams include Pleurozium schreberi, Ptilidium spp. and Cladonia spp.. Grass species Deschampsia flexuosa, Festuca vivipara, F. ovina and Agrostis capillaris are scattered and …","https://link.springer.com/article/10.1007/s00442-004-1706-0","https://scholar.google.com/scholar?q=related:WOmlTsjXFN0J:scholar.google.com/&scioq=pleurozium+scattering&hl=en&as_sdt=2007"
17,"OV Lisitsyna, S Hicks","Estimation of pollen deposition time-span in moss polsters with the aid of annual pollen accumulation values from pollen traps",2014,"Grana","Taylor &Francis","https://www.tandfonline.com/doi/abs/10.1080/00173134.2014.916344","https://scholar.google.com/scholar?cites=17689067747034753034&as_sdt=2005&sciodt=2007&hl=en",154,"2024-07-11 11:55:22","","10.1080/00173134.2014.916344","","",,,,,17,1.70,9,2,10,"… traps N27 and U16 are placed in the heath with scattered mountain birch (zone HMB), and traps … fuscum) was the most frequent moss type, but also Pleurozium schreberi, Hylocomium …","","https://scholar.google.com/scholar?q=related:CmjTLWUxfPUJ:scholar.google.com/&scioq=pleurozium+scattering&hl=en&as_sdt=2007"
61,"S Marko, B Aneta, G Dragoljub","Bryophytes as a potential source of medicinal compounds",2001,"Pregl Rev","academia.edu","https://www.academia.edu/download/30935921/2_Pregledni_ls_21_02.pdf","https://scholar.google.com/scholar?cites=15351018213390830438&as_sdt=2005&sciodt=2007&hl=en",155,"2024-07-11 11:55:22","PDF","","","",,,,,61,2.65,20,3,23,"… Bryophyte chemistry is poorly known, and the results on this issue are very scattered. The reason for this is hard identification and small amount of the same species available for …","https://www.academia.edu/download/30935921/2_Pregledni_ls_21_02.pdf","https://scholar.google.com/scholar?q=related:Zku2XbvFCdUJ:scholar.google.com/&scioq=pleurozium+scattering&hl=en&as_sdt=2007"
26,"W Stanek, L Orlóci","A comparison of Braun-Blanquet's method with sum-of-squares agglomeration for vegetation classification",1973,"Vegetatio","Springer","https://link.springer.com/article/10.1007/BF02387329","https://scholar.google.com/scholar?cites=17946835603864838183&as_sdt=2005&sciodt=2007&hl=en",156,"2024-07-11 11:55:22","","10.1007/BF02387329","","",,,,,26,0.51,13,2,51,"This paper presents the results of a comparative study in which the same collection of vegetation stands of an ombrotrophic peatland was classified firstly, by Braun-Blanquet's method …","https://www.jstor.org/stable/pdf/20036762.pdf","https://scholar.google.com/scholar?q=related:J2CyMuX3D_kJ:scholar.google.com/&scioq=pleurozium+scattering&hl=en&as_sdt=2007"
35,"EA Ignatova, EI Ivanova, OV Ivanov, MS Ignatov","Mosses of the Mus-Khaya Mountain (Yakutia, Asiatic Russia)",2011,"Arctoa","elibrary.ru","https://elibrary.ru/item.asp?id=18836963","https://scholar.google.com/scholar?cites=14168316243559813434&as_sdt=2005&sciodt=2007&hl=en",157,"2024-07-11 11:55:22","","","","",,,,,35,2.69,9,4,13,"… , and more rarely Pleurozium schreberi, Sphagnum lenense, Sanionia uncinata. Forest vegetation reaches 1600-1650 m on S-faced slopes, although scattered trees were seen up to at …","","https://scholar.google.com/scholar?q=related:OpHHeo74n8QJ:scholar.google.com/&scioq=pleurozium+scattering&hl=en&as_sdt=2007"
181,"J Pojar, K Klinka, DA Dermarchi","Coastal western hemlock zone",1991,"Ecosystems of British Columbia","Citeseer","https://citeseerx.ist.psu.edu/document?repid=rep1&type=pdf&doi=977ed13794601251847fab494633e64fa6fb5df1#page=108","https://scholar.google.com/scholar?cites=13865749622736403962&as_sdt=2005&sciodt=2007&hl=en",158,"2024-07-11 11:55:22","PDF","","","",,,,,181,5.48,60,3,33,"… of typically interior or continental species like Pleurozium schreberi (red-stemmed feathermoss… Mahonia nervosa and Vaccinium parvifolium scattered. Advance regeneration of western …","https://citeseerx.ist.psu.edu/document?repid=rep1&type=pdf&doi=977ed13794601251847fab494633e64fa6fb5df1#page=108","https://scholar.google.com/scholar?q=related:-r21Z9EJbcAJ:scholar.google.com/&scioq=pleurozium+scattering&hl=en&as_sdt=2007"
18,"SM Såstad","Fungi-vegetation relationships in a Pinus sylvestris forest in central Norway",1995,"Canadian Journal of Botany","cdnsciencepub.com","https://cdnsciencepub.com/doi/abs/10.1139/b95-089","https://scholar.google.com/scholar?cites=15761751180557444882&as_sdt=2005&sciodt=2007&hl=en",159,"2024-07-11 11:55:22","","10.1139/b95-089","","",,,,,18,0.62,18,1,29,"… The most important bottom layer species are Hylocomium splendetls and Pleurozium sclzreberi. Sphagnum species dominate on wetter patches scattered over the area. The vegetation …","","https://scholar.google.com/scholar?q=related:Emc4ezD9vNoJ:scholar.google.com/&scioq=pleurozium+scattering&hl=en&as_sdt=2007"
116,"CP Ward, RL Sleighter, PG Hatcher…","Insights into the complete and partial photooxidation of black carbon in surface waters",2014,"… Science: Processes & …","pubs.rsc.org","https://pubs.rsc.org/en/content/articlehtml/2014/em/c3em00597f","https://scholar.google.com/scholar?cites=11384350012085062278&as_sdt=2005&sciodt=2007&hl=en",160,"2024-07-11 11:55:22","","","","",,,,,116,11.60,29,4,10,"… Tealeaf willow (Salix pulchra) and feather moss (Pleurozium … This method corrects for the influence of light scattering on the … from scattering at all concentrations and multiple scattering …","https://pubs.rsc.org/en/content/getauthorversionpdf/c3em00597f","https://scholar.google.com/scholar?q=related:hkoL5QRW_Z0J:scholar.google.com/&scioq=pleurozium+scattering&hl=en&as_sdt=2007"
0,"SD BEAVAN, RJ HECKFORD…","Phiaris metallicana (Hübner,[1799])(Lepidoptera: Tortricidae): a description of all the early stages, and a consideration of larval pabula",2017,"Entomologist's Gazette","researchgate.net","https://www.researchgate.net/profile/Stella-Beavan/publication/321920490_Phiaris_metallicana_Hubner_1799_Lepidoptera_Tortricidae_A_description_of_all_the_early_stages_and_a_consideration_of_larval_pabula/links/651bf2cd1e2386049df3c9ae/Phiaris-metallicana-Huebner-1799-Lepidoptera-Tortricidae-A-description-of-all-the-early-stages-and-a-consideration-of-larval-pabula.pdf","",161,"2024-07-11 11:55:22","PDF","","","",,,,,0,0.00,0,3,7,"… Finally there is a mixture of other very sparse species scattered about, including Pleurozium schreberi. SDB and RJH were staying at Crathie for a few days. Heartened by the fact that …","https://www.researchgate.net/profile/Stella-Beavan/publication/321920490_Phiaris_metallicana_Hubner_1799_Lepidoptera_Tortricidae_A_description_of_all_the_early_stages_and_a_consideration_of_larval_pabula/links/651bf2cd1e2386049df3c9ae/Phiaris-metallicana-Huebner-1799-Lepidoptera-Tortricidae-A-description-of-all-the-early-stages-and-a-consideration-of-larval-pabula.pdf","https://scholar.google.com/scholar?q=related:MMCd3ymDED4J:scholar.google.com/&scioq=pleurozium+scattering&hl=en&as_sdt=2007"
71,"PL Gorchakovsky, SG Shiyatov","The Upper Forest Limit in the Mountains of the Boreal Zone of the USSR∗",1978,"Arctic and Alpine Research","Taylor &Francis","https://www.tandfonline.com/doi/abs/10.1080/00040851.1978.12003973","https://scholar.google.com/scholar?cites=837793711650682062&as_sdt=2005&sciodt=2007&hl=en",162,"2024-07-11 11:55:22","","10.1080/00040851.1978.12003973","","",,,,,71,1.54,36,2,46,"The high-mountain areas of the Boreal Zone of the USSR may be subdivided, according to the composition of physiognomic types of the upper forest limit, into three sectors: the western …","https://www.tandfonline.com/doi/pdf/10.1080/00040851.1978.12003973","https://scholar.google.com/scholar?q=related:zrT-IfFwoAsJ:scholar.google.com/&scioq=pleurozium+scattering&hl=en&as_sdt=2007"
18,"RS Nostrand","Growth response of black spruce in Newfoundland to N, P and K fertilization",1979,"The Forestry Chronicle","pubs.cif-ifc.org","https://pubs.cif-ifc.org/doi/abs/10.5558/tfc55189-5","https://scholar.google.com/scholar?cites=16939018035583858820&as_sdt=2005&sciodt=2007&hl=en",163,"2024-07-11 11:55:22","","10.5558/tfc55189-5","","",,,,,18,0.40,18,1,45,"… almost pure black spruce with scattered white birch, Betula … 7-15 cm thick, dominated by Pleurozium schreberi (Brid.) Mitt. … 5-7 cm thick, dominated by Pleurozium schreberi with lesser …","https://pubs.cif-ifc.org/doi/pdf/10.5558/tfc55189-5","https://scholar.google.com/scholar?q=related:hDjpFih7E-sJ:scholar.google.com/&scioq=pleurozium+scattering&hl=en&as_sdt=2007"
63,"OV Lisitsyna, S Hicks, A Huusko","Do moss samples, pollen traps and modern lake sediments all collect pollen in the same way? A comparison from the forest limit area of northernmost Europe",2012,"Vegetation history and Archaeobotany","Springer","https://link.springer.com/article/10.1007/s00334-011-0335-x","https://scholar.google.com/scholar?cites=14146867867313843570&as_sdt=2005&sciodt=2007&hl=en",164,"2024-07-11 11:55:22","HTML","10.1007/s00334-011-0335-x","","",,,,,63,5.25,21,3,12,"… Zone BWP mountain birch woodland with scattered pine. Pines are sparse or locally clustered on southern slopes. In the Kola Peninsula the pine forest limit is patchy and diffuse, and …","https://link.springer.com/article/10.1007/s00334-011-0335-x","https://scholar.google.com/scholar?q=related:ci2hO1_FU8QJ:scholar.google.com/&scioq=pleurozium+scattering&hl=en&as_sdt=2007"
