Cites,Authors,Title,Year,Source,Publisher,ArticleURL,CitesURL,GSRank,QueryDate,Type,DOI,ISSN,CitationURL,Volume,Issue,StartPage,EndPage,ECC,CitesPerYear,CitesPerAuthor,AuthorCount,Age,Abstract,FullTextURL,RelatedURL
12,"E Hauge, R Wiger","The spider fauna (Araneae) from 12 habitats in the Vassfaret region, south-eastern Norway",1980,"Fauna Norvegica, Ser. B","entomologi.no","http://www.entomologi.no/journals/nje/old/V27/NJE_27_01+02_1980.pdf#page=62","https://scholar.google.com/scholar?cites=11410919544997686593&as_sdt=2005&sciodt=2007&hl=en",100,"2024-07-11 11:55:22","PDF","","","",,,,,12,0.27,6,2,44,"… Pleurozium schreberi is the do minating moss. Dead remnants of Pinus are scattered about. … A few dead parts of birch are scattered about 2 traps. Station 5. Situated in a subalpine form …","http://www.entomologi.no/journals/nje/old/V27/NJE_27_01+02_1980.pdf#page=62","https://scholar.google.com/scholar?q=related:QS0mWN66W54J:scholar.google.com/&scioq=pleurozium+scattering&hl=en&as_sdt=2007"
87,"GD Hope, WR Mitchell, DA Lloyd, WR Erickson…","Interior Douglas-fir zone",1991,"Ecosystems of british …","Citeseer","https://citeseerx.ist.psu.edu/document?repid=rep1&type=pdf&doi=977ed13794601251847fab494633e64fa6fb5df1#page=166","https://scholar.google.com/scholar?cites=7287612989289376216&as_sdt=2005&sciodt=2007&hl=en",101,"2024-07-11 11:55:22","PDF","","","",,,,,87,2.64,17,5,33,"… The understory has scattered clumps of Douglas-fir of various ages. … The moderately developed moss layer contains Pleurozium schreberi . In dense, older stands the moss layer can be …","https://citeseerx.ist.psu.edu/document?repid=rep1&type=pdf&doi=977ed13794601251847fab494633e64fa6fb5df1#page=166","https://scholar.google.com/scholar?q=related:2Kkd_2bNImUJ:scholar.google.com/&scioq=pleurozium+scattering&hl=en&as_sdt=2007"
158,"H Ando, A Matsuo","Applied bryology.",1984,"Advances in bryology","hbg.repo.nii.ac.jp","https://hbg.repo.nii.ac.jp/record/4354/files/matsuo_akihiko_102.pdf","https://scholar.google.com/scholar?cites=13341759241148922468&as_sdt=2005&sciodt=2007&hl=en",102,"2024-07-11 11:55:22","PDF","","","",,,,,158,3.95,79,2,40,"Bryophytes have long been considered to be insignificant in the economy of man except for those mosses used in packing, plugging, and decoration, and raw Sphagnum and peat. In …","https://hbg.repo.nii.ac.jp/record/4354/files/matsuo_akihiko_102.pdf","https://scholar.google.com/scholar?q=related:ZHp3l1dzJ7kJ:scholar.google.com/&scioq=pleurozium+scattering&hl=en&as_sdt=2007"
101,"T Asada, BG Warner, A Banner","Growth of mosses in relation to climate factors in a hypermaritime coastal peatland in British Columbia, Canada",2003,"Bryologist","JSTOR","https://www.jstor.org/stable/3244611","https://scholar.google.com/scholar?cites=15906155653381829338&as_sdt=2005&sciodt=2007&hl=en",103,"2024-07-11 11:55:22","","","","",,,,,101,4.81,34,3,21,"… nootkatensis, and Juniperus communis are scattered across this … are Racomitrium lanuginosum, Pleurozium schreberi, Siphula … Pleurozium schreberi is mainly found in the area where …","https://www.jstor.org/stable/pdf/3244611.pdf","https://scholar.google.com/scholar?q=related:2jLl1UoEvtwJ:scholar.google.com/&scioq=pleurozium+scattering&hl=en&as_sdt=2007"
185,"LA Viereck","Plant succession and soil development on gravel outwash of the Muldrow Glacier, Alaska",1966,"Ecological Monographs","JSTOR","https://www.jstor.org/stable/1942416","https://scholar.google.com/scholar?cites=7264981268721892097&as_sdt=2005&sciodt=2007&hl=en",104,"2024-07-11 11:55:22","","","","",,,,,185,3.19,185,1,58,"… creating a micro-environment in which the mosses Iylocomium splendens and Pleurozium schreberi become established and slowly develop. Meadows and scattered shrubs develop at …","https://www.jstor.org/stable/pdf/1942416.pdf","https://scholar.google.com/scholar?q=related:AfsI7vhl0mQJ:scholar.google.com/&scioq=pleurozium+scattering&hl=en&as_sdt=2007"
0,"S Gorge","Yorkshire, Matthew Adamson",,"britishbryologicalsociety.org.uk","","https://www.britishbryologicalsociety.org.uk/wp-content/uploads/2021/01/FB97_The-Studfold-Community-Nature-Project.pdf","",105,"2024-07-11 11:55:22","PDF","","","",,,,,0,0.00,0,1,,"… be gauged from the fact that these species are scattered over 28 different squares. Only one … The distribution of Pleurozium schreberi picks out the enclosed area of Nardus–Agrostis–…","https://www.britishbryologicalsociety.org.uk/wp-content/uploads/2021/01/FB97_The-Studfold-Community-Nature-Project.pdf","https://scholar.google.com/scholar?q=related:Mpnvn0NoYb4J:scholar.google.com/&scioq=pleurozium+scattering&hl=en&as_sdt=2007"
66,"NE Koroleva","Phytosociological survey of the tundra vegetation of the Kola Peninsula, Russia",1994,"Journal of Vegetation Science","Wiley Online Library","https://onlinelibrary.wiley.com/doi/abs/10.2307/3236195","https://scholar.google.com/scholar?cites=5595045687561717875&as_sdt=2005&sciodt=2007&hl=en",106,"2024-07-11 11:55:22","","10.2307/3236195","","",,,,,66,2.20,66,1,30,"… The sample plots are widely scattered in the ordination space. The higher syntaxa as described above are clearly separated, whereas the distribution of communities and associations …","https://www.jstor.org/stable/pdf/3236195.pdf","https://scholar.google.com/scholar?q=related:c4gytWiYpU0J:scholar.google.com/&scioq=pleurozium+scattering&hl=en&as_sdt=2007"
64,"R Ozolinčius, R Buožytė…","Wood ash and nitrogen influence on ground vegetation cover and chemical composition",2007,"Biomass and …","Elsevier","https://www.sciencedirect.com/science/article/pii/S0961953407001225","https://scholar.google.com/scholar?cites=7324874409941106585&as_sdt=2005&sciodt=2007&hl=en",107,"2024-07-11 11:55:22","","","","",,,,,64,3.76,21,3,17,"… The field layer cover was scattered in the experimental plots and was mostly dominated by … The reduction in cover was most pronounced for Pleurozium schreberi. Similarly, nitrogen (N) …","https://scholar.google.com/scholar?output=instlink&q=info:mX_jjHcup2UJ:scholar.google.com/&hl=en&as_sdt=2007&scillfp=13257306107792812571&oi=lle","https://scholar.google.com/scholar?q=related:mX_jjHcup2UJ:scholar.google.com/&scioq=pleurozium+scattering&hl=en&as_sdt=2007"
93,"L Kullman","Late Holocene reproductional patterns of Pinus sylvestris and Picea abies at the forest limit in central Sweden",1986,"Canadian Journal of Botany","cdnsciencepub.com","https://cdnsciencepub.com/doi/abs/10.1139/b86-225","https://scholar.google.com/scholar?cites=14047581721013083210&as_sdt=2005&sciodt=2007&hl=en",108,"2024-07-11 11:55:22","","10.1139/b86-225","","",,,,,93,2.45,93,1,38,"… (A) South-facing slopes Pine is predominant, although scattered birch and spruce may also occur… The main constituent of the bottom layer is Pleurozium schreberi. The low-alpine dwarf …","https://www.researchgate.net/profile/Leif-Kullman/publication/237162859_Late_Holocene_reproductional_patterns_of_PinuS_sylvestris_and_Picea_abies_at_the_forest-limit_in_Central_Sweden/links/00463524566e1a84b6000000/Late-Holocene-reproductional-patterns-of-PinuS-sylvestris-and-Picea-abies-at-the-forest-limit-in-Central-Sweden.pdf","https://scholar.google.com/scholar?q=related:SlxB4iUJ88IJ:scholar.google.com/&scioq=pleurozium+scattering&hl=en&as_sdt=2007"
45,"NJ Fenton, Y Bergeron, D Paré","Decomposition rates of bryophytes in managed boreal forests: influence of bryophyte species and forest harvesting",2010,"Plant and soil","Springer","https://link.springer.com/article/10.1007/s11104-010-0506-z","https://scholar.google.com/scholar?cites=11643420322936706993&as_sdt=2005&sciodt=2007&hl=en",109,"2024-07-11 11:55:22","HTML","10.1007/s11104-010-0506-z","","",,,,,45,3.21,15,3,14,"… m and the spatial dispersion was scattered across the treatment block. Within each plot, two of the most common environments were selected, Pleurozium schreberi and Sphagnum …","https://link.springer.com/article/10.1007/s11104-010-0506-z","https://scholar.google.com/scholar?q=related:sdc0Hxi9laEJ:scholar.google.com/&scioq=pleurozium+scattering&hl=en&as_sdt=2007"
84,"E Gorham, JA Janssens, GA Wheeler…","The natural and anthropogenic acidification of peatlands",1987,"Effects of atmospheric …","Springer","https://link.springer.com/chapter/10.1007/978-3-642-70874-9_36","https://scholar.google.com/scholar?cites=7361393362098752007&as_sdt=2005&sciodt=2007&hl=en",110,"2024-07-11 11:55:22","","10.1007/978-3-642-70874-9_36","","",,,,,84,2.27,21,4,37,"… fuscum are common on bogs and on scattered ombrotrophic hummocks in fens. … Scattered patches of Sphagnum species tolerant of circumneutral pH, such as S. teres, S. warnstorfii, …","","https://scholar.google.com/scholar?q=related:B4rQr0LsKGYJ:scholar.google.com/&scioq=pleurozium+scattering&hl=en&as_sdt=2007"
22,"M Koranda, A Michelsen","Mosses reduce soil nitrogen availability in a subarctic birch forest via effects on soil thermal regime and sequestration of deposited nitrogen",2021,"Journal of Ecology","Wiley Online Library","https://besjournals.onlinelibrary.wiley.com/doi/abs/10.1111/1365-2745.13567","https://scholar.google.com/scholar?cites=2823294989922528598&as_sdt=2005&sciodt=2007&hl=en",111,"2024-07-11 11:55:22","","10.1111/1365-2745.13567","","",,,,,22,7.33,11,2,3,"… Pleurozium schreberi) and scattered ericaceous dwarf shrubs (mainly Empetrum hermaphroditum, Vaccinium vitis-idaea, Vaccinium myrtillus). Soil type was a gleyic Podzol, consisting …","https://besjournals.onlinelibrary.wiley.com/doi/pdf/10.1111/1365-2745.13567","https://scholar.google.com/scholar?q=related:Vu14utVbLicJ:scholar.google.com/&scioq=pleurozium+scattering&hl=en&as_sdt=2007"
70,"H Mehus","Fruit body production of macrofungi in some North Norwegian forest types",1986,"Nordic Journal of Botany","Wiley Online Library","https://onlinelibrary.wiley.com/doi/abs/10.1111/j.1756-1051.1986.tb00468.x","https://scholar.google.com/scholar?cites=3584879227603812804&as_sdt=2005&sciodt=2007&hl=en",112,"2024-07-11 11:55:22","","10.1111/j.1756-1051.1986.tb00468.x","","",,,,,70,1.84,70,1,38,"… Some of the forests included in the 17 scattered localities under the “continental” variant of Tab. 3 may belong to these types. The locality Storeid belongs to Group 1 of Fig. …","","https://scholar.google.com/scholar?q=related:xIEA_KkMwDEJ:scholar.google.com/&scioq=pleurozium+scattering&hl=en&as_sdt=2007"
29,"JD Bainard, SG Newmaster, JM Budke","Genome size and endopolyploidy evolution across the moss phylogeny",2020,"Annals of Botany","academic.oup.com","https://academic.oup.com/aob/article-abstract/125/4/543/5645044","https://scholar.google.com/scholar?cites=10711866751134223913&as_sdt=2005&sciodt=2007&hl=en",113,"2024-07-11 11:55:22","","","","",,,,,29,7.25,10,3,4,"… ), as well as forward scatter and side scatter. In order to calculate EI … versus side scatter and fluorescence versus forward scatter. … , Dicranum scoparium and Pleurozium schreberi) the …","https://academic.oup.com/aob/article/125/4/543/5645044","https://scholar.google.com/scholar?q=related:KU6sZg4yqJQJ:scholar.google.com/&scioq=pleurozium+scattering&hl=en&as_sdt=2007"
5,"L Van Doorslaer","Erica mackaiana Bab. in Mayo, a new county record",1990,"The Irish Naturalists' Journal","JSTOR","https://www.jstor.org/stable/25539499","https://scholar.google.com/scholar?cites=5463988932644603244&as_sdt=2005&sciodt=2007&hl=en",114,"2024-07-11 11:55:22","","","","",,,,,5,0.15,5,1,34,"… Otherwise it occurs in smaller, scattered patches on the bog itself. Erica X stuartii is very … , Agrostis capillaris, Anthoxanthum odoratum and Pleurozium schreberi. This releve' was taken …","https://www.jstor.org/stable/pdf/25539499.pdf","https://scholar.google.com/scholar?q=related:bIXyGvz800sJ:scholar.google.com/&scioq=pleurozium+scattering&hl=en&as_sdt=2007"
93,"SJ Taylor, TJ Carleton, R Adams","Understorey vegetation change in a Picea mariana chronosequence",1988,"Vegetatio","Springer","https://link.springer.com/article/10.1007/BF00031853","https://scholar.google.com/scholar?cites=13233274144320835295&as_sdt=2005&sciodt=2007&hl=en",115,"2024-07-11 11:55:22","","10.1007/BF00031853","","",,,,,93,2.58,31,3,36,"… A plot of stand age over the bivariate scatter of stand scores for DCA axis 1 versus 2 indicates … The Pleurozium schreberi surrounding individual tree bases, expands to form a more or …","https://www.jstor.org/stable/pdf/20038228.pdf","https://scholar.google.com/scholar?q=related:386aq7gIprcJ:scholar.google.com/&scioq=pleurozium+scattering&hl=en&as_sdt=2007"
0,"S II","SURVEY OF UK METAL CONTENT OF MOSSES 2000",,"uk-air.defra.gov.uk","","https://uk-air.defra.gov.uk/assets/documents/reports/empire/Moss_Report_2000.pdf","",116,"2024-07-11 11:55:22","PDF","","","",,,,,0,0.00,0,1,,"… 'Pleurozium standardised' concentrations is described in Section 3.2. Section 3.3 contains 'Pleurozium … Scatter plots of 1995 and 2000 Pleurozium schreberi metal concentrations with 1:…","https://uk-air.defra.gov.uk/assets/documents/reports/empire/Moss_Report_2000.pdf","https://scholar.google.com/scholar?q=related:HdEZXbbEbIsJ:scholar.google.com/&scioq=pleurozium+scattering&hl=en&as_sdt=2007"
1,"J Wu, G Guo, D Chen, X Zhao, M Long…","Review of diversity and nitrogen fixation potential of bryophyte-cyanobacteria associations",2023,"Biodiversity …","biodiversity-science.net","https://www.biodiversity-science.net/EN/Y2023/V31/I8/23081","https://scholar.google.com/scholar?cites=7120484553764545221&as_sdt=2005&sciodt=2007&hl=en",117,"2024-07-11 11:55:22","","","","",,,,,1,1.00,0,6,1,"… of the Northern Hemisphere, with few and scattered reports in other ecosystems. Therefore, we … For example, Pleurozium schreberi-cyanobacteria associations are dominate in the …","https://www.biodiversity-science.net/EN/article/downloadArticleFile.do?attachType=PDF&id=97954","https://scholar.google.com/scholar?q=related:xaLKx_kK0WIJ:scholar.google.com/&scioq=pleurozium+scattering&hl=en&as_sdt=2007"
0,"AM Dunaev, IV Rumyantsev, MV Frontasyeva…","COMPARATIVE ANALYSIS OF TRACE ELEMENT CONTENT IN IVANOVO REGION MOSSES AND SOILS",,"inspirehep.net","","https://inspirehep.net/files/9f1d96ddbf803a0a2bfdc2e935dbbf6d","",118,"2024-07-11 11:55:22","PDF","","","",,,,,0,0.00,0,4,,"… We used recommended moss species Hylocomium splendens, Pleurozium schreberi, and Polytrichum commune. Soil samples were collected using Russian standards for …","https://inspirehep.net/files/9f1d96ddbf803a0a2bfdc2e935dbbf6d","https://scholar.google.com/scholar?q=related:dt6eqV5gYAEJ:scholar.google.com/&scioq=pleurozium+scattering&hl=en&as_sdt=2007"
38,"RM Smith, MR Young, M Marquiss","Bryophyte use by an insect herbivore: does the crane‐fly Tipula montana select food to maximise growth?",2001,"Ecological Entomology","Wiley Online Library","https://resjournals.onlinelibrary.wiley.com/doi/abs/10.1046/j.1365-2311.2001.00297.x","https://scholar.google.com/scholar?cites=16295274058244472832&as_sdt=2005&sciodt=2007&hl=en",119,"2024-07-11 11:55:22","","10.1046/j.1365-2311.2001.00297.x","","",,,,,38,1.65,13,3,23,"… One notable exception was the moss Pleurozium schreberi, which gave the best growth … Nearly half the larvae feeding on Pleurozium schreberi had moulted to fourth instars, compared …","https://resjournals.onlinelibrary.wiley.com/doi/pdfdirect/10.1046/j.1365-2311.2001.00297.x","https://scholar.google.com/scholar?q=related:AMBMf2txJOIJ:scholar.google.com/&scioq=pleurozium+scattering&hl=en&as_sdt=2007"
11,"GD Hope, WR Mitchell, DA Lloyd, WL Harper…","Montane spruce zone",1991,"Ecosystems of British Co …","Citeseer","https://citeseerx.ist.psu.edu/document?repid=rep1&type=pdf&doi=977ed13794601251847fab494633e64fa6fb5df1#page=196","https://scholar.google.com/scholar?cites=3434033027762525544&as_sdt=2005&sciodt=2007&hl=en",120,"2024-07-11 11:55:22","PDF","","","",,,,,11,0.33,2,5,33,"… All subzones have lodgepole pine, hybrid white spruce, Orthilia secunda (one-sided wintergreen), and a moderate to high cover of Pleurozium schreberi (redstemmed feathermoss). …","https://citeseerx.ist.psu.edu/document?repid=rep1&type=pdf&doi=977ed13794601251847fab494633e64fa6fb5df1#page=196","https://scholar.google.com/scholar?q=related:aJW-LtgiqC8J:scholar.google.com/&scioq=pleurozium+scattering&hl=en&as_sdt=2007"
24,"O Steen, DA Demarchi, D Meidinger, J Pojar","Sub-boreal pine–spruce zone",1991,"Ecosystems in British …","Citeseer","https://citeseerx.ist.psu.edu/document?repid=rep1&type=pdf&doi=977ed13794601251847fab494633e64fa6fb5df1#page=208","https://scholar.google.com/scholar?cites=4886112155609177019&as_sdt=2005&sciodt=2007&hl=en",121,"2024-07-11 11:55:22","PDF","","","",,,,,24,0.73,6,4,33,"… stands of lodgepole pine with only occasional scattered white spruce. Lodgepole pine, … and dominated by feathermosses, especially Pleurozium schreberi (red-stemmed feathermoss) …","https://citeseerx.ist.psu.edu/document?repid=rep1&type=pdf&doi=977ed13794601251847fab494633e64fa6fb5df1#page=208","https://scholar.google.com/scholar?q=related:u5vNJx71zkMJ:scholar.google.com/&scioq=pleurozium+scattering&hl=en&as_sdt=2007"
489,"RK Chakrabarty, H Moosmüller…","Brown carbon in tar balls from smoldering biomass combustion",2010,"Atmospheric …","acp.copernicus.org","https://acp.copernicus.org/articles/10/6363/2010/","https://scholar.google.com/scholar?cites=13544786425054571484&as_sdt=2005&sciodt=2007&hl=en",122,"2024-07-11 11:55:22","","","","",,,,,489,34.93,163,3,14,"… layer of soil with live and dead feathermoss (Pleurozium schreberi) collected from a spruce-… a modulation frequency of 1500 Hz to measure the scattering (Bsca) and absorption (Babs) …","https://acp.copernicus.org/articles/10/6363/2010/acp-10-6363-2010.pdf","https://scholar.google.com/scholar?q=related:3Cvpf32_-LsJ:scholar.google.com/&scioq=pleurozium+scattering&hl=en&as_sdt=2007"
8,"JG Crock, KA Beck, DL Fey, PL Hageman, CS Papp…","Element concentrations and baselines for moss, lichen, spruce, and surface soils, in and near Wrangell-Saint Elias National Park and Preserve, Alaska",1993,"","pubs.usgs.gov","https://pubs.usgs.gov/of/1993/0014/report.pdf","https://scholar.google.com/scholar?cites=4712809330616943123&as_sdt=2005&sciodt=2007&hl=en",123,"2024-07-11 11:55:22","PDF","","","",,,,,8,0.26,1,6,31,"… Sites were characterized by a moderate understory of mixed shrubs and a dense ground cover of mosses (Hvlocotniutn/Pleurozium/Polytrichutn) with scattered clumps of miscellaneous …","https://pubs.usgs.gov/of/1993/0014/report.pdf","https://scholar.google.com/scholar?q=related:E8KR3R1DZ0EJ:scholar.google.com/&scioq=pleurozium+scattering&hl=en&as_sdt=2007"
91,"G Brumelis, TJ Carleton","The vegetation of post-logged black spruce lowlands in central Canada. II. Understorey vegetation",1989,"Journal of Applied Ecology","JSTOR","https://www.jstor.org/stable/2403670","https://scholar.google.com/scholar?cites=13227903941763288906&as_sdt=2005&sciodt=2007&hl=en",124,"2024-07-11 11:55:22","","","","",,,,,91,2.60,46,2,35,"… in two dimensions as a bivariate scatter of the nine stand … the positive relationship between Pleurozium schreberi cover and … Bivariate scatter of the ground cover of Pleurozium schreberi …","https://www.jstor.org/stable/pdf/2403670.pdf","https://scholar.google.com/scholar?q=related:Sk_K84z0krcJ:scholar.google.com/&scioq=pleurozium+scattering&hl=en&as_sdt=2007"
157,"H Harmens, DA Norris, DM Cooper, G Mills…","Nitrogen concentrations in mosses indicate the spatial distribution of atmospheric nitrogen deposition in Europe",2011,"Environmental …","Elsevier","https://www.sciencedirect.com/science/article/pii/S0269749111002491","https://scholar.google.com/scholar?cites=903881935231288659&as_sdt=2005&sciodt=2007&hl=en",125,"2024-07-11 11:55:22","","","","",,,,,157,12.08,31,5,13,"… scatter when there were at least five moss sampling sites per grid. Factors potentially contributing to the scatter … whereas in Finland and Sweden, Pleurozium schreberi was sampled. For …","https://www.osti.gov/etdeweb/biblio/21586116","https://scholar.google.com/scholar?q=related:U4VaxNQ7iwwJ:scholar.google.com/&scioq=pleurozium+scattering&hl=en&as_sdt=2007"
0,"FE Wielgolaski","(_| N| TA| N|| B| RCH ECOS)/STEMS",,"researchgate.net","","https://www.researchgate.net/profile/Henry-Vaere/publication/371701881_Mountain_birch_taxonomy_and_floristics_of_mountain_birch_woodland/links/649177ef95bbbe0c6edbbf6b/Mountain-birch-taxonomy-and-floristics-of-mountain-birch-woodland.pdf","",126,"2024-07-11 11:55:22","PDF","","","",,,,,0,0.00,0,1,,"… Mountain birch height is on average 4–7 m, with scattered … scoparium, Hylocomium splendens, Pleurozium schreberi). … Mountain birch height is on average 6 m, with scattered …","https://www.researchgate.net/profile/Henry-Vaere/publication/371701881_Mountain_birch_taxonomy_and_floristics_of_mountain_birch_woodland/links/649177ef95bbbe0c6edbbf6b/Mountain-birch-taxonomy-and-floristics-of-mountain-birch-woodland.pdf","https://scholar.google.com/scholar?q=related:31ZkfjELXa8J:scholar.google.com/&scioq=pleurozium+scattering&hl=en&as_sdt=2007"
49,"WE Winner, JD Bewley","Terrestrial mosses as bioindicators of SO2 pollution stress: Synecological analysis and the index of atmospheric purity",1978,"Oecologia","Springer","https://link.springer.com/article/10.1007/BF00344733","https://scholar.google.com/scholar?cites=12471663382098876800&as_sdt=2005&sciodt=2007&hl=en",127,"2024-07-11 11:55:22","","10.1007/BF00344733","","",,,,,49,1.07,25,2,46,"… Among the feather mosses Pleurozium schreberi produced half the number of capsules as Hylocomium splendens and Ptilium crista-castrensis. Longton and Green (1969) observed …","https://www.jstor.org/stable/pdf/4215668.pdf","https://scholar.google.com/scholar?q=related:gBlAsMQ_FK0J:scholar.google.com/&scioq=pleurozium+scattering&hl=en&as_sdt=2007"
2,"S Payette, V Pilon, M Frégeau","Origin of the southernmost Arctic tundra of continental North America",2018,"Arctic Science","cdnsciencepub.com","https://cdnsciencepub.com/doi/abs/10.1139/as-2018-0007","https://scholar.google.com/scholar?cites=15731592298290129042&as_sdt=2005&sciodt=2007&hl=en",128,"2024-07-11 11:55:22","","10.1139/as-2018-0007","","",,,,,2,0.33,1,3,6,"… The forest limit corresponds to the last tree groupings, more or less scattered in the landscape and located at the edge of the tundra environment, whereas the boreal environment is …","https://cdnsciencepub.com/doi/pdf/10.1139/AS-2018-0007","https://scholar.google.com/scholar?q=related:kqjagtjXUdoJ:scholar.google.com/&scioq=pleurozium+scattering&hl=en&as_sdt=2007"
51,"S Pellerin, M Mercure, AS Desaulniers…","Changes in plant communities over three decades on two disturbed bogs in southeastern Québec",2009,"Applied Vegetation …","Wiley Online Library","https://onlinelibrary.wiley.com/doi/abs/10.1111/j.1654-109X.2009.01008.x","https://scholar.google.com/scholar?cites=11466818243794730294&as_sdt=2005&sciodt=2007&hl=en",129,"2024-07-11 11:55:22","","10.1111/j.1654-109X.2009.01008.x","","",,,,,51,3.40,13,4,15,"… Picea mariana, Sphagnum fuscum and Pleurozium schreberi increased in percent cover … Today, the region is mainly cultivated fields with scattered woodlots, old fields and bogs. Most of …","https://www.jstor.org/stable/pdf/27735049.pdf","https://scholar.google.com/scholar?q=related:Nn1aXXBSIp8J:scholar.google.com/&scioq=pleurozium+scattering&hl=en&as_sdt=2007"
106,"M Rautiainen, M Mõttus, J Heiskanen, A Akujärvi…","Seasonal reflectance dynamics of common understory types in a northern European boreal forest",2011,"Remote Sensing of …","Elsevier","https://www.sciencedirect.com/science/article/pii/S003442571100229X","https://scholar.google.com/scholar?cites=9048781980860425375&as_sdt=2005&sciodt=2007&hl=en",130,"2024-07-11 11:55:22","","","","",,,,,106,8.15,21,5,13,"… Further, the potentially high anisotropy of vegetation scattering was reduced by using diffuse irradiance conditions. Although this is somewhat incorrect, we refer to the reflectance …","https://www.academia.edu/download/41590578/Seasonal_reflectance_dynamics_of_common_20160126-15256-1lif4zz.pdf","https://scholar.google.com/scholar?q=related:nyQk40S7k30J:scholar.google.com/&scioq=pleurozium+scattering&hl=en&as_sdt=2007"
36,"S Liiv, M Kaasik","Trace metals in mosses in the Estonian oil shale processing region",2004,"Journal of Atmospheric Chemistry","Springer","https://link.springer.com/article/10.1007/s10874-004-1266-z","https://scholar.google.com/scholar?cites=11112537596232180111&as_sdt=2005&sciodt=2007&hl=en",131,"2024-07-11 11:55:22","","10.1007/s10874-004-1266-z","","",,,,,36,1.80,18,2,20,"… Samples of epigeic mosses Pleurozium schreberi and Hylocomium splendens were taken … As small discrepancies from the one-to-one line are shaded by a significant scatter of data …","https://link.springer.com/content/pdf/10.1007/s10874-004-1266-z.pdf","https://scholar.google.com/scholar?q=related:j6GXKBGqN5oJ:scholar.google.com/&scioq=pleurozium+scattering&hl=en&as_sdt=2007"
11,"WC Steere","Bryophyta of Arctic America. I. Species from Little Diomede Island, Bering Strait, Alaska",1938,"The American Midland Naturalist","JSTOR","https://www.jstor.org/stable/2422985","https://scholar.google.com/scholar?cites=10340206451671095663&as_sdt=2005&sciodt=2007&hl=en",132,"2024-07-11 11:55:22","","","","",,,,,11,0.13,11,1,86,"The boreal bryophyte flora is of extreme interest for several reasons. In the first place, north of latitude 60? N., it is known only very imperfectly from few and scattered collections, so that …","https://www.jstor.org/stable/pdf/2422985.pdf","https://scholar.google.com/scholar?q=related:b9kOqPvKf48J:scholar.google.com/&scioq=pleurozium+scattering&hl=en&as_sdt=2007"
