Cites,Authors,Title,Year,Source,Publisher,ArticleURL,CitesURL,GSRank,QueryDate,Type,DOI,ISSN,CitationURL,Volume,Issue,StartPage,EndPage,ECC,CitesPerYear,CitesPerAuthor,AuthorCount,Age,Abstract,FullTextURL,RelatedURL
8,"S. Whitehead","Post-burning responses by vegetation on blanket bog peatland sites on a Scottish grouse moor",2021,"Ecological Indicators","","https://api.elsevier.com/content/article/eid/1-s2.0-S1470160X21000017","https://www.scopus.com/inward/citedby.uri?partnerID=HzOxMe3b&scp=85099436157&origin=inward",177,"2024-07-12 10:46:10","Article","10.1016/j.ecolind.2021.107336","1470-160X","https://api.elsevier.com/content/abstract/scopus_id/85099436157",123,,,,8,2.67,8,1,3,"","",""
8,"P.P.J. Gaffney","Ecohydrological change following rewetting of a deep-drained northern raised bog",2020,"Ecohydrology","","","https://www.scopus.com/inward/citedby.uri?partnerID=HzOxMe3b&scp=85083848047&origin=inward",178,"2024-07-12 10:46:10","Article","10.1002/eco.2210","1936-0584","https://api.elsevier.com/content/abstract/scopus_id/85083848047",13,5,,,8,2.00,8,1,4,"","",""
8,"I. Kirillova","Molecular and morphological approaches to studying the Dactylorhiza genus in the Komi Republic",2018,"Vestnik Tomskogo Gosudarstvennogo Universiteta, Biologiya","","","https://www.scopus.com/inward/citedby.uri?partnerID=HzOxMe3b&scp=85059766305&origin=inward",179,"2024-07-12 10:46:10","Article","10.17223/19988591/43/3","1998-8591","https://api.elsevier.com/content/abstract/scopus_id/85059766305",,43,44,65,8,1.33,8,1,6,"","",""
8,"C. Pernot","Root system origin and structure influence planting shock of black spruce seedlings in boreal microsites",2019,"Forest Ecology and Management","","https://api.elsevier.com/content/article/eid/1-s2.0-S0378112718317717","https://www.scopus.com/inward/citedby.uri?partnerID=HzOxMe3b&scp=85057344080&origin=inward",180,"2024-07-12 10:46:10","Article","10.1016/j.foreco.2018.11.043","0378-1127","https://api.elsevier.com/content/abstract/scopus_id/85057344080",433,,594,605,8,1.60,8,1,5,"","",""
8,"M.M. Hassan","Improvement of in vitro date palm plantlet acclimatization rate with kinetin and hoagland solution",2017,"Methods in Molecular Biology","","","https://www.scopus.com/inward/citedby.uri?partnerID=HzOxMe3b&scp=85027254472&origin=inward",181,"2024-07-12 10:46:10","Book Chapter","10.1007/978-1-4939-7156-5_16","1064-3745","https://api.elsevier.com/content/abstract/scopus_id/85027254472",1637,,185,200,8,1.14,8,1,7,"","",""
8,"J.R. Lamont","Anaerobically digested dairy fiber in soilless potting media for poinsettias",2016,"International Journal of Recycling of Organic Waste in Agriculture","","","https://www.scopus.com/inward/citedby.uri?partnerID=HzOxMe3b&scp=84971455415&origin=inward",182,"2024-07-12 10:46:10","Article","10.1007/s40093-016-0130-x","2195-3228","https://api.elsevier.com/content/abstract/scopus_id/84971455415",5,2,173,177,8,1.00,8,1,8,"","",""
8,"C.M. Heckscher","Photuris Mysticalampas (Coleoptera: Lampyridae): A new firefly from peatland floodplain forests of the delmarva peninsula",2013,"Entomological News","","","https://www.scopus.com/inward/citedby.uri?partnerID=HzOxMe3b&scp=84884831091&origin=inward",183,"2024-07-12 10:46:10","Article","10.3157/021.123.0202","0013-872X","https://api.elsevier.com/content/abstract/scopus_id/84884831091",123,2,93,100,8,0.73,8,1,11,"","",""
8,"L. Rodríguez-Canché","Production of habanero pepper seedlings with vermicompost generated from sewage sludge",2010,"Compost Science and Utilization","","","https://www.scopus.com/inward/citedby.uri?partnerID=HzOxMe3b&scp=77951537949&origin=inward",184,"2024-07-12 10:46:10","Article","10.1080/1065657X.2010.10736932","1065-657X","https://api.elsevier.com/content/abstract/scopus_id/77951537949",18,1,42,46,8,0.57,8,1,14,"","",""
8,"N. Gutzerová","Patch dynamics and local succession in a sandstone area with frequent disturbance",2001,"Journal of Vegetation Science","","","https://www.scopus.com/inward/citedby.uri?partnerID=HzOxMe3b&scp=0034765628&origin=inward",185,"2024-07-12 10:46:10","Article","10.2307/3237005","1100-9233","https://api.elsevier.com/content/abstract/scopus_id/0034765628",12,4,533,544,8,0.35,8,1,23,"","",""
8,"L. Kutnar","Spruce mire types on the Pokljuka plateau, Slovenia",2000,"Phyton - Annales Rei Botanicae","","","https://www.scopus.com/inward/citedby.uri?partnerID=HzOxMe3b&scp=0034713688&origin=inward",186,"2024-07-12 10:46:10","Conference Paper","","0079-2047","https://api.elsevier.com/content/abstract/scopus_id/0034713688",40,4,123,128,8,0.33,8,1,24,"","",""
7,"C. Currey","Substrate volumetric water content controls growth and development of containerized culinary herbs",2019,"Agronomy","","","https://www.scopus.com/inward/citedby.uri?partnerID=HzOxMe3b&scp=85074289555&origin=inward",187,"2024-07-12 10:46:10","Article","10.3390/agronomy9110667","2073-4395","https://api.elsevier.com/content/abstract/scopus_id/85074289555",9,11,,,7,1.40,7,1,5,"","",""
7,"T. Power","Forest structure and site conditions of boreal felt lichen (Erioderma pedicellatum) habitat in Cape Breton, Nova Scotia, Canada",2018,"Botany","","","https://www.scopus.com/inward/citedby.uri?partnerID=HzOxMe3b&scp=85049446059&origin=inward",188,"2024-07-12 10:46:10","Article","10.1139/cjb-2017-0209","1916-2804","https://api.elsevier.com/content/abstract/scopus_id/85049446059",96,7,449,459,7,1.17,7,1,6,"","",""
7,"J.Z. Ma","Effects of shading on relative competitive advantage of three species of Sphagnum",2015,"Mires and Peat","","","https://www.scopus.com/inward/citedby.uri?partnerID=HzOxMe3b&scp=84938153847&origin=inward",189,"2024-07-12 10:46:10","Article","","1819-754X","https://api.elsevier.com/content/abstract/scopus_id/84938153847",16,,,,7,0.78,7,1,9,"","",""
7,"H. López-Mendoza","Effects of gamma-irradiated seeds on germination and growth in Capsicum annuum L. Plants grown in a greenhouse",2012,"Acta Horticulturae","","","https://www.scopus.com/inward/citedby.uri?partnerID=HzOxMe3b&scp=84863697907&origin=inward",190,"2024-07-12 10:46:10","Conference Paper","10.17660/actahortic.2012.947.7","0567-7572","https://api.elsevier.com/content/abstract/scopus_id/84863697907",947,,77,82,7,0.58,7,1,12,"","",""
7,"A. Large","Reversing spontaneous succession to protect high-value vegetation: Assessment of two Scottish mires using rapid survey techniques",2001,"Applied Vegetation Science","","","https://www.scopus.com/inward/citedby.uri?partnerID=HzOxMe3b&scp=0034946781&origin=inward",191,"2024-07-12 10:46:10","Conference Paper","10.1111/j.1654-109X.2001.tb00240.x","1402-2001","https://api.elsevier.com/content/abstract/scopus_id/0034946781",4,1,103,110,7,0.30,7,1,23,"","",""
6,"L.M. Ribeiro","Influence of light, natural ventilation and cultivation flask size on the growth and development of denphal (Orchidaceae)",2019,"Revista Brasileirade Ciencias Agrarias","","","https://www.scopus.com/inward/citedby.uri?partnerID=HzOxMe3b&scp=85105485674&origin=inward",192,"2024-07-12 10:46:10","Article","10.5039/AGRARIA.V14I3A5957","1981-1160","https://api.elsevier.com/content/abstract/scopus_id/85105485674",14,3,,,6,1.20,6,1,5,"","",""
6,"A. Heinemeyer","Assessing soil compaction and micro-topography impacts of alternative heather cutting as compared to burning as part of grouse moor management on blanket bog",2019,"PeerJ","","","https://www.scopus.com/inward/citedby.uri?partnerID=HzOxMe3b&scp=85074186522&origin=inward",193,"2024-07-12 10:46:10","Article","10.7717/peerj.7298","2167-8359","https://api.elsevier.com/content/abstract/scopus_id/85074186522",2019,7,,,6,1.20,6,1,5,"","",""
6,"M. Turunen","Quantifying physical properties of three sphagnum-based growing media as affected by drying–wetting cycles",2019,"Vadose Zone Journal","","","https://www.scopus.com/inward/citedby.uri?partnerID=HzOxMe3b&scp=85074090542&origin=inward",194,"2024-07-12 10:46:10","Article","10.2136/vzj2019.04.0033","1539-1663","https://api.elsevier.com/content/abstract/scopus_id/85074090542",18,1,,,6,1.20,6,1,5,"","",""
6,"D.A. Philippov","Data on air temperature, relative humidity and dew point in a boreal Sphagnum bog and an upland site (Shichengskoe mire system, North-Western Russia)",2019,"Data in Brief","","https://api.elsevier.com/content/article/eid/1-s2.0-S2352340919305104","https://www.scopus.com/inward/citedby.uri?partnerID=HzOxMe3b&scp=85067825695&origin=inward",195,"2024-07-12 10:46:10","Data Paper","10.1016/j.dib.2019.104156","2352-3409","https://api.elsevier.com/content/abstract/scopus_id/85067825695",25,,,,6,1.20,6,1,5,"","",""
6,"J.Z. Ma","Effects of shading on two Sphagnum species growth and their interactions",2012,"Chinese Journal of Applied Ecology","","","https://www.scopus.com/inward/citedby.uri?partnerID=HzOxMe3b&scp=84860158796&origin=inward",196,"2024-07-12 10:46:10","Article","","1001-9332","https://api.elsevier.com/content/abstract/scopus_id/84860158796",23,2,357,362,6,0.50,6,1,12,"","",""
6,"C.G. Morales","Seedling quality of 'poblano' pepper in the sierra nevada of puebla, México",2011,"Revista Fitotecnia Mexicana","","","https://www.scopus.com/inward/citedby.uri?partnerID=HzOxMe3b&scp=80054033896&origin=inward",197,"2024-07-12 10:46:10","Article","","0187-7380","https://api.elsevier.com/content/abstract/scopus_id/80054033896",34,2,115,121,6,0.46,6,1,13,"","",""
6,"J. Lisiecka","Reproduction of strawberry in an unheated glasshouse",2002,"Acta Horticulturae","","","https://www.scopus.com/inward/citedby.uri?partnerID=HzOxMe3b&scp=33751299505&origin=inward",198,"2024-07-12 10:46:10","Conference Paper","10.17660/ActaHortic.2002.567.59","0567-7572","https://api.elsevier.com/content/abstract/scopus_id/33751299505",567,,285,287,6,0.27,6,1,22,"","",""
6,"J.R. Stokes","Effect of water table on growth of three New Zealand Sphagnum species: Implications for S. cristatum management",1999,"Journal of Bryology","","","https://www.scopus.com/inward/citedby.uri?partnerID=HzOxMe3b&scp=0037588588&origin=inward",199,"2024-07-12 10:46:10","Article","10.1179/jbr.1999.21.1.25","0373-6687","https://api.elsevier.com/content/abstract/scopus_id/0037588588",21,1,25,29,6,0.24,6,1,25,"","",""
6,"J.S. Huang","Assessment of the need for nitrogen, phosphorus, potassium, and sulfur preplant nutrients for plug seedling growth",2002,"HortScience","","","https://www.scopus.com/inward/citedby.uri?partnerID=HzOxMe3b&scp=0036269989&origin=inward",200,"2024-07-12 10:46:10","Article","10.21273/hortsci.37.3.529","0018-5345","https://api.elsevier.com/content/abstract/scopus_id/0036269989",37,3,529,533,6,0.27,6,1,22,"","",""
