Cites,Authors,Title,Year,Source,Publisher,ArticleURL,CitesURL,GSRank,QueryDate,Type,DOI,ISSN,CitationURL,Volume,Issue,StartPage,EndPage,ECC,CitesPerYear,CitesPerAuthor,AuthorCount,Age,Abstract,FullTextURL,RelatedURL
18,"S.M. Renard","Prescribed burning after clearcut limits paludification in black spruce boreal forest",2016,"Forest Ecology and Management","","https://api.elsevier.com/content/article/eid/1-s2.0-S0378112715005320","https://www.scopus.com/inward/citedby.uri?partnerID=HzOxMe3b&scp=84943515998&origin=inward",118,"2024-07-12 10:46:10","Article","10.1016/j.foreco.2015.09.037","0378-1127","https://api.elsevier.com/content/abstract/scopus_id/84943515998",359,,147,155,18,2.25,18,1,8,"","",""
18,"K.A. Allen","Habitat and conservation of the enigmatic damselfly Ischnura pumilio",2010,"Journal of Insect Conservation","","","https://www.scopus.com/inward/citedby.uri?partnerID=HzOxMe3b&scp=78249269761&origin=inward",119,"2024-07-12 10:46:10","Article","10.1007/s10841-010-9297-z","1366-638X","https://api.elsevier.com/content/abstract/scopus_id/78249269761",14,6,689,700,18,1.29,18,1,14,"","",""
18,"I. Drobyshev","Growth response of spruce saplings in relation to climatic conditions along a gradient of gap size",2000,"Canadian Journal of Forest Research","","","https://www.scopus.com/inward/citedby.uri?partnerID=HzOxMe3b&scp=0033823978&origin=inward",120,"2024-07-12 10:46:10","Article","10.1139/x00-008","0045-5067","https://api.elsevier.com/content/abstract/scopus_id/0033823978",30,6,930,938,18,0.75,18,1,24,"","",""
18,"M. Gale","Plant community responses to harvesting and post-harvest manipulations in a picea - Larix - Pinus wetland with a mineral substrate",1998,"Wetlands","","","https://www.scopus.com/inward/citedby.uri?partnerID=HzOxMe3b&scp=0031666339&origin=inward",121,"2024-07-12 10:46:10","Article","10.1007/BF03161452","0277-5212","https://api.elsevier.com/content/abstract/scopus_id/0031666339",18,1,150,159,18,0.69,18,1,26,"","",""
18,"M. SEPPALA","Development of low–centred ice–wedge polygons in the northernmost Ungava Peninsual, Queébec, Canada",1991,"Boreas","","","https://www.scopus.com/inward/citedby.uri?partnerID=HzOxMe3b&scp=0026307839&origin=inward",122,"2024-07-12 10:46:10","Article","10.1111/j.1502-3885.1991.tb00155.x","0300-9483","https://api.elsevier.com/content/abstract/scopus_id/0026307839",20,3,259,285,18,0.55,18,1,33,"","",""
18,"L. Gignac","Ecological tolerance and niche structure of Sphagnum along a pollution gradient near Sudbury, Ontario, Canada.",1987,"Canadian Journal of Botany","","","https://www.scopus.com/inward/citedby.uri?partnerID=HzOxMe3b&scp=0023469339&origin=inward",123,"2024-07-12 10:46:10","Article","10.1139/b87-177","0008-4026","https://api.elsevier.com/content/abstract/scopus_id/0023469339",65,6,1268,1274,18,0.49,18,1,37,"","",""
17,"A. Nair","Biochar rate and transplant tray cell number have implications on pepper growth during transplant production",2016,"HortTechnology","","","https://www.scopus.com/inward/citedby.uri?partnerID=HzOxMe3b&scp=85008199598&origin=inward",124,"2024-07-12 10:46:10","Article","10.21273/HORTTECH03490-16","1063-0198","https://api.elsevier.com/content/abstract/scopus_id/85008199598",26,6,713,719,17,2.13,17,1,8,"","",""
17,"M. Papafotiou","Coloration, anthocyanin concentration, and growth of croton (Codiaeum variegatum L.) as affected by cotton gin trash compost use in the potting medium",2007,"HortScience","","","https://www.scopus.com/inward/citedby.uri?partnerID=HzOxMe3b&scp=33846820158&origin=inward",125,"2024-07-12 10:46:10","Article","10.21273/hortsci.42.1.83","0018-5345","https://api.elsevier.com/content/abstract/scopus_id/33846820158",42,1,83,87,17,1.00,17,1,17,"","",""
17,"K.F. Salifu","Evaluating chemical indices of growing media for nursery production of Quercus rubra seedlings",2006,"HortScience","","","https://www.scopus.com/inward/citedby.uri?partnerID=HzOxMe3b&scp=33748639926&origin=inward",126,"2024-07-12 10:46:10","Article","10.21273/hortsci.41.5.1342","0018-5345","https://api.elsevier.com/content/abstract/scopus_id/33748639926",41,5,1342,1346,17,0.94,17,1,18,"","",""
17,"K. Yabe","Variation in size and shape of Sphagnum hummocks in relation to climatic conditions in Hokkaido Island, northern Japan",2001,"Canadian Journal of Botany","","","https://www.scopus.com/inward/citedby.uri?partnerID=HzOxMe3b&scp=0035665688&origin=inward",127,"2024-07-12 10:46:10","Article","10.1139/cjb-79-11-1318","0008-4026","https://api.elsevier.com/content/abstract/scopus_id/0035665688",79,11,1318,1326,17,0.74,17,1,23,"","",""
17,"J. Heiskanen","Effect of peat-based container media on establishment of scots pine, norway spruce and silver birch seedlings after transplanting in contrasting water conditions",2000,"Scandinavian Journal of Forest Research","","","https://www.scopus.com/inward/citedby.uri?partnerID=HzOxMe3b&scp=0034114748&origin=inward",128,"2024-07-12 10:46:10","Article","10.1080/02827580050160466","0282-7581","https://api.elsevier.com/content/abstract/scopus_id/0034114748",15,1,49,57,17,0.71,17,1,24,"","",""
17,"G. Jia","Concentration and vertical distribution of plutonium and americium in Italian mosses and lichens",1997,"Journal of Radioanalytical and Nuclear Chemistry","","","https://www.scopus.com/inward/citedby.uri?partnerID=HzOxMe3b&scp=0030712234&origin=inward",129,"2024-07-12 10:46:10","Article","10.1007/BF02034237","0236-5731","https://api.elsevier.com/content/abstract/scopus_id/0030712234",222,1,3,9,17,0.63,17,1,27,"","",""
16,"B.T. Piatkowski","Functional trait evolution in Sphagnum peat mosses and its relationship to niche construction",2019,"New Phytologist","","","https://www.scopus.com/inward/citedby.uri?partnerID=HzOxMe3b&scp=85065044385&origin=inward",130,"2024-07-12 10:46:10","Article","10.1111/nph.15825","0028-646X","https://api.elsevier.com/content/abstract/scopus_id/85065044385",223,2,939,949,16,3.20,16,1,5,"","",""
16,"T.L.J. Gauthier","The effect of compression on Sphagnum hydrophysical properties: Implications for increasing hydrological connectivity in restored cutover peatlands",2018,"Ecohydrology","","","https://www.scopus.com/inward/citedby.uri?partnerID=HzOxMe3b&scp=85053937340&origin=inward",131,"2024-07-12 10:46:10","Article","10.1002/eco.2020","1936-0584","https://api.elsevier.com/content/abstract/scopus_id/85053937340",11,8,,,16,2.67,16,1,6,"","",""
16,"G. Berecha","Exploring the suitability of coffee pulp compost as growth media substitute in greenhouse production",2011,"International Journal of Agricultural Research","","","https://www.scopus.com/inward/citedby.uri?partnerID=HzOxMe3b&scp=79958026412&origin=inward",132,"2024-07-12 10:46:10","Article","10.3923/ijar.2011.255.267","1816-4897","https://api.elsevier.com/content/abstract/scopus_id/79958026412",6,3,255,267,16,1.23,16,1,13,"","",""
16,"S. Peckham","Bryophyte cover estimation in a boreal black spruce forest using airborne lidar and multispectral sensors",2009,"Remote Sensing of Environment","","https://api.elsevier.com/content/article/eid/1-s2.0-S0034425709000364","https://www.scopus.com/inward/citedby.uri?partnerID=HzOxMe3b&scp=64549135757&origin=inward",133,"2024-07-12 10:46:10","Article","10.1016/j.rse.2009.02.008","0034-4257","https://api.elsevier.com/content/abstract/scopus_id/64549135757",113,6,1127,1132,16,1.07,16,1,15,"","",""
16,"H. Kempter","The geochemistry of ombrotrophic Sphagnum species growing in different microhabitats of eight German and Belgian peat bogs and the regional atmospheric deposition",2007,"Water, Air, and Soil Pollution","","","https://www.scopus.com/inward/citedby.uri?partnerID=HzOxMe3b&scp=34548217190&origin=inward",134,"2024-07-12 10:46:10","Article","10.1007/s11270-007-9397-x","0049-6979","https://api.elsevier.com/content/abstract/scopus_id/34548217190",184,1,29,48,16,0.94,16,1,17,"","",""
16,"M.E. Berube","The natural revegetation of a vacuum-mined peatland: Eight years of monitoring",2000,"Canadian Field-Naturalist","","","https://www.scopus.com/inward/citedby.uri?partnerID=HzOxMe3b&scp=0033791065&origin=inward",135,"2024-07-12 10:46:10","Article","","0008-3550","https://api.elsevier.com/content/abstract/scopus_id/0033791065",114,2,279,286,16,0.67,16,1,24,"","",""
15,"L. Maanavilja","Rewetting of drained boreal spruce swamp forests results in rapid recovery of Sphagnum production",2015,"Journal of Applied Ecology","","","https://www.scopus.com/inward/citedby.uri?partnerID=HzOxMe3b&scp=84941172576&origin=inward",136,"2024-07-12 10:46:10","Article","10.1111/1365-2664.12474","0021-8901","https://api.elsevier.com/content/abstract/scopus_id/84941172576",52,5,1355,1363,15,1.67,15,1,9,"","",""
15,"M. Yunus","In vitro propagation of Etlingera elatior (Jack) (torch ginger)",2012,"Scientia Horticulturae","","https://api.elsevier.com/content/article/eid/1-s2.0-S0304423811006480","https://www.scopus.com/inward/citedby.uri?partnerID=HzOxMe3b&scp=84855775653&origin=inward",137,"2024-07-12 10:46:10","Article","10.1016/j.scienta.2011.12.016","0304-4238","https://api.elsevier.com/content/abstract/scopus_id/84855775653",135,,145,150,15,1.25,15,1,12,"","",""
15,"P. Hájková","Sphagnum-mediated successional pattern in the mixed mire in the Muránska planina Mts (Western Carpathians, Slovakia)",2004,"Biologia - Section Botany","","","https://www.scopus.com/inward/citedby.uri?partnerID=HzOxMe3b&scp=1642291087&origin=inward",138,"2024-07-12 10:46:10","Article","","1335-6372","https://api.elsevier.com/content/abstract/scopus_id/1642291087",59,1,65,74,15,0.75,15,1,20,"","",""
14,"B. D'Acunha","Ecohydrological responses to rewetting of a highly impacted raised bog ecosystem",2018,"Ecohydrology","","","https://www.scopus.com/inward/citedby.uri?partnerID=HzOxMe3b&scp=85034235323&origin=inward",139,"2024-07-12 10:46:10","Article","10.1002/eco.1922","1936-0584","https://api.elsevier.com/content/abstract/scopus_id/85034235323",11,1,,,14,2.33,14,1,6,"","",""
14,"F. Ballaud","Dynamics of viral abundance and diversity in a sphagnum-dominated peatland: Temporal fluctuations prevail over habitat",2016,"Frontiers in Microbiology","","","https://www.scopus.com/inward/citedby.uri?partnerID=HzOxMe3b&scp=84958025746&origin=inward",140,"2024-07-12 10:46:10","Article","10.3389/fmicb.2015.01494","1664-302X","https://api.elsevier.com/content/abstract/scopus_id/84958025746",6,,,,14,1.75,14,1,8,"","",""
14,"T. Yazaki","Effects of snow-load and shading by vascular plants on the vertical growth of hummocks formed by Sphagnum papillosum in a mire of Northern Japan",2012,"Plant Ecology","","","https://www.scopus.com/inward/citedby.uri?partnerID=HzOxMe3b&scp=84863459423&origin=inward",141,"2024-07-12 10:46:10","Article","10.1007/s11258-012-0065-x","1385-0237","https://api.elsevier.com/content/abstract/scopus_id/84863459423",213,7,1055,1067,14,1.17,14,1,12,"","",""
14,"F.A. Gutiérrez-Miceli","Acclimatization of micropropagated orchid Guarianthe skinnerii inoculated with Trichoderma harzianum",2008,"Asian Journal of Plant Sciences","","","https://www.scopus.com/inward/citedby.uri?partnerID=HzOxMe3b&scp=59249100542&origin=inward",142,"2024-07-12 10:46:10","Article","10.3923/ajps.2008.327.330","1682-3974","https://api.elsevier.com/content/abstract/scopus_id/59249100542",7,3,327,330,14,0.88,14,1,16,"","",""
14,"H.W. Chen","Load of forest surface dead fuel in Huzhong area of Daxing' anling Mountains and relevant affecting factors",2008,"Chinese Journal of Ecology","","","https://www.scopus.com/inward/citedby.uri?partnerID=HzOxMe3b&scp=39749133116&origin=inward",143,"2024-07-12 10:46:10","Article","","1000-4890","https://api.elsevier.com/content/abstract/scopus_id/39749133116",27,1,50,55,14,0.88,14,1,16,"","",""
14,"V. Olivo","Influence of six substrates in Pinus ponderosa grown in containers under greenhouse conditions",2006,"Bosque","","","https://www.scopus.com/inward/citedby.uri?partnerID=HzOxMe3b&scp=33846830003&origin=inward",144,"2024-07-12 10:46:10","Article","","0304-8799","https://api.elsevier.com/content/abstract/scopus_id/33846830003",27,3,267,271,14,0.78,14,1,18,"","",""
13,"Z. Bu","Performance of four mosses in a reciprocal transplant experiment: Implications for peatland succession in NE China",2013,"Journal of Bryology","","","https://www.scopus.com/inward/citedby.uri?partnerID=HzOxMe3b&scp=84884186680&origin=inward",145,"2024-07-12 10:46:10","Article","10.1179/1743282013Y.0000000063","0373-6687","https://api.elsevier.com/content/abstract/scopus_id/84884186680",35,3,220,227,13,1.18,13,1,11,"","",""
13,"P.A. Londra","Evaluation of water-air balance of various substrates on Begonia growth",2012,"HortScience","","","https://www.scopus.com/inward/citedby.uri?partnerID=HzOxMe3b&scp=84867261502&origin=inward",146,"2024-07-12 10:46:10","Article","10.21273/hortsci.47.8.1153","0018-5345","https://api.elsevier.com/content/abstract/scopus_id/84867261502",47,8,1153,1158,13,1.08,13,1,12,"","",""
13,"A. Veijalainen","Growing Picea abies container seedlings in peat and composted forest-nursery waste mixtures for forest regeneration",2007,"Scandinavian Journal of Forest Research","","","https://www.scopus.com/inward/citedby.uri?partnerID=HzOxMe3b&scp=36248954992&origin=inward",147,"2024-07-12 10:46:10","Article","10.1080/02827580701647271","0282-7581","https://api.elsevier.com/content/abstract/scopus_id/36248954992",22,5,390,397,13,0.76,13,1,17,"","",""
12,"J. Alvarez-Herrera","Effect of irrigation and nutrition with calcium on fruit cracking of the cape gooseberry (Physalis peruviana L.) in the three strata of the plant",2012,"Acta Horticulturae","","","https://www.scopus.com/inward/citedby.uri?partnerID=HzOxMe3b&scp=84863613872&origin=inward",148,"2024-07-12 10:46:10","Conference Paper","10.17660/ActaHortic.2012.928.19","0567-7572","https://api.elsevier.com/content/abstract/scopus_id/84863613872",928,,163,170,12,1.00,12,1,12,"","",""
12,"Y. Zheng","Searching for recyclable or biodegradable growing media",2009,"Acta Horticulturae","","","https://www.scopus.com/inward/citedby.uri?partnerID=HzOxMe3b&scp=70350089818&origin=inward",149,"2024-07-12 10:46:10","Conference Paper","","0567-7572","https://api.elsevier.com/content/abstract/scopus_id/70350089818",819,,435,442,12,0.80,12,1,15,"","",""
12,"M. Ishiguro","Upward infiltration into porous media as affected by wettability and anionic surfactants",2008,"Soil Science Society of America Journal","","","https://www.scopus.com/inward/citedby.uri?partnerID=HzOxMe3b&scp=43949133359&origin=inward",150,"2024-07-12 10:46:10","Article","10.2136/sssaj2006.0367","0361-5995","https://api.elsevier.com/content/abstract/scopus_id/43949133359",72,3,741,749,12,0.75,12,1,16,"","",""
12,"P.E. Trani","Evaluation of substrates in the production of lettuce plantlets",2007,"Horticultura Brasileira","","","https://www.scopus.com/inward/citedby.uri?partnerID=HzOxMe3b&scp=36049051427&origin=inward",151,"2024-07-12 10:46:10","Article","10.1590/s0102-05362007000200025","0102-0536","https://api.elsevier.com/content/abstract/scopus_id/36049051427",25,2,256,260,12,0.71,12,1,17,"","",""
12,"C. Tyler","Soil acidity and distribution of species on tussocks and interspaces in schoenus vegetation of South and Southeast Sweden",1981,"Vegetatio","","","https://www.scopus.com/inward/citedby.uri?partnerID=HzOxMe3b&scp=0004781731&origin=inward",152,"2024-07-12 10:46:10","Article","10.1007/BF00119798","0042-3106","https://api.elsevier.com/content/abstract/scopus_id/0004781731",44,1,25,35,12,0.28,12,1,43,"","",""
11,"V.T. Thuong","Effects of growing substrates and seed density on yield and quality of radish (Raphanus sativus) microgreens",2020,"Research on Crops","","","https://www.scopus.com/inward/citedby.uri?partnerID=HzOxMe3b&scp=85094189878&origin=inward",153,"2024-07-12 10:46:10","Article","10.31830/2348-7542.2020.091","0972-3226","https://api.elsevier.com/content/abstract/scopus_id/85094189878",21,3,579,586,11,2.75,11,1,4,"","",""
11,"M. Vestberg","Reproducibility of suppression of pythium wilt of cucumber by compost",2014,"Agricultural and Food Science","","","https://www.scopus.com/inward/citedby.uri?partnerID=HzOxMe3b&scp=84961289531&origin=inward",154,"2024-07-12 10:46:10","Article","10.23986/afsci.41471","1459-6067","https://api.elsevier.com/content/abstract/scopus_id/84961289531",23,3,236,245,11,1.10,11,1,10,"","",""
11,"P. von Sengbusch","Enhanced sensitivity of a mountain bog to climate change as a delayed effect of road construction",2015,"Mires and Peat","","","https://www.scopus.com/inward/citedby.uri?partnerID=HzOxMe3b&scp=84938054251&origin=inward",155,"2024-07-12 10:46:10","Article","","1819-754X","https://api.elsevier.com/content/abstract/scopus_id/84938054251",15,,,,11,1.22,11,1,9,"","",""
11,"L.B. Vence","Water retention curves as a tool in the selection of a plant-growing substrate and the watering scheme",2013,"Ciencia del Suelo","","","https://www.scopus.com/inward/citedby.uri?partnerID=HzOxMe3b&scp=84905501015&origin=inward",156,"2024-07-12 10:46:10","Article","","0326-3169","https://api.elsevier.com/content/abstract/scopus_id/84905501015",31,2,153,164,11,1.00,11,1,11,"","",""
11,"J. Bennie","Measuring biodiversity across spatial scales in a raised bog using a novel paired-sample diversity index",2011,"Journal of Ecology","","","https://www.scopus.com/inward/citedby.uri?partnerID=HzOxMe3b&scp=79951568559&origin=inward",157,"2024-07-12 10:46:10","Article","10.1111/j.1365-2745.2010.01762.x","0022-0477","https://api.elsevier.com/content/abstract/scopus_id/79951568559",99,2,482,490,11,0.85,11,1,13,"","",""
11,"S. Mahamud","Preliminary studies on sago waste as growing medium for tomato",2007,"Acta Horticulturae","","","https://www.scopus.com/inward/citedby.uri?partnerID=HzOxMe3b&scp=70449109540&origin=inward",158,"2024-07-12 10:46:10","Conference Paper","10.17660/ActaHortic.2007.742.21","0567-7572","https://api.elsevier.com/content/abstract/scopus_id/70449109540",742,,163,168,11,0.65,11,1,17,"","",""
11,"P. Bernier","Effects of the physical properties of sphagnum peat on the nursery growth of containerized picea mariana and picea glauca seedlings",1995,"Scandinavian Journal of Forest Research","","","https://www.scopus.com/inward/citedby.uri?partnerID=HzOxMe3b&scp=0029152603&origin=inward",159,"2024-07-12 10:46:10","Article","10.1080/02827589509382882","0282-7581","https://api.elsevier.com/content/abstract/scopus_id/0029152603",10,1,176,183,11,0.38,11,1,29,"","",""
10,"J.R. Bannister","Shrub influences on seedling performance when restoring the slow-growing conifer Pilgerodendron uviferum in southern bog forests",2020,"Restoration Ecology","","","https://www.scopus.com/inward/citedby.uri?partnerID=HzOxMe3b&scp=85076772013&origin=inward",160,"2024-07-12 10:46:10","Article","10.1111/rec.13090","1061-2971","https://api.elsevier.com/content/abstract/scopus_id/85076772013",28,2,396,407,10,2.50,10,1,4,"","",""
10,"A. Noble","Impacts of prescribed burning on Sphagnum mosses in a long-Term peatland field experiment",2018,"PLoS ONE","","","https://www.scopus.com/inward/citedby.uri?partnerID=HzOxMe3b&scp=85055915431&origin=inward",161,"2024-07-12 10:46:10","Article","10.1371/journal.pone.0206320","1932-6203","https://api.elsevier.com/content/abstract/scopus_id/85055915431",13,11,,,10,1.67,10,1,6,"","",""
10,"G. Préfontaine","Variation in stand density, black spruce individual growth and plant community following 20 years of drainage in post-harvest boreal peatlands",2017,"Forest Ecology and Management","","https://api.elsevier.com/content/article/eid/1-s2.0-S0378112717301603","https://www.scopus.com/inward/citedby.uri?partnerID=HzOxMe3b&scp=85020845205&origin=inward",162,"2024-07-12 10:46:10","Article","10.1016/j.foreco.2017.06.029","0378-1127","https://api.elsevier.com/content/abstract/scopus_id/85020845205",400,,321,331,10,1.43,10,1,7,"","",""
10,"H. Genet","Growth responses of Sphagnum hollows to a growing season lengthening manipulation in Alaskan Arctic tundra",2013,"Polar Biology","","","https://www.scopus.com/inward/citedby.uri?partnerID=HzOxMe3b&scp=84871431197&origin=inward",163,"2024-07-12 10:46:10","Article","10.1007/s00300-012-1236-x","0722-4060","https://api.elsevier.com/content/abstract/scopus_id/84871431197",36,1,41,50,10,0.91,10,1,11,"","",""
10,"R. Laiho","Moss production in a boreal, forestry-drained peatland",2011,"Boreal Environment Research","","","https://www.scopus.com/inward/citedby.uri?partnerID=HzOxMe3b&scp=80054110820&origin=inward",164,"2024-07-12 10:46:10","Article","","1239-6095","https://api.elsevier.com/content/abstract/scopus_id/80054110820",16,5,441,449,10,0.77,10,1,13,"","",""
10,"S.F. Alsharari","Evaluation of drought tolerance of potato cultivars under greenhouse conditions",2007,"Acta Horticulturae","","","https://www.scopus.com/inward/citedby.uri?partnerID=HzOxMe3b&scp=70449380329&origin=inward",165,"2024-07-12 10:46:10","Conference Paper","10.17660/ActaHortic.2007.747.5","0567-7572","https://api.elsevier.com/content/abstract/scopus_id/70449380329",747,,67,74,10,0.59,10,1,17,"","",""
10,"O.M. Sawan","The effect of different growing media on cucumber seedling production, fruit yield and quality under greenhouse conditions",1999,"Acta Horticulturae","","","https://www.scopus.com/inward/citedby.uri?partnerID=HzOxMe3b&scp=20044362283&origin=inward",166,"2024-07-12 10:46:10","Conference Paper","10.17660/ActaHortic.1999.491.57","0567-7572","https://api.elsevier.com/content/abstract/scopus_id/20044362283",491,,369,376,10,0.40,10,1,25,"","",""
10,"T. Johansson","Sucker production from root cuttings of populus tremula in relation to growing conditions",1988,"Scandinavian Journal of Forest Research","","","https://www.scopus.com/inward/citedby.uri?partnerID=HzOxMe3b&scp=0343767055&origin=inward",167,"2024-07-12 10:46:10","Article","10.1080/02827588809382497","0282-7581","https://api.elsevier.com/content/abstract/scopus_id/0343767055",3,1,75,82,10,0.28,10,1,36,"","",""
10,"V.I. Lohr","Mulching reduces water use of containerized plants",2001,"HortTechnology","","","https://www.scopus.com/inward/citedby.uri?partnerID=HzOxMe3b&scp=0035726802&origin=inward",168,"2024-07-12 10:46:10","Article","10.21273/horttech.11.2.277","1063-0198","https://api.elsevier.com/content/abstract/scopus_id/0035726802",11,2,277,278,10,0.43,10,1,23,"","",""
10,"S.A. Harris","Palsa formation in floating peat and related vegetation cover as illustrated by a fen bog in the MacMillan Pass, Yukon Territory, Canada",1992,"Geografiska Annaler, Series A","","","https://www.scopus.com/inward/citedby.uri?partnerID=HzOxMe3b&scp=0027020564&origin=inward",169,"2024-07-12 10:46:10","Article","10.1080/04353676.1992.11880375","","https://api.elsevier.com/content/abstract/scopus_id/0027020564",74,4,349,362,10,0.31,10,1,32,"","",""
9,"R.J.M. Temmink","Overcoming establishment thresholds for peat mosses in human-made bog pools",2021,"Ecological Applications","","","https://www.scopus.com/inward/citedby.uri?partnerID=HzOxMe3b&scp=85107005859&origin=inward",170,"2024-07-12 10:46:10","Article","10.1002/eap.2359","1051-0761","https://api.elsevier.com/content/abstract/scopus_id/85107005859",31,6,,,9,3.00,9,1,3,"","",""
9,"A.T. Paraskevopoulou","Plant growth of Atriplex portulacoides affected by irrigation amount and substrate type in an extensive green roof system",2021,"Ecological Engineering","","https://api.elsevier.com/content/article/eid/1-s2.0-S0925857421000781","https://www.scopus.com/inward/citedby.uri?partnerID=HzOxMe3b&scp=85103686922&origin=inward",171,"2024-07-12 10:46:10","Article","10.1016/j.ecoleng.2021.106223","0925-8574","https://api.elsevier.com/content/abstract/scopus_id/85103686922",165,,,,9,3.00,9,1,3,"","",""
9,"B. Lafleur","Silviculture to sustain productivity in black spruce paludified forests",2016,"Forest Ecology and Management","","https://api.elsevier.com/content/article/eid/1-s2.0-S0378112716302833","https://www.scopus.com/inward/citedby.uri?partnerID=HzOxMe3b&scp=84973334789&origin=inward",172,"2024-07-12 10:46:10","Article","10.1016/j.foreco.2016.05.037","0378-1127","https://api.elsevier.com/content/abstract/scopus_id/84973334789",375,,172,181,9,1.13,9,1,8,"","",""
9,"S. Rehell","Young successional stages of aapa mires on the land uplift coast of northern Ostrobothnia, Finland",2009,"Suo","","","https://www.scopus.com/inward/citedby.uri?partnerID=HzOxMe3b&scp=77649118971&origin=inward",173,"2024-07-12 10:46:10","Article","","0039-5471","https://api.elsevier.com/content/abstract/scopus_id/77649118971",60,1,1,22,9,0.60,9,1,15,"","",""
9,"O. Nagata","Effect of Sasa invasion on global warming potential in Sphagnum dominated poor fen in Bibai, Japan",2005,"Phyton - Annales Rei Botanicae","","","https://www.scopus.com/inward/citedby.uri?partnerID=HzOxMe3b&scp=31544479591&origin=inward",174,"2024-07-12 10:46:10","Conference Paper","","0079-2047","https://api.elsevier.com/content/abstract/scopus_id/31544479591",45,4,299,307,9,0.47,9,1,19,"","",""
9,"K.W. Pomper","Growth enhancement of container-grown pawpaw seedlings as influenced by media type, root-zone temperature, and fertilization regime",2002,"HortScience","","","https://www.scopus.com/inward/citedby.uri?partnerID=HzOxMe3b&scp=0036102066&origin=inward",175,"2024-07-12 10:46:10","Article","10.21273/hortsci.37.2.329","0018-5345","https://api.elsevier.com/content/abstract/scopus_id/0036102066",37,2,329,333,9,0.41,9,1,22,"","",""
8,"Y.D. Chen","Induced defense and its cost in two bryophyte species",2021,"American Journal of Botany","","","https://www.scopus.com/inward/citedby.uri?partnerID=HzOxMe3b&scp=85105046586&origin=inward",176,"2024-07-12 10:46:10","Article","10.1002/ajb2.1654","0002-9122","https://api.elsevier.com/content/abstract/scopus_id/85105046586",108,5,777,787,8,2.67,8,1,3,"","",""
