Cites,Authors,Title,Year,Source,Publisher,ArticleURL,CitesURL,GSRank,QueryDate,Type,DOI,ISSN,CitationURL,Volume,Issue,StartPage,EndPage,ECC,CitesPerYear,CitesPerAuthor,AuthorCount,Age,Abstract,FullTextURL,RelatedURL
412,"S Porembski, W Barthlott","Granitic and gneissic outcrops (inselbergs) as centers of diversity for desiccation-tolerant vascular plants",2000,"Plant Ecology","Springer","https://link.springer.com/article/10.1023/A:1026565817218","https://scholar.google.com/scholar?cites=16997466156570452542&as_sdt=2005&sciodt=2007&hl=en",1,"2024-07-16 10:22:34","","10.1023/A:1026565817218","","",,,,,412,17.17,206,2,24,"… desiccation tolerance is common in non-vascular plants, this adaptive trait is very rare in vascular plants. Desiccation-… The diversity of desiccation-tolerant species as measured by …","https://link.springer.com/content/pdf/10.1023/A:1026565817218.pdf","https://scholar.google.com/scholar?q=related:PiIbuGkh4-sJ:scholar.google.com/&scioq=%22non+vascular%22+desiccation&hl=en&as_sdt=2007"
13,"HWM Hilhorst, MCD Costa, JM Farrant","A footprint of plant desiccation tolerance. Does it exist?",2018,"Molecular plant","cell.com","https://www.cell.com/molecular-plant/fulltext/S1674-2052(18)30219-3","https://scholar.google.com/scholar?cites=4402008769848763325&as_sdt=2005&sciodt=2007&hl=en",2,"2024-07-16 10:22:34","HTML","","","",,,,,13,2.17,4,3,6,"… Protection against desiccation in such resurrection plants is constitutive. The evolution of … sequences of desiccation-tolerant plants have become available for the non-vascular moss …","https://www.cell.com/molecular-plant/fulltext/S1674-2052(18)30219-3","https://scholar.google.com/scholar?q=related:vWP9QKcTFz0J:scholar.google.com/&scioq=%22non+vascular%22+desiccation&hl=en&as_sdt=2007"
93,"F Gasulla, PG de Nova, A Esteban-Carrasco…","Dehydration rate and time of desiccation affect recovery of the lichenic algae Trebouxia erici: alternative and classical protective mechanisms",2009,"Planta","Springer","https://link.springer.com/article/10.1007/s00425-009-1019-y","https://scholar.google.com/scholar?cites=15876664598271910023&as_sdt=2005&sciodt=2007&hl=en",3,"2024-07-16 10:22:34","HTML","10.1007/s00425-009-1019-y","","",,,,,93,6.20,23,4,15,"… are based on protection during desiccation, rather than repair on rehydration (Alpert and Oliver 2002). In contrast, non-vascular resurrection plants (fully desiccation-tolerant plants) can …","https://link.springer.com/article/10.1007/s00425-009-1019-y","https://scholar.google.com/scholar?q=related:h2AEflU-VdwJ:scholar.google.com/&scioq=%22non+vascular%22+desiccation&hl=en&as_sdt=2007"
17,"G Alejo-Jacuinde, L Herrera-Estrella","Exploring the high variability of vegetative desiccation tolerance in pteridophytes",2022,"Plants","mdpi.com","https://www.mdpi.com/2223-7747/11/9/1222","https://scholar.google.com/scholar?cites=8864828558551285764&as_sdt=2005&sciodt=2007&hl=en",4,"2024-07-16 10:22:34","HTML","","","",,,,,17,8.50,9,2,2,"… of plants to tolerate drought, but also desiccation, has been of great interest because of its … to desiccation are commonly known as “resurrection plants” (vascular and non-vascular plants…","https://www.mdpi.com/2223-7747/11/9/1222","https://scholar.google.com/scholar?q=related:BAAwK5syBnsJ:scholar.google.com/&scioq=%22non+vascular%22+desiccation&hl=en&as_sdt=2007"
13,"H Harańczyk, A Casanova-Katny, M Olech…","Dehydration and freezing resistance of lichenized fungi",2017,"… adaptation strategies in …","Springer","https://link.springer.com/chapter/10.1007/978-981-10-6744-0_3","https://scholar.google.com/scholar?cites=462915233587414377&as_sdt=2005&sciodt=2007&hl=en",5,"2024-07-16 10:22:34","","10.1007/978-981-10-6744-0_3","","",,,,,13,1.86,3,4,7,"… to regulate the water loss and prevent desiccation different from the high plants which have roots… As a rule, with increasing latitude, the proportion of non-vascular plants to vascular ones …","https://scholar.google.com/scholar?output=instlink&q=info:aUUYy_OabAYJ:scholar.google.com/&hl=en&as_sdt=2007&scillfp=14128851390430010232&oi=lle","https://scholar.google.com/scholar?q=related:aUUYy_OabAYJ:scholar.google.com/&scioq=%22non+vascular%22+desiccation&hl=en&as_sdt=2007"
27,"B Hartard, M Cuntz, C Máguas, M Lakatos","Water isotopes in desiccating lichens",2009,"Planta","Springer","https://link.springer.com/article/10.1007/s00425-009-1038-8","https://scholar.google.com/scholar?cites=1380134204013852188&as_sdt=2005&sciodt=2007&hl=en",6,"2024-07-16 10:22:34","HTML","10.1007/s00425-009-1038-8","","",,,,,27,1.80,7,4,15,"… on isotope processes in non-vascular, poikilohydric organisms … non-vascular plants, thallus water isotopic composition was studied in various green-algal lichens exposed to desiccation…","https://link.springer.com/article/10.1007/s00425-009-1038-8","https://scholar.google.com/scholar?q=related:HLacDL84JxMJ:scholar.google.com/&scioq=%22non+vascular%22+desiccation&hl=en&as_sdt=2007"
11,"T Kampowski, S Demandt, S Poppinga…","Kinematical, Structural and Mechanical Adaptations to Desiccation in Poikilohydric Ramonda myconi (Gesneriaceae)",2018,"Frontiers in Plant …","frontiersin.org","https://www.frontiersin.org/articles/10.3389/fpls.2018.01701/full","https://scholar.google.com/scholar?cites=16655130616968855165&as_sdt=2005&sciodt=2007&hl=en",7,"2024-07-16 10:22:34","HTML","10.3389/fpls.2018.01701","","",,,,,11,1.83,3,4,6,"… of low environmental water availability, desiccation is defined as the … myconi's adaptations to desiccation also include structural … traits contribute to the desiccation tolerance of R. myconi. …","https://www.frontiersin.org/articles/10.3389/fpls.2018.01701/full","https://scholar.google.com/scholar?q=related:fT4psA3pIucJ:scholar.google.com/&scioq=%22non+vascular%22+desiccation&hl=en&as_sdt=2007"
18,"AV Perera-Castro, M Nadal…","What drives photosynthesis during desiccation? Mosses and other outliers from the photosynthesis–elasticity trade-off",2020,"Journal of Experimental …","academic.oup.com","https://academic.oup.com/jxb/article-abstract/71/20/6460/5873698","https://scholar.google.com/scholar?cites=7489474961583334706&as_sdt=2005&sciodt=2007&hl=en",8,"2024-07-16 10:22:34","","","","",,,,,18,4.50,6,3,4,"… non-vascular plants were plotted together, ε still linearly determined the cessation of net photosynthesis during desiccation … view of photosynthetic responses to desiccation and/or water …","https://academic.oup.com/jxb/article/71/20/6460/5873698","https://scholar.google.com/scholar?q=related:MmVb78v172cJ:scholar.google.com/&scioq=%22non+vascular%22+desiccation&hl=en&as_sdt=2007"
107,"P Porada, JT Van Stan, A Kleidon","Significant contribution of non-vascular vegetation to global rainfall interception",2018,"Nature Geoscience","nature.com","https://www.nature.com/articles/s41561-018-0176-7","https://scholar.google.com/scholar?cites=9068687782871084337&as_sdt=2005&sciodt=2007&hl=en",9,"2024-07-16 10:22:34","","","","",,,,,107,17.83,36,3,6,"… globally ubiquitous as their high desiccation tolerance 3,4 and … The global abundance of non-vascular vegetation in … In forests, where most terrestrial precipitation occurs, non-vascular …","https://scholar.google.com/scholar?output=instlink&q=info:Ma30lH1z2n0J:scholar.google.com/&hl=en&as_sdt=2007&scillfp=7930566205869418627&oi=lle","https://scholar.google.com/scholar?q=related:Ma30lH1z2n0J:scholar.google.com/&scioq=%22non+vascular%22+desiccation&hl=en&as_sdt=2007"
49,"B Fernández-Marín, F Míguez, JM Becerril…","Dehydration-mediated activation of the xanthophyll cycle in darkness: is it related to desiccation tolerance?",2011,"Planta","Springer","https://link.springer.com/article/10.1007/s00425-011-1420-1","https://scholar.google.com/scholar?cites=120416868351255980&as_sdt=2005&sciodt=2007&hl=en",10,"2024-07-16 10:22:34","HTML","10.1007/s00425-011-1420-1","","",,,,,49,3.77,12,4,13,"… For that purpose, we compare the operation of xanthophyll cycle in desiccation-sensitive and desiccation-tolerant species belonging to all of the main taxonomic clades. …","https://link.springer.com/article/10.1007/s00425-011-1420-1","https://scholar.google.com/scholar?q=related:rKUK94DOqwEJ:scholar.google.com/&scioq=%22non+vascular%22+desiccation&hl=en&as_sdt=2007"
62,"U Lüttge, E Beck, D Bartels","Plant desiccation tolerance",2011,"","books.google.com","https://books.google.com/books?hl=en&lr=&id=yrFG32oSWhcC&oi=fnd&pg=PR3&dq=%22non+vascular%22+desiccation&ots=d-H6zRSL3f&sig=SvD0NpK4Gsdh3IIFQEYNHnJNoGc","https://scholar.google.com/scholar?cites=16109098249400670699&as_sdt=2005&sciodt=2007&hl=en",11,"2024-07-16 10:22:34","BOOK","","","",,,,,62,4.77,21,3,13,"… Dinter recognised to be desiccation-tolerant. Focused exploration for desiccation-tolerant plants … also Sporobolus stapfianus that was recognised as a desiccation-tolerant grass in 1970. …","","https://scholar.google.com/scholar?q=related:69lkF4IDj98J:scholar.google.com/&scioq=%22non+vascular%22+desiccation&hl=en&as_sdt=2007"
0,"NS Lehde","Comparative morpho-anatomical and ecological aspects of desiccation-tolerant vascular plants",2012,"","Dissertation, Rostock, Universität …","","",12,"2024-07-16 10:22:34","CITATION","","","",,,,,0,0.00,0,1,12,"","","https://scholar.google.com/scholar?q=related:WeUZuDFD0KcJ:scholar.google.com/&scioq=%22non+vascular%22+desiccation&hl=en&as_sdt=2007"
64,"TJ Brodribb, M Carriquí, S Delzon, SAM McAdam…","Advanced vascular function discovered in a widespread moss",2020,"Nature Plants","nature.com","https://www.nature.com/articles/s41477-020-0602-x","https://scholar.google.com/scholar?cites=2781981766080286569&as_sdt=2005&sciodt=2007&hl=en",13,"2024-07-16 10:22:34","","","","",,,,,64,16.00,13,5,4,"… A transition from small, ‘non-vascular’ bryophytes to arborescent vascular plants during the … 4b) and, as a result, are not able to delay desiccation to the same extent as stomata-bearing …","https://par.nsf.gov/servlets/purl/10191639","https://scholar.google.com/scholar?q=related:aU_UOq2VmyYJ:scholar.google.com/&scioq=%22non+vascular%22+desiccation&hl=en&as_sdt=2007"
100,"JA Raven","Long‐distance transport in non‐vascular plants",2003,"Plant, Cell &Environment","Wiley Online Library","https://onlinelibrary.wiley.com/doi/abs/10.1046/j.1365-3040.2003.00920.x","https://scholar.google.com/scholar?cites=2580384851763273790&as_sdt=2005&sciodt=2007&hl=en",14,"2024-07-16 10:22:34","","10.1046/j.1365-3040.2003.00920.x","","",,,,,100,4.76,100,1,21,"… The same quantitative arguments apply to non-vascular plants … The other group of non-vascular photosynthetic organisms … The ‘non-vascular’ organisms will be dealt with in the inverse …","https://onlinelibrary.wiley.com/doi/pdf/10.1046/j.1365-3040.2003.00920.x","https://scholar.google.com/scholar?q=related:PiAm6VlezyMJ:scholar.google.com/&scioq=%22non+vascular%22+desiccation&hl=en&as_sdt=2007"
28,"AJ Matilla","The orthodox dry seeds are alive: A clear example of desiccation tolerance",2021,"Plants","mdpi.com","https://www.mdpi.com/2223-7747/11/1/20","https://scholar.google.com/scholar?cites=11749266769198975326&as_sdt=2005&sciodt=2007&hl=en",15,"2024-07-16 10:22:34","HTML","","","",,,,,28,9.33,28,1,3,"… Although the core of desiccation-tolerance responses is retained in orthodox seeds, this special adaptation is only present in the vegetative organs of non-vascular plants (ie, bryophytes…","https://www.mdpi.com/2223-7747/11/1/20","https://scholar.google.com/scholar?q=related:XgloVeDHDaMJ:scholar.google.com/&scioq=%22non+vascular%22+desiccation&hl=en&as_sdt=2007"
41,"F Gasulla, EM Del Campo, LM Casano, A Guéra","Advances in understanding of desiccation tolerance of lichens and lichen-forming algae",2021,"Plants","mdpi.com","https://www.mdpi.com/2223-7747/10/4/807","https://scholar.google.com/scholar?cites=4370052681472260123&as_sdt=2005&sciodt=2007&hl=en",16,"2024-07-16 10:22:34","HTML","","","",,,,,41,13.67,10,4,3,"… The psbS protein also belongs to the Lhc family, but it does not bind pigments [36] and has been detected in vascular and non-vascular plants, but its presence in microalgae has been …","https://www.mdpi.com/2223-7747/10/4/807","https://scholar.google.com/scholar?q=related:G7jloMKLpTwJ:scholar.google.com/&scioq=%22non+vascular%22+desiccation&hl=en&as_sdt=2007"
9,"DJ Bedford","Vascular plants",1999,"Care and Conservation of Natural History Collections; …","natsca.org","https://natsca.org/sites/default/files/publications/books/Vascular%20plants.pdf","https://scholar.google.com/scholar?cites=1840190671623924497&as_sdt=2005&sciodt=2007&hl=en",17,"2024-07-16 10:22:34","PDF","","","",,,,,9,0.36,9,1,25,"… Apart from the immediate changes of loss of water and desiccation of cell contents on drying… is commonly used for fungi (see Chapter 4 on non-vascular plants). Some aspects of freeze-…","https://natsca.org/sites/default/files/publications/books/Vascular%20plants.pdf","https://scholar.google.com/scholar?q=related:EashhaqriRkJ:scholar.google.com/&scioq=%22non+vascular%22+desiccation&hl=en&as_sdt=2007"
1,"M Braun","Rehydration from Desiccation: Evaluating the Potential for Leaf Water Absorption in X. elegans",2017,"","digitalcommons.lmu.edu","https://digitalcommons.lmu.edu/honors-thesis/143/","https://scholar.google.com/scholar?cites=392331005273290870&as_sdt=2005&sciodt=2007&hl=en",18,"2024-07-16 10:22:34","","","","",,,,,1,0.14,1,1,7,"… While the science behind the process of desiccating has been widely researched, the … of the desiccation tolerant angiosperm Xerophyta elegans. Data comparing desiccated and …","https://digitalcommons.lmu.edu/cgi/viewcontent.cgi?article=1190&context=honors-thesis","https://scholar.google.com/scholar?q=related:drive_jWcQUJ:scholar.google.com/&scioq=%22non+vascular%22+desiccation&hl=en&as_sdt=2007"
0,"IG Hnatowich, EG Lamb, KJ Stewart","Reintroducing Vascular and Non-Vascular Plants to Disturbed Arctic Sites: Investigating Turfs and Turf Fragments",2023,"Ecological Restoration","er.uwpress.org","https://er.uwpress.org/content/41/1/3.abstract","",19,"2024-07-16 10:22:34","","","","",,,,,0,0.00,0,3,1,"… transfer of non-vascular species but must be protected from wind, flooding, and desiccation. … material may improve development of early successional non-vascular communities. …","https://er.uwpress.org/content/wper/41/1/3.full.pdf","https://scholar.google.com/scholar?q=related:7m4tZHuZR2QJ:scholar.google.com/&scioq=%22non+vascular%22+desiccation&hl=en&as_sdt=2007"
10,"C Atala","Water transport and gas exchange in the non-vascular plant Dendroligotrichum dendroides (Brid. ex Hedw.) Broth.(Polytrichaceae, Bryophyta)",2011,"Gayana Botánica","revistas.udec.cl","http://revistas.udec.cl/index.php/gayana_botanica/article/view/4393","https://scholar.google.com/scholar?cites=6356895650656203023&as_sdt=2005&sciodt=2007&hl=en",20,"2024-07-16 10:22:34","","","","",,,,,10,0.77,10,1,13,"… This non-vascular plant has an organized conducting tissue with high specific hydraulic conductivity. In the field this plant could functionally behave as a vascular plant, competing and …","https://revistas.udec.cl/index.php/gayana_botanica/article/download/4393/4265","https://scholar.google.com/scholar?q=related:D7GW--k6OFgJ:scholar.google.com/&scioq=%22non+vascular%22+desiccation&hl=en&as_sdt=2007"
10,"M López-Pozo, F Gasulla, JI García-Plazaola…","Unraveling metabolic mechanisms behind chloroplast desiccation tolerance: Chlorophyllous fern spore as a new promising unicellular model",2019,"Plant Science","Elsevier","https://www.sciencedirect.com/science/article/pii/S0168945218308859","https://scholar.google.com/scholar?cites=2628544546076558895&as_sdt=2005&sciodt=2007&hl=en",21,"2024-07-16 10:22:34","","","","",,,,,10,2.00,3,4,5,"… In addition, both DS and DT generations are observed in their life cycle, as a mixture between vascular and non-vascular plants [44]. Thus, DT is considered to be common in fern …","https://scholar.google.com/scholar?output=instlink&q=info:LwYviVZ3eiQJ:scholar.google.com/&hl=en&as_sdt=2007&scillfp=981058782028400918&oi=lle","https://scholar.google.com/scholar?q=related:LwYviVZ3eiQJ:scholar.google.com/&scioq=%22non+vascular%22+desiccation&hl=en&as_sdt=2007"
122,"DF Gaff","Desiccation tolerant plants in South America",1987,"Oecologia","Springer","https://link.springer.com/article/10.1007/BF00377357","https://scholar.google.com/scholar?cites=17388949815086095001&as_sdt=2005&sciodt=2007&hl=en",22,"2024-07-16 10:22:34","","10.1007/BF00377357","","",,,,,122,3.30,122,1,37,"… Voucher specimens of all plants found to be desiccation tolerant were deposited in the appropriate … , were also found to be desiccation tolerant. Nonvascular plants were not examined. …","https://www.jstor.org/stable/pdf/4218442.pdf","https://scholar.google.com/scholar?q=related:mRpN6bn1UfEJ:scholar.google.com/&scioq=%22non+vascular%22+desiccation&hl=en&as_sdt=2007"
35,"MY Bader, T Reich, S Wagner…","Differences in desiccation tolerance do not explain altitudinal distribution patterns of tropical bryophytes",2013,"Journal of …","Taylor &Francis","https://www.tandfonline.com/doi/abs/10.1179/1743282012Y.0000000033","https://scholar.google.com/scholar?cites=7303933924450527017&as_sdt=2005&sciodt=2007&hl=en",23,"2024-07-16 10:22:34","","10.1179/1743282012Y.0000000033","","",,,,,35,3.18,9,4,11,"… the desiccation tolerance, as maximum duration of desiccation tolerated, of … desiccation tolerance has previously been studied in tropical bryophytes addressing the level of desiccation (…","","https://scholar.google.com/scholar?q=related:KWfM1TTJXGUJ:scholar.google.com/&scioq=%22non+vascular%22+desiccation&hl=en&as_sdt=2007"
50,"G Zotz","Altitudinal changes in diversity and abundance of non-vascular epiphytes in the tropics—an ecophysiological explanation",1999,"Selbyana","JSTOR","https://www.jstor.org/stable/41760030","https://scholar.google.com/scholar?cites=14218331477172820276&as_sdt=2005&sciodt=2007&hl=en",24,"2024-07-16 10:22:34","","","","",,,,,50,2.00,50,1,25,"… apparent unsuitability of lo tropical forest for non-vascular organisms was due to a combination … Carbon balance limits the microdistribution of Grimmia laevigata , a desiccation-tolerant …","https://www.jstor.org/stable/pdf/41760030.pdf","https://scholar.google.com/scholar?q=related:NBmkgyWpUcUJ:scholar.google.com/&scioq=%22non+vascular%22+desiccation&hl=en&as_sdt=2007"
37,"M Pizarro, RA Contreras, H Köhler, GE Zúñiga","Desiccation tolerance in the Antarctic moss Sanionia uncinata",2019,"Biological Research","Springer","https://link.springer.com/article/10.1186/s40659-019-0251-6","https://scholar.google.com/scholar?cites=6622775386748679302&as_sdt=2005&sciodt=2007&hl=en",25,"2024-07-16 10:22:34","HTML","10.1186/s40659-019-0251-6","","",,,,,37,7.40,9,4,5,"… in non-vascular plants, the pretreatment confers desiccation tolerance to P. patens and ABI 3 is the transcription factor that responds to this hormone, when de A, B, C ABI3 genes were …","https://link.springer.com/article/10.1186/s40659-019-0251-6","https://scholar.google.com/scholar?q=related:hvRaEiDT6FsJ:scholar.google.com/&scioq=%22non+vascular%22+desiccation&hl=en&as_sdt=2007"
67,"FC Carniel, M Gerdol, A Montagner, E Banchi…","New features of desiccation tolerance in the lichen photobiont Trebouxia gelatinosa are revealed by a transcriptomic approach",2016,"Plant Molecular …","Springer","https://link.springer.com/article/10.1007/s11103-016-0468-5","https://scholar.google.com/scholar?cites=9693399711841723792&as_sdt=2005&sciodt=2007&hl=en",26,"2024-07-16 10:22:34","HTML","10.1007/s11103-016-0468-5","","",,,,,67,8.38,13,5,8,"… -terrestrial green algae and all its species are desiccation tolerant (DT). The molecular bases … a stable expression, suggesting that the desiccation tolerance of T. gelatinosa mostly relies …","https://link.springer.com/article/10.1007/s11103-016-0468-5","https://scholar.google.com/scholar?q=related:kCUzGq7fhYYJ:scholar.google.com/&scioq=%22non+vascular%22+desiccation&hl=en&as_sdt=2007"
8,"C Atala, JF Alfaro, MJ Parra, A Saldaña","Desiccation tolerance in Dendroligotrichum dendroides (Brid. ex Hedw.) Broth. from two Chilean populations with contrasting precipitation",2014,"Gayana Botánica","revistas.udec.cl","http://revistas.udec.cl/index.php/gayana_botanica/article/view/3835","https://scholar.google.com/scholar?cites=13507040635276321424&as_sdt=2005&sciodt=2007&hl=en",27,"2024-07-16 10:22:34","","","","",,,,,8,0.80,2,4,10,"… Mosses are poikilohydrous non-vascular plants, usually with some degree of desiccation tolerance… We studied desiccation tolerance and rehydration capacity on D. dendroidesfrom two …","https://revistas.udec.cl/index.php/gayana_botanica/article/download/3835/3764","https://scholar.google.com/scholar?q=related:kGJp-OSlcrsJ:scholar.google.com/&scioq=%22non+vascular%22+desiccation&hl=en&as_sdt=2007"
0,"N Mayaba","Mechanisms of desiccation tolerance in cryptogams.",2002,"","","","",28,"2024-07-16 10:22:34","CITATION","","","",,,,,0,0.00,0,1,22,"","","https://scholar.google.com/scholar?q=related:0PlHMpwnV94J:scholar.google.com/&scioq=%22non+vascular%22+desiccation&hl=en&as_sdt=2007"
1,"GF Peñaloza-Bojacá, T Vilas-Boas, JC Villarreal A…","Differential Effects of Desiccation on Hornworts with Contrasting Life Histories in Tropical Montane Forests: A Functional Trait—Based Perspective",2023,"Forests","mdpi.com","https://www.mdpi.com/1999-4907/14/2/255","https://scholar.google.com/scholar?cites=450167473254442394&as_sdt=2005&sciodt=2007&hl=en",29,"2024-07-16 10:22:34","HTML","","","",,,,,1,1.00,0,4,1,"… This is the first study to highlight these trade-offs in hornworts, in line with similar differential DT strategies reported in both vascular and non-vascular plants. Sporophytes of the desert …","https://www.mdpi.com/1999-4907/14/2/255","https://scholar.google.com/scholar?q=related:miXEjO5QPwYJ:scholar.google.com/&scioq=%22non+vascular%22+desiccation&hl=en&as_sdt=2007"
0,"H Cui, S Chen, H Song, Z Liu, J Chen…","Contrasting mechanisms of non‐vascular and vascular plants on spatial turnover in multifunctionality in the Antarctic continent",2024,"Journal of …","Wiley Online Library","https://besjournals.onlinelibrary.wiley.com/doi/abs/10.1111/1365-2745.14346","",30,"2024-07-16 10:22:34","","10.1111/1365-2745.14346","","",,,,,0,0.00,0,6,1,"… We observed that non- vascular plants had significant effects on the spatial heterogeneity of … Contrasting assembly processes in a bacterial metacommunity along a desiccation gradient…","","https://scholar.google.com/scholar?q=related:_3BefUN1wJUJ:scholar.google.com/&scioq=%22non+vascular%22+desiccation&hl=en&as_sdt=2007"
75,"L Song, WY Liu, NM Nadkarni","Response of non-vascular epiphytes to simulated climate change in a montane moist evergreen broad-leaved forest in southwest China",2012,"Biological Conservation","Elsevier","https://www.sciencedirect.com/science/article/pii/S000632071200184X","https://scholar.google.com/scholar?cites=762010668719444664&as_sdt=2005&sciodt=2007&hl=en",31,"2024-07-16 10:22:34","HTML","","","",,,,,75,6.25,25,3,12,"… Non-vascular epiphytes in this forest type respond much more rapidly to changes in water availability than terrestrial trees. The non-vascular … Non-vascular epiphyte species may be …","https://www.sciencedirect.com/science/article/pii/S000632071200184X","https://scholar.google.com/scholar?q=related:uJIUeKo0kwoJ:scholar.google.com/&scioq=%22non+vascular%22+desiccation&hl=en&as_sdt=2007"
2,"G Berro, R Ramos, C Joly, S Vieira","The potential of non-vascular epiphytes in water storage in the Montane Atlantic Forest",2022,"Environmental Sciences …","mdpi.com","https://www.mdpi.com/2673-4931/22/1/3","https://scholar.google.com/scholar?cites=16904732750866126026&as_sdt=2005&sciodt=2007&hl=en",32,"2024-07-16 10:22:34","HTML","","","",,,,,2,1.00,1,4,2,"… are subject to higher humidity and lower desiccation conditions due to the occurrence of low … conditions that contribute to the survival of non-vascular epiphytes [24]. Tree stems of up to …","https://www.mdpi.com/2673-4931/22/1/3","https://scholar.google.com/scholar?q=related:ypRJLt-smeoJ:scholar.google.com/&scioq=%22non+vascular%22+desiccation&hl=en&as_sdt=2007"
6,"A Orekhova, M Barták, J Hájek, J Morkusová","Species-specific responses of spectral reflectance and the photosynthetic characteristics in two selected Antarctic mosses to thallus desiccation",2022,"Acta Physiologiae …","Springer","https://link.springer.com/article/10.1007/s11738-021-03339-6","https://scholar.google.com/scholar?cites=14425596763835175433&as_sdt=2005&sciodt=2007&hl=en",33,"2024-07-16 10:22:34","HTML","10.1007/s11738-021-03339-6","","",,,,,6,3.00,2,4,2,"… In addition to lichens, mosses are dominant components of non-vascular flora in the Polar Regions, based on their ability to cope with a variety of harsh conditions. Due to their …","https://link.springer.com/article/10.1007/s11738-021-03339-6","https://scholar.google.com/scholar?q=related:CZJrndMDMsgJ:scholar.google.com/&scioq=%22non+vascular%22+desiccation&hl=en&as_sdt=2007"
