Cites,Authors,Title,Year,Source,Publisher,ArticleURL,CitesURL,GSRank,QueryDate,Type,DOI,ISSN,CitationURL,Volume,Issue,StartPage,EndPage,ECC,CitesPerYear,CitesPerAuthor,AuthorCount,Age,Abstract,FullTextURL,RelatedURL
20,"A Moghtaderi, M Taghavi, R Rezaei","Cyanobacteria in biological soil crust of Chadormalu area, Bafq region in central Iran",2009,"Pakistan Journal of Nutrition","Citeseer","https://citeseerx.ist.psu.edu/document?repid=rep1&type=pdf&doi=1dde3e46bf1f9b2af68e46392c59c46e91cd6adc","https://scholar.google.com/scholar?cites=12787837704172564063&as_sdt=2005&sciodt=2007&hl=en",259,"2024-07-16 10:22:34","PDF","","","",,,,,20,1.33,7,3,15,"… The absence of a dense distribution of macrophytes (higher plants), much of arid and semi-arid surfaces are covered by microphytic communities of small non-vascular plants. An …","https://citeseerx.ist.psu.edu/document?repid=rep1&type=pdf&doi=1dde3e46bf1f9b2af68e46392c59c46e91cd6adc","https://scholar.google.com/scholar?q=related:X26NmqOGd7EJ:scholar.google.com/&scioq=%22non+vascular%22+desiccation&hl=en&as_sdt=2007"
2,"L Číhal","Bryophytes in a Changing World: Understanding Distribution Patterns, Risks, and Conservation",2023,"Diversity","mdpi.com","https://www.mdpi.com/1424-2818/15/5/647","https://scholar.google.com/scholar?cites=12307158972551397362&as_sdt=2005&sciodt=2007&hl=en",260,"2024-07-16 10:22:34","HTML","","","",,,,,2,2.00,2,1,1,"… Bryophytes are a group of small, non-vascular plants that include … are known to have high levels of desiccation tolerance [6], as … and increased susceptibility to desiccation stress [7]. …","https://www.mdpi.com/1424-2818/15/5/647","https://scholar.google.com/scholar?q=related:8v8vIeHPy6oJ:scholar.google.com/&scioq=%22non+vascular%22+desiccation&hl=en&as_sdt=2007"
19,"X Liu, Y Zhang, H Yang, Y Liang, X Li…","Functional Aspects of Early Light-Induced Protein (ELIP) Genes from the Desiccation-Tolerant Moss Syntrichia caninervis",2020,"International Journal of …","mdpi.com","https://www.mdpi.com/1422-0067/21/4/1411","https://scholar.google.com/scholar?cites=14797985969379412769&as_sdt=2005&sciodt=2007&hl=en",261,"2024-07-16 10:22:34","HTML","","","",,,,,19,4.75,3,6,4,"… ScELIP1 has close primary amino acid sequence similarity to the ELIPs of the non-vascular … the observation that the genomes of desiccation tolerant plants are rich in ELIP genes [33]. …","https://www.mdpi.com/1422-0067/21/4/1411","https://scholar.google.com/scholar?q=related:IQsTCNYBXc0J:scholar.google.com/&scioq=%22non+vascular%22+desiccation&hl=en&as_sdt=2007"
25,"S Im, HN Lee, HS Jung, S Yang, EJ Park…","Transcriptome-based identification of the desiccation response genes in marine red algae Pyropia tenera (Rhodophyta) and enhancement of abiotic stress …",2017,"Marine …","Springer","https://link.springer.com/article/10.1007/s10126-017-9744-x","https://scholar.google.com/scholar?cites=1042031328937708953&as_sdt=2005&sciodt=2007&hl=en",262,"2024-07-16 10:22:34","HTML","10.1007/s10126-017-9744-x","","",,,,,25,3.57,4,6,7,"… tenera have developed a variety of strategies and mechanisms to survive under such desiccation stress conditions. Strategies for desiccation tolerance are common in non-vascular …","https://link.springer.com/article/10.1007/s10126-017-9744-x","https://scholar.google.com/scholar?q=related:mQ0pBvkJdg4J:scholar.google.com/&scioq=%22non+vascular%22+desiccation&hl=en&as_sdt=2007"
60,"S Wagner, MY Bader, G Zotz","Physiological ecology of tropical bryophytes",2014,"Photosynthesis in bryophytes and early land …","Springer","https://link.springer.com/chapter/10.1007/978-94-007-6988-5_15","https://scholar.google.com/scholar?cites=10377265045484087592&as_sdt=2005&sciodt=2007&hl=en",263,"2024-07-16 10:22:34","","10.1007/978-94-007-6988-5_15","","",,,,,60,6.00,20,3,10,"… our contribution with a short outlook on the particular fate of tropical non-vascular epiphytes. … Recovery from desiccation becomes slower and less complete as the desiccation period …","http://ndl.ethernet.edu.et/bitstream/123456789/73989/1/440.pdf.pdf#page=289","https://scholar.google.com/scholar?q=related:KCko6JNzA5AJ:scholar.google.com/&scioq=%22non+vascular%22+desiccation&hl=en&as_sdt=2007"
0,"F Lei, Y Liang, R Yang, Q Yang, W Bai, F Yin…","ScbZIP1 positively regulates desiccation tolerance of desert moss Syntrichia caninervis by ROS scavenging and photosynthesis pathways",2024,"Environmental and …","Elsevier","https://www.sciencedirect.com/science/article/pii/S0098847224001758","",264,"2024-07-16 10:22:34","","","","",,,,,0,0.00,0,7,1,"… are very few studies on the bZIP genes in non-vascular plants, and the research on DT … The purpose of the study is that to verify the DT function of a desiccation-inducible bZIP gene…","","https://scholar.google.com/scholar?q=related:0s9wj1rZbtIJ:scholar.google.com/&scioq=%22non+vascular%22+desiccation&hl=en&as_sdt=2007"
7,"JG Duckett, S Pressel","Of mosses and vascular plants",2020,"Nature Plants","nature.com","https://www.nature.com/articles/s41477-020-0619-1","https://scholar.google.com/scholar?cites=13403826699435540568&as_sdt=2005&sciodt=2007&hl=en",265,"2024-07-16 10:22:34","","","","",,,,,7,1.75,4,2,4,"… hydroid system in the large, widespread ‘non-vascular’ moss Polytrichum commune (Fig. 1a) … experience desiccation, while the rhizoid pegs enable recovery from desiccation on a par …","https://www.academia.edu/download/100488224/s41477-020-0619-120230331-1-3n91ed.pdf","https://scholar.google.com/scholar?q=related:WIDA2l31A7oJ:scholar.google.com/&scioq=%22non+vascular%22+desiccation&hl=en&as_sdt=2007"
42,"M Mallen-Cooper, DJ Eldridge","Laboratory-based techniques for assessing the functional traits of biocrusts",2016,"Plant and Soil","Springer","https://link.springer.com/article/10.1007/s11104-016-2870-9","https://scholar.google.com/scholar?cites=10206035794664903456&as_sdt=2005&sciodt=2007&hl=en",266,"2024-07-16 10:22:34","HTML","10.1007/s11104-016-2870-9","","",,,,,42,5.25,21,2,8,"… The functional traits of vascular plants are well-documented but those of non-vascular plants … than their dormant, desiccated state, which is their predominant condition in our study area. …","https://link.springer.com/article/10.1007/s11104-016-2870-9","https://scholar.google.com/scholar?q=related:IFPsOXsfo40J:scholar.google.com/&scioq=%22non+vascular%22+desiccation&hl=en&as_sdt=2007"
50,"H Yin, HB Guo, DJ Weston, AM Borland, P Ranjan…","Diel rewiring and positive selection of ancient plant proteins enabled evolution of CAM photosynthesis in Agave",2018,"BMC genomics","Springer","https://link.springer.com/article/10.1186/s12864-018-4964-7","https://scholar.google.com/scholar?cites=13687699766213685575&as_sdt=2005&sciodt=2007&hl=en",267,"2024-07-16 10:22:34","HTML","10.1186/s12864-018-4964-7","","",,,,,50,8.33,8,6,6,"… We showed that the core metabolic components required for CAM are shared by non-vascular plants, but regulatory proteins involved in re-reprogramming of carbon fixation and …","https://link.springer.com/article/10.1186/s12864-018-4964-7","https://scholar.google.com/scholar?q=related:RzFdtWp69L0J:scholar.google.com/&scioq=%22non+vascular%22+desiccation&hl=en&as_sdt=2007"
31,"JA Raven, JD Lawson","Comparative physiology of plant and arthropod land adaptation",1985,"… of the Royal Society of London …","royalsocietypublishing.org","https://royalsocietypublishing.org/doi/abs/10.1098/rstb.1985.0087","https://scholar.google.com/scholar?cites=4120818112997740331&as_sdt=2005&sciodt=2007&hl=en",268,"2024-07-16 10:22:34","","10.1098/rstb.1985.0087","","",,,,,31,0.79,16,2,39,"… (that is, the mainly desiccation-intolerant vascular plant sporophytes, and arthropods, rather than the frequently desiccation-tolerant non-vascular land plants and nematodes, rotifers …","https://www.jstor.org/stable/pdf/2396368.pdf","https://scholar.google.com/scholar?q=related:K885oT0WMDkJ:scholar.google.com/&scioq=%22non+vascular%22+desiccation&hl=en&as_sdt=2007"
16,"AM Linde, DM Eklund, N Cronberg, JL Bowman…","Rates and patterns of molecular evolution in bryophyte genomes, with focus on complex thalloid liverworts, Marchantiopsida",2021,"Molecular Phylogenetics …","Elsevier","https://www.sciencedirect.com/science/article/pii/S1055790321002281","https://scholar.google.com/scholar?cites=13066319016537026697&as_sdt=2005&sciodt=2007&hl=en",269,"2024-07-16 10:22:34","HTML","","","",,,,,16,5.33,3,5,3,"… Plants commonly referred to as “bryophytes” belong to three major lineages of non-vascular plants: … for desiccation and data indicated that some bryophyte species with low desiccation …","https://www.sciencedirect.com/science/article/pii/S1055790321002281","https://scholar.google.com/scholar?q=related:ifCezurjVLUJ:scholar.google.com/&scioq=%22non+vascular%22+desiccation&hl=en&as_sdt=2007"
535,"JHC Cornelissen, SI Lang, NA Soudzilovskaia…","Comparative cryptogam ecology: a review of bryophyte and lichen traits that drive biogeochemistry",2007,"Annals of …","academic.oup.com","https://academic.oup.com/aob/article-abstract/99/5/987/2769322","https://scholar.google.com/scholar?cites=9615171266348572679&as_sdt=2005&sciodt=2007&hl=en",270,"2024-07-16 10:22:34","","","","",,,,,535,31.47,134,4,17,"… Very little is known about the role and applicability of functional traits of non-vascular cryptogams, particularly bryophytes and lichens, with respect to biogeochemical cycling. Yet these …","https://academic.oup.com/aob/article/99/5/987/2769322","https://scholar.google.com/scholar?q=related:B-A_yVLzb4UJ:scholar.google.com/&scioq=%22non+vascular%22+desiccation&hl=en&as_sdt=2007"
26,"G Barker, RDH Boyd, SW D'Souza, P Donnai, H Fox…","Placental water content and distribution",1994,"Placenta","Elsevier","https://www.sciencedirect.com/science/article/pii/S0143400405802358","https://scholar.google.com/scholar?cites=3187368657128828570&as_sdt=2005&sciodt=2007&hl=en",271,"2024-07-16 10:22:34","","","","",,,,,26,0.87,4,6,30,"… placenta was measured by desiccation to constant weight. This water content was fractionated into fetal and maternal vascular compartments and non-vascular extracellular (EW) and …","https://scholar.google.com/scholar?output=instlink&q=info:mq5gAOjOOywJ:scholar.google.com/&hl=en&as_sdt=2007&scillfp=1994146529527397192&oi=lle","https://scholar.google.com/scholar?q=related:mq5gAOjOOywJ:scholar.google.com/&scioq=%22non+vascular%22+desiccation&hl=en&as_sdt=2007"
41,"RIL Smith","Summer and winter concentrations of sodium, potassium and calcium in some maritime Antarctic cryptogams",1978,"The Journal of Ecology","JSTOR","https://www.jstor.org/stable/2259302","https://scholar.google.com/scholar?cites=18278820846223098216&as_sdt=2005&sciodt=2007&hl=en",272,"2024-07-16 10:22:34","","","","",,,,,41,0.89,41,1,46,"… (8) The simple mechanism of uptake and storage of mineral-ions in these non-vascular … from low temperatures, ice abrasion or desiccation. Precipitation in summer is mainly as rainfall …","https://www.jstor.org/stable/pdf/2259302.pdf","https://scholar.google.com/scholar?q=related:aAEi3LZqq_0J:scholar.google.com/&scioq=%22non+vascular%22+desiccation&hl=en&as_sdt=2007"
70,"P Bombelli, RJ Dennis, F Felder…","Electrical output of bryophyte microbial fuel cell systems is sufficient to power a radio or an environmental sensor",2016,"Royal Society …","royalsocietypublishing.org","https://royalsocietypublishing.org/doi/abs/10.1098/rsos.160249","https://scholar.google.com/scholar?cites=11878650117234565684&as_sdt=2005&sciodt=2007&hl=en",273,"2024-07-16 10:22:34","","10.1098/rsos.160249","","",,,,,70,8.75,18,4,8,"… been used to develop a non-vascular bryophyte microbial fuel cell (… was determined by taking the desiccated moss away from the … at room temperature for about a month for desiccation. …","https://royalsocietypublishing.org/doi/full/10.1098/rsos.160249","https://scholar.google.com/scholar?q=related:NCLriFhx2aQJ:scholar.google.com/&scioq=%22non+vascular%22+desiccation&hl=en&as_sdt=2007"
177,"G Ménot, SJ Burns","Carbon isotopes in ombrogenic peat bog plants as climatic indicators: calibration from an altitudinal transect in Switzerland",2001,"Organic Geochemistry","Elsevier","https://www.sciencedirect.com/science/article/pii/S0146638000001704","https://scholar.google.com/scholar?cites=9421259104931585131&as_sdt=2005&sciodt=2007&hl=en",274,"2024-07-16 10:22:34","","","","",,,,,177,7.70,89,2,23,"… The species selected for this study, both vascular and non-vascular plants, are those most … The non-vascular plants, all Sphagnum mosses, were chosen with regard to their micro-…","https://www.academia.edu/download/71386383/s0146-6380_2800_2900170-420211005-27417-t8h2nb.pdf","https://scholar.google.com/scholar?q=related:a5xcbj0Jv4IJ:scholar.google.com/&scioq=%22non+vascular%22+desiccation&hl=en&as_sdt=2007"
1,"I Nishida","2013 Awards for Journal of Plant Research publications",2013,"Journal of plant research","Springer","https://link.springer.com/article/10.1007/s10265-013-0589-8","https://scholar.google.com/scholar?cites=12609841769955703450&as_sdt=2005&sciodt=2007&hl=en",275,"2024-07-16 10:22:34","HTML","10.1007/s10265-013-0589-8","","",,,,,1,0.09,1,1,11,"… However, it remained unclear whether non-vascular plants respond to auxin during … the auxin model in non-vascular plants but also for the evolutionary interest of the research. …","https://link.springer.com/article/10.1007/s10265-013-0589-8","https://scholar.google.com/scholar?q=related:mroXrEco_64J:scholar.google.com/&scioq=%22non+vascular%22+desiccation&hl=en&as_sdt=2007"
3,"Å Stam, X He, U Kaasalainen, M Toivonen…","Epiphyte colonisation of fog nets in montane forests of the taita hills, Kenya",2020,"Annales Botanici …","BioOne","https://bioone.org/journals/annales-botanici-fennici/volume-57/issue-4-6/085.057.0406/Epiphyte-Colonisation-of-Fog-Nets-in-Montane-Forests-of-the/10.5735/085.057.0406.short","https://scholar.google.com/scholar?cites=17897463059975510700&as_sdt=2005&sciodt=2007&hl=en",276,"2024-07-16 10:22:34","","10.5735/085.057.0406.short","","",,,,,3,0.75,1,5,4,"… and subsequent growth of non-vascular epiphytes and result in … to study colonisation of non-vascular epiphytes as well as the … 2013: Differences in desiccation tolerance do not explain …","https://www.jstor.org/stable/pdf/27100524.pdf","https://scholar.google.com/scholar?q=related:rBqEBtSPYPgJ:scholar.google.com/&scioq=%22non+vascular%22+desiccation&hl=en&as_sdt=2007"
2,"R Emerson","Non-toxic molluscicidal, bryophoticidal and algicidal composition",2007,"US Patent App. 11/222,002","Google Patents","https://patents.google.com/patent/US20070053947A1/en","https://scholar.google.com/scholar?cites=13255925972796134404&as_sdt=2005&sciodt=2007&hl=en",277,"2024-07-16 10:22:34","","","","",,,,,2,0.12,2,1,17,"… In the case of the principal chemical control metaldehyde, when it is sunny and hot, the kill mechanism is desiccation; however under very moist conditions desiccated and apparently …","https://patentimages.storage.googleapis.com/b5/d3/aa/c2b5afe02a6661/US20070053947A1.pdf","https://scholar.google.com/scholar?q=related:BFRjeXCC9rcJ:scholar.google.com/&scioq=%22non+vascular%22+desiccation&hl=en&as_sdt=2007"
12,"K Kieran, TL Hall, JE Parsons, JS Wolf Jr…","Exploring the acoustic parameter space in ultrasound therapy: Defining the threshold for cavitational effects",2007,"AIP Conference …","pubs.aip.org","https://pubs.aip.org/aip/acp/article-abstract/911/1/185/658477","https://scholar.google.com/scholar?cites=12865095417201879215&as_sdt=2005&sciodt=2007&hl=en",278,"2024-07-16 10:22:34","","","","",,,,,12,0.71,2,5,17,"… evidence of blanching), desiccated (significant blanching and intralesional desiccation), mixed (… First, it is difficult to model the effects of vascular and non-vascular heat sinks in ex vivo …","","https://scholar.google.com/scholar?q=related:r-jSpx4AirIJ:scholar.google.com/&scioq=%22non+vascular%22+desiccation&hl=en&as_sdt=2007"
110,"A Desiro, JG Duckett, S Pressel…","Fungal symbioses in hornworts: a chequered history",2013,"… of the Royal …","royalsocietypublishing.org","https://royalsocietypublishing.org/doi/abs/10.1098/rspb.2013.0207","https://scholar.google.com/scholar?cites=2396922964608096770&as_sdt=2005&sciodt=2007&hl=en",279,"2024-07-16 10:22:34","","10.1098/rspb.2013.0207","","",,,,,110,10.00,28,4,11,"… Owing to a recent report of other fungi in some non-vascular plants, here we investigate the fungi associated with diverse hornworts worldwide, using electron microscopy and molecular …","https://royalsocietypublishing.org/doi/full/10.1098/rspb.2013.0207","https://scholar.google.com/scholar?q=related:Ahpxo7yUQyEJ:scholar.google.com/&scioq=%22non+vascular%22+desiccation&hl=en&as_sdt=2007"
0,"IPR Buyens, MJ Raath‐Krüger…","Fine‐scale variation in the effect of the cushion plant Azorella selago on vascular plants, mosses, hepatics and lichens in the sub‐Antarctic",2023,"Journal of …","Wiley Online Library","https://onlinelibrary.wiley.com/doi/abs/10.1111/jvs.13200","",280,"2024-07-16 10:22:34","","10.1111/jvs.13200","","",,,,,0,0.00,0,3,1,"… than five occurrences), only two non-vascular species were found to occur exclusively only on cushion plants. In contrast, 12 non-vascular plant species occurred exclusively only on the …","https://onlinelibrary.wiley.com/doi/pdfdirect/10.1111/jvs.13200","https://scholar.google.com/scholar?q=related:wPo_-K933osJ:scholar.google.com/&scioq=%22non+vascular%22+desiccation&hl=en&as_sdt=2007"
0,"R Rozzi, JJ Armesto, B Goffinet, W Buck…","FrontiersinEcology",2008,"Front Ecol …","academia.edu","https://www.academia.edu/download/30689234/Rozzi_et_al._Frontiers_2007.pdf","",281,"2024-07-16 10:22:34","PDF","","","",,,,,0,0.00,0,5,16,"… To better visualize the contrasting latitudinal patterns of vascular and non-vascular species richness, and to facilitate comparisons with other regions of South America, we define the …","https://www.academia.edu/download/30689234/Rozzi_et_al._Frontiers_2007.pdf","https://scholar.google.com/scholar?q=related:-vFKPya5D90J:scholar.google.com/&scioq=%22non+vascular%22+desiccation&hl=en&as_sdt=2007"
0,"A Tilak, S Hoyne, N Kettridge","Quantifying the Ecohydrological Controls exerted by the Near-Surface Sphagnum Peat layers overlying the Degraded Peat layer",2022,"AGU Fall Meeting Abstracts","ui.adsabs.harvard.edu","https://ui.adsabs.harvard.edu/abs/2022AGUFM.B32B..04T/abstract","",282,"2024-07-16 10:22:34","","","","",,,,,0,0.00,0,3,2,"… The Sphagnum mosses are non-vascular and rely on capillary water transport from the … stored in the hyaline cells causing moss desiccation and reduction in photosynthesis, limiting …","","https://scholar.google.com/scholar?q=related:696C-CjMJRQJ:scholar.google.com/&scioq=%22non+vascular%22+desiccation&hl=en&as_sdt=2007"
66,"M Angélica Casanova-Katny, LA Cavieres","Antarctic moss carpets facilitate growth of Deschampsia antarctica but not its survival",2012,"Polar Biology","Springer","https://link.springer.com/article/10.1007/s00300-012-1229-9","https://scholar.google.com/scholar?cites=2790270088053817963&as_sdt=2005&sciodt=2007&hl=en",283,"2024-07-16 10:22:34","HTML","10.1007/s00300-012-1229-9","","",,,,,66,5.50,33,2,12,"… However, little is known about its recruitment and interaction with non-vascular tundra plants. Although several authors propose that tolerance and/or competition should be the main …","https://link.springer.com/article/10.1007/s00300-012-1229-9","https://scholar.google.com/scholar?q=related:a4LYkdwHuSYJ:scholar.google.com/&scioq=%22non+vascular%22+desiccation&hl=en&as_sdt=2007"
270,"NM Nadkarni, R Solano","Potential effects of climate change on canopy communities in a tropical cloud forest: an experimental approach",2002,"Oecologia","Springer","https://link.springer.com/article/10.1007/s00442-002-0899-3","https://scholar.google.com/scholar?cites=4839736364059294460&as_sdt=2005&sciodt=2007&hl=en",284,"2024-07-16 10:22:34","","10.1007/s00442-002-0899-3","","",,,,,270,12.27,135,2,22,"… pulled out all of the non-vascular plants from half the mats (“… are borne out: vascular and non-vascular epiphytes will decline, … support only the most desiccationresistant epiphytes (those …","https://link.springer.com/content/pdf/10.1007/s00442-002-0899-3.pdf","https://scholar.google.com/scholar?q=related:_HpLwpQyKkMJ:scholar.google.com/&scioq=%22non+vascular%22+desiccation&hl=en&as_sdt=2007"
3,"RL Mitchell, P Kenrick, S Pressel, J Duckett…","Terrestrial surface stabilisation by modern analogues of the earliest land plants: A multi‐dimensional imaging study",2023,"…","Wiley Online Library","https://onlinelibrary.wiley.com/doi/abs/10.1111/gbi.12546","https://scholar.google.com/scholar?cites=9257591214131658312&as_sdt=2005&sciodt=2007&hl=en",285,"2024-07-16 10:22:34","","10.1111/gbi.12546","","",,,,,3,3.00,1,5,1,"… (μCT) of non-vascular liverworts (Haplomitriopsida and … for preservation and to prevent desiccation. The liverworts … under vacuum) without desiccation and collapse, which would …","https://onlinelibrary.wiley.com/doi/full/10.1111/gbi.12546","https://scholar.google.com/scholar?q=related:SD4YEimSeYAJ:scholar.google.com/&scioq=%22non+vascular%22+desiccation&hl=en&as_sdt=2007"
65,"MA Saand, YP Xu, JP Munyampundu, W Li…","Phylogeny and evolution of plant cyclic nucleotide-gated ion channel (CNGC) gene family and functional analyses of tomato CNGCs",2015,"DNA …","academic.oup.com","https://academic.oup.com/dnaresearch/article-abstract/22/6/471/2462531","https://scholar.google.com/scholar?cites=17872449718876364311&as_sdt=2005&sciodt=2007&hl=en",286,"2024-07-16 10:22:34","","","","",,,,,65,7.22,13,5,9,"… desiccation symptoms at 3 days after stopping watering, including leaf rolling and wilting, while the eGFP-control plants did not show any obvious desiccation … , the non-vascular land …","https://academic.oup.com/dnaresearch/article/22/6/471/2462531","https://scholar.google.com/scholar?q=related:F96nt1OyB_gJ:scholar.google.com/&scioq=%22non+vascular%22+desiccation&hl=en&as_sdt=2007"
0,"OCU Adumanya","The Role of Oxylipins (Phyto-Oxylipins) in Moss Development",2023,"Phyto-Oxylipins","taylorfrancis.com","https://www.taylorfrancis.com/chapters/edit/10.1201/9781003316558-12/role-oxylipins-phyto-oxylipins-moss-development-adumanya","",287,"2024-07-16 10:22:34","","10.1201/9781003316558-12","","",,,,,0,0.00,0,1,1,"… Moss is a non- vascular flowerless plant, bryophyta … extreme conditions such as desiccation and exposure to dam… leafy shoots made of a non- vascular stem with leaves, reproductive …","","https://scholar.google.com/scholar?q=related:pZ4szrRqdT8J:scholar.google.com/&scioq=%22non+vascular%22+desiccation&hl=en&as_sdt=2007"
30,"JA Raven, D Edwards","Photosynthesis in early land plants: adapting to the terrestrial environment",2013,"Photosynthesis in bryophytes and early land …","Springer","https://link.springer.com/chapter/10.1007/978-94-007-6988-5_3","https://scholar.google.com/scholar?cites=5801348698805690036&as_sdt=2005&sciodt=2007&hl=en",288,"2024-07-16 10:22:34","","10.1007/978-94-007-6988-5_3","","",,,,,30,2.73,15,2,11,"… The distribution of desiccation tolerance, desiccation intolerance, poikilohydry and homoiohydry among oxygenic photosynthetic organisms. The terms dessication tolerance, …","http://ndl.ethernet.edu.et/bitstream/123456789/73989/1/440.pdf.pdf#page=57","https://scholar.google.com/scholar?q=related:tN58mueHglAJ:scholar.google.com/&scioq=%22non+vascular%22+desiccation&hl=en&as_sdt=2007"
55,"SA Robinson, MJ Waterman","Sunsafe bryophytes: photoprotection from excess and damaging solar radiation",2013,"Photosynthesis in bryophytes and early land …","Springer","https://link.springer.com/chapter/10.1007/978-94-007-6988-5_7","https://scholar.google.com/scholar?cites=13423725549290824096&as_sdt=2005&sciodt=2007&hl=en",289,"2024-07-16 10:22:34","","10.1007/978-94-007-6988-5_7","","",,,,,55,5.00,28,2,11,"… Both vascular and non-vascular plants produce secondary metabolites that can specifically … mosses and the desiccation tolerant liverwort, with the desiccation tolerant bryophytes both …","https://ro.uow.edu.au/cgi/viewcontent.cgi?article=2299&context=smhpapers","https://scholar.google.com/scholar?q=related:oKHQ30OnSroJ:scholar.google.com/&scioq=%22non+vascular%22+desiccation&hl=en&as_sdt=2007"
66,"JK Rowntree, S Pressel, MM Ramsay…","In vitro conservation of European bryophytes",2011,"In Vitro Cellular & …","Springer","https://link.springer.com/article/10.1007/s11627-010-9326-3","https://scholar.google.com/scholar?cites=15270586500034936700&as_sdt=2005&sciodt=2007&hl=en",290,"2024-07-16 10:22:34","HTML","10.1007/s11627-010-9326-3","","",,,,,66,5.08,17,4,13,"… It initially ran until 2006, and both a living collection (tissue culture of gametophytic material), and a cryopreserved collection (of desiccated gametophytic material, encapsulated in …","https://link.springer.com/article/10.1007/s11627-010-9326-3","https://scholar.google.com/scholar?q=related:fD91xoMF7NMJ:scholar.google.com/&scioq=%22non+vascular%22+desiccation&hl=en&as_sdt=2007"
