Cites,Authors,Title,Year,Source,Publisher,ArticleURL,CitesURL,GSRank,QueryDate,Type,DOI,ISSN,CitationURL,Volume,Issue,StartPage,EndPage,ECC,CitesPerYear,CitesPerAuthor,AuthorCount,Age,Abstract,FullTextURL,RelatedURL
98,"R. Guardado-Mendoza","The role of nateglinide and repaglinide, derivatives of meglitinide, in the treatment of type 2 diabetes mellitus",2013,"Archives of Medical Science","","","https://www.scopus.com/inward/citedby.uri?partnerID=HzOxMe3b&scp=84888091849&origin=inward",177,"2024-07-24 12:54:01","Article","10.5114/aoms.2013.34991","1734-1922","https://api.elsevier.com/content/abstract/scopus_id/84888091849",9,5,936,943,98,8.91,98,1,11,"","",""
98,"Q. Peng","Uptake, Localization, and Photodynamic Effect of meso-Tetra(hydroxyphenyl)porphine and Its Corresponding Chlorin in Normal and Tumor Tissues of Mice Bearing Mammary Carcinoma",1995,"Cancer Research","","","https://www.scopus.com/inward/citedby.uri?partnerID=HzOxMe3b&scp=0029016286&origin=inward",178,"2024-07-24 12:54:01","Article","","0008-5472","https://api.elsevier.com/content/abstract/scopus_id/0029016286",55,12,2620,2626,98,3.38,98,1,29,"","",""
97,"P.J. Sims","Regulatory control of complement on blood platelets. Modulation of platelet procoagulant responses by a membrane inhibitor of the C5b-9 complex",1989,"Journal of Biological Chemistry","","","https://www.scopus.com/inward/citedby.uri?partnerID=HzOxMe3b&scp=0024800828&origin=inward",179,"2024-07-24 12:54:01","Article","","0021-9258","https://api.elsevier.com/content/abstract/scopus_id/0024800828",264,32,19228,19235,97,2.77,97,1,35,"","",""
97,"K.D. Rainsford","Mechanisms of gastrointestinal toxicity of nonsteroidal anti-inflammatory drugs",1989,"Scandinavian Journal of Gastroenterology","","","https://www.scopus.com/inward/citedby.uri?partnerID=HzOxMe3b&scp=0024306005&origin=inward",180,"2024-07-24 12:54:01","Article","10.3109/00365528909091169","0036-5521","https://api.elsevier.com/content/abstract/scopus_id/0024306005",24,,9,16,97,2.77,97,1,35,"","",""
97,"G.D. Giraud","Decreased nutrient blood flow during dopamine- and epinephrine-induced intestinal vasodilation",1984,"Journal of Pharmacology and Experimental Therapeutics","","","https://www.scopus.com/inward/citedby.uri?partnerID=HzOxMe3b&scp=0021153957&origin=inward",181,"2024-07-24 12:54:01","Article","","0022-3565","https://api.elsevier.com/content/abstract/scopus_id/0021153957",230,1,214,220,97,2.43,97,1,40,"","",""
96,"T. Salvatore","An Overview of the Cardiorenal Protective Mechanisms of SGLT2 Inhibitors",2022,"International Journal of Molecular Sciences","","","https://www.scopus.com/inward/citedby.uri?partnerID=HzOxMe3b&scp=85128093780&origin=inward",182,"2024-07-24 12:54:01","Article","10.3390/ijms23073651","1661-6596","https://api.elsevier.com/content/abstract/scopus_id/85128093780",23,7,,,96,48.00,96,1,2,"","",""
96,"N. Del Papa","Antibodies to endothelial cells in primary vasculitides mediate in vitro endothelial cytotoxicity in the presence of normal peripheral blood mononuclear cells",1992,"Clinical Immunology and Immunopathology","","https://api.elsevier.com/content/article/eid/1-s2.0-009012299290232D","https://www.scopus.com/inward/citedby.uri?partnerID=HzOxMe3b&scp=0026632718&origin=inward",183,"2024-07-24 12:54:01","Article","10.1016/0090-1229(92)90232-D","0090-1229","https://api.elsevier.com/content/abstract/scopus_id/0026632718",63,3,267,274,96,3.00,96,1,32,"","",""
96,"S.N. Gacheru","Structural and catalytic properties of copper in lysyl oxidase",1990,"Journal of Biological Chemistry","","","https://www.scopus.com/inward/citedby.uri?partnerID=HzOxMe3b&scp=0025093088&origin=inward",184,"2024-07-24 12:54:01","Article","","0021-9258","https://api.elsevier.com/content/abstract/scopus_id/0025093088",265,31,19022,19027,96,2.82,96,1,34,"","",""
96,"C. Stewart","Effect of maturation on drug disposition in pediatric patients",1987,"Clinical Pharmacy","","","https://www.scopus.com/inward/citedby.uri?partnerID=HzOxMe3b&scp=0023217333&origin=inward",185,"2024-07-24 12:54:01","Review","","0278-2677","https://api.elsevier.com/content/abstract/scopus_id/0023217333",6,7,548,564,96,2.59,96,1,37,"","",""
96,"G. DiBona","Neural regulation of renal tubular sodium reabsorption and renin secretion",1985,"Federation Proceedings","","","https://www.scopus.com/inward/citedby.uri?partnerID=HzOxMe3b&scp=0022343651&origin=inward",186,"2024-07-24 12:54:01","Review","","0014-9446","https://api.elsevier.com/content/abstract/scopus_id/0022343651",44,13,2816,2822,96,2.46,96,1,39,"","",""
95,"A.J. Hutchison","Oral phosphate binders",2009,"Kidney International","","https://api.elsevier.com/content/article/eid/1-s2.0-S0085253815538246","https://www.scopus.com/inward/citedby.uri?partnerID=HzOxMe3b&scp=64949135289&origin=inward",187,"2024-07-24 12:54:01","Article","10.1038/ki.2009.60","0085-2538","https://api.elsevier.com/content/abstract/scopus_id/64949135289",75,9,906,914,95,6.33,95,1,15,"","",""
95,"J. Oh","HIV-associated dyslipidaemia: pathogenesis and treatment",2007,"Lancet Infectious Diseases","","https://api.elsevier.com/content/article/eid/1-s2.0-S1473309907702876","https://www.scopus.com/inward/citedby.uri?partnerID=HzOxMe3b&scp=36348999732&origin=inward",188,"2024-07-24 12:54:01","Review","10.1016/S1473-3099(07)70287-6","1473-3099","https://api.elsevier.com/content/abstract/scopus_id/36348999732",7,12,787,796,95,5.59,95,1,17,"","",""
95,"M.H. Witte","Structure function relationships in the lymphatic system and implications for cancer biology",2006,"Cancer and Metastasis Reviews","","","https://www.scopus.com/inward/citedby.uri?partnerID=HzOxMe3b&scp=33745070553&origin=inward",189,"2024-07-24 12:54:01","Conference Paper","10.1007/s10555-006-8496-2","0167-7659","https://api.elsevier.com/content/abstract/scopus_id/33745070553",25,2,159,184,95,5.28,95,1,18,"","",""
94,"M. Adamič","Vascular lasers and IPLS: Guidelines for care from the European Society for Laser Dermatology (ESLD)",2007,"Journal of Cosmetic and Laser Therapy","","","https://www.scopus.com/inward/citedby.uri?partnerID=HzOxMe3b&scp=34250210519&origin=inward",190,"2024-07-24 12:54:01","Review","10.1080/14764170701280693","1476-4172","https://api.elsevier.com/content/abstract/scopus_id/34250210519",9,2,113,124,94,5.53,94,1,17,"","",""
93,"F.A.L.M. Eskens","Biologic and clinical activity of tivozanib (AV-951, KRN-951), a selective inhibitor of VEGF receptor-1, -2, and -3 tyrosine kinases, in a 4-week-on, 2-week-off schedule in patients with advanced solid tumors",2011,"Clinical Cancer Research","","","https://www.scopus.com/inward/citedby.uri?partnerID=HzOxMe3b&scp=81255128983&origin=inward",191,"2024-07-24 12:54:01","Article","10.1158/1078-0432.CCR-11-0411","1078-0432","https://api.elsevier.com/content/abstract/scopus_id/81255128983",17,22,7156,7163,93,7.15,93,1,13,"","",""
93,"M. Asghar","Renal Vein Thrombosis",2007,"European Journal of Vascular and Endovascular Surgery","","https://api.elsevier.com/content/article/eid/1-s2.0-S1078588407001840","https://www.scopus.com/inward/citedby.uri?partnerID=HzOxMe3b&scp=34347209777&origin=inward",192,"2024-07-24 12:54:01","Review","10.1016/j.ejvs.2007.02.017","1078-5884","https://api.elsevier.com/content/abstract/scopus_id/34347209777",34,2,217,223,93,5.47,93,1,17,"","",""
93,"A. Basu","New treatment options for erectile dysfunction in patients with diabetes mellitus",2004,"Drugs","","","https://www.scopus.com/inward/citedby.uri?partnerID=HzOxMe3b&scp=10344241995&origin=inward",193,"2024-07-24 12:54:01","Review","10.2165/00003495-200464230-00004","0012-6667","https://api.elsevier.com/content/abstract/scopus_id/10344241995",64,23,2667,2688,93,4.65,93,1,20,"","",""
93,"M. Zweers","Vascular endothelial growth factor in peritoneal dialysis: A longitudinal follow-up",2001,"Journal of Laboratory and Clinical Medicine","","https://api.elsevier.com/content/article/eid/1-s2.0-S002221430187267X","https://www.scopus.com/inward/citedby.uri?partnerID=HzOxMe3b&scp=0035141301&origin=inward",194,"2024-07-24 12:54:01","Article","10.1067/mlc.2001.112235","0022-2143","https://api.elsevier.com/content/abstract/scopus_id/0035141301",137,2,125,132,93,4.04,93,1,23,"","",""
93,"R. KREPLER","Immunocytochemistry of Intermediate Filament Proteins Present in Pleomorphic Adenomas of the Human Parotid Gland: Characterization of Different Cell Types in the Same Tumor",1982,"Differentiation","","https://api.elsevier.com/content/article/eid/1-s2.0-S0301468111614643","https://www.scopus.com/inward/citedby.uri?partnerID=HzOxMe3b&scp=0020328113&origin=inward",195,"2024-07-24 12:54:01","Article","10.1111/j.1432-0436.1982.tb01213.x","0301-4681","https://api.elsevier.com/content/abstract/scopus_id/0020328113",21,1,191,199,93,2.21,93,1,42,"","",""
92,"C.G. Schalkwijk","Increased accumulation of the glycoxidation product N<sup>ε</sup>- (carboxymethyl)lysine in hearts of diabetic patients: Generation and characterisation of a monoclonal anti-CML antibody",2004,"Biochimica et Biophysica Acta - Molecular and Cell Biology of Lipids","","https://api.elsevier.com/content/article/eid/1-s2.0-S1388198104000058","https://www.scopus.com/inward/citedby.uri?partnerID=HzOxMe3b&scp=2942692013&origin=inward",196,"2024-07-24 12:54:01","Review","10.1016/j.bbalip.2003.07.002","1388-1981","https://api.elsevier.com/content/abstract/scopus_id/2942692013",1636,2,82,89,92,4.60,92,1,20,"","",""
92,"P.C. Choy","Lipids and atherosclerosis",2004,"Biochemistry and Cell Biology","","","https://www.scopus.com/inward/citedby.uri?partnerID=HzOxMe3b&scp=2342653564&origin=inward",197,"2024-07-24 12:54:01","Review","10.1139/o03-085","0829-8211","https://api.elsevier.com/content/abstract/scopus_id/2342653564",82,1,212,224,92,4.60,92,1,20,"","",""
92,"F. Paulsen","The human nasolacrimal ducts.",2003,"Advances in anatomy, embryology, and cell biology","","","https://www.scopus.com/inward/citedby.uri?partnerID=HzOxMe3b&scp=18544407163&origin=inward",198,"2024-07-24 12:54:01","Review","","0301-5556","https://api.elsevier.com/content/abstract/scopus_id/18544407163",170,,,,92,4.38,92,1,21,"","",""
92,"P.A. Todd","Felodipine: A Review of the Pharmacology and Therapeutic Use of the Extended Release Formulation in Cardiovascular Disorders",1992,"Drugs","","","https://www.scopus.com/inward/citedby.uri?partnerID=HzOxMe3b&scp=0026785831&origin=inward",199,"2024-07-24 12:54:01","Article","10.2165/00003495-199244020-00008","0012-6667","https://api.elsevier.com/content/abstract/scopus_id/0026785831",44,2,251,277,92,2.88,92,1,32,"","",""
91,"G. Wu","Boron containing macromolecules and nanovehicles as delivery agents for neutron capture therapy",2006,"Anti-Cancer Agents in Medicinal Chemistry","","","https://www.scopus.com/inward/citedby.uri?partnerID=HzOxMe3b&scp=33645816753&origin=inward",200,"2024-07-24 12:54:01","Review","10.2174/187152006776119153","1871-5206","https://api.elsevier.com/content/abstract/scopus_id/33645816753",6,2,167,184,91,5.06,91,1,18,"","",""
