Cites,Authors,Title,Year,Source,Publisher,ArticleURL,CitesURL,GSRank,QueryDate,Type,DOI,ISSN,CitationURL,Volume,Issue,StartPage,EndPage,ECC,CitesPerYear,CitesPerAuthor,AuthorCount,Age,Abstract,FullTextURL,RelatedURL
454,"A. Castano","Mechanisms in photodynamic therapy: Part three - Photosensitizer pharmacokinetics, biodistribution, tumor localization and modes of tumor destruction",2005,"Photodiagnosis and Photodynamic Therapy","","https://api.elsevier.com/content/article/eid/1-s2.0-S1572100005000608","https://www.scopus.com/inward/citedby.uri?partnerID=HzOxMe3b&scp=23844473855&origin=inward",112,"2024-07-24 13:24:21","Review","10.1016/S1572-1000(05)00060-8","1572-1000","https://api.elsevier.com/content/abstract/scopus_id/23844473855",2,2,91,106,454,23.89,454,1,19,"","",""
453,"J.P. Dreier","Cortical spreading ischaemia is a novel process involved in ischaemic damage in patients with aneurysmal subarachnoid haemorrhage",2009,"Brain","","","https://www.scopus.com/inward/citedby.uri?partnerID=HzOxMe3b&scp=67650089668&origin=inward",113,"2024-07-24 13:24:21","Article","10.1093/brain/awp102","0006-8950","https://api.elsevier.com/content/abstract/scopus_id/67650089668",132,7,1866,1881,453,30.20,453,1,15,"","",""
440,"W.A. Pulsinelli","Regional cerebral blood flow and glucose metabolism following transient forebrain ischemia",1982,"Annals of Neurology","","","https://www.scopus.com/inward/citedby.uri?partnerID=HzOxMe3b&scp=0020069661&origin=inward",114,"2024-07-24 13:24:21","Article","10.1002/ana.410110510","0364-5134","https://api.elsevier.com/content/abstract/scopus_id/0020069661",11,5,499,509,440,10.48,440,1,42,"","",""
439,"M.F. Iademarco","Characterization of the promoter for vascular cell adhesion molecule-1 (VCAM-1)",1992,"Journal of Biological Chemistry","","","https://www.scopus.com/inward/citedby.uri?partnerID=HzOxMe3b&scp=0026672245&origin=inward",115,"2024-07-24 13:24:21","Article","","0021-9258","https://api.elsevier.com/content/abstract/scopus_id/0026672245",267,23,16323,16329,439,13.72,439,1,32,"","",""
438,"K.T. Khaw","Dietary Potassium and Stroke-Associated Mortality",1987,"New England Journal of Medicine","","","https://www.scopus.com/inward/citedby.uri?partnerID=HzOxMe3b&scp=0023105455&origin=inward",116,"2024-07-24 13:24:21","Article","10.1056/NEJM198701293160502","0028-4793","https://api.elsevier.com/content/abstract/scopus_id/0023105455",316,5,235,240,438,11.84,438,1,37,"","",""
436,"H.V. Vinters","Cerebral amyloid angiopathy: Incidence and complications in the aging brain. II. The distribution of amyloid vascular changes",1983,"Stroke","","","https://www.scopus.com/inward/citedby.uri?partnerID=HzOxMe3b&scp=0021075136&origin=inward",117,"2024-07-24 13:24:21","Article","10.1161/01.STR.14.6.924","0039-2499","https://api.elsevier.com/content/abstract/scopus_id/0021075136",14,6,924,928,436,10.63,436,1,41,"","",""
434,"T. Shih","Bevacizumab: An angiogenesis inhibitor for the treatment of solid malignancies",2006,"Clinical Therapeutics","","https://api.elsevier.com/content/article/eid/1-s2.0-S0149291806002852","https://www.scopus.com/inward/citedby.uri?partnerID=HzOxMe3b&scp=33845961014&origin=inward",118,"2024-07-24 13:24:21","Review","10.1016/j.clinthera.2006.11.015","0149-2918","https://api.elsevier.com/content/abstract/scopus_id/33845961014",28,11,1779,1802,434,24.11,434,1,18,"","",""
433,"A.C. Gruessner","Pancreas transplant outcomes for United States (US) and non- US cases as reported to the United Network for Organ Sharing (UNOS) and the International Prancreas Transplant Registry (IPTR) as of June 2004",2005,"Clinical Transplantation","","","https://www.scopus.com/inward/citedby.uri?partnerID=HzOxMe3b&scp=22244456740&origin=inward",119,"2024-07-24 13:24:21","Review","10.1111/j.1399-0012.2005.00378.x","0902-0063","https://api.elsevier.com/content/abstract/scopus_id/22244456740",19,4,433,455,433,22.79,433,1,19,"","",""
432,"G.J. Gasic","Platelet—tumor‐cell interactions in mice. The role of platelets in the spread of malignant disease",1973,"International Journal of Cancer","","","https://www.scopus.com/inward/citedby.uri?partnerID=HzOxMe3b&scp=0015784395&origin=inward",120,"2024-07-24 13:24:21","Article","10.1002/ijc.2910110322","0020-7136","https://api.elsevier.com/content/abstract/scopus_id/0015784395",11,3,704,718,432,8.47,432,1,51,"","",""
430,"M. Mizutani","Muller cell changes in human diabetic retinopathy",1998,"Diabetes","","","https://www.scopus.com/inward/citedby.uri?partnerID=HzOxMe3b&scp=0031594369&origin=inward",121,"2024-07-24 13:24:21","Article","10.2337/diabetes.47.3.445","0012-1797","https://api.elsevier.com/content/abstract/scopus_id/0031594369",47,3,445,449,430,16.54,430,1,26,"","",""
430,"K. Plate","Vascular endothelial growth factor and glioma angiogenesis: Coordinate induction of VEGF receptors, distribution of VEGF protein and possible In vivo regulatory mechanisms",1994,"International Journal of Cancer","","","https://www.scopus.com/inward/citedby.uri?partnerID=HzOxMe3b&scp=0028090642&origin=inward",122,"2024-07-24 13:24:21","Article","10.1002/ijc.2910590415","0020-7136","https://api.elsevier.com/content/abstract/scopus_id/0028090642",59,4,520,529,430,14.33,430,1,30,"","",""
425,"G. Galasso","An updated checklist of the vascular flora alien to Italy",2018,"Plant Biosystems","","","https://www.scopus.com/inward/citedby.uri?partnerID=HzOxMe3b&scp=85043695610&origin=inward",123,"2024-07-24 13:24:21","Article","10.1080/11263504.2018.1441197","1126-3504","https://api.elsevier.com/content/abstract/scopus_id/85043695610",152,3,556,592,425,70.83,425,1,6,"","",""
425,"C. Riva","Blood velocity and volumetric flow rate in human retinal vessels",1985,"Investigative Ophthalmology and Visual Science","","","https://www.scopus.com/inward/citedby.uri?partnerID=HzOxMe3b&scp=0021877678&origin=inward",124,"2024-07-24 13:24:21","Article","","0146-0404","https://api.elsevier.com/content/abstract/scopus_id/0021877678",26,8,1124,1132,425,10.90,425,1,39,"","",""
417,"S. Mura","Nanotheranostics for personalized medicine",2012,"Advanced Drug Delivery Reviews","","https://api.elsevier.com/content/article/eid/1-s2.0-S0169409X12002049","https://www.scopus.com/inward/citedby.uri?partnerID=HzOxMe3b&scp=84867627449&origin=inward",125,"2024-07-24 13:24:21","Review","10.1016/j.addr.2012.06.006","0169-409X","https://api.elsevier.com/content/abstract/scopus_id/84867627449",64,13,1394,1416,417,34.75,417,1,12,"","",""
417,"D. Triguero","Capillary Depletion Method for Quantification of Blood–Brain Barrier Transport of Circulating Peptides and Plasma Proteins",1990,"Journal of Neurochemistry","","","https://www.scopus.com/inward/citedby.uri?partnerID=HzOxMe3b&scp=0025295847&origin=inward",126,"2024-07-24 13:24:21","Article","10.1111/j.1471-4159.1990.tb04886.x","0022-3042","https://api.elsevier.com/content/abstract/scopus_id/0025295847",54,6,1882,1888,417,12.26,417,1,34,"","",""
417,"R.P. Barber","The origin, distribution and synaptic relationships of substance P axons in rat spinal cord",1979,"Journal of Comparative Neurology","","","https://www.scopus.com/inward/citedby.uri?partnerID=HzOxMe3b&scp=0018387774&origin=inward",127,"2024-07-24 13:24:21","Article","10.1002/cne.901840208","0021-9967","https://api.elsevier.com/content/abstract/scopus_id/0018387774",184,2,331,351,417,9.27,417,1,45,"","",""
416,"S. Li","Nanoparticles evading the reticuloendothelial system: Role of the supported bilayer",2009,"Biochimica et Biophysica Acta - Biomembranes","","https://api.elsevier.com/content/article/eid/1-s2.0-S0005273609002223","https://www.scopus.com/inward/citedby.uri?partnerID=HzOxMe3b&scp=70349542520&origin=inward",128,"2024-07-24 13:24:21","Article","10.1016/j.bbamem.2009.06.022","0005-2736","https://api.elsevier.com/content/abstract/scopus_id/70349542520",1788,10,2259,2266,416,27.73,416,1,15,"","",""
416,"C.L. Joachim","Amyloid β-protein deposition in tissues other than brain in Alzheimer's disease",1989,"Nature","","","https://www.scopus.com/inward/citedby.uri?partnerID=HzOxMe3b&scp=0024451476&origin=inward",129,"2024-07-24 13:24:21","Article","10.1038/341226a0","0028-0836","https://api.elsevier.com/content/abstract/scopus_id/0024451476",341,6239,226,230,416,11.89,416,1,35,"","",""
414,"I. Kühn","The flora of German cities is naturally species rich",2004,"Evolutionary Ecology Research","","","https://www.scopus.com/inward/citedby.uri?partnerID=HzOxMe3b&scp=17044455031&origin=inward",130,"2024-07-24 13:24:21","Article","","1522-0613","https://api.elsevier.com/content/abstract/scopus_id/17044455031",6,5,749,764,414,20.70,414,1,20,"","",""
414,"C.J. Ng","Paraoxonase-2 Is a Ubiquitously Expressed Protein with Antioxidant Properties and Is Capable of Preventing Cell-mediated Oxidative Modification of Low Density Lipoprotein",2001,"Journal of Biological Chemistry","","https://api.elsevier.com/content/article/eid/1-s2.0-S0021925819826315","https://www.scopus.com/inward/citedby.uri?partnerID=HzOxMe3b&scp=0035976903&origin=inward",131,"2024-07-24 13:24:21","Article","10.1074/jbc.M105660200","0021-9258","https://api.elsevier.com/content/abstract/scopus_id/0035976903",276,48,44444,44449,414,18.00,414,1,23,"","",""
414,"A. Gougos","Primary structure of endoglin, an RGD-containing glycoprotein of human endothelial cells",1990,"Journal of Biological Chemistry","","","https://www.scopus.com/inward/citedby.uri?partnerID=HzOxMe3b&scp=0025310515&origin=inward",132,"2024-07-24 13:24:21","Article","","0021-9258","https://api.elsevier.com/content/abstract/scopus_id/0025310515",265,15,8361,8364,414,12.18,414,1,34,"","",""
414,"P. Vadas","Role of secretory phospholipases A<inf>2</inf> in the pathobiology of disease",1986,"Laboratory Investigation","","","https://www.scopus.com/inward/citedby.uri?partnerID=HzOxMe3b&scp=0023034069&origin=inward",133,"2024-07-24 13:24:21","Review","","0023-6837","https://api.elsevier.com/content/abstract/scopus_id/0023034069",55,4,391,404,414,10.89,414,1,38,"","",""
413,"C. Nombela-Arrieta","Quantitative imaging of haematopoietic stem and progenitor cell localization and hypoxic status in the bone marrow microenvironment",2013,"Nature Cell Biology","","","https://www.scopus.com/inward/citedby.uri?partnerID=HzOxMe3b&scp=84877575509&origin=inward",134,"2024-07-24 13:24:21","Article","10.1038/ncb2730","1465-7392","https://api.elsevier.com/content/abstract/scopus_id/84877575509",15,5,533,543,413,37.55,413,1,11,"","",""
411,"C. Moran","Brain atrophy in type 2 diabetes: Regional distribution and influence on cognition",2013,"Diabetes Care","","","https://www.scopus.com/inward/citedby.uri?partnerID=HzOxMe3b&scp=84891885282&origin=inward",135,"2024-07-24 13:24:21","Article","10.2337/dc13-0143","0149-5992","https://api.elsevier.com/content/abstract/scopus_id/84891885282",36,12,4036,4042,411,37.36,411,1,11,"","",""
408,"A. Ericsson","Type 1 interleukin‐1 receptor in the rat brain: Distribution, regulation, and relationship to sites of IL‐1–induced cellular activation",1995,"Journal of Comparative Neurology","","","https://www.scopus.com/inward/citedby.uri?partnerID=HzOxMe3b&scp=0028885890&origin=inward",136,"2024-07-24 13:24:21","Article","10.1002/cne.903610410","0021-9967","https://api.elsevier.com/content/abstract/scopus_id/0028885890",361,4,681,698,408,14.07,408,1,29,"","",""
408,"J.M. Jacobs","Qualitative and quantitative morphology of human sural nerve at different ages",1985,"Brain","","","https://www.scopus.com/inward/citedby.uri?partnerID=HzOxMe3b&scp=0022368276&origin=inward",137,"2024-07-24 13:24:21","Article","10.1093/brain/108.4.897","0006-8950","https://api.elsevier.com/content/abstract/scopus_id/0022368276",108,4,897,924,408,10.46,408,1,39,"","",""
396,"T. Takeuchi","Cellular localization of membrane-type serine protease 1 and identification of protease-activated receptor-2 and single-chain urokinase-type plasminogen activator as substrates",2000,"Journal of Biological Chemistry","","https://api.elsevier.com/content/article/eid/1-s2.0-S0021925819616030","https://www.scopus.com/inward/citedby.uri?partnerID=HzOxMe3b&scp=0034714379&origin=inward",138,"2024-07-24 13:24:21","Article","10.1074/jbc.M002941200","0021-9258","https://api.elsevier.com/content/abstract/scopus_id/0034714379",275,34,26333,26342,396,16.50,396,1,24,"","",""
395,"S.C. Cortez","Experimental fluid percussion brain injury: vascular disruption and neuronal and glial alterations",1989,"Brain Research","","https://api.elsevier.com/content/article/eid/1-s2.0-0006899389911906","https://www.scopus.com/inward/citedby.uri?partnerID=HzOxMe3b&scp=0024508256&origin=inward",139,"2024-07-24 13:24:21","Article","10.1016/0006-8993(89)91190-6","0006-8993","https://api.elsevier.com/content/abstract/scopus_id/0024508256",482,2,271,282,395,11.29,395,1,35,"","",""
394,"M.A. Spassova","A common mechanism underlies stretch activation and activation of TRPC6 channels",2006,"Proceedings of the National Academy of Sciences of the United States of America","","","https://www.scopus.com/inward/citedby.uri?partnerID=HzOxMe3b&scp=33750802650&origin=inward",140,"2024-07-24 13:24:21","Article","10.1073/pnas.0606894103","0027-8424","https://api.elsevier.com/content/abstract/scopus_id/33750802650",103,44,16586,16591,394,21.89,394,1,18,"","",""
394,"P.M. Winter","Molecular imaging of angiogenesis in nascent Vx-2 rabbit tumors using a novel α<inf>v</inf>β<inf>3</inf>-targeted nanoparticle and 1.5 Tesla magnetic resonance imaging",2003,"Cancer Research","","","https://www.scopus.com/inward/citedby.uri?partnerID=HzOxMe3b&scp=0141731298&origin=inward",141,"2024-07-24 13:24:21","Article","","0008-5472","https://api.elsevier.com/content/abstract/scopus_id/0141731298",63,18,5838,5843,394,18.76,394,1,21,"","",""
388,"E.S. Huang","Rates of complications and mortality in older patients with diabetes mellitus : the diabetes and aging study",2014,"JAMA Internal Medicine","","","https://www.scopus.com/inward/citedby.uri?partnerID=HzOxMe3b&scp=84893580325&origin=inward",142,"2024-07-24 13:24:21","Article","10.1001/jamainternmed.2013.12956","2168-6106","https://api.elsevier.com/content/abstract/scopus_id/84893580325",174,2,251,258,388,38.80,388,1,10,"","",""
388,"A. McCullough","Pathophysiology of nonalcoholic steatohepatitis",2006,"Journal of Clinical Gastroenterology","","","https://www.scopus.com/inward/citedby.uri?partnerID=HzOxMe3b&scp=33748150370&origin=inward",143,"2024-07-24 13:24:21","Conference Paper","10.1097/01.mcg.0000168645.86658.22","0192-0790","https://api.elsevier.com/content/abstract/scopus_id/33748150370",40,,,,388,21.56,388,1,18,"","",""
387,"L.G. Smith","A dominant mutation in the maize homeobox gene, Knotted-1, causes its ectopic expression in leaf cells with altered fates",1992,"Development","","","https://www.scopus.com/inward/citedby.uri?partnerID=HzOxMe3b&scp=0026660721&origin=inward",144,"2024-07-24 13:24:21","Article","","0950-1991","https://api.elsevier.com/content/abstract/scopus_id/0026660721",116,1,21,30,387,12.09,387,1,32,"","",""
387,"C.M. Doerschuk","CD18-dependent and -independent mechanisms of neutrophil emigration in the pulmonary and systemic microcirculation of rabbits",1990,"Journal of Immunology","","","https://www.scopus.com/inward/citedby.uri?partnerID=HzOxMe3b&scp=0025230704&origin=inward",145,"2024-07-24 13:24:21","Article","","0022-1767","https://api.elsevier.com/content/abstract/scopus_id/0025230704",144,6,2327,2333,387,11.38,387,1,34,"","",""
386,"F. Vázquez","METH-1, a human ortholog of ADAMTS-1, and METH-2 are members of a new family of proteins with angio-inhibitory activity",1999,"Journal of Biological Chemistry","","https://api.elsevier.com/content/article/eid/1-s2.0-S0021925819652920","https://www.scopus.com/inward/citedby.uri?partnerID=HzOxMe3b&scp=0038757017&origin=inward",146,"2024-07-24 13:24:21","Article","10.1074/jbc.274.33.23349","0021-9258","https://api.elsevier.com/content/abstract/scopus_id/0038757017",274,33,23349,23357,386,15.44,386,1,25,"","",""
386,"C.J. Dunn","Metformin: A Review of its Pharmacological Properties and Therapeutic Use in Non—Insulin-Dependent Diabetes Mellitus",1995,"Drugs","","","https://www.scopus.com/inward/citedby.uri?partnerID=HzOxMe3b&scp=0028913896&origin=inward",147,"2024-07-24 13:24:21","Article","10.2165/00003495-199549050-00007","0012-6667","https://api.elsevier.com/content/abstract/scopus_id/0028913896",49,5,721,749,386,13.31,386,1,29,"","",""
385,"E.E. Smith","Cerebral microinfarcts: The invisible lesions",2012,"The Lancet Neurology","","https://api.elsevier.com/content/article/eid/1-s2.0-S1474442211703076","https://www.scopus.com/inward/citedby.uri?partnerID=HzOxMe3b&scp=84856880119&origin=inward",148,"2024-07-24 13:24:21","Review","10.1016/S1474-4422(11)70307-6","1474-4422","https://api.elsevier.com/content/abstract/scopus_id/84856880119",11,3,272,282,385,32.08,385,1,12,"","",""
384,"M. Chaffman","Diltiazem: A Review of its Pharmacological Properties and Therapeutic Efficacy",1985,"Drugs","","","https://www.scopus.com/inward/citedby.uri?partnerID=HzOxMe3b&scp=0021796829&origin=inward",149,"2024-07-24 13:24:21","Article","10.2165/00003495-198529050-00001","0012-6667","https://api.elsevier.com/content/abstract/scopus_id/0021796829",29,5,387,454,384,9.85,384,1,39,"","",""
380,"L. Seymour","Passive tumor targeting of soluble macromolecules and drug conjugates",1992,"Critical Reviews in Therapeutic Drug Carrier Systems","","","https://www.scopus.com/inward/citedby.uri?partnerID=HzOxMe3b&scp=0026694788&origin=inward",150,"2024-07-24 13:24:21","Review","","0743-4863","https://api.elsevier.com/content/abstract/scopus_id/0026694788",9,2,135,187,380,11.88,380,1,32,"","",""
380,"A.M. Emslie‐Smith","Microvascular changes in early and advanced dermatomyositis: A quantitative study",1990,"Annals of Neurology","","","https://www.scopus.com/inward/citedby.uri?partnerID=HzOxMe3b&scp=0025366230&origin=inward",151,"2024-07-24 13:24:21","Article","10.1002/ana.410270402","0364-5134","https://api.elsevier.com/content/abstract/scopus_id/0025366230",27,4,343,356,380,11.18,380,1,34,"","",""
380,"A.B. Cosimi","In vivo effects of monoclonal antibody to ICAM-1 (CD54) in nonhuman primates with renal allografts",1990,"Journal of Immunology","","","https://www.scopus.com/inward/citedby.uri?partnerID=HzOxMe3b&scp=0025341115&origin=inward",152,"2024-07-24 13:24:21","Article","","0022-1767","https://api.elsevier.com/content/abstract/scopus_id/0025341115",144,12,4604,4612,380,11.18,380,1,34,"","",""
378,"N. Klöting","Adipocyte dysfunction, inflammation and metabolic syndrome",2014,"Reviews in Endocrine and Metabolic Disorders","","","https://www.scopus.com/inward/citedby.uri?partnerID=HzOxMe3b&scp=84911971924&origin=inward",153,"2024-07-24 13:24:21","Review","10.1007/s11154-014-9301-0","1389-9155","https://api.elsevier.com/content/abstract/scopus_id/84911971924",15,4,277,287,378,37.80,378,1,10,"","",""
374,"K. Gould","Noninvasive assessment of coronary stenoses by myocardial perfusion imaging during pharmacologie coronary vasodilatation. I. Physiologic basis and experimental validation",1978,"The American Journal of Cardiology","","https://api.elsevier.com/content/article/eid/1-s2.0-0002914978901650","https://www.scopus.com/inward/citedby.uri?partnerID=HzOxMe3b&scp=0018150663&origin=inward",154,"2024-07-24 13:24:21","Article","10.1016/0002-9149(78)90165-0","0002-9149","https://api.elsevier.com/content/abstract/scopus_id/0018150663",41,2,267,278,374,8.13,374,1,46,"","",""
369,"A. Saria","Vascular protein leakage in various tissues induced by substance P, capsaicin, bradykinin, serotonin, histamine and by antigen challenge",1983,"Naunyn-Schmiedeberg's Archives of Pharmacology","","","https://www.scopus.com/inward/citedby.uri?partnerID=HzOxMe3b&scp=0020973249&origin=inward",155,"2024-07-24 13:24:21","Article","10.1007/BF00503897","0028-1298","https://api.elsevier.com/content/abstract/scopus_id/0020973249",324,3,212,218,369,9.00,369,1,41,"","",""
367,"M. Jerosch-Herold","Magnetic resonance quantification of the myocardial perfusion reserve with a Fermi function model for constrained deconvolution",1998,"Medical Physics","","","https://www.scopus.com/inward/citedby.uri?partnerID=HzOxMe3b&scp=0031906266&origin=inward",156,"2024-07-24 13:24:21","Article","10.1118/1.598163","0094-2405","https://api.elsevier.com/content/abstract/scopus_id/0031906266",25,1,73,84,367,14.12,367,1,26,"","",""
367,"A.S. Daar","The detailed distribution of HLA–A, B, C antigens in normal human organs",1984,"Transplantation","","","https://www.scopus.com/inward/citedby.uri?partnerID=HzOxMe3b&scp=0021190074&origin=inward",157,"2024-07-24 13:24:21","Article","10.1097/00007890-198409000-00018","0041-1337","https://api.elsevier.com/content/abstract/scopus_id/0021190074",38,3,287,292,367,9.18,367,1,40,"","",""
364,"M. Lee","Low glomerular filtration rate and risk of stroke: Meta-analysis",2010,"BMJ (Online)","","","https://www.scopus.com/inward/citedby.uri?partnerID=HzOxMe3b&scp=77957874980&origin=inward",158,"2024-07-24 13:24:21","Article","10.1136/bmj.c4249","1756-1833","https://api.elsevier.com/content/abstract/scopus_id/77957874980",341,7776,767,767,364,26.00,364,1,14,"","",""
364,"T. Choueiri","Risk of arterial thromboembolic events with sunitinib and sorafenib: A systematic review and meta-analysis of clinical trials",2010,"Journal of Clinical Oncology","","","https://www.scopus.com/inward/citedby.uri?partnerID=HzOxMe3b&scp=77952310126&origin=inward",159,"2024-07-24 13:24:21","Article","10.1200/JCO.2009.27.2757","0732-183X","https://api.elsevier.com/content/abstract/scopus_id/77952310126",28,13,2280,2285,364,26.00,364,1,14,"","",""
360,"R. Bukowski","Causes of death among stillbirths",2011,"JAMA","","","https://www.scopus.com/inward/citedby.uri?partnerID=HzOxMe3b&scp=83455235074&origin=inward",160,"2024-07-24 13:24:21","Article","10.1001/jama.2011.1823","0098-7484","https://api.elsevier.com/content/abstract/scopus_id/83455235074",306,22,2459,2468,360,27.69,360,1,13,"","",""
359,"C.J. Chuong","Three–dimensional stress distribution in arteries",1983,"Journal of Biomechanical Engineering","","","https://www.scopus.com/inward/citedby.uri?partnerID=HzOxMe3b&scp=0020806994&origin=inward",161,"2024-07-24 13:24:21","Article","10.1115/1.3138417","0148-0731","https://api.elsevier.com/content/abstract/scopus_id/0020806994",105,3,268,274,359,8.76,359,1,41,"","",""
358,"N. Inagaki","Organization of histaminergic fibers in the rat brain",1988,"Journal of Comparative Neurology","","","https://www.scopus.com/inward/citedby.uri?partnerID=HzOxMe3b&scp=0023805662&origin=inward",162,"2024-07-24 13:24:21","Article","10.1002/cne.902730302","0021-9967","https://api.elsevier.com/content/abstract/scopus_id/0023805662",273,3,283,300,358,9.94,358,1,36,"","",""
358,"C. Benham","Spontaneous transient outward currents in single visceral and vascular smooth muscle cells of the rabbit.",1986,"The Journal of Physiology","","","https://www.scopus.com/inward/citedby.uri?partnerID=HzOxMe3b&scp=0022924461&origin=inward",163,"2024-07-24 13:24:21","Article","10.1113/jphysiol.1986.sp016333","0022-3751","https://api.elsevier.com/content/abstract/scopus_id/0022924461",381,1,385,406,358,9.42,358,1,38,"","",""
356,"A.S. Antonopoulos","Statins as anti-inflammatory agents in atherogenesis: Molecular mechanisms and lessons from the recent clinical trials",2012,"Current Pharmaceutical Design","","","https://www.scopus.com/inward/citedby.uri?partnerID=HzOxMe3b&scp=84857694797&origin=inward",164,"2024-07-24 13:24:21","Review","10.2174/138161212799504803","1381-6128","https://api.elsevier.com/content/abstract/scopus_id/84857694797",18,11,1519,1530,356,29.67,356,1,12,"","",""
355,"R.S.L. Lima","Incremental value of combined perfusion and function over perfusion alone by gated SPECT myocardial perfusion imaging for detection of severe three-vessel coronary artery disease",2003,"Journal of the American College of Cardiology","","https://api.elsevier.com/content/article/eid/1-s2.0-S073510970300562X","https://www.scopus.com/inward/citedby.uri?partnerID=HzOxMe3b&scp=0038205789&origin=inward",165,"2024-07-24 13:24:21","Article","10.1016/S0735-1097(03)00562-X","0735-1097","https://api.elsevier.com/content/abstract/scopus_id/0038205789",42,1,64,70,355,16.90,355,1,21,"","",""
354,"R.A. Linsenmeier","Effects of light and darkness on oxygen distribution and consumption in the cat retina",1986,"Journal of General Physiology","","","https://www.scopus.com/inward/citedby.uri?partnerID=HzOxMe3b&scp=0023023438&origin=inward",166,"2024-07-24 13:24:21","Article","10.1085/jgp.88.4.521","0022-1295","https://api.elsevier.com/content/abstract/scopus_id/0023023438",88,4,521,542,354,9.32,354,1,38,"","",""
353,"T. Imai","Induction of endothelin-1 gene by angiotensin and vasopressin in endothelial cells",1992,"Hypertension","","","https://www.scopus.com/inward/citedby.uri?partnerID=HzOxMe3b&scp=0026566370&origin=inward",167,"2024-07-24 13:24:21","Article","10.1161/01.HYP.19.6.753","0194-911X","https://api.elsevier.com/content/abstract/scopus_id/0026566370",19,6,753,757,353,11.03,353,1,32,"","",""
353,"W. Risau","Changes in the vascular extracellular matrix during embryonic vasculogenesis and angiogenesis",1988,"Developmental Biology","","https://api.elsevier.com/content/article/eid/1-s2.0-0012160688902254","https://www.scopus.com/inward/citedby.uri?partnerID=HzOxMe3b&scp=0023905973&origin=inward",168,"2024-07-24 13:24:21","Article","10.1016/0012-1606(88)90225-4","0012-1606","https://api.elsevier.com/content/abstract/scopus_id/0023905973",125,2,441,450,353,9.81,353,1,36,"","",""
