Cites,Authors,Title,Year,Source,Publisher,ArticleURL,CitesURL,GSRank,QueryDate,Type,DOI,ISSN,CitationURL,Volume,Issue,StartPage,EndPage,ECC,CitesPerYear,CitesPerAuthor,AuthorCount,Age,Abstract,FullTextURL,RelatedURL
351,"D.E. Kuhl","Epileptic patterns of local cerebral metabolism and perfusion in humans determined by emission computed tomography of <sup>18</sup>FDG and <sup>13</sup>NH<inf>3</inf>",1980,"Annals of Neurology","","","https://www.scopus.com/inward/citedby.uri?partnerID=HzOxMe3b&scp=0019122096&origin=inward",169,"2024-07-24 13:24:21","Article","10.1002/ana.410080403","0364-5134","https://api.elsevier.com/content/abstract/scopus_id/0019122096",8,4,348,360,351,7.98,351,1,44,"","",""
350,"G. Shen","Anlotinib: A novel multi-targeting tyrosine kinase inhibitor in clinical development",2018,"Journal of Hematology and Oncology","","","https://www.scopus.com/inward/citedby.uri?partnerID=HzOxMe3b&scp=85053676075&origin=inward",170,"2024-07-24 13:24:21","Review","10.1186/s13045-018-0664-7","1756-8722","https://api.elsevier.com/content/abstract/scopus_id/85053676075",11,1,,,350,58.33,350,1,6,"","",""
350,"T.A. Drake","Expression of tissue factor, thrombomodulin, and E-selectin in baboons with lethal Escherichia coli sepsis",1993,"American Journal of Pathology","","","https://www.scopus.com/inward/citedby.uri?partnerID=HzOxMe3b&scp=0027725139&origin=inward",171,"2024-07-24 13:24:21","Article","","0002-9440","https://api.elsevier.com/content/abstract/scopus_id/0027725139",142,5,1458,1470,350,11.29,350,1,31,"","",""
349,"S. Das","Anti-inflammatory responses of resveratrol",2007,"Inflammation and Allergy - Drug Targets","","","https://www.scopus.com/inward/citedby.uri?partnerID=HzOxMe3b&scp=34648830916&origin=inward",172,"2024-07-24 13:24:21","Review","10.2174/187152807781696464","1871-5281","https://api.elsevier.com/content/abstract/scopus_id/34648830916",6,3,168,173,349,20.53,349,1,17,"","",""
349,"M. Asensi","Inhibition of cancer growth by resveratrol is related to its low bioavailability",2002,"Free Radical Biology and Medicine","","https://api.elsevier.com/content/article/eid/1-s2.0-S0891584902009115","https://www.scopus.com/inward/citedby.uri?partnerID=HzOxMe3b&scp=0036667553&origin=inward",173,"2024-07-24 13:24:21","Article","10.1016/S0891-5849(02)00911-5","0891-5849","https://api.elsevier.com/content/abstract/scopus_id/0036667553",33,3,387,398,349,15.86,349,1,22,"","",""
346,"H. Yusuf-Makagiansar","Inhibition of LFA-1/ICAM-1 and VLA-4/VCAM-1 as a therapeutic approach to inflammation and autoimmune diseases",2002,"Medicinal Research Reviews","","","https://www.scopus.com/inward/citedby.uri?partnerID=HzOxMe3b&scp=0036174736&origin=inward",174,"2024-07-24 13:24:21","Review","10.1002/med.10001","0198-6325","https://api.elsevier.com/content/abstract/scopus_id/0036174736",22,2,146,167,346,15.73,346,1,22,"","",""
346,"R. Hawkins","Evaluation of the skeletal kinetics of fluorine-18-fluoride ion with PET",1992,"Journal of Nuclear Medicine","","","https://www.scopus.com/inward/citedby.uri?partnerID=HzOxMe3b&scp=0026648265&origin=inward",175,"2024-07-24 13:24:21","Article","","0161-5505","https://api.elsevier.com/content/abstract/scopus_id/0026648265",33,5,633,642,346,10.81,346,1,32,"","",""
345,"S. Savaldi-Goldstein","The epidermis both drives and restricts plant shoot growth",2007,"Nature","","","https://www.scopus.com/inward/citedby.uri?partnerID=HzOxMe3b&scp=33947166907&origin=inward",176,"2024-07-24 13:24:21","Article","10.1038/nature05618","0028-0836","https://api.elsevier.com/content/abstract/scopus_id/33947166907",446,7132,199,202,345,20.29,345,1,17,"","",""
345,"D.R.D. Premkumar","Apolipoprotein E-∈4 alleles in cerebral amyloid angiopathy and cerebrovascular pathology associated with Alzheimer's disease",1996,"American Journal of Pathology","","","https://www.scopus.com/inward/citedby.uri?partnerID=HzOxMe3b&scp=0029665096&origin=inward",177,"2024-07-24 13:24:21","Article","","0002-9440","https://api.elsevier.com/content/abstract/scopus_id/0029665096",148,6,2083,2095,345,12.32,345,1,28,"","",""
343,"A. Barber","Altered expression of retinal occludin and glial fibrillary acidic protein in experimental diabetes",2000,"Investigative Ophthalmology and Visual Science","","","https://www.scopus.com/inward/citedby.uri?partnerID=HzOxMe3b&scp=0033771018&origin=inward",178,"2024-07-24 13:24:21","Article","","0146-0404","https://api.elsevier.com/content/abstract/scopus_id/0033771018",41,11,3561,3568,343,14.29,343,1,24,"","",""
343,"I. Herman","Microvascular pericytes contain muscle and nonmuscle actins",1985,"Journal of Cell Biology","","","https://www.scopus.com/inward/citedby.uri?partnerID=HzOxMe3b&scp=0021824956&origin=inward",179,"2024-07-24 13:24:21","Article","10.1083/jcb.101.1.43","0021-9525","https://api.elsevier.com/content/abstract/scopus_id/0021824956",101,1,43,52,343,8.79,343,1,39,"","",""
341,"A. Santel","A novel siRNA-lipoplex technology for RNA interference in the mouse vascular endothelium",2006,"Gene Therapy","","","https://www.scopus.com/inward/citedby.uri?partnerID=HzOxMe3b&scp=33746883220&origin=inward",180,"2024-07-24 13:24:21","Article","10.1038/sj.gt.3302777","0969-7128","https://api.elsevier.com/content/abstract/scopus_id/33746883220",13,16,1222,1234,341,18.94,341,1,18,"","",""
341,"M.H. Criqui","Chronic venous disease in an ethnically diverse population: The San Diego population study",2003,"American Journal of Epidemiology","","","https://www.scopus.com/inward/citedby.uri?partnerID=HzOxMe3b&scp=0043011857&origin=inward",181,"2024-07-24 13:24:21","Article","10.1093/aje/kwg166","0002-9262","https://api.elsevier.com/content/abstract/scopus_id/0043011857",158,5,448,456,341,16.24,341,1,21,"","",""
339,"B. Maron","Clinical profile of stroke in 900 patients with hypertrophic cardiomyopathy",2002,"Journal of the American College of Cardiology","","https://api.elsevier.com/content/article/eid/1-s2.0-S0735109701017272","https://www.scopus.com/inward/citedby.uri?partnerID=HzOxMe3b&scp=0037116544&origin=inward",182,"2024-07-24 13:24:21","Article","10.1016/S0735-1097(01)01727-2","0735-1097","https://api.elsevier.com/content/abstract/scopus_id/0037116544",39,2,301,307,339,15.41,339,1,22,"","",""
337,"K. Takamizawa","Strain energy density function and uniform strain hypothesis for arterial mechanics",1987,"Journal of Biomechanics","","https://api.elsevier.com/content/article/eid/1-s2.0-0021929087902624","https://www.scopus.com/inward/citedby.uri?partnerID=HzOxMe3b&scp=0023157588&origin=inward",183,"2024-07-24 13:24:21","Article","10.1016/0021-9290(87)90262-4","0021-9290","https://api.elsevier.com/content/abstract/scopus_id/0023157588",20,1,7,17,337,9.11,337,1,37,"","",""
336,"B.E. Van Beers","Primovist, eovist: What to expect?",2012,"Journal of Hepatology","","https://api.elsevier.com/content/article/eid/1-s2.0-S0168827812002486","https://www.scopus.com/inward/citedby.uri?partnerID=HzOxMe3b&scp=84863987369&origin=inward",184,"2024-07-24 13:24:21","Review","10.1016/j.jhep.2012.01.031","0168-8278","https://api.elsevier.com/content/abstract/scopus_id/84863987369",57,2,421,429,336,28.00,336,1,12,"","",""
333,"D.N. Guha Mazumder","Chronic arsenic toxicity &amp; human health",2008,"Indian Journal of Medical Research","","","https://www.scopus.com/inward/citedby.uri?partnerID=HzOxMe3b&scp=61849157342&origin=inward",185,"2024-07-24 13:24:21","Review","","0971-5916","https://api.elsevier.com/content/abstract/scopus_id/61849157342",128,4,436,447,333,20.81,333,1,16,"","",""
329,"M.A. Bourdon","Human glioma-mesenchymal extracellular matrix antigen defined by monoclonal antibody",1983,"Cancer Research","","","https://www.scopus.com/inward/citedby.uri?partnerID=HzOxMe3b&scp=0020527983&origin=inward",186,"2024-07-24 13:24:21","Article","","0008-5472","https://api.elsevier.com/content/abstract/scopus_id/0020527983",43,6,2796,2805,329,8.02,329,1,41,"","",""
327,"J.S. Lewis","Expression of vascular endothelial growth factor by macrophages is up-regulated in poorly vascularized areas of breast carcinomas",2000,"Journal of Pathology","","","https://www.scopus.com/inward/citedby.uri?partnerID=HzOxMe3b&scp=0033780453&origin=inward",187,"2024-07-24 13:24:21","Article","10.1002/1096-9896(2000)9999:9999<::AID-PATH687>3.0.CO;2-G","0022-3417","https://api.elsevier.com/content/abstract/scopus_id/0033780453",192,2,150,158,327,13.63,327,1,24,"","",""
324,"T. Yoshizawa","Endothelin: A novel peptide in the posterior pituitary system",1990,"Science","","","https://www.scopus.com/inward/citedby.uri?partnerID=HzOxMe3b&scp=0025125841&origin=inward",188,"2024-07-24 13:24:21","Article","10.1126/science.2405487","0036-8075","https://api.elsevier.com/content/abstract/scopus_id/0025125841",247,4941,462,464,324,9.53,324,1,34,"","",""
323,"I. Caniggia","Oxygen and placental development during the first trimester: Implications for the pathophysiology of pre-eclampsia",2000,"Placenta","","https://api.elsevier.com/content/article/eid/1-s2.0-S0143400499905222","https://www.scopus.com/inward/citedby.uri?partnerID=HzOxMe3b&scp=0034149941&origin=inward",189,"2024-07-24 13:24:21","Article","10.1053/plac.1999.0522","0143-4004","https://api.elsevier.com/content/abstract/scopus_id/0034149941",21,,,,323,13.46,323,1,24,"","",""
323,"A.E. Koch","Immunolocalization of endothelial and leukocyte adhesion molecules in human rheumatoid and osteoarthritic synovial tissues",1991,"Laboratory Investigation","","","https://www.scopus.com/inward/citedby.uri?partnerID=HzOxMe3b&scp=0025736324&origin=inward",190,"2024-07-24 13:24:21","Article","","0023-6837","https://api.elsevier.com/content/abstract/scopus_id/0025736324",64,3,313,320,323,9.79,323,1,33,"","",""
321,"S. Kumar","The Prevalence of Foot Ulceration and its Correlates in Type 2 Diabetic Patients: a Population‐based Study",1994,"Diabetic Medicine","","","https://www.scopus.com/inward/citedby.uri?partnerID=HzOxMe3b&scp=0028363976&origin=inward",191,"2024-07-24 13:24:21","Article","10.1111/j.1464-5491.1994.tb00310.x","0742-3071","https://api.elsevier.com/content/abstract/scopus_id/0028363976",11,5,480,484,321,10.70,321,1,30,"","",""
321,"J. Partanen","A novel endothelial cell surface receptor tyrosine kinase with extracellular epidermal growth factor homology domains",1992,"Molecular and Cellular Biology","","","https://www.scopus.com/inward/citedby.uri?partnerID=HzOxMe3b&scp=0026545092&origin=inward",192,"2024-07-24 13:24:21","Article","10.1128/MCB.12.4.1698","0270-7306","https://api.elsevier.com/content/abstract/scopus_id/0026545092",12,4,1698,1707,321,10.03,321,1,32,"","",""
319,"R.N. Salomon","Human coronary transplantation-associated arteriosclerosis: Evidence for a chronic immune reaction to activated graft endothelial cells",1991,"American Journal of Pathology","","","https://www.scopus.com/inward/citedby.uri?partnerID=HzOxMe3b&scp=0025869772&origin=inward",193,"2024-07-24 13:24:21","Article","","0002-9440","https://api.elsevier.com/content/abstract/scopus_id/0025869772",138,4,791,798,319,9.67,319,1,33,"","",""
318,"G. Zotz","The systematic distribution of vascular epiphytes-a critical update",2013,"Botanical Journal of the Linnean Society","","","https://www.scopus.com/inward/citedby.uri?partnerID=HzOxMe3b&scp=84874376942&origin=inward",194,"2024-07-24 13:24:21","Article","10.1111/boj.12010","0024-4074","https://api.elsevier.com/content/abstract/scopus_id/84874376942",171,3,453,481,318,28.91,318,1,11,"","",""
318,"N.J. Scolding","Aβ-related angiitis: Primary angiitis of the central nervous system associated with cerebral amyloid angiopathy",2005,"Brain","","","https://www.scopus.com/inward/citedby.uri?partnerID=HzOxMe3b&scp=20144366048&origin=inward",195,"2024-07-24 13:24:21","Article","10.1093/brain/awh379","0006-8950","https://api.elsevier.com/content/abstract/scopus_id/20144366048",128,3,500,515,318,16.74,318,1,19,"","",""
316,"F. García-Olmedo","The defensive role of nonspecific lipid-transfer proteins in plants",1995,"Trends in Microbiology","","https://api.elsevier.com/content/article/eid/1-s2.0-S0966842X00888794","https://www.scopus.com/inward/citedby.uri?partnerID=HzOxMe3b&scp=0028833949&origin=inward",196,"2024-07-24 13:24:21","Article","10.1016/S0966-842X(00)88879-4","0966-842X","https://api.elsevier.com/content/abstract/scopus_id/0028833949",3,2,72,74,316,10.90,316,1,29,"","",""
315,"S. Hammarstrom","Leukotrienes",1983,"Annual Review of Biochemistry","","","https://www.scopus.com/inward/citedby.uri?partnerID=HzOxMe3b&scp=0020972415&origin=inward",197,"2024-07-24 13:24:21","Article","10.1146/annurev.bi.52.070183.002035","0066-4154","https://api.elsevier.com/content/abstract/scopus_id/0020972415",,,355,377,315,7.68,315,1,41,"","",""
314,"J.W. Dundee","Midazolam: A Review of its Pharmacological Properties and Therapeutic Use",1984,"Drugs","","","https://www.scopus.com/inward/citedby.uri?partnerID=HzOxMe3b&scp=0021743129&origin=inward",198,"2024-07-24 13:24:21","Article","10.2165/00003495-198428060-00002","0012-6667","https://api.elsevier.com/content/abstract/scopus_id/0021743129",28,6,519,543,314,7.85,314,1,40,"","",""
313,"T. Michel","Phosphorylation and subcellular translocation of endothelial nitric oxide synthase",1993,"Proceedings of the National Academy of Sciences of the United States of America","","","https://www.scopus.com/inward/citedby.uri?partnerID=HzOxMe3b&scp=0027289468&origin=inward",199,"2024-07-24 13:24:21","Article","10.1073/pnas.90.13.6252","0027-8424","https://api.elsevier.com/content/abstract/scopus_id/0027289468",90,13,6252,6256,313,10.10,313,1,31,"","",""
312,"R.M. Schiffelers","Anti-tumor efficacy of tumor vasculature-targeted liposomal doxorubicin",2003,"Journal of Controlled Release","","https://api.elsevier.com/content/article/eid/1-s2.0-S0168365903002402","https://www.scopus.com/inward/citedby.uri?partnerID=HzOxMe3b&scp=0141990623&origin=inward",200,"2024-07-24 13:24:21","Conference Paper","10.1016/S0168-3659(03)00240-2","0168-3659","https://api.elsevier.com/content/abstract/scopus_id/0141990623",91,1,115,122,312,14.86,312,1,21,"","",""
