Cites,Authors,Title,Year,Source,Publisher,ArticleURL,CitesURL,GSRank,QueryDate,Type,DOI,ISSN,CitationURL,Volume,Issue,StartPage,EndPage,ECC,CitesPerYear,CitesPerAuthor,AuthorCount,Age,Abstract,FullTextURL,RelatedURL
149,"I Kottke, A Beiter, M Weiss, I Haug, F Oberwinkler…","Heterobasidiomycetes form symbiotic associations with hepatics: Jungermanniales have sebacinoid mycobionts while Aneura pinguis (Metzgeriales) is associated …",2003,"Mycological …","Elsevier","https://www.sciencedirect.com/science/article/pii/S0953756208612873","https://scholar.google.com/scholar?cites=13793315439226584350&as_sdt=2005&sciodt=2007&hl=en",136,"2024-07-23 09:00:53","","","","",,,,,149,7.10,25,6,21,"… , from naked soil and between peat moss in different habitats … Soil particles adhering to rhizoids were removed with a fine … In case hyphae were detected in the rhizoids, stems or thalli, …","","https://scholar.google.com/scholar?q=related:Hv0C1k-za78J:scholar.google.com/&scioq=peat+rhizoid&hl=en&as_sdt=2007"
52,"MA Jasieniuk, EA Johnson","Peatland vegetation organization and dynamics in the western subarctic, Northwest Territories, Canada",1982,"Canadian Journal of Botany","cdnsciencepub.com","https://cdnsciencepub.com/doi/abs/10.1139/b82-314","https://scholar.google.com/scholar?cites=7311233936097695326&as_sdt=2005&sciodt=2007&hl=en",137,"2024-07-23 09:00:53","","10.1139/b82-314","","",,,,,52,1.24,26,2,42,"… gradients acting on peatland vegetation are moisture-nutrients, peat substrate, and the … wider habitat tolerance and excellent regenerative ability from rhizomes, rhizoids, and gem- …","https://www.academia.edu/download/68257212/d6426aacbebf1f8c48e90c0b40008768fb39.pdf","https://scholar.google.com/scholar?q=related:XlbiPoe4dmUJ:scholar.google.com/&scioq=peat+rhizoid&hl=en&as_sdt=2007"
0,"JH McCulloch","A Method for the Observation of a Typical Fern Life History",1981,"The American Biology Teacher","online.ucpress.edu","https://online.ucpress.edu/abt/article-abstract/43/3/124/12688","",138,"2024-07-23 09:00:53","CITATION","","","",,,,,0,0.00,0,1,43,"… Place the Jiffy-7-Peat Pellet in the deepest half of the petri dish, with the side of the peat pellet up that is not … Hold the brush onehalf inch or less from the top of the peat pellet and tap it …","","https://scholar.google.com/scholar?q=related:pg75Z0BCkegJ:scholar.google.com/&scioq=peat+rhizoid&hl=en&as_sdt=2007"
25,"MA Lemay, L De Vriendt, S Pellerin…","Ex situ germination as a method for seed viability assessment in a peatland orchid, Platanthera blephariglottis",2015,"American Journal of …","Wiley Online Library","https://bsapubs.onlinelibrary.wiley.com/doi/abs/10.3732/ajb.1400441","https://scholar.google.com/scholar?cites=6721688005482983865&as_sdt=2005&sciodt=2007&hl=en",139,"2024-07-23 09:00:53","","10.3732/ajb.1400441","","",,,,,25,2.78,6,4,9,"… Most germinated seeds had swollen embryos, rhizoids, and an intact testa, but no seed developed into a protocorm. There was no visible evidence of mycorrhizal infection of the seeds, …","https://bsapubs.onlinelibrary.wiley.com/doi/pdf/10.3732/ajb.1400441","https://scholar.google.com/scholar?q=related:uTHRwaA7SF0J:scholar.google.com/&scioq=peat+rhizoid&hl=en&as_sdt=2007"
0,"F Tsuraya, MS Rahmansyah, F Fikri…","Identification of microalgae in peat swamp waters",2023,"Biological Environment …","pubs.ascee.org","http://pubs.ascee.org/index.php/bioenvipo/article/view/654","",140,"2024-07-23 09:00:53","","","","",,,,,0,0.00,0,4,1,"… This study aims to identify microalgae in peat swamp water in the Universitas Palangka Raya area… Abiotic factors indicate that the condition of peat swamp water is a reasonably extreme …","http://pubs.ascee.org/index.php/bioenvipo/article/download/654/320","https://scholar.google.com/scholar?q=related:7d2T_cx94o4J:scholar.google.com/&scioq=peat+rhizoid&hl=en&as_sdt=2007"
450,"DJ Read, JG Duckett, R Francis…","Symbiotic fungal associations in 'lower'land plants",2000,"… Transactions of the …","royalsocietypublishing.org","https://royalsocietypublishing.org/doi/abs/10.1098/rstb.2000.0617","https://scholar.google.com/scholar?cites=11245698944733391642&as_sdt=2005&sciodt=2007&hl=en",141,"2024-07-23 09:00:53","","10.1098/rstb.2000.0617","","",,,,,450,18.75,113,4,24,"… The structural features of the fungal colonization of rhizoids and … peat in a series of transparent observation chambers. After the Betula root system had begun to extend across the peat, …","https://www.ncbi.nlm.nih.gov/pmc/articles/PMC1692782/pdf/10905611.pdf","https://scholar.google.com/scholar?q=related:GqvRo5u_EJwJ:scholar.google.com/&scioq=peat+rhizoid&hl=en&as_sdt=2007"
2,"AC Crundwell","Rhizomnium magnifolium (Horne) Kop. in the British Isles",1978,"Journal of Bryology","Taylor &Francis","https://www.tandfonline.com/doi/pdf/10.1179/jbr.1978.10.1.1","https://scholar.google.com/scholar?cites=4206984714445467940&as_sdt=2005&sciodt=2007&hl=en",142,"2024-07-23 09:00:53","","10.1179/jbr.1978.10.1.1","","",,,,,2,0.04,2,1,46,"… The youngest shoots in all species may be quite without rhizoids, but the difference can be … permanently wet peaty habitats. In the British Isles it appears to be confined to base-rich peat, …","","https://scholar.google.com/scholar?q=related:JDEF6E42YjoJ:scholar.google.com/&scioq=peat+rhizoid&hl=en&as_sdt=2007"
0,"P LYELLII","… . This paper presents a new species of Hepaticoflora of Romania, the Pallavicinia lyellii liverwort. This species was found in the peatland"" Mlaca Mică de la …",2003,"AHBBuc","Editura"" Alo, București!""","","",143,"2024-07-23 09:00:53","CITATION","","","",,,,,0,0.00,0,1,21,"","","https://scholar.google.com/scholar?q=related:ue0B33mJ_c4J:scholar.google.com/&scioq=peat+rhizoid&hl=en&as_sdt=2007"
0,"DS Littler, MM Littler, BL Brooks","FROM THE TOBACCO RANGE FRACTURE ZONE, BELIZE, CA",,"researchgate.net","","https://www.researchgate.net/profile/Barrett-Brooks/publication/237517160_Marine_algae_and_seagrasses_from_the_Tobacco_Range_Fracture_Zone_Belize_CA/links/58b8050e92851c471d4a04c2/Marine-algae-and-seagrasses-from-the-Tobacco-Range-Fracture-Zone-Belize-CA.pdf","",144,"2024-07-23 09:00:53","PDF","","","",,,,,0,0.00,0,3,,"… in the habitats within and surrounding the fractured peat zone of Tobacco Range, a previously … To our knowledge, no dther studies of comparable fractured mangrove-peat habitats have …","https://www.researchgate.net/profile/Barrett-Brooks/publication/237517160_Marine_algae_and_seagrasses_from_the_Tobacco_Range_Fracture_Zone_Belize_CA/links/58b8050e92851c471d4a04c2/Marine-algae-and-seagrasses-from-the-Tobacco-Range-Fracture-Zone-Belize-CA.pdf","https://scholar.google.com/scholar?q=related:MQOqYgah6IYJ:scholar.google.com/&scioq=peat+rhizoid&hl=en&as_sdt=2007"
14,"AG Stokey, LR Atkinson","The gametophyte of Didymochlaena sinuata Desv",1954,"Phytomorphology","International Society of Plant …","","https://scholar.google.com/scholar?cites=17162325383562016954&as_sdt=2005&sciodt=2007&hl=en",145,"2024-07-23 09:00:53","CITATION","","","",,,,,14,0.20,7,2,70,"","","https://scholar.google.com/scholar?q=related:ujjipgHULO4J:scholar.google.com/&scioq=peat+rhizoid&hl=en&as_sdt=2007"
10,"AG Stokey, LR Atkinson","The gametophytes of Plagiogyria glauca (BL.) Mett. and P. semicordata (PR.) Christ",1956,"Phytomorphology","","","https://scholar.google.com/scholar?cites=2600848947491335907&as_sdt=2005&sciodt=2007&hl=en",146,"2024-07-23 09:00:53","CITATION","","","",,,,,10,0.15,5,2,68,"","","https://scholar.google.com/scholar?q=related:426rfVYSGCQJ:scholar.google.com/&scioq=peat+rhizoid&hl=en&as_sdt=2007"
21,"MA O'Toole, DM Synnott","The bryophyte succession on blanket peat following calcium carbonate, nitrogen, phosphorus and potassium fertilizers",1971,"The Journal of Ecology","JSTOR","https://www.jstor.org/stable/2258456","https://scholar.google.com/scholar?cites=11002090530438073769&as_sdt=2005&sciodt=2007&hl=en",147,"2024-07-23 09:00:53","","","","",,,,,21,0.40,11,2,53,"… peat with increased phosphate level and low pH. P. aurantiacum has a more extensive rhizoid … the surface than those species whose rhizoids are confined to the topmost millimetre of …","","https://scholar.google.com/scholar?q=related:qU1zvQtHr5gJ:scholar.google.com/&scioq=peat+rhizoid&hl=en&as_sdt=2007"
238,"PE Galand, H Fritze, R Conrad…","Pathways for methanogenesis and diversity of methanogenic archaea in three boreal peatland ecosystems",2005,"Applied and …","Am Soc Microbiol","https://journals.asm.org/doi/abs/10.1128/aem.71.4.2195-2198.2005","https://scholar.google.com/scholar?cites=2960874729232521884&as_sdt=2005&sciodt=2007&hl=en",148,"2024-07-23 09:00:53","","10.1128/aem.71.4.2195-2198.2005","","",,,,,238,12.53,60,4,19,"… peatlands where CO 2 reduction is an important pathway (23). Mosses have a shallow rhizoid … any labile carbon substrates to anaerobic peat layers. The methanogenic community at …","https://journals.asm.org/doi/pdf/10.1128/aem.71.4.2195-2198.2005","https://scholar.google.com/scholar?q=related:nNpV_OAjFykJ:scholar.google.com/&scioq=peat+rhizoid&hl=en&as_sdt=2007"
79,"EVG Groeneveld, L Rochefort","Nursing plants in peatland restoration: on their potential use to alleviate frost heaving problems",2002,"Suo","researchgate.net","https://www.researchgate.net/profile/Elisabeth-Groeneveld/publication/279690860_Nursing_plants_in_peatland_restoration_On_their_potential_use_to_alleviate_frost_heaving_problems/links/5880e871a6fdcc6b790dd0f2/Nursing-plants-in-peatland-restoration-On-their-potential-use-to-alleviate-frost-heaving-problems.pdf?_sg%5B0%5D=started_experiment_milestone&origin=journalDetail&_rtd=e30%3D","https://scholar.google.com/scholar?cites=17813028018606405431&as_sdt=2005&sciodt=2007&hl=en",149,"2024-07-23 09:00:53","PDF","","","",,,,,79,3.59,40,2,22,"… P strictum, is covered with a dense layer of rhizoids. These … cutover peatlands for their eventual restoration back to a peat … the higher moisture content of the peat. Nurse plants are an in…","https://www.researchgate.net/profile/Elisabeth-Groeneveld/publication/279690860_Nursing_plants_in_peatland_restoration_On_their_potential_use_to_alleviate_frost_heaving_problems/links/5880e871a6fdcc6b790dd0f2/Nursing-plants-in-peatland-restoration-On-their-potential-use-to-alleviate-frost-heaving-problems.pdf?_sg%5B0%5D=started_experiment_milestone&origin=journalDetail&_rtd=e30%3D","https://scholar.google.com/scholar?q=related:N3cd_5qWNPcJ:scholar.google.com/&scioq=peat+rhizoid&hl=en&as_sdt=2007"
12,"W Watson","A Somerset heath and its bryophytic zonation",1915,"New Phytologist","JSTOR","https://www.jstor.org/stable/2427406","https://scholar.google.com/scholar?cites=7106872618588973933&as_sdt=2005&sciodt=2007&hl=en",150,"2024-07-23 09:00:53","","10.1111/j.1469-8137.1915.tb07175.x","","",,,,,12,0.11,12,1,109,"… rhizoids … peaty pools, the surfaces of which are above those of the interliinking channels, are liable at times to become flooded and in times of drought become dirty patches of moist peat …","https://nph.onlinelibrary.wiley.com/doi/pdf/10.1111/j.1469-8137.1915.tb07175.x","https://scholar.google.com/scholar?q=related:bSvyJv6uoGIJ:scholar.google.com/&scioq=peat+rhizoid&hl=en&as_sdt=2007"
0,"E Moss","Many cold temperate, boreal, and polar ecosystems have large bio-mass components in bryophytes and lichens. These bryophyte and lichen guilds often …",2007,"Principles and standards for measuring …","Oxford University Press, USA","","",151,"2024-07-23 09:00:53","CITATION","","","",,,,,0,0.00,0,1,17,"","","https://scholar.google.com/scholar?q=related:RNvjenRsJCkJ:scholar.google.com/&scioq=peat+rhizoid&hl=en&as_sdt=2007"
14,"AG Stokey, LR Atkinson","The gametophyte of Cheiropleuria bicuspis (Bl.) Presl",1954,"Phytomorphology","International Society of Plant …","","https://scholar.google.com/scholar?cites=11339102330916735412&as_sdt=2005&sciodt=2007&hl=en",152,"2024-07-23 09:00:53","CITATION","","","",,,,,14,0.20,7,2,70,"","","https://scholar.google.com/scholar?q=related:tIkYKn6VXJ0J:scholar.google.com/&scioq=peat+rhizoid&hl=en&as_sdt=2007"
69,"F Leroy, S Gogo, C Guimbaud, L Bernard-Jannin…","Vegetation composition controls temperature sensitivity of CO2 and CH4 emissions and DOC concentration in peatlands",2017,"Soil Biology and …","Elsevier","https://www.sciencedirect.com/science/article/pii/S0038071716303157","https://scholar.google.com/scholar?cites=16317587346341849390&as_sdt=2005&sciodt=2007&hl=en",153,"2024-07-23 09:00:53","","","","",,,,,69,9.86,14,5,7,"… and C fluxes in peatlands is required to predict the future of the peatland C budget. The … [DOC] sensitivities to abiotic factors in Sphagnum peat mesocosms could be modulated by the …","https://insu.hal.science/insu-01440176/document","https://scholar.google.com/scholar?q=related:Lmkdujy3c-IJ:scholar.google.com/&scioq=peat+rhizoid&hl=en&as_sdt=2007"
22,"PJV Borg","Ecology of Equisetum palustre in Finland, with special reference to its role as a noxious weed",1971,"Annales Botanici Fennici","JSTOR","https://www.jstor.org/stable/23724669","https://scholar.google.com/scholar?cites=16275707663369821549&as_sdt=2005&sciodt=2007&hl=en",154,"2024-07-23 09:00:53","","","","",,,,,22,0.42,22,1,53,"… , and even on mineral soil when the peat layer had disappeared. The ecological observations … palustre rhizomes ex a slightly elongated rhizoid cell, no other growth, tended about half a …","","https://scholar.google.com/scholar?q=related:bd1CL-Pt3uEJ:scholar.google.com/&scioq=peat+rhizoid&hl=en&as_sdt=2007"
148,"AO Landva, P La Rochelle","Compressibility and shear characteristics of Radforth peats",1983,"Testing of peats …","asmedigitalcollection.asme.org","https://asmedigitalcollection.asme.org/astm-ebooks/book/chapter-pdf/7178137/10_1520_stp37341s.pdf","https://scholar.google.com/scholar?cites=4620274652967098463&as_sdt=2005&sciodt=2007&hl=en",155,"2024-07-23 09:00:53","","","","",,,,,148,3.61,74,2,41,"… peat is a term introduced here to describe peats with a negligible content of mineral matter. The Sphagnum peat … (stems and leaves, fibers, root threads, rhizoids, etc.), and it is this more …","","https://scholar.google.com/scholar?q=related:X1jYTlGDHkAJ:scholar.google.com/&scioq=peat+rhizoid&hl=en&as_sdt=2007"
1,"C Liu, K Pouliot, S Roy, L Rochefort","Moss regeneration for lithium mine waste rock revegetation in Québec, Canada",2023,"Botany","cdnsciencepub.com","https://cdnsciencepub.com/doi/abs/10.1139/cjb-2023-0110","https://scholar.google.com/scholar?cites=14223936847920449763&as_sdt=2005&sciodt=2007&hl=en",156,"2024-07-23 09:00:53","","10.1139/cjb-2023-0110","","",,,,,1,1.00,0,4,1,"… study, we observed the rhizoids of Racomitrium spp., which are high density and around 453 … The rhizoid of moss showed a strong ability to hold peat (a) and pegmatite (b) 754 …","","https://scholar.google.com/scholar?q=related:40jjlzOTZcUJ:scholar.google.com/&scioq=peat+rhizoid&hl=en&as_sdt=2007"
10,"CJ Harper, M Krings","Nimbosphaera Rothwellii Nov. Gen. et Sp., an Enigmatic Microfossil Enveloped in a Prominent Sheath from the Lower Devonian Windyfield Chert, Scotland",2019,"International Journal of Plant Sciences","journals.uchicago.edu","https://www.journals.uchicago.edu/doi/abs/10.1086/702941","https://scholar.google.com/scholar?cites=15673273453226794179&as_sdt=2005&sciodt=2007&hl=en",157,"2024-07-23 09:00:53","","10.1086/702941","","",,,,,10,2.00,5,2,5,"… The presence of rhizoids is placed in the genus diagnosis, while we presently regard the … The Thallophyta occurring in the peat-bed; the succession of the plants throughout a vertical …","","https://scholar.google.com/scholar?q=related:w5wkRyqngtkJ:scholar.google.com/&scioq=peat+rhizoid&hl=en&as_sdt=2007"
8,"H Kanda","Regenerative development in culture of Antarctic plants of Ceratodon purpureus (HEDW.) BRID.",1979,"Memoirs of National Institute of Polar Research …","nipr.repo.nii.ac.jp","https://nipr.repo.nii.ac.jp/?action=repository_uri&item_id=942","https://scholar.google.com/scholar?cites=7132031295920809189&as_sdt=2005&sciodt=2007&hl=en",158,"2024-07-23 09:00:53","","","","",,,,,8,0.18,8,1,45,"… Developmental features of secondary protonemata, rhizoids and new shoots produced from cultivated plants varied with conditions of culture medium, temper ature and light. The …","https://nipr.repo.nii.ac.jp/record/942/files/KJ00000011489.pdf","https://scholar.google.com/scholar?q=related:5SRUMK0Q-mIJ:scholar.google.com/&scioq=peat+rhizoid&hl=en&as_sdt=2007"
98,"E Frei, RD Preston","Non-cellulosic structural polysaccharides in algal cell walls - II. Association of xylan and mannan in Porphyra umbilicalis",1964,"Proceedings of the Royal Society of …","royalsocietypublishing.org","https://royalsocietypublishing.org/doi/abs/10.1098/rspb.1964.0042","https://scholar.google.com/scholar?cites=16481104472014031835&as_sdt=2005&sciodt=2007&hl=en",159,"2024-07-23 09:00:53","","10.1098/rspb.1964.0042","","",,,,,98,1.63,49,2,60,"… in all the walls with the exception of the rhizoids. The rhizoids are as a rule narrow, with thick… lies in the fact that the Porphyra material used by Peat etal. (1961) yielded more xylan than …","","https://scholar.google.com/scholar?q=related:24t_WDKluOQJ:scholar.google.com/&scioq=peat+rhizoid&hl=en&as_sdt=2007"
51,"AG Stokey","Spore germination and vegetative stages of the gametophytes of Hymenophyllum and Trichomanes",1940,"Botanical Gazette","journals.uchicago.edu","https://www.journals.uchicago.edu/doi/abs/10.1086/334914","https://scholar.google.com/scholar?cites=1982604517652364526&as_sdt=2005&sciodt=2007&hl=en",160,"2024-07-23 09:00:53","","10.1086/334914","","",,,,,51,0.61,51,1,84,"… none was found in the cultures which were planted on sterile peat. The vigorous growth of the gametophytes with uninfected rhizoids gives support to the statement of HOLLOWAY (i6) …","","https://scholar.google.com/scholar?q=related:7vzA9E2ggxsJ:scholar.google.com/&scioq=peat+rhizoid&hl=en&as_sdt=2007"
3,"CE Bessey","The phyla, classes, and orders of plants",1910,"Transactions of the American Microscopical Society","JSTOR","https://www.jstor.org/stable/3221285","https://scholar.google.com/scholar?cites=3217658488647208054&as_sdt=2005&sciodt=2007&hl=en",161,"2024-07-23 09:00:53","","","","",,,,,3,0.03,3,1,114,"… thalloid, normally attached by rhizoids, mostly monoecious; … , normally at-tached by rhizoids, mostly monoecious: sporophytes … or globose, with few rhizoids or none, often dioecious; …","","https://scholar.google.com/scholar?q=related:dkxW-FhrpywJ:scholar.google.com/&scioq=peat+rhizoid&hl=en&as_sdt=2007"
61,"ML Hicks","Guide to the liverworts of North Carolina",2013,"","books.google.com","https://books.google.com/books?hl=en&lr=&id=5RWbDwAAQBAJ&oi=fnd&pg=PT5&dq=peat+rhizoid&ots=akuaNx6vwO&sig=4eJj0nKL61pu5z4kWpKxr-Dqvdc","https://scholar.google.com/scholar?cites=7698058437943312393&as_sdt=2005&sciodt=2007&hl=en",162,"2024-07-23 09:00:53","BOOK","","","",,,,,61,5.55,61,1,11,"… with water, forming lakes; others are peat-filled swampy or shallow … In the Marchantiales the rhizoids are of two types: the usual … The ventral surface may have scales as well as rhizoids. …","","https://scholar.google.com/scholar?q=related:CUDP_Vz_1GoJ:scholar.google.com/&scioq=peat+rhizoid&hl=en&as_sdt=2007"
49,"F Bengtsson, H Rydin, JL Baltzer, L Bragazza…","Environmental drivers of Sphagnum growth in peatlands across the Holarctic region",2021,"Journal of …","Wiley Online Library","https://besjournals.onlinelibrary.wiley.com/doi/abs/10.1111/1365-2745.13499","https://scholar.google.com/scholar?cites=7175765141133110464&as_sdt=2005&sciodt=2007&hl=en",163,"2024-07-23 09:00:53","","10.1111/1365-2745.13499","","",,,,,49,16.33,10,5,3,"… peatlands. We tested the importance of previously proposed abiotic and biotic drivers for peatland … Variation in growth was large, but similar within and between peatlands. Length …","https://besjournals.onlinelibrary.wiley.com/doi/pdf/10.1111/1365-2745.13499","https://scholar.google.com/scholar?q=related:wKzehGBwlWMJ:scholar.google.com/&scioq=peat+rhizoid&hl=en&as_sdt=2007"
156,"SL Stewart, LW Zettler","Symbiotic germination of three semi-aquatic rein orchids (Habenaria repens, H. quinquiseta, H. macroceratitis) from Florida",2002,"Aquatic Botany","Elsevier","https://www.sciencedirect.com/science/article/pii/S0304377001002145","https://scholar.google.com/scholar?cites=14888154723514603449&as_sdt=2005&sciodt=2007&hl=en",164,"2024-07-23 09:00:53","","","","",,,,,156,7.09,78,2,22,"… brevilabris fungus that were transferred to peat in a … , rhizoids on stage 1 Habenaria seedlings, especially H. macroceratitis, appeared considerably longer (>1 mm) than rhizoids …","https://citeseerx.ist.psu.edu/document?repid=rep1&type=pdf&doi=6d8c6268006f5017b9ad147fbacfa0d21805c10c","https://scholar.google.com/scholar?q=related:uVckGNdZnc4J:scholar.google.com/&scioq=peat+rhizoid&hl=en&as_sdt=2007"
19,"AG Stokey","Gametophytes of Marattia sambucina and Macroglossum smithii",1942,"Botanical Gazette","journals.uchicago.edu","https://www.journals.uchicago.edu/doi/abs/10.1086/335069","https://scholar.google.com/scholar?cites=16628906240999664713&as_sdt=2005&sciodt=2007&hl=en",165,"2024-07-23 09:00:53","","10.1086/335069","","",,,,,19,0.23,19,1,82,"… peat by methods described previously (Is). Fresh prothalli were used for the study of germination stages, habit, rhizoids… -bearing cell, although four or five cells may form before a rhizoid …","","https://scholar.google.com/scholar?q=related:SawPWh--xeYJ:scholar.google.com/&scioq=peat+rhizoid&hl=en&as_sdt=2007"
18,"DH Norris, T Koponen, S Piippo","Bryophyte flora of the Huon Peninsula, Papua New Guinea. LXVI. Meesiaceae (Musci), with lists of boreal to temperate disjunct, bipolar, and widely spread species in …",1999,"Annales Botanici Fennici","JSTOR","https://www.jstor.org/stable/23726582","https://scholar.google.com/scholar?cites=1992838669150716127&as_sdt=2005&sciodt=2007&hl=en",166,"2024-07-23 09:00:53","","","","",,,,,18,0.72,6,3,25,"… and heavily branched rhizoids; green to grass-green above, o (2) rhizoids arranged on … of peatlands, often calcareous. Two of the genera rent ^ a str'P UP t0 ^ ce""s (.Paludella Brid. …","https://www.sekj.org/PDF/anbf36/anbf36-257p.pdf","https://scholar.google.com/scholar?q=related:3wBkCTb8pxsJ:scholar.google.com/&scioq=peat+rhizoid&hl=en&as_sdt=2007"
204,"MI Bidartondo, TD Bruns, M Weiß…","Specialized cheating of the ectomycorrhizal symbiosis by an epiparasitic liverwort",2003,"Proceedings of the …","royalsocietypublishing.org","https://royalsocietypublishing.org/doi/abs/10.1098/rspb.2002.2299","https://scholar.google.com/scholar?cites=6691000432461035203&as_sdt=2005&sciodt=2007&hl=en",167,"2024-07-23 09:00:53","","10.1098/rspb.2002.2299","","",,,,,204,9.71,51,4,21,"… thalli from the peat surface with forceps and replacing them in their original positions. The … Of three sets of older rhizoids (each rhizoid ca. 2 mm long, 3–6 individual rhizoids per DNA …","https://www.ncbi.nlm.nih.gov/pmc/articles/PMC1691308/pdf/12737662.pdf","https://scholar.google.com/scholar?q=related:wzbTYHE121wJ:scholar.google.com/&scioq=peat+rhizoid&hl=en&as_sdt=2007"
22,"AG Stokey","The gametophyte of Dipteris conjugata",1945,"Botanical Gazette","journals.uchicago.edu","https://www.journals.uchicago.edu/doi/abs/10.1086/335312","https://scholar.google.com/scholar?cites=1813004640176343165&as_sdt=2005&sciodt=2007&hl=en",168,"2024-07-23 09:00:53","","10.1086/335312","","",,,,,22,0.28,22,1,79,"… and on peat, and the later stages on peat by methods described in a previous paper (ii). … of the two cells usually produced a rhizoid (figs. 5, 6), although a rhizoid arose as a result of the …","","https://scholar.google.com/scholar?q=related:fYjYUR0WKRkJ:scholar.google.com/&scioq=peat+rhizoid&hl=en&as_sdt=2007"
2,"FH Schweingruber, A Börner…","Stem anatomical structures of major taxonomic units",2018,"The Plant Stem: A …","Springer","https://link.springer.com/content/pdf/10.1007/978-3-319-73524-5_7.pdf","https://scholar.google.com/scholar?cites=15493864782267160538&as_sdt=2005&sciodt=2007&hl=en",169,"2024-07-23 09:00:53","PDF","10.1007/978-3-319-73524-5_7","","",,,,,2,0.33,1,3,6,"… The principal stem structure of mosses and peat mosses is similar. An epidermis and a mantle … Starch grains in large parenchyma cells and rhizoids a the base of the thallus. Unstained …","https://link.springer.com/content/pdf/10.1007/978-3-319-73524-5_7.pdf","https://scholar.google.com/scholar?q=related:2hf48O1DBdcJ:scholar.google.com/&scioq=peat+rhizoid&hl=en&as_sdt=2007"
20,"AC Crundwell, HLK Whitehouse","A revision of Bryum bornholmense Wink. &R. Ruthe",2001,"Journal of bryology","Taylor &Francis","https://www.tandfonline.com/doi/abs/10.1179/jbr.2001.23.3.171","https://scholar.google.com/scholar?cites=16639552947848090035&as_sdt=2005&sciodt=2007&hl=en",170,"2024-07-23 09:00:53","","10.1179/jbr.2001.23.3.171","","",,,,,20,0.87,10,2,23,"… very long rhizoid; B: base of plant with tuber on a long rhizoid; … rhizoids; J: part of plant near base with three tubers on long … Fisk, 20 February 1990; on acid peaty soil in clearing in a plan…","","https://scholar.google.com/scholar?q=related:sxHK9T6R6-YJ:scholar.google.com/&scioq=peat+rhizoid&hl=en&as_sdt=2007"
