Cites,Authors,Title,Year,Source,Publisher,ArticleURL,CitesURL,GSRank,QueryDate,Type,DOI,ISSN,CitationURL,Volume,Issue,StartPage,EndPage,ECC,CitesPerYear,CitesPerAuthor,AuthorCount,Age,Abstract,FullTextURL,RelatedURL
15,"D Edwards","The early history of vascular plants based on late Silurian and early Devonian floras of the British Isles",1979,"Geological Society, London, Special Publications","lyellcollection.org","https://www.lyellcollection.org/doi/abs/10.1144/gsl.sp.1979.008.01.46","https://scholar.google.com/scholar?cites=14524028168571701287&as_sdt=2005&sciodt=2007&hl=en",68,"2024-07-23 09:00:53","","10.1144/gsl.sp.1979.008.01.46","","",,,,,15,0.33,15,1,45,"… almost contemporaneous flora preserved in silicified peat in Aberdeenshire is also different, … tion of water having occurred by means of rhizoids. An example of the remarkable preser…","https://citeseerx.ist.psu.edu/document?repid=rep1&type=pdf&doi=3a2c78fb0e639891a8e347d7e733d64d1af21d87","https://scholar.google.com/scholar?q=related:J8h776q2j8kJ:scholar.google.com/&scioq=peat+rhizoid&hl=en&as_sdt=2007"
49,"J Warburton, D Higgitt, A Mills","Anatomy of a Pennine peat slide, Northern England",2003,"Earth Surface Processes and …","Wiley Online Library","https://onlinelibrary.wiley.com/doi/abs/10.1002/esp.452","https://scholar.google.com/scholar?cites=9576756284740847225&as_sdt=2005&sciodt=2007&hl=en",69,"2024-07-23 09:00:53","","10.1002/esp.452","","",,,,,49,2.33,16,3,21,"… along the line of an active peatland stream flush. Detailed mapping … Estimates of the velocity of the flowing peat mass as it … A sediment budget for the peat slide estimates the failed peat …","","https://scholar.google.com/scholar?q=related:ecZ35Bl554QJ:scholar.google.com/&scioq=peat+rhizoid&hl=en&as_sdt=2007"
84,"S Hao, J Xue, D Guo, D Wang","Earliest rooting system and root : shoot ratio from a new Zosterophyllum plant",2010,"New Phytologist","Wiley Online Library","https://nph.onlinelibrary.wiley.com/doi/abs/10.1111/j.1469-8137.2009.03056.x","https://scholar.google.com/scholar?cites=18111554830607634493&as_sdt=2005&sciodt=2007&hl=en",70,"2024-07-23 09:00:53","","10.1111/j.1469-8137.2009.03056.x","","",,,,,84,6.00,21,4,14,"… Generally, it has been suggested that many early vascular plants lack any kind of true rooting structure and that only the rhizome bears rhizoids, for which the rhyniophytes of the Rhynie …","https://nph.onlinelibrary.wiley.com/doi/pdfdirect/10.1111/j.1469-8137.2009.03056.x","https://scholar.google.com/scholar?q=related:PdBgyCgrWfsJ:scholar.google.com/&scioq=peat+rhizoid&hl=en&as_sdt=2007"
117,"N Fenner, NJ Ostle, N McNamara, T Sparks…","Elevated CO2 Effects on Peatland Plant Community Carbon Dynamics and DOC Production",2007,"Ecosystems","Springer","https://link.springer.com/article/10.1007/s10021-007-9051-x","https://scholar.google.com/scholar?cites=1004007022175516935&as_sdt=2005&sciodt=2007&hl=en",71,"2024-07-23 09:00:53","","10.1007/s10021-007-9051-x","","",,,,,117,6.88,23,5,17,"… peatlands are important stores of carbon and reservoirs of biodiversity that are vulnerable to global change. However, the carbon dynamics of individual peatland … ) on (a) peatland plant …","https://www.academia.edu/download/66749442/s10021-007-9051-x20210501-1138-1tehk6g.pdf","https://scholar.google.com/scholar?q=related:B_nENBHz7g0J:scholar.google.com/&scioq=peat+rhizoid&hl=en&as_sdt=2007"
38,"DD Dimitrov, JS Bhatti, RF Grant","The transition zones (ecotone) between boreal forests and peatlands: Ecological controls on ecosystem productivity along a transition zone between upland black …",2014,"Ecological modelling","Elsevier","https://www.sciencedirect.com/science/article/pii/S0304380014003573","https://scholar.google.com/scholar?cites=18330322438361364756&as_sdt=2005&sciodt=2007&hl=en",72,"2024-07-23 09:00:53","","","","",,,,,38,3.80,13,3,10,"… Thus, simulated moss rhizoid respiration and growth did not show a consistent decline with … due to rhizoids growing in near-surface aerated peat only. Slightly higher rhizoid respiration …","https://www.academia.edu/download/52061005/The_transition_zones_ecotone_between_b20170307-10356-1jpdd0m.pdf","https://scholar.google.com/scholar?q=related:FLnmtCNjYv4J:scholar.google.com/&scioq=peat+rhizoid&hl=en&as_sdt=2007"
16,"JF Nordbakken","Fine‐scale persistence of boreal bog plants",2000,"Journal of Vegetation Science","Wiley Online Library","https://onlinelibrary.wiley.com/doi/abs/10.2307/3236807","https://scholar.google.com/scholar?cites=9928584571695402207&as_sdt=2005&sciodt=2007&hl=en",73,"2024-07-23 09:00:53","","10.2307/3236807","","",,,,,16,0.67,16,1,24,"… No general relationship between persistence and depth to the water table was found, but for the cryptogams there was somewhat higher persistence for the less peat‐producing species…","","https://scholar.google.com/scholar?q=related:3wxUZhBryYkJ:scholar.google.com/&scioq=peat+rhizoid&hl=en&as_sdt=2007"
0,"JS Cho, BK Jang, K Park, HM Lee, CH Lee","Gametophyte Propagation and Sporophyte Formation of Asian Chain Fern [Woodwardia japonica (L. f.) Sm.] Under Various Medium Conditions In Vitro and …",2019,"Korean Journal of Plant …","kjpr.kr","http://www.kjpr.kr/articles/xml/d5eD/","",74,"2024-07-23 09:00:53","HTML","","","",,,,,0,0.00,0,5,5,"… (2019a), in the same bed soil and peat moss as used in this study accounts for more than 80… of Asian chain fern using bed soil and peat moss. However, perlite is standardized and …","http://www.kjpr.kr/articles/xml/d5eD/","https://scholar.google.com/scholar?q=related:TZa1G1aWDQUJ:scholar.google.com/&scioq=peat+rhizoid&hl=en&as_sdt=2007"
195,"RS Clymo, JG Duckett","REGENERATION OF SPHAGNUM",1986,"New phytologist","Wiley Online Library","https://nph.onlinelibrary.wiley.com/doi/abs/10.1111/j.1469-8137.1986.tb00834.x","https://scholar.google.com/scholar?cites=13603488324449490382&as_sdt=2005&sciodt=2007&hl=en",75,"2024-07-23 09:00:53","","10.1111/j.1469-8137.1986.tb00834.x","","",,,,,195,5.13,98,2,38,"… We record here the results of some experiments on peat cores taken from two widely … , (g) Numerous antheridia amidst the rhizoids on the basal region of a Dryopteris-like gametophyte. …","https://nph.onlinelibrary.wiley.com/doi/pdf/10.1111/j.1469-8137.1986.tb00834.x","https://scholar.google.com/scholar?q=related:zlX8hI5MybwJ:scholar.google.com/&scioq=peat+rhizoid&hl=en&as_sdt=2007"
34,"DH Vitt","Estimating moss and lichen ground layer net primary production in tundra, peatlands, and forests",2007,"Principles and standards for measuring primary …","books.google.com","https://books.google.com/books?hl=en&lr=&id=qHs8DwAAQBAJ&oi=fnd&pg=PA82&dq=peat+rhizoid&ots=nOnEqPjGER&sig=RWPlsikvIVjMTCqCiafJpHvHO98","https://scholar.google.com/scholar?cites=7887769952737090913&as_sdt=2005&sciodt=2007&hl=en",76,"2024-07-23 09:00:53","","","","",,,,,34,2.00,34,1,17,"… Members of both groups attach to substrates through single-cell, nonphotosynthetic structures (rhizoids in bryophytes and rhizines in lichens), and hence lack roots. Neither lichens nor …","","https://scholar.google.com/scholar?q=related:Yd3kFvv8dm0J:scholar.google.com/&scioq=peat+rhizoid&hl=en&as_sdt=2007"
69,"C Tian, Y Chen, X Zhao, L Zhao","Plant regeneration through protocorm-like bodies induced from rhizoids using leaf explants of Rosa spp.",2008,"Plant Cell Reports","Springer","https://link.springer.com/article/10.1007/s00299-007-0504-7","https://scholar.google.com/scholar?cites=8855074683211185924&as_sdt=2005&sciodt=2007&hl=en",77,"2024-07-23 09:00:53","","10.1007/s00299-007-0504-7","","",,,,,69,4.31,17,4,16,"… Rhizoids were induced from calli of leaf explants incubated under … of rhizoids cultured under light conditions on ½ MS medium containing 20 mg/l TDZ. About 90, 17 and 93% of rhizoid …","","https://scholar.google.com/scholar?q=related:BH9bGIKL43oJ:scholar.google.com/&scioq=peat+rhizoid&hl=en&as_sdt=2007"
6,"D Klavina, I Druva-Lusite, A Gailite","Asymbiotic cultivation in vitro of the endangered orchid Cypripedium calceolus L. and some aspects of ex vitro growth",2007,"III International Symposium on …","actahort.org","https://www.actahort.org/books/812/812_78.htm","https://scholar.google.com/scholar?cites=14067842492441311417&as_sdt=2005&sciodt=2007&hl=en",78,"2024-07-23 09:00:53","","","","",,,,,6,0.35,2,3,17,"… , protocorm growth stage (without production of rhizoids in our conditions), bud development… Ex vitro culture was tested using peat substrate with addition of sand, natural habitat soil (3:1…","","https://scholar.google.com/scholar?q=related:uTgcVjYEO8MJ:scholar.google.com/&scioq=peat+rhizoid&hl=en&as_sdt=2007"
2,"F Puspita, IR Dini, D Sari","Screening of Fungi from Oil Palm Rhizosphere in Peat Soils and the Potential as Biological Agents against Ganoderma boninense",2019,"Indonesian Journal of Agricultural …","talenta.usu.ac.id","https://talenta.usu.ac.id/InJAR/article/view/918","https://scholar.google.com/scholar?cites=13347355421543031463&as_sdt=2005&sciodt=2007&hl=en",79,"2024-07-23 09:00:53","","","","",,,,,2,0.40,1,3,5,"One of the diseases that attack oil palm plants is stem rot disease. Control efforts that can be done is to use rhizosphere fungi from oil palm plants in peat soils. This study aimed to select …","https://talenta.usu.ac.id/InJAR/article/view/918/1148","https://scholar.google.com/scholar?q=related:p-L03wlVO7kJ:scholar.google.com/&scioq=peat+rhizoid&hl=en&as_sdt=2007"
0,"NG Bayfield","30 Rehabilitation of disturbed ecosystems 2. 5",,"Institute of Terrestrial Ecology","nora.nerc.ac.uk","https://nora.nerc.ac.uk/id/eprint/507892/1/ITE%20AR%2082.pdf#page=30","",80,"2024-07-23 09:00:53","PDF","","","",,,,,0,0.00,0,1,,"… and with one side of glass to facilitate observations of rhizoid growth. The glass sides were normally covered to … commune), and rhizoid depths from 18 mm (D. scoparium) to 152 mm …","https://nora.nerc.ac.uk/id/eprint/507892/1/ITE%20AR%2082.pdf#page=30","https://scholar.google.com/scholar?q=related:c7PhEJlcR7UJ:scholar.google.com/&scioq=peat+rhizoid&hl=en&as_sdt=2007"
30,"DD Wynn-Williams","Comparative microbiology of moss-peat decomposition on the Scotia Arc and Antarctic Peninsula",1985,"Antarctic nutrient cycles and food webs","Springer","https://link.springer.com/chapter/10.1007/978-3-642-82275-9_29","https://scholar.google.com/scholar?cites=3025057288408907941&as_sdt=2005&sciodt=2007&hl=en",81,"2024-07-23 09:00:53","","10.1007/978-3-642-82275-9_29","","",,,,,30,0.77,30,1,39,"… peat is due to microbial activity (Davis 1981 ). A preliminary assay of 0 2 -uptake by excised rhizoids … -ground moss tissue to total peat respiration was 3%-14%. This assumed an active …","","https://scholar.google.com/scholar?q=related:pcDRjJMp-ykJ:scholar.google.com/&scioq=peat+rhizoid&hl=en&as_sdt=2007"
0,"JLG Massini","A Possible Endoparasitic Chytridiomycete Fungus From",,"","","","",82,"2024-07-23 09:00:53","CITATION","","","",,,,,0,0.00,0,1,,"","","https://scholar.google.com/scholar?q=related:62w4pXcv9GEJ:scholar.google.com/&scioq=peat+rhizoid&hl=en&as_sdt=2007"
0,"MP Kang, CZ Zhao, M Ma","Responses of plant biomass allocation and carbon storage characteristics to altitude gradient in alpine peat bogs",2023,"","researchsquare.com","https://www.researchsquare.com/article/rs-3244669/latest","",83,"2024-07-23 09:00:53","","","","",,,,,0,0.00,0,3,1,"… This is mainly because the plants in the peat swamp are mainly perennial sedge plants, and rhizoid plants such as Blysmus sinocompressus, Kobresia tibetica, Carex muliensis are the …","https://www.researchsquare.com/article/rs-3244669/latest.pdf","https://scholar.google.com/scholar?q=related:0sjR61IsFlcJ:scholar.google.com/&scioq=peat+rhizoid&hl=en&as_sdt=2007"
59,"DD Wynn-Williams","Seasonal fluctuations in microbial activity in Antarctic moss peat",1980,"Biological Journal of the Linnean Society","academic.oup.com","https://academic.oup.com/biolinnean/article-abstract/14/1/11/2682749","https://scholar.google.com/scholar?cites=6839819253594748930&as_sdt=2005&sciodt=2007&hl=en",84,"2024-07-23 09:00:53","","","","",,,,,59,1.34,59,1,44,"… rhizoids in the upper zone of the decomposing peat. No reliable estimates of stem and rhizoid … on autotrophic biomass, mainly bryophyte stems and rhizoids. The proportion of the non-…","","https://scholar.google.com/scholar?q=related:AnhkSl_r614J:scholar.google.com/&scioq=peat+rhizoid&hl=en&as_sdt=2007"
58,"JH Baker","The rate of production and decomposition of Chorisodontium aciphyllum (Hook f. and Wils.) Broth",1972,"British Antarctic Survey Bulletin","nora.nerc.ac.uk","https://nora.nerc.ac.uk/id/eprint/526159/1/bulletin27_09.pdf","https://scholar.google.com/scholar?cites=6400669819568083252&as_sdt=2005&sciodt=2007&hl=en",85,"2024-07-23 09:00:53","PDF","","","",,,,,58,1.12,58,1,52,"… , the energy for the growth of the rhizoids must have come from storage … rhizoid production in this instance was due to the stems being cut or whether it happens in the undisturbed peat…","https://nora.nerc.ac.uk/id/eprint/526159/1/bulletin27_09.pdf","https://scholar.google.com/scholar?q=related:NFHr50m_01gJ:scholar.google.com/&scioq=peat+rhizoid&hl=en&as_sdt=2007"
29,"JH Baker, DG Smith","The bacteria in an Antarctic peat",1972,"Journal of Applied Bacteriology","Wiley Online Library","https://ami-journals.onlinelibrary.wiley.com/doi/abs/10.1111/j.1365-2672.1972.tb03740.x","https://scholar.google.com/scholar?cites=11247878088714734688&as_sdt=2005&sciodt=2007&hl=en",86,"2024-07-23 09:00:53","","10.1111/j.1365-2672.1972.tb03740.x","","",,,,,29,0.56,15,2,52,"… fibrous acid peat and it is with the bacteriology of some such peat that this paper is concerned. … The peat chosen for this study formed a bank c. 110 m2 in area on the west coast of Sigiry …","","https://scholar.google.com/scholar?q=related:YMy9Iod9GJwJ:scholar.google.com/&scioq=peat+rhizoid&hl=en&as_sdt=2007"
9,"J Glime","Ecophysiology of development: protonema",2007,"Bryophyte ecology","researchgate.net","https://www.researchgate.net/profile/Janice-Glime/publication/242237272_CHAPTER_5-3_ECOPHYSIOLOGY_OF_DEVELOPMENT_PROTONEMA/links/5592b7ba08ae1e9cb429739f/CHAPTER-5-3-ECOPHYSIOLOGY-OF-DEVELOPMENT-PROTONEMA.pdf","https://scholar.google.com/scholar?cites=1395126660956761577&as_sdt=2005&sciodt=2007&hl=en",87,"2024-07-23 09:00:53","PDF","","","",,,,,9,0.53,9,1,17,"… Those liverworts with swollen rhizoids grow exclusively on peat and rotten wood associated with fungal hyphae. Pleurocarpous moss rhizoids become flattened near the tips, but in …","https://www.researchgate.net/profile/Janice-Glime/publication/242237272_CHAPTER_5-3_ECOPHYSIOLOGY_OF_DEVELOPMENT_PROTONEMA/links/5592b7ba08ae1e9cb429739f/CHAPTER-5-3-ECOPHYSIOLOGY-OF-DEVELOPMENT-PROTONEMA.pdf","https://scholar.google.com/scholar?q=related:6S0Bc058XBMJ:scholar.google.com/&scioq=peat+rhizoid&hl=en&as_sdt=2007"
0,"EB Bailey","Edinburgh Geological Society",1920,"Geological Magazine","cambridge.org","https://www.cambridge.org/core/journals/geological-magazine/article/edinburgh-geological-society/F3ECABFB4F88A942120FDAF02C024D56","",88,"2024-07-23 09:00:53","","","","",,,,,0,0.00,0,1,104,"… the peaty soil by numerous non-septate rhizoids. The plant was larger than R, Gwynne-Vaughani, and probably attained a height of 40-50 cm. There is, however, no clear information on …","","https://scholar.google.com/scholar?q=related:ul3-2t5x-C4J:scholar.google.com/&scioq=peat+rhizoid&hl=en&as_sdt=2007"
95,"LS Wong, R Hashim, FH Ali","A review on hydraulic conductivity and compressibility of peat",2009,"Journal of Applied Sciences","researchgate.net","https://www.researchgate.net/profile/Faisal-Ali-30/publication/26849363_A_Review_on_Hydraulic_Conductivity_and_Compressibility_of_Peat/links/557e418908aeea18b777c519/A-Review-on-Hydraulic-Conductivity-and-Compressibility-of-Peat.pdf","https://scholar.google.com/scholar?cites=6375258699738355801&as_sdt=2005&sciodt=2007&hl=en",89,"2024-07-23 09:00:53","PDF","","","",,,,,95,6.33,32,3,15,"… peat in hydraulic conductivity and compressibility. A study on the mechanical properties of peat … Preloading technique is normally employed as a method to improve peat ground so that …","https://www.researchgate.net/profile/Faisal-Ali-30/publication/26849363_A_Review_on_Hydraulic_Conductivity_and_Compressibility_of_Peat/links/557e418908aeea18b777c519/A-Review-on-Hydraulic-Conductivity-and-Compressibility-of-Peat.pdf","https://scholar.google.com/scholar?q=related:WZgfhQJ4eVgJ:scholar.google.com/&scioq=peat+rhizoid&hl=en&as_sdt=2007"
25,"DH Vitt","A key and review of bryophytes common in North American peatlands",2014,"Evansia","BioOne","https://bioone.org/journals/evansia/volume-31/issue-4/079.031.0402/A-Key-and-Review-of-Bryophytes-Common-in-North-American/10.1639/079.031.0402.short","https://scholar.google.com/scholar?cites=14373052278952369058&as_sdt=2005&sciodt=2007&hl=en",90,"2024-07-23 09:00:53","","10.1639/079.031.0402.short","","",,,,,25,2.50,25,1,10,"… Peatlands are ecosystems that over millennia have accumulated organic matter as deposits of peat… Plants erect, unbranched, reddish below owing to dense tomentum of reddish rhizoids…","https://www.researchgate.net/profile/Dale-Vitt-2/publication/272352700_A_Key_and_Review_of_Bryophytes_Common_in_North_American_Peatlands/links/54e2658c0cf2c3e7d2d3a0e4/A-Key-and-Review-of-Bryophytes-Common-in-North-American-Peatlands.pdf","https://scholar.google.com/scholar?q=related:ohsTYeVWd8cJ:scholar.google.com/&scioq=peat+rhizoid&hl=en&as_sdt=2007"
100,"SB Kroken, LE Graham, ME Cook","Occurrence and evolutionary significance of resistant cell walls in charophytes and bryophytes",1996,"American Journal of Botany","Wiley Online Library","https://bsapubs.onlinelibrary.wiley.com/doi/abs/10.1002/j.1537-2197.1996.tb13908.x","https://scholar.google.com/scholar?cites=178259157397795038&as_sdt=2005&sciodt=2007&hl=en",91,"2024-07-23 09:00:53","","10.1002/j.1537-2197.1996.tb13908.x","","",,,,,100,3.57,33,3,28,"… sporangial epidermis, spiral thickenings of e1aters, rhizoids, and leaves in the special case of … in the pulverized moss peat, and was qualitatively like that of unadulterated moss peat. …","","https://scholar.google.com/scholar?q=related:3vCnWsJNeQIJ:scholar.google.com/&scioq=peat+rhizoid&hl=en&as_sdt=2007"
0,"JHC Fenton","The contribution of Antarctic moss peat to the understanding of global peatland processes",2022,"Antarctic Science","cambridge.org","https://www.cambridge.org/core/journals/antarctic-science/article/contribution-of-antarctic-moss-peat-to-the-understanding-of-global-peatland-processes/C67B099EC2EF0EDA9FF04A96020AD8BF","",92,"2024-07-23 09:00:53","","","","",,,,,0,0.00,0,1,2,"… peat. They can provide insights into how the balance of growth, decomposition and compaction of peat results in peat … patterned bogs and how erosion of peat can be a natural process. …","https://www.auricht.com/awi/documents/peat/the-contribution-of-antarctic-moss-peat-to-the-understanding-of-global-peatland-processes.pdf","https://scholar.google.com/scholar?q=related:2gaOJIw0c0sJ:scholar.google.com/&scioq=peat+rhizoid&hl=en&as_sdt=2007"
10,"H Kiheri, S Velmala, T Pennanen, S Timonen…","Fungal colonization patterns and enzymatic activities of peatland ericaceous plants following long-term nutrient addition",2020,"Soil Biology and …","Elsevier","https://www.sciencedirect.com/science/article/pii/S0038071720301309","https://scholar.google.com/scholar?cites=15101286821772022680&as_sdt=2005&sciodt=2007&hl=en",93,"2024-07-23 09:00:53","HTML","","","",,,,,10,2.50,2,5,4,"… Northern peatlands are often dominated by ericaceous shrub species which rely on ericoid … melanized DSE may have implications for peatland C sequestration under nutrient addition. …","https://www.sciencedirect.com/science/article/pii/S0038071720301309","https://scholar.google.com/scholar?q=related:mFMCt1qMktEJ:scholar.google.com/&scioq=peat+rhizoid&hl=en&as_sdt=2007"
62,"A Jonathan Shaw, N Devos, Y Liu, CJ Cox…","Organellar phylogenomics of an emerging model system: Sphagnum (peatmoss)",2016,"Annals of …","academic.oup.com","https://academic.oup.com/aob/article-abstract/118/2/185/1740364","https://scholar.google.com/scholar?cites=1378299934107368530&as_sdt=2005&sciodt=2007&hl=en",94,"2024-07-23 09:00:53","","","","",,,,,62,7.75,12,5,8,"… in the biogeochemistry of peatlands and the Sphagnum traits … ), and they also lack rhizoids, which anchor other mosses to … research on peatmosses and peatlands, we need to know …","https://academic.oup.com/aob/article/118/2/185/1740364","https://scholar.google.com/scholar?q=related:Uvxpzny0IBMJ:scholar.google.com/&scioq=peat+rhizoid&hl=en&as_sdt=2007"
23,"M Chiaffredo, C Figureau","Substrate containing Cyanophycea and Bryophyte protonemas for producing vegetation on bare terrain",1995,"US Patent 5,441,877","Google Patents","https://patents.google.com/patent/US5441877A/en","https://scholar.google.com/scholar?cites=1763896701028391892&as_sdt=2005&sciodt=2007&hl=en",95,"2024-07-23 09:00:53","","","","",,,,,23,0.79,12,2,29,"… The material rich in organic matter is preferably black peat, … A ground mass of leaves, twigs and rhizoids in the powder … spores introduced into micronized black peat, then suspended in …","https://patentimages.storage.googleapis.com/39/4f/f0/16ea0579a18035/US5441877.pdf","https://scholar.google.com/scholar?q=related:1NtHPbSeehgJ:scholar.google.com/&scioq=peat+rhizoid&hl=en&as_sdt=2007"
15,"RV Thummel, WH Brightly, CAE Strömberg","Evolution of phytolith deposition in modern bryophytes, and implications for the fossil record and influence on silica cycle in early land plant evolution",2019,"New Phytologist","Wiley Online Library","https://nph.onlinelibrary.wiley.com/doi/abs/10.1111/nph.15559","https://scholar.google.com/scholar?cites=615615588369698327&as_sdt=2005&sciodt=2007&hl=en",96,"2024-07-23 09:00:53","","10.1111/nph.15559","","",,,,,15,3.00,5,3,5,"… of Monoclea, which has only sparsely pegged rhizoids, all productive samples of liverwort taxa that have pegged rhizoids also produced phytoliths of pegged rhizoids (Fig. 3), and these …","https://nph.onlinelibrary.wiley.com/doi/pdfdirect/10.1111/nph.15559","https://scholar.google.com/scholar?q=related:Fw74rh0biwgJ:scholar.google.com/&scioq=peat+rhizoid&hl=en&as_sdt=2007"
2,"C Cardona-Correa, A Ecker…","Direction of illumination controls gametophyte orientation in seedless plants and related algae",2015,"Plant signaling & …","Taylor &Francis","https://www.tandfonline.com/doi/abs/10.1080/15592324.2015.1051277","https://scholar.google.com/scholar?cites=14730432581407110513&as_sdt=2005&sciodt=2007&hl=en",97,"2024-07-23 09:00:53","","10.1080/15592324.2015.1051277","","",,,,,2,0.22,1,3,9,"… –whose ventral rhizoids initially penetrated agar substrate … bearing rhizoids faced overlying air space and rhizoids extended … Cultures identified as the peat moss Sphagnum compactum, …","https://www.tandfonline.com/doi/pdf/10.1080/15592324.2015.1051277","https://scholar.google.com/scholar?q=related:cXWcOmMCbcwJ:scholar.google.com/&scioq=peat+rhizoid&hl=en&as_sdt=2007"
6,"EA Odu","Extracellular adhesive substances on bryophyte rhizoids",1989,"Acta Botanica Hungarica","","","https://scholar.google.com/scholar?cites=14789192735915088363&as_sdt=2005&sciodt=2007&hl=en",98,"2024-07-23 09:00:53","CITATION","","","",,,,,6,0.17,6,1,35,"","","https://scholar.google.com/scholar?q=related:65kB02_EPc0J:scholar.google.com/&scioq=peat+rhizoid&hl=en&as_sdt=2007"
0,"DD WYNN-WILLIAMS","Q factors. At high water content, conditions became microaerophilic in Calliergon peat and anaerobic in Cephaloziella. The stabilising effect of the water …",,"core.ac.uk","","https://core.ac.uk/download/pdf/200755154.pdf","",99,"2024-07-23 09:00:53","PDF","","","",,,,,0,0.00,0,1,,"… 1, none of these species has rhizoids. This community grows on peat 4-20 cm deep (mean … dark brown decomposing stems, below which the peat is more amorphous and changes from …","https://core.ac.uk/download/pdf/200755154.pdf","https://scholar.google.com/scholar?q=related:g27VaV2ozLoJ:scholar.google.com/&scioq=peat+rhizoid&hl=en&as_sdt=2007"
51,"DD Dimitrov, RF Grant, PM Lafleur…","Modeling the effects of hydrology on gross primary productivity and net ecosystem productivity at Mer Bleue bog",2011,"Journal of …","Wiley Online Library","https://agupubs.onlinelibrary.wiley.com/doi/abs/10.1029/2010JG001586","https://scholar.google.com/scholar?cites=17768406191234783305&as_sdt=2005&sciodt=2007&hl=en",100,"2024-07-23 09:00:53","","10.1029/2010JG001586","","",,,,,51,3.92,13,4,13,"… peat layers below ∼10 cm depth in hummocks and peat in … /rhizoid surfaces (Ω S ), radial resistances from those surfaces to root/rhizoid axes (Ω R ) and axial resistances of root/rhizoid …","https://agupubs.onlinelibrary.wiley.com/doi/pdfdirect/10.1029/2010JG001586","https://scholar.google.com/scholar?q=related:SZhmNUoPlvYJ:scholar.google.com/&scioq=peat+rhizoid&hl=en&as_sdt=2007"
20,"C Albinsson","Niche relations and association analysis of southern Swedish mire hepatics",1997,"Journal of Bryology","Taylor &Francis","https://www.tandfonline.com/doi/abs/10.1179/jbr.1997.19.3.409","https://scholar.google.com/scholar?cites=15138117711238519581&as_sdt=2005&sciodt=2007&hl=en",101,"2024-07-23 09:00:53","","10.1179/jbr.1997.19.3.409","","",,,,,20,0.74,20,1,27,"… The term ‘compromise strategy’ is introduced for the hepatics that rely on habitats created by other living bryophytes and ‘avoidance strategy’ for those hepatics that instead prefer peat …","","https://scholar.google.com/scholar?q=related:HdtratplFdIJ:scholar.google.com/&scioq=peat+rhizoid&hl=en&as_sdt=2007"
