Cites,Authors,Title,Year,Source,Publisher,ArticleURL,CitesURL,GSRank,QueryDate,Type,DOI,ISSN,CitationURL,Volume,Issue,StartPage,EndPage,ECC,CitesPerYear,CitesPerAuthor,AuthorCount,Age,Abstract,FullTextURL,RelatedURL
2026,"G. Rondeaux","Optimization of soil-adjusted vegetation indices",1996,"Remote Sensing of Environment","","https://api.elsevier.com/content/article/eid/1-s2.0-0034425795001867","https://www.scopus.com/inward/citedby.uri?partnerID=HzOxMe3b&scp=0029751226&origin=inward",1,"2024-07-23 10:07:48","Article","10.1016/0034-4257(95)00186-7","0034-4257","https://api.elsevier.com/content/abstract/scopus_id/0029751226",55,2,95,107,2026,72.36,2026,1,28,"","",""
457,"Y. Chen","Characterization of chemical functional groups in macerals across different coal ranks via micro-FTIR spectroscopy",2012,"International Journal of Coal Geology","","https://api.elsevier.com/content/article/eid/1-s2.0-S0166516212002121","https://www.scopus.com/inward/citedby.uri?partnerID=HzOxMe3b&scp=84868262986&origin=inward",2,"2024-07-23 10:07:48","Article","10.1016/j.coal.2012.09.001","0166-5162","https://api.elsevier.com/content/abstract/scopus_id/84868262986",104,,22,33,457,38.08,457,1,12,"","",""
413,"M. Teichmüller","The genesis of coal from the viewpoint of coal petrology",1989,"International Journal of Coal Geology","","https://api.elsevier.com/content/article/eid/1-s2.0-0166516289900475","https://www.scopus.com/inward/citedby.uri?partnerID=HzOxMe3b&scp=0024856632&origin=inward",3,"2024-07-23 10:07:48","Article","10.1016/0166-5162(89)90047-5","0166-5162","https://api.elsevier.com/content/abstract/scopus_id/0024856632",12,1,1,87,413,11.80,413,1,35,"","",""
313,"J. Niemeyer","Characterization of humic acids, composts, and peat by diffuse reflectance Fourier-transform infrared spectroscopy",1992,"Soil Science Society of America Journal","","","https://www.scopus.com/inward/citedby.uri?partnerID=HzOxMe3b&scp=0027009354&origin=inward",4,"2024-07-23 10:07:48","Article","10.2136/sssaj1992.03615995005600010021x","0361-5995","https://api.elsevier.com/content/abstract/scopus_id/0027009354",56,1,135,140,313,9.78,313,1,32,"","",""
275,"Y. Guo","FTIR spectroscopy and reflectance of modern charcoals and fungal decayed woods: implications for studies of inertinite in coals",1998,"International Journal of Coal Geology","","https://api.elsevier.com/content/article/eid/1-s2.0-S0166516298000196","https://www.scopus.com/inward/citedby.uri?partnerID=HzOxMe3b&scp=0342659914&origin=inward",5,"2024-07-23 10:07:48","Article","10.1016/S0166-5162(98)00019-6","0166-5162","https://api.elsevier.com/content/abstract/scopus_id/0342659914",37,1,29,53,275,10.58,275,1,26,"","",""
274,"J.M.K. O'Keefe","On the fundamental difference between coal rank and coal type",2013,"International Journal of Coal Geology","","https://api.elsevier.com/content/article/eid/1-s2.0-S0166516213001912","https://www.scopus.com/inward/citedby.uri?partnerID=HzOxMe3b&scp=84884494058&origin=inward",6,"2024-07-23 10:07:48","Review","10.1016/j.coal.2013.08.007","0166-5162","https://api.elsevier.com/content/abstract/scopus_id/84884494058",118,,58,87,274,24.91,274,1,11,"","",""
263,"M. Teichmüller","Fluorescence microscopical rank studies on liptinites and vitrinites in peat and coals, and comparison with results of the rock-eval pyrolysis",1983,"International Journal of Coal Geology","","https://api.elsevier.com/content/article/eid/1-s2.0-0166516283900010","https://www.scopus.com/inward/citedby.uri?partnerID=HzOxMe3b&scp=0020707378&origin=inward",7,"2024-07-23 10:07:48","Article","10.1016/0166-5162(83)90001-0","0166-5162","https://api.elsevier.com/content/abstract/scopus_id/0020707378",2,3,197,230,263,6.41,263,1,41,"","",""
261,"A.U. Baes","Diffuse reflectance and transmission Fourier transform infrared (DRIFT) spectroscopy of humic and fulvic acids",1989,"Soil Science Society of America Journal","","","https://www.scopus.com/inward/citedby.uri?partnerID=HzOxMe3b&scp=0024800458&origin=inward",8,"2024-07-23 10:07:48","Article","10.2136/sssaj1989.03615995005300030008x","0361-5995","https://api.elsevier.com/content/abstract/scopus_id/0024800458",53,3,695,700,261,7.46,261,1,35,"","",""
229,"Y. Li","Coal pore size distributions controlled by the coalification process: An experimental study of coals from the Junggar, Ordos and Qinshui basins in China",2017,"Fuel","","https://api.elsevier.com/content/article/eid/1-s2.0-S0016236117307275","https://www.scopus.com/inward/citedby.uri?partnerID=HzOxMe3b&scp=85020712334&origin=inward",9,"2024-07-23 10:07:48","Article","10.1016/j.fuel.2017.06.028","0016-2361","https://api.elsevier.com/content/abstract/scopus_id/85020712334",206,,352,363,229,32.71,229,1,7,"","",""
216,"A. Scott","The nature and influence of fire in Carboniferous ecosystems",1994,"Palaeogeography, Palaeoclimatology, Palaeoecology","","https://api.elsevier.com/content/article/eid/1-s2.0-0031018294900051","https://www.scopus.com/inward/citedby.uri?partnerID=HzOxMe3b&scp=0028259554&origin=inward",10,"2024-07-23 10:07:48","Article","10.1016/0031-0182(94)90005-1","0031-0182","https://api.elsevier.com/content/abstract/scopus_id/0028259554",106,1,91,112,216,7.20,216,1,30,"","",""
169,"S. Dai","Elemental and mineralogical anomalies in the coal-hosted Ge ore deposit of Lincang, Yunnan, southwestern China: Key role of N<inf>2</inf>-CO<inf>2</inf>-mixed hydrothermal solutions",2015,"International Journal of Coal Geology","","https://api.elsevier.com/content/article/eid/1-s2.0-S0166516214002390","https://www.scopus.com/inward/citedby.uri?partnerID=HzOxMe3b&scp=84941367630&origin=inward",11,"2024-07-23 10:07:48","Article","10.1016/j.coal.2014.11.006","0166-5162","https://api.elsevier.com/content/abstract/scopus_id/84941367630",152,,19,46,169,18.78,169,1,9,"","",""
164,"S. Zhang","The characteristics of coal reservoir pores and coal facies in Liulin district, Hedong coal field of China",2010,"International Journal of Coal Geology","","https://api.elsevier.com/content/article/eid/1-s2.0-S0166516209002031","https://www.scopus.com/inward/citedby.uri?partnerID=HzOxMe3b&scp=73449146937&origin=inward",12,"2024-07-23 10:07:48","Article","10.1016/j.coal.2009.11.007","0166-5162","https://api.elsevier.com/content/abstract/scopus_id/73449146937",81,2,117,127,164,11.71,164,1,14,"","",""
160,"C. Diessel","On balanced and unbalanced accommodation/peat accumulation ratios in the Cretaceous coals from Gates Formation, Western Canada, and their sequence-stratigraphic significance",2000,"International Journal of Coal Geology","","https://api.elsevier.com/content/article/eid/1-s2.0-S0166516299000580","https://www.scopus.com/inward/citedby.uri?partnerID=HzOxMe3b&scp=0034075569&origin=inward",13,"2024-07-23 10:07:48","Conference Paper","10.1016/S0166-5162(99)00058-0","0166-5162","https://api.elsevier.com/content/abstract/scopus_id/0034075569",43,1,143,186,160,6.67,160,1,24,"","",""
138,"Z. Wei","Diamondoid hydrocarbons as a molecular proxy for thermal maturity and oil cracking: Geochemical models from hydrous pyrolysis",2007,"Organic Geochemistry","","https://api.elsevier.com/content/article/eid/1-s2.0-S0146638006002488","https://www.scopus.com/inward/citedby.uri?partnerID=HzOxMe3b&scp=33846648041&origin=inward",14,"2024-07-23 10:07:48","Article","10.1016/j.orggeochem.2006.09.011","0146-6380","https://api.elsevier.com/content/abstract/scopus_id/33846648041",38,2,227,249,138,8.12,138,1,17,"","",""
136,"R. Suggate","Carbon NMR of coals: The effects of coal type and rank",2004,"International Journal of Coal Geology","","https://api.elsevier.com/content/article/eid/1-s2.0-S0166516203001162","https://www.scopus.com/inward/citedby.uri?partnerID=HzOxMe3b&scp=1642463792&origin=inward",15,"2024-07-23 10:07:48","Article","10.1016/S0166-5162(03)00116-2","0166-5162","https://api.elsevier.com/content/abstract/scopus_id/1642463792",57,1,1,22,136,6.80,136,1,20,"","",""
127,"M.L.S. Oliveira","Mineralogy and leaching characteristics of beneficiated coal products from Santa Catarina, Brazil",2012,"International Journal of Coal Geology","","https://api.elsevier.com/content/article/eid/1-s2.0-S0166516211002217","https://www.scopus.com/inward/citedby.uri?partnerID=HzOxMe3b&scp=84859964469&origin=inward",16,"2024-07-23 10:07:48","Article","10.1016/j.coal.2011.10.004","0166-5162","https://api.elsevier.com/content/abstract/scopus_id/84859964469",94,,314,325,127,10.58,127,1,12,"","",""
123,"R. Hinrichs","Simple procedure for an estimation of the coal rank using micro-Raman spectroscopy",2014,"International Journal of Coal Geology","","https://api.elsevier.com/content/article/eid/1-s2.0-S0166516214002237","https://www.scopus.com/inward/citedby.uri?partnerID=HzOxMe3b&scp=84918533565&origin=inward",17,"2024-07-23 10:07:48","Article","10.1016/j.coal.2014.10.013","0166-5162","https://api.elsevier.com/content/abstract/scopus_id/84918533565",136,,52,58,123,12.30,123,1,10,"","",""
111,"E. Eiche","Geochemical processes underlying a sharp contrast in groundwater arsenic concentrations in a village on the Red River delta, Vietnam",2008,"Applied Geochemistry","","https://api.elsevier.com/content/article/eid/1-s2.0-S0883292708002461","https://www.scopus.com/inward/citedby.uri?partnerID=HzOxMe3b&scp=54449085896&origin=inward",18,"2024-07-23 10:07:48","Article","10.1016/j.apgeochem.2008.06.023","0883-2927","https://api.elsevier.com/content/abstract/scopus_id/54449085896",23,11,3143,3154,111,6.94,111,1,16,"","",""
102,"K.H. Syed","Environmental control of net ecosystem CO<inf>2</inf> exchange in a treed, moderately rich fen in northern Alberta",2006,"Agricultural and Forest Meteorology","","https://api.elsevier.com/content/article/eid/1-s2.0-S016819230600222X","https://www.scopus.com/inward/citedby.uri?partnerID=HzOxMe3b&scp=33845200909&origin=inward",19,"2024-07-23 10:07:48","Article","10.1016/j.agrformet.2006.03.022","0168-1923","https://api.elsevier.com/content/abstract/scopus_id/33845200909",140,1,97,114,102,5.67,102,1,18,"","",""
100,"C. Knoth","Unmanned aerial vehicles as innovative remote sensing platforms for high-resolution infrared imagery to support restoration monitoring in cut-over bogs",2013,"Applied Vegetation Science","","","https://www.scopus.com/inward/citedby.uri?partnerID=HzOxMe3b&scp=84878782534&origin=inward",20,"2024-07-23 10:07:48","Article","10.1111/avsc.12024","1402-2001","https://api.elsevier.com/content/abstract/scopus_id/84878782534",16,3,509,517,100,9.09,100,1,11,"","",""
93,"S. Kelemen","Thermal transformations of nitrogen and sulfur forms in peat related to coalification",2006,"Energy and Fuels","","","https://www.scopus.com/inward/citedby.uri?partnerID=HzOxMe3b&scp=33645771465&origin=inward",21,"2024-07-23 10:07:48","Article","10.1021/ef050307p","0887-0624","https://api.elsevier.com/content/abstract/scopus_id/33645771465",20,2,635,652,93,5.17,93,1,18,"","",""
91,"M.P. Singh","Petrographic characterization and evolution of the Permian coal deposits of the Rajmahal basin, Bihar, India",1996,"International Journal of Coal Geology","","https://api.elsevier.com/content/article/eid/1-s2.0-0166516295000054","https://www.scopus.com/inward/citedby.uri?partnerID=HzOxMe3b&scp=0029667445&origin=inward",22,"2024-07-23 10:07:48","Article","10.1016/0166-5162(95)00005-4","0166-5162","https://api.elsevier.com/content/abstract/scopus_id/0029667445",29,1,93,118,91,3.25,91,1,28,"","",""
88,"H. Petersen","Coal-generated oil: Source rock evaluation and petroleum geochemistry of the Lulita oilfield, Danish North Sea",2000,"Journal of Petroleum Geology","","","https://www.scopus.com/inward/citedby.uri?partnerID=HzOxMe3b&scp=0034056614&origin=inward",23,"2024-07-23 10:07:48","Article","10.1111/j.1747-5457.2000.tb00484.x","0141-6421","https://api.elsevier.com/content/abstract/scopus_id/0034056614",23,1,55,90,88,3.67,88,1,24,"","",""
87,"C.F.K. Diessel","Utility of coal petrology for sequence-stratigraphic analysis",2007,"International Journal of Coal Geology","","https://api.elsevier.com/content/article/eid/1-s2.0-S0166516206000954","https://www.scopus.com/inward/citedby.uri?partnerID=HzOxMe3b&scp=33846992001&origin=inward",24,"2024-07-23 10:07:48","Article","10.1016/j.coal.2006.01.008","0166-5162","https://api.elsevier.com/content/abstract/scopus_id/33846992001",70,1,3,34,87,5.12,87,1,17,"","",""
86,"F. Braadbaart","Fuel, Fire and Heat: An experimental approach to highlight the potential of studying ash and char remains from archaeological contexts",2012,"Journal of Archaeological Science","","https://api.elsevier.com/content/article/eid/1-s2.0-S0305440311003682","https://www.scopus.com/inward/citedby.uri?partnerID=HzOxMe3b&scp=84856383701&origin=inward",25,"2024-07-23 10:07:48","Article","10.1016/j.jas.2011.10.009","0305-4403","https://api.elsevier.com/content/abstract/scopus_id/84856383701",39,4,836,847,86,7.17,86,1,12,"","",""
85,"G. Granberg","Sources of spatial variation in methane emission from mires in northern Sweden: A mechanistic approach in statistical modeling",1997,"Global Biogeochemical Cycles","","","https://www.scopus.com/inward/citedby.uri?partnerID=HzOxMe3b&scp=0031457302&origin=inward",26,"2024-07-23 10:07:48","Article","10.1029/96GB03352","0886-6236","https://api.elsevier.com/content/abstract/scopus_id/0031457302",11,2,135,150,85,3.15,85,1,27,"","",""
83,"O. Francioso","Spectroscopic study of humic acids fractionated by means of tangential ultrafiltration",2002,"Journal of Molecular Structure","","https://api.elsevier.com/content/article/eid/1-s2.0-S0022286001009711","https://www.scopus.com/inward/citedby.uri?partnerID=HzOxMe3b&scp=0037198464&origin=inward",27,"2024-07-23 10:07:48","Article","10.1016/S0022-2860(01)00971-1","0022-2860","https://api.elsevier.com/content/abstract/scopus_id/0037198464",609,1,137,147,83,3.77,83,1,22,"","",""
82,"J.C. Hower","Notes on the origin of inertinite macerals in coals: Observations on the importance of fungi in the origin of macrinite",2009,"International Journal of Coal Geology","","https://api.elsevier.com/content/article/eid/1-s2.0-S0166516209001335","https://www.scopus.com/inward/citedby.uri?partnerID=HzOxMe3b&scp=70349989951&origin=inward",28,"2024-07-23 10:07:48","Article","10.1016/j.coal.2009.08.006","0166-5162","https://api.elsevier.com/content/abstract/scopus_id/70349989951",80,2,135,143,82,5.47,82,1,15,"","",""
82,"J. Newman","Reflectance anomalies in Pike River coals: Evidence of variability in vitrinite type, with implications for maturation studies and “Suggate rank”",1982,"New Zealand Journal of Geology and Geophysics","","","https://www.scopus.com/inward/citedby.uri?partnerID=HzOxMe3b&scp=0000296020&origin=inward",29,"2024-07-23 10:07:48","Article","10.1080/00288306.1982.10421412","0028-8306","https://api.elsevier.com/content/abstract/scopus_id/0000296020",25,2,233,243,82,1.95,82,1,42,"","",""
80,"K. Jasper","Evolution of Pennsylvanian (Late Carboniferous) peat swamps of the Ruhr Basin, Germany: Comparison of palynological, coal petrographical and organic geochemical data",2010,"International Journal of Coal Geology","","https://api.elsevier.com/content/article/eid/1-s2.0-S0166516210001035","https://www.scopus.com/inward/citedby.uri?partnerID=HzOxMe3b&scp=77956180172&origin=inward",30,"2024-07-23 10:07:48","Review","10.1016/j.coal.2010.05.008","0166-5162","https://api.elsevier.com/content/abstract/scopus_id/77956180172",83,4,346,365,80,5.71,80,1,14,"","",""
80,"B.R. Jahn","Mid-infrared Spectroscopic Determination of Soil Nitrate Content",2006,"Biosystems Engineering","","https://api.elsevier.com/content/article/eid/1-s2.0-S1537511006001814","https://www.scopus.com/inward/citedby.uri?partnerID=HzOxMe3b&scp=33746462990&origin=inward",31,"2024-07-23 10:07:48","Article","10.1016/j.biosystemseng.2006.05.011","1537-5110","https://api.elsevier.com/content/abstract/scopus_id/33746462990",94,4,505,515,80,4.44,80,1,18,"","",""
79,"H. Amijaya","Microfacies and depositional environment of Tertiary Tanjung Enim low rank coal, South Sumatra Basin, Indonesia",2005,"International Journal of Coal Geology","","https://api.elsevier.com/content/article/eid/1-s2.0-S0166516204001326","https://www.scopus.com/inward/citedby.uri?partnerID=HzOxMe3b&scp=12344325852&origin=inward",32,"2024-07-23 10:07:48","Article","10.1016/j.coal.2004.07.004","0166-5162","https://api.elsevier.com/content/abstract/scopus_id/12344325852",61,3,197,221,79,4.16,79,1,19,"","",""
77,"J. Holden","Hydrological connectivity of soil pipes determined by ground-penetrating radar tracer detection",2004,"Earth Surface Processes and Landforms","","","https://www.scopus.com/inward/citedby.uri?partnerID=HzOxMe3b&scp=2142774179&origin=inward",33,"2024-07-23 10:07:48","Article","10.1002/esp.1039","0197-9337","https://api.elsevier.com/content/abstract/scopus_id/2142774179",29,4,437,442,77,3.85,77,1,20,"","",""
75,"S. Kalaitzidis","Late Cretaceous coal overlying karstic bauxite deposits in the Parnassus-Ghiona Unit, Central Greece: Coal characteristics and depositional environment",2010,"International Journal of Coal Geology","","https://api.elsevier.com/content/article/eid/1-s2.0-S0166516209000895","https://www.scopus.com/inward/citedby.uri?partnerID=HzOxMe3b&scp=77950690604&origin=inward",34,"2024-07-23 10:07:48","Article","10.1016/j.coal.2009.06.005","0166-5162","https://api.elsevier.com/content/abstract/scopus_id/77950690604",81,4,211,226,75,5.36,75,1,14,"","",""
73,"Y. Fujii","Characteristics of carbonaceous aerosols emitted from peatland fire in Riau, Sumatra, Indonesia",2014,"Atmospheric Environment","","https://api.elsevier.com/content/article/eid/1-s2.0-S1352231014000569","https://www.scopus.com/inward/citedby.uri?partnerID=HzOxMe3b&scp=84896881430&origin=inward",35,"2024-07-23 10:07:48","Article","10.1016/j.atmosenv.2014.01.037","1352-2310","https://api.elsevier.com/content/abstract/scopus_id/84896881430",87,,164,169,73,7.30,73,1,10,"","",""
72,"T. Gentzis","Coalbed methane producibility from the Mannville coals in Alberta, Canada: A comparison of two areas",2008,"International Journal of Coal Geology","","https://api.elsevier.com/content/article/eid/1-s2.0-S0166516208000256","https://www.scopus.com/inward/citedby.uri?partnerID=HzOxMe3b&scp=41749090457&origin=inward",36,"2024-07-23 10:07:48","Article","10.1016/j.coal.2008.01.004","0166-5162","https://api.elsevier.com/content/abstract/scopus_id/41749090457",74,3,237,249,72,4.50,72,1,16,"","",""
71,"S. GHOSH","Sorption and Fractionation of a Peat Derived Humic Acid by Kaolinite, Montmorillonite, and Goethite Project supported by the Federal Hatch Program, USA (No. MAS 8532); the Cheung Kong Scholar Program, Ministry of Education of China; and the CSREES, USDA National Research Initiative Competitive Grants Program, USA (No. 2005-35107-15278).",2009,"Pedosphere","","https://api.elsevier.com/content/article/eid/1-s2.0-S1002016008600806","https://www.scopus.com/inward/citedby.uri?partnerID=HzOxMe3b&scp=58149087577&origin=inward",37,"2024-07-23 10:07:48","Article","10.1016/S1002-0160(08)60080-6","1002-0160","https://api.elsevier.com/content/abstract/scopus_id/58149087577",19,1,21,30,71,4.73,71,1,15,"","",""
68,"R. Littke","Petrology and genesis of Upper Carboniferous seams from the Ruhr region, West Germany",1987,"International Journal of Coal Geology","","https://api.elsevier.com/content/article/eid/1-s2.0-0166516287900474","https://www.scopus.com/inward/citedby.uri?partnerID=HzOxMe3b&scp=0023163166&origin=inward",38,"2024-07-23 10:07:48","Article","10.1016/0166-5162(87)90047-4","0166-5162","https://api.elsevier.com/content/abstract/scopus_id/0023163166",7,2,147,184,68,1.84,68,1,37,"","",""
67,"J.E. Vogelmann","Spectral reflectance measurements in the genus Sphagnum",1993,"Remote Sensing of Environment","","https://api.elsevier.com/content/article/eid/1-s2.0-003442579390110J","https://www.scopus.com/inward/citedby.uri?partnerID=HzOxMe3b&scp=0027799475&origin=inward",39,"2024-07-23 10:07:48","Article","10.1016/0034-4257(93)90110-J","0034-4257","https://api.elsevier.com/content/abstract/scopus_id/0027799475",45,3,273,279,67,2.16,67,1,31,"","",""
66,"E. Honkavaara","Remote Sensing of 3-D Geometry and Surface Moisture of a Peat Production Area Using Hyperspectral Frame Cameras in Visible to Short-Wave Infrared Spectral Ranges Onboard a Small Unmanned Airborne Vehicle (UAV)",2016,"IEEE Transactions on Geoscience and Remote Sensing","","","https://www.scopus.com/inward/citedby.uri?partnerID=HzOxMe3b&scp=84971430929&origin=inward",40,"2024-07-23 10:07:48","Article","10.1109/TGRS.2016.2565471","0196-2892","https://api.elsevier.com/content/abstract/scopus_id/84971430929",54,9,5440,5454,66,8.25,66,1,8,"","",""
65,"J.W.H. Weijers","Bacterial tetraether membrane lipids in peat and coal: Testing the MBT-CBT temperature proxy for climate reconstruction",2011,"Organic Geochemistry","","https://api.elsevier.com/content/article/eid/1-s2.0-S0146638011000672","https://www.scopus.com/inward/citedby.uri?partnerID=HzOxMe3b&scp=79957922562&origin=inward",41,"2024-07-23 10:07:48","Article","10.1016/j.orggeochem.2011.03.013","0146-6380","https://api.elsevier.com/content/abstract/scopus_id/79957922562",42,5,477,486,65,5.00,65,1,13,"","",""
63,"H. Amijaya","Organic geochemistry of the Lower Suban coal seam, South Sumatra Basin, Indonesia: Palaeoecological and thermal metamorphism implications",2006,"Organic Geochemistry","","https://api.elsevier.com/content/article/eid/1-s2.0-S0146638005002512","https://www.scopus.com/inward/citedby.uri?partnerID=HzOxMe3b&scp=32844460493&origin=inward",42,"2024-07-23 10:07:48","Article","10.1016/j.orggeochem.2005.10.012","0146-6380","https://api.elsevier.com/content/abstract/scopus_id/32844460493",37,3,261,279,63,3.50,63,1,18,"","",""
61,"M. Hakimi","Organic geochemical and petrographic characteristics of Tertiary coals in the northwest Sarawak, Malaysia: Implications for palaeoenvironmental conditions and hydrocarbon generation potential",2013,"Marine and Petroleum Geology","","https://api.elsevier.com/content/article/eid/1-s2.0-S0264817213001773","https://www.scopus.com/inward/citedby.uri?partnerID=HzOxMe3b&scp=84881533872&origin=inward",43,"2024-07-23 10:07:48","Article","10.1016/j.marpetgeo.2013.07.009","0264-8172","https://api.elsevier.com/content/abstract/scopus_id/84881533872",48,,31,46,61,5.55,61,1,11,"","",""
59,"L. Tremblay","Fast quantification of humic substances and organic matter by direct analysis of sediments using DRIFT spectroscopy",2002,"Analytical Chemistry","","","https://www.scopus.com/inward/citedby.uri?partnerID=HzOxMe3b&scp=0036645740&origin=inward",44,"2024-07-23 10:07:48","Article","10.1021/ac011043g","0003-2700","https://api.elsevier.com/content/abstract/scopus_id/0036645740",74,13,2985,2993,59,2.68,59,1,22,"","",""
57,"M. Farhaduzzaman","Depositional environment and hydrocarbon source potential of the Permian Gondwana coals from the Barapukuria Basin, Northwest Bangladesh",2012,"International Journal of Coal Geology","","https://api.elsevier.com/content/article/eid/1-s2.0-S016651621100262X","https://www.scopus.com/inward/citedby.uri?partnerID=HzOxMe3b&scp=84856380528&origin=inward",45,"2024-07-23 10:07:48","Article","10.1016/j.coal.2011.12.006","0166-5162","https://api.elsevier.com/content/abstract/scopus_id/84856380528",90,,162,179,57,4.75,57,1,12,"","",""
54,"L. Zieger","Bolsovian (Pennsylvanian) tropical peat depositional environments: The example of the Ruhr Basin, Germany",2019,"International Journal of Coal Geology","","https://api.elsevier.com/content/article/eid/1-s2.0-S0166516219302460","https://www.scopus.com/inward/citedby.uri?partnerID=HzOxMe3b&scp=85066479085&origin=inward",46,"2024-07-23 10:07:48","Article","10.1016/j.coal.2019.103209","0166-5162","https://api.elsevier.com/content/abstract/scopus_id/85066479085",211,,,,54,10.80,54,1,5,"","",""
54,"G. Holdgate","Inorganic chemistry, petrography and palaeobotany of Permian coals in the Prince Charles Mountains, East Antarctica",2005,"International Journal of Coal Geology","","https://api.elsevier.com/content/article/eid/1-s2.0-S0166516205000571","https://www.scopus.com/inward/citedby.uri?partnerID=HzOxMe3b&scp=15744392720&origin=inward",47,"2024-07-23 10:07:48","Article","10.1016/j.coal.2005.02.011","0166-5162","https://api.elsevier.com/content/abstract/scopus_id/15744392720",63,1,156,177,54,2.84,54,1,19,"","",""
53,"A. Fernandes","Elemental and spectral properties of peat and soil samples and their respective humic substances",2010,"Journal of Molecular Structure","","https://api.elsevier.com/content/article/eid/1-s2.0-S0022286010002115","https://www.scopus.com/inward/citedby.uri?partnerID=HzOxMe3b&scp=77950860663&origin=inward",48,"2024-07-23 10:07:48","Article","10.1016/j.molstruc.2010.02.069","0022-2860","https://api.elsevier.com/content/abstract/scopus_id/77950860663",971,1,33,38,53,3.79,53,1,14,"","",""
53,"S. Widodo","Reconstruction of floral changes during deposition of the Miocene Embalut coal from Kutai Basin, Mahakam Delta, East Kalimantan, Indonesia by use of aromatic hydrocarbon composition and stable carbon isotope ratios of organic matter",2009,"Organic Geochemistry","","https://api.elsevier.com/content/article/eid/1-s2.0-S0146638008003331","https://www.scopus.com/inward/citedby.uri?partnerID=HzOxMe3b&scp=59149106475&origin=inward",49,"2024-07-23 10:07:48","Article","10.1016/j.orggeochem.2008.10.008","0146-6380","https://api.elsevier.com/content/abstract/scopus_id/59149106475",40,2,206,218,53,3.53,53,1,15,"","",""
52,"B. Alpern","Documented international enquiry on solid sedimentary fossil fuels; coal: definitions, classifications, reserves-resources, and energy potential",2002,"International Journal of Coal Geology","","https://api.elsevier.com/content/article/eid/1-s2.0-S016651620200112X","https://www.scopus.com/inward/citedby.uri?partnerID=HzOxMe3b&scp=0036587627&origin=inward",50,"2024-07-23 10:07:48","Article","10.1016/S0166-5162(02)00112-X","0166-5162","https://api.elsevier.com/content/abstract/scopus_id/0036587627",50,1,3,41,52,2.36,52,1,22,"","",""
